C1: Tournament Date: | H1: Please enter results in upper half of crosstable
C2: 39857
A4: # | B4: ID | C4: Name | D4: Rating | E4: Rating | J4: Games Won/Lost against | W4: Matches | X4: Games | AC4: Rating | AD4: Bonus | AE4: Change | AF4: Rating change vs.
A5: 1 | D5: Pre | E5: Post | G5: 1 | I5: 2 | K5: 3 | M5: 4 | O5: 5 | Q5: 6 | S5: 7 | U5: 8 | W5: Won | X5: Won | AC5: Change | AD5: Points | AE5: w/Bonus | AF5: 1 | AG5: 2 | AH5: 3 | AI5: 4 | AJ5: 5 | AK5: 6 | AL5: 7 | AM5: 8
A6: 1 | B6: 2139 | C6: Breton, Arthur | D6: 2317 | E6: =IF($C6>"",MAX(ROUND(D6+AE6,0),200),"") -> 2347 | F6: XXX | G6: XXX | H6: 3 | I6: 0 | J6: 3 | K6: 0 | L6: 3 | M6: 0 | N6: 3 | O6: 0 | P6: 0 | Q6: 0 | W6: =IF($C6>"",(IF(F6=3,1,0)+IF(H6=3,1,0)+IF(J6=3,1,0)+IF(L6=3,1,0)+IF(N6=3,1,0)+IF(P6=3,1,0)+IF(R6=3,1,0)+IF(T6=3,1,0)),"") -> 4 | X6: =IF($C6>"",SUM(F6,H6,J6,L6,N6,P6,R6,T6),"") -> 12 | Y6: =IF(C6>"",IF(D6<2000,16,8),"") -> 8 | Z6: =IF($C6>"",IF($D6<2000,2,1),"") -> 1 | AA6: =IF($C6>"",IF($D6<2000,25,50),"") -> 50 | AC6: =IF($C6>"",SUM(AF6:AL6),"") -> 27.04 | AD6: =IF($C6>"",IF(AC6<=24,0,AC6-24),"") -> 3.04 | AE6: =IF($C6>"",AC6+AD6,"") -> 30.08 | AF6: XXX | AG6: =RatingChange(D6,OFFSET($D$5,$AG$5,0),H6,I6) -> 7.76 | AH6: =RatingChange(D6,OFFSET($D$5,$AH$5,0),J6,K6) -> 7.08 | AI6: =RatingChange(D6,OFFSET($D$5,$AI$5,0),L6,M6) -> 6.28 | AJ6: =RatingChange(D6,OFFSET($D$5,$AJ$5,0),N6,O6) -> 5.92 | AK6: =RatingChange(D6,OFFSET($D$5,$AK$5,0),P6,Q6) -> 0 | AL6: =RatingChange(D6,OFFSET($D$5,$AL$5,0),R6,S6) ->  | AM6: =RatingChange(D6,OFFSET($D$5,$AM$5,0),T6,U6) -> 
A7: 2 | B7: 1331 | C7: Yang, Chris | D7: 2305 | E7: =IF($C7>"",MAX(ROUND(D7+AE7,0),200),"") -> 2322 | F7: =IF($C7>"",OFFSET($E$5,G$5,2*$A7),"") -> 0 | G7: =IF($C7>"",OFFSET($E$5,G$5,2*$A7-1),"") -> 3 | H7: XXX | I7: XXX | J7: 3 | K7: 0 | L7: 3 | M7: 0 | N7: 3 | O7: 0 | P7: 3 | Q7: 1 | W7: =IF($C7>"",(IF(F7=3,1,0)+IF(H7=3,1,0)+IF(J7=3,1,0)+IF(L7=3,1,0)+IF(N7=3,1,0)+IF(P7=3,1,0)+IF(R7=3,1,0)+IF(T7=3,1,0)),"") -> 4 | X7: =IF($C7>"",SUM(F7,H7,J7,L7,N7,P7,R7,T7),"") -> 12 | Y7: =IF(C7>"",IF(D7<2000,16,8),"") -> 8 | Z7: =IF($C7>"",IF($D7<2000,2,1),"") -> 1 | AA7: =IF($C7>"",IF($D7<2000,25,50),"") -> 50 | AC7: =IF($C7>"",SUM(AF7:AL7),"") -> 17.04 | AD7: =IF($C7>"",IF(AC7<=24,0,AC7-24),"") -> 0 | AE7: =IF($C7>"",AC7+AD7,"") -> 17.04 | AF7: =RatingChange(D7,OFFSET($D$5,$AF$5,0),F7,G7) -> -7.76 | AG7: XXX | AH7: =RatingChange(D7,OFFSET($D$5,$AH$5,0),J7,K7) -> 7.32 | AI7: =RatingChange(D7,OFFSET($D$5,$AI$5,0),L7,M7) -> 6.52 | AJ7: =RatingChange(D7,OFFSET($D$5,$AJ$5,0),N7,O7) -> 6.16 | AK7: =RatingChange(D7,OFFSET($D$5,$AK$5,0),P7,Q7) -> 4.8 | AL7: =RatingChange(D7,OFFSET($D$5,$AL$5,0),R7,S7) ->  | AM7: =RatingChange(D7,OFFSET($D$5,$AM$5,0),T7,U7) -> 
A8: 3 | B8: 1043 | C8: Lee, Bunny | D8: 2271 | E8: =IF($C8>"",MAX(ROUND(D8+AE8,0),200),"") -> 2260 | F8: =IF($C8>"",OFFSET($E$5,G$5,2*$A8),"") -> 0 | G8: =IF($C8>"",OFFSET($E$5,G$5,2*$A8-1),"") -> 3 | H8: =IF($C8>"",OFFSET($E$5,I$5,2*$A8),"") -> 0 | I8: =IF($C8>"",OFFSET($E$5,I$5,2*$A8-1),"") -> 3 | J8: XXX | K8: XXX | L8: 3 | M8: 1 | N8: 3 | O8: 1 | P8: 1 | Q8: 3 | W8: =IF($C8>"",(IF(F8=3,1,0)+IF(H8=3,1,0)+IF(J8=3,1,0)+IF(L8=3,1,0)+IF(N8=3,1,0)+IF(P8=3,1,0)+IF(R8=3,1,0)+IF(T8=3,1,0)),"") -> 2 | X8: =IF($C8>"",SUM(F8,H8,J8,L8,N8,P8,R8,T8),"") -> 7 | Y8: =IF(C8>"",IF(D8<2000,16,8),"") -> 8 | Z8: =IF($C8>"",IF($D8<2000,2,1),"") -> 1 | AA8: =IF($C8>"",IF($D8<2000,25,50),"") -> 50 | AC8: =IF($C8>"",SUM(AF8:AL8),"") -> -10.88 | AD8: =IF($C8>"",IF(AC8<=24,0,AC8-24),"") -> 0 | AE8: =IF($C8>"",AC8+AD8,"") -> -10.88 | AF8: =RatingChange(D8,OFFSET($D$5,$AF$5,0),F8,G8) -> -7.08 | AG8: =RatingChange(D8,OFFSET($D$5,$AG$5,0),H8,I8) -> -7.32 | AH8: XXX | AI8: =RatingChange(D8,OFFSET($D$5,$AI$5,0),L8,M8) -> 6.2 | AJ8: =RatingChange(D8,OFFSET($D$5,$AJ$5,0),N8,O8) -> 5.84 | AK8: =RatingChange(D8,OFFSET($D$5,$AK$5,0),P8,Q8) -> -8.52 | AL8: =RatingChange(D8,OFFSET($D$5,$AL$5,0),R8,S8) ->  | AM8: =RatingChange(D8,OFFSET($D$5,$AM$5,0),T8,U8) -> 
A9: 4 | B9: 1647 | C9: Guo, Sylvan | D9: 2231 | E9: =IF($C9>"",MAX(ROUND(D9+AE9,0),200),"") -> 2220 | F9: =IF($C9>"",OFFSET($E$5,G$5,2*$A9),"") -> 0 | G9: =IF($C9>"",OFFSET($E$5,G$5,2*$A9-1),"") -> 3 | H9: =IF($C9>"",OFFSET($E$5,I$5,2*$A9),"") -> 0 | I9: =IF($C9>"",OFFSET($E$5,I$5,2*$A9-1),"") -> 3 | J9: =IF($C9>"",OFFSET($E$5,K$5,2*$A9),"") -> 1 | K9: =IF($C9>"",OFFSET($E$5,K$5,2*$A9-1),"") -> 3 | L9: XXX | M9: XXX | N9: 3 | O9: 0 | P9: 0 | Q9: 0 | W9: =IF($C9>"",(IF(F9=3,1,0)+IF(H9=3,1,0)+IF(J9=3,1,0)+IF(L9=3,1,0)+IF(N9=3,1,0)+IF(P9=3,1,0)+IF(R9=3,1,0)+IF(T9=3,1,0)),"") -> 1 | X9: =IF($C9>"",SUM(F9,H9,J9,L9,N9,P9,R9,T9),"") -> 4 | Y9: =IF(C9>"",IF(D9<2000,16,8),"") -> 8 | Z9: =IF($C9>"",IF($D9<2000,2,1),"") -> 1 | AA9: =IF($C9>"",IF($D9<2000,25,50),"") -> 50 | AC9: =IF($C9>"",SUM(AF9:AL9),"") -> -11.36 | AD9: =IF($C9>"",IF(AC9<=24,0,AC9-24),"") -> 0 | AE9: =IF($C9>"",AC9+AD9,"") -> -11.36 | AF9: =RatingChange(D9,OFFSET($D$5,$AF$5,0),F9,G9) -> -6.28 | AG9: =RatingChange(D9,OFFSET($D$5,$AG$5,0),H9,I9) -> -6.52 | AH9: =RatingChange(D9,OFFSET($D$5,$AH$5,0),J9,K9) -> -6.2 | AI9: XXX | AJ9: =RatingChange(D9,OFFSET($D$5,$AJ$5,0),N9,O9) -> 7.64 | AK9: =RatingChange(D9,OFFSET($D$5,$AK$5,0),P9,Q9) -> 0 | AL9: =RatingChange(D9,OFFSET($D$5,$AL$5,0),R9,S9) ->  | AM9: =RatingChange(D9,OFFSET($D$5,$AM$5,0),T9,U9) -> 
A10: 5 | B10: 1202 | C10: Lee, Mike | D10: 2213 | E10: =IF($C10>"",MAX(ROUND(D10+AE10,0),200),"") -> 2179 | F10: =IF($C10>"",OFFSET($E$5,G$5,2*$A10),"") -> 0 | G10: =IF($C10>"",OFFSET($E$5,G$5,2*$A10-1),"") -> 3 | H10: =IF($C10>"",OFFSET($E$5,I$5,2*$A10),"") -> 0 | I10: =IF($C10>"",OFFSET($E$5,I$5,2*$A10-1),"") -> 3 | J10: =IF($C10>"",OFFSET($E$5,K$5,2*$A10),"") -> 1 | K10: =IF($C10>"",OFFSET($E$5,K$5,2*$A10-1),"") -> 3 | L10: =IF($C10>"",OFFSET($E$5,M$5,2*$A10),"") -> 0 | M10: =IF($C10>"",OFFSET($E$5,M$5,2*$A10-1),"") -> 3 | N10: XXX | O10: XXX | P10: 0 | Q10: 3 | W10: =IF($C10>"",(IF(F10=3,1,0)+IF(H10=3,1,0)+IF(J10=3,1,0)+IF(L10=3,1,0)+IF(N10=3,1,0)+IF(P10=3,1,0)+IF(R10=3,1,0)+IF(T10=3,1,0)),"") -> 0 | X10: =IF($C10>"",SUM(F10,H10,J10,L10,N10,P10,R10,T10),"") -> 1 | Y10: =IF(C10>"",IF(D10<2000,16,8),"") -> 8 | Z10: =IF($C10>"",IF($D10<2000,2,1),"") -> 1 | AA10: =IF($C10>"",IF($D10<2000,25,50),"") -> 50 | AC10: =IF($C10>"",SUM(AF10:AL10),"") -> -33.92 | AD10: =IF($C10>"",IF(AC10<=24,0,AC10-24),"") -> 0 | AE10: =IF($C10>"",AC10+AD10,"") -> -33.92 | AF10: =RatingChange(D10,OFFSET($D$5,$AF$5,0),F10,G10) -> -5.92 | AG10: =RatingChange(D10,OFFSET($D$5,$AG$5,0),H10,I10) -> -6.16 | AH10: =RatingChange(D10,OFFSET($D$5,$AH$5,0),J10,K10) -> -5.84 | AI10: =RatingChange(D10,OFFSET($D$5,$AI$5,0),L10,M10) -> -7.64 | AJ10: XXX | AK10: =RatingChange(D10,OFFSET($D$5,$AK$5,0),P10,Q10) -> -8.36 | AL10: =RatingChange(D10,OFFSET($D$5,$AL$5,0),R10,S10) ->  | AM10: =RatingChange(D10,OFFSET($D$5,$AM$5,0),T10,U10) -> 
A11: 6 | B11: 1589 | C11: Sue, Sally | D11: 2195 | E11: =IF($C11>"",MAX(ROUND(D11+AE11,0),200),"") -> 2207 | F11: =IF($C11>"",OFFSET($E5,G5,2*$A11),"") -> 0 | G11: =IF($C11>"",OFFSET($E5,G5,2*$A11-1),"") -> 0 | H11: =IF($C11>"",OFFSET($E5,I5,2*$A11),"") -> 1 | I11: =IF($C11>"",OFFSET($E5,I5,2*$A11-1),"") -> 3 | J11: =IF($C11>"",OFFSET($E5,K5,2*$A11),"") -> 3 | K11: =IF($C11>"",OFFSET($E5,K5,2*$A11-1),"") -> 1 | L11: =IF($C11>"",OFFSET($E5,M5,2*$A11),"") -> 0 | M11: =IF($C11>"",OFFSET($E5,M5,2*$A11-1),"") -> 0 | N11: =IF($C11>"",OFFSET($E5,O5,2*$A11),"") -> 3 | O11: =IF($C11>"",OFFSET($E5,O5,2*$A11-1),"") -> 0 | P11: XXX | Q11: XXX | W11: =IF($C11>"",(IF(F11=3,1,0)+IF(H11=3,1,0)+IF(J11=3,1,0)+IF(L11=3,1,0)+IF(N11=3,1,0)+IF(P11=3,1,0)+IF(R11=3,1,0)+IF(T11=3,1,0)),"") -> 2 | X11: =IF($C11>"",SUM(F11,H11,J11,L11,N11,P11,R11,T11),"") -> 7 | Y11: 8 | Z11: 1 | AA11: 50 | AC11: =IF($C11>"",SUM(AF11:AL11),"") -> 12.08 | AD11: =IF($C11>"",IF(AC11<=24,0,AC11-24),"") -> 0 | AE11: =IF($C11>"",AC11+AD11,"") -> 12.08 | AF11: =RatingChange(D11,OFFSET($D$5,$AF$5,0),F11,G11) -> 0 | AG11: =RatingChange(D11,OFFSET($D$5,$AG$5,0),H11,I11) -> -4.8 | AH11: =RatingChange(D11,OFFSET($D$5,$AH$5,0),J11,K11) -> 8.52 | AI11: =RatingChange(D11,OFFSET($D$5,$AI$5,0),L11,M11) -> 0 | AJ11: =RatingChange(D11,OFFSET($D$5,$AJ$5,0),N11,O11) -> 8.36 | AK11: XXX | AL11: =RatingChange(D11,OFFSET($D$5,$AL$5,0),R11,S11) ->  | AM11: =RatingChange(D11,OFFSET($D$5,$AM$5,0),T11,U11) -> 
A12: 7 | E12: =IF($C12>"",MAX(ROUND(D12+AE12,0),200),"") ->  | F12: =IF($C12>"",OFFSET($E$5,G$5,2*$A12),"") ->  | G12: =IF($C12>"",OFFSET($E$5,G$5,2*$A12-1),"") ->  | H12: =IF($C12>"",OFFSET($E$5,I$5,2*$A12),"") ->  | I12: =IF($C12>"",OFFSET($E$5,I$5,2*$A12-1),"") ->  | J12: =IF($C12>"",OFFSET($E$5,K$5,2*$A12),"") ->  | K12: =IF($C12>"",OFFSET($E$5,K$5,2*$A12-1),"") ->  | L12: =IF($C12>"",OFFSET($E$5,M$5,2*$A12),"") ->  | M12: =IF($C12>"",OFFSET($E$5,M$5,2*$A12-1),"") ->  | N12: =IF($C12>"",OFFSET($E$5,O$5,2*$A12),"") ->  | O12: =IF($C12>"",OFFSET($E$5,O$5,2*$A12-1),"") ->  | P12: =IF($C12>"",OFFSET($E$5,Q$5,2*$A12),"") ->  | Q12: =IF($C12>"",OFFSET($E$5,Q$5,2*$A12-1),"") ->  | R12: XXX | S12: XXX | W12: =IF($C12>"",(IF(F12=3,1,0)+IF(H12=3,1,0)+IF(J12=3,1,0)+IF(L12=3,1,0)+IF(N12=3,1,0)+IF(P12=3,1,0)+IF(R12=3,1,0)+IF(T12=3,1,0)),"") ->  | X12: =IF($C12>"",SUM(F12,H12,J12,L12,N12,P12,R12,T12),"") ->  | Y12: =IF(C12>"",IF(D12<2000,16,8),"") ->  | Z12: =IF($C12>"",IF($D12<2000,2,1),"") ->  | AA12: =IF($C12>"",IF($D12<2000,25,50),"") ->  | AC12: =IF($C12>"",SUM(AF12:AL12),"") ->  | AD12: =IF($C12>"",IF(AC12<=24,0,AC12-24),"") ->  | AE12: =IF($C12>"",AC12+AD12,"") ->  | AF12: =RatingChange(D12,OFFSET($D$5,$AF$5,0),F12,G12) ->  | AG12: =RatingChange(D12,OFFSET($D$5,$AG$5,0),H12,I12) ->  | AH12: =RatingChange(D12,OFFSET($D$5,$AH$5,0),J12,K12) ->  | AI12: =RatingChange(D12,OFFSET($D$5,$AI$5,0),L12,M12) ->  | AJ12: =RatingChange(D12,OFFSET($D$5,$AJ$5,0),N12,O12) ->  | AK12: =RatingChange(D12,OFFSET($D$5,$AK$5,0),P12,Q12) ->  | AL12: XXX | AM12: =RatingChange(D12,OFFSET($D$5,$AM$5,0),T12,U12) -> 
A13: 8 | E13: =IF($C13>"",MAX(ROUND(D13+AE13,0),200),"") ->  | F13: =IF($C13>"",OFFSET($E$5,G$5,2*$A13),"") ->  | G13: =IF($C13>"",OFFSET($E$5,G$5,2*$A13-1),"") ->  | H13: =IF($C13>"",OFFSET($E$5,I$5,2*$A13),"") ->  | I13: =IF($C13>"",OFFSET($E$5,I$5,2*$A13-1),"") ->  | J13: =IF($C13>"",OFFSET($E$5,K$5,2*$A13),"") ->  | K13: =IF($C13>"",OFFSET($E$5,K$5,2*$A13-1),"") ->  | L13: =IF($C13>"",OFFSET($E$5,M$5,2*$A13),"") ->  | M13: =IF($C13>"",OFFSET($E$5,M$5,2*$A13-1),"") ->  | N13: =IF($C13>"",OFFSET($E$5,O$5,2*$A13),"") ->  | O13: =IF($C13>"",OFFSET($E$5,O$5,2*$A13-1),"") ->  | P13: =IF($C13>"",OFFSET($E$5,Q$5,2*$A13),"") ->  | Q13: =IF($C13>"",OFFSET($E$5,Q$5,2*$A13-1),"") ->  | R13: =IF($C13>"",OFFSET($E$5,S$5,2*$A13),"") ->  | S13: =IF($C13>"",OFFSET($E$5,S$5,2*$A13-1),"") ->  | T13: XXX | U13: XXX | W13: =IF($C13>"",(IF(F13=3,1,0)+IF(H13=3,1,0)+IF(J13=3,1,0)+IF(L13=3,1,0)+IF(N13=3,1,0)+IF(P13=3,1,0)+IF(R13=3,1,0)+IF(T13=3,1,0)),"") ->  | X13: =IF($C13>"",SUM(F13,H13,J13,L13,N13,P13,R13,T13),"") ->  | Y13: =IF(C13>"",IF(D13<2000,16,8),"") ->  | Z13: =IF($C13>"",IF($D13<2000,2,1),"") ->  | AA13: =IF($C13>"",IF($D13<2000,25,50),"") ->  | AC13: =IF($C13>"",SUM(AF13:AL13),"") ->  | AD13: =IF($C13>"",IF(AC13<=24,0,AC13-24),"") ->  | AE13: =IF($C13>"",AC13+AD13,"") ->  | AF13: =RatingChange(D13,OFFSET($D$5,$AF$5,0),F13,G13) ->  | AG13: =RatingChange(D13,OFFSET($D$5,$AG$5,0),H13,I13) ->  | AH13: =RatingChange(D13,OFFSET($D$5,$AH$5,0),J13,K13) ->  | AI13: =RatingChange(D13,OFFSET($D$5,$AI$5,0),L13,M13) ->  | AJ13: =RatingChange(D13,OFFSET($D$5,$AJ$5,0),N13,O13) ->  | AK13: =RatingChange(D13,OFFSET($D$5,$AK$5,0),P13,Q13) ->  | AL13: =RatingChange(D13,OFFSET($D$5,$AL$5,0),R13,S13) ->  | AM13: XXX
A19: # | B19: ID | C19: Name | D19: Rating | E19: Rating | J19: Games Won/Lost against | W19: Matches | X19: Games | AC19: Rating | AD19: Bonus | AE19: Change | AF19: Rating change vs.
A20: 2 | D20: Pre | E20: Post | G20: 1 | I20: 2 | K20: 3 | M20: 4 | O20: 5 | Q20: 6 | S20: 7 | U20: 8 | W20: Won | X20: Won | AC20: Change | AD20: Points | AE20: w/Bonus | AF20: 1 | AG20: 2 | AH20: 3 | AI20: 4 | AJ20: 5 | AK20: 6 | AL20: 7 | AM20: 8
A21: 1 | B21: 1616 | C21: Yuen, Kevin | D21: 2094 | E21: =IF($C21>"",MAX(ROUND(D21+AE21,0),200),"") -> 2111 | F21: XXX | G21: XXX | H21: 3 | I21: 2 | J21: 3 | K21: 1 | L21: 3 | M21: 0 | N21: 2 | O21: 3 | P21: 3 | Q21: 0 | W21: =IF($C21>"",(IF(F21=3,1,0)+IF(H21=3,1,0)+IF(J21=3,1,0)+IF(L21=3,1,0)+IF(N21=3,1,0)+IF(P21=3,1,0)+IF(R21=3,1,0)+IF(T21=3,1,0)),"") -> 4 | X21: =IF($C21>"",SUM(F21,H21,J21,L21,N21,P21,R21,T21),"") -> 14 | Y21: =IF(C21>"",IF(D21<2000,16,8),"") -> 8 | Z21: =IF($C21>"",IF($D21<2000,2,1),"") -> 1 | AA21: =IF($C21>"",IF($D21<2000,25,50),"") -> 50 | AC21: =IF($C21>"",SUM(AF21:AL21),"") -> 17.44 | AD21: =IF($C21>"",IF(AC21<=24,0,AC21-24),"") -> 0 | AE21: =IF($C21>"",AC21+AD21,"") -> 17.44 | AF21: XXX | AG21: =RatingChange(D21,OFFSET($D$20,$AG$20,0),H21,I21) -> 4.96 | AH21: =RatingChange(D21,OFFSET($D$20,$AH$20,0),J21,K21) -> 7.06 | AI21: =RatingChange(D21,OFFSET($D$20,$AI$20,0),L21,M21) -> 6.84 | AJ21: =RatingChange(D21,OFFSET($D$20,$AJ$20,0),N21,O21) -> -7.68 | AK21: =RatingChange(D21,OFFSET($D$20,$AK$20,0),P21,Q21) -> 6.26 | AL21: =RatingChange(D21,OFFSET($D$20,$AL$20,0),R21,S21) ->  | AM21: =RatingChange(D21,OFFSET($D$20,$AM$20,0),T21,U21) -> 
A22: 2 | B22: 1528 | C22: Nejad, Ray | D22: 2042 | E22: =IF($C22>"",MAX(ROUND(D22+AE22,0),200),"") -> 2026 | F22: =IF($C22>"",OFFSET($E20,G20,2*$A22),"") -> 2 | G22: =IF($C22>"",OFFSET($E20,G20,2*$A22-1),"") -> 3 | H22: XXX | I22: XXX | J22: 2 | K22: 3 | L22: 3 | M22: 1 | N22: 2 | O22: 3 | P22: 2 | Q22: 3 | W22: =IF($C22>"",(IF(F22=3,1,0)+IF(H22=3,1,0)+IF(J22=3,1,0)+IF(L22=3,1,0)+IF(N22=3,1,0)+IF(P22=3,1,0)+IF(R22=3,1,0)+IF(T22=3,1,0)),"") -> 1 | X22: =IF($C22>"",SUM(F22,H22,J22,L22,N22,P22,R22,T22),"") -> 11 | Y22: =IF(C22>"",IF(D22<2000,16,8),"") -> 8 | Z22: =IF($C22>"",IF($D22<2000,2,1),"") -> 1 | AA22: =IF($C22>"",IF($D22<2000,25,50),"") -> 50 | AC22: =IF($C22>"",SUM(AF22:AL22),"") -> -16.32 | AD22: =IF($C22>"",IF(AC22<=24,0,AC22-24),"") -> 0 | AE22: =IF($C22>"",AC22+AD22,"") -> -16.32 | AF22: =RatingChange(D22,OFFSET($D$20,$AF$20,0),F22,G22) -> -4.96 | AG22: XXX | AH22: =RatingChange(D22,OFFSET($D$20,$AH$20,0),J22,K22) -> -4.9 | AI22: =RatingChange(D22,OFFSET($D$20,$AI$20,0),L22,M22) -> 6.88 | AJ22: =RatingChange(D22,OFFSET($D$20,$AJ$20,0),N22,O22) -> -6.64 | AK22: =RatingChange(D22,OFFSET($D$20,$AK$20,0),P22,Q22) -> -6.7 | AL22: =RatingChange(D22,OFFSET($D$20,$AL$20,0),R22,S22) ->  | AM22: =RatingChange(D22,OFFSET($D$20,$AM$20,0),T22,U22) -> 
A23: 3 | B23: 1495 | C23: Huang, Johnny | D23: 2097 | E23: =IF($C23>"",MAX(ROUND(D23+AE23,0),200),"") -> 2113 | F23: =IF($C23>"",OFFSET($E20,G20,2*$A23),"") -> 1 | G23: =IF($C23>"",OFFSET($E20,G20,2*$A23-1),"") -> 3 | H23: =IF($C23>"",OFFSET($E20,I20,2*$A23),"") -> 3 | I23: =IF($C23>"",OFFSET($E20,I20,2*$A23-1),"") -> 2 | J23: XXX | K23: XXX | L23: 3 | M23: 1 | N23: 3 | O23: 0 | P23: 3 | Q23: 0 | W23: =IF($C23>"",(IF(F23=3,1,0)+IF(H23=3,1,0)+IF(J23=3,1,0)+IF(L23=3,1,0)+IF(N23=3,1,0)+IF(P23=3,1,0)+IF(R23=3,1,0)+IF(T23=3,1,0)),"") -> 4 | X23: =IF($C23>"",SUM(F23,H23,J23,L23,N23,P23,R23,T23),"") -> 13 | Y23: =IF(C23>"",IF(D23<2000,16,8),"") -> 8 | Z23: =IF($C23>"",IF($D23<2000,2,1),"") -> 1 | AA23: =IF($C23>"",IF($D23<2000,25,50),"") -> 50 | AC23: =IF($C23>"",SUM(AF23:AL23),"") -> 16.08 | AD23: =IF($C23>"",IF(AC23<=24,0,AC23-24),"") -> 0 | AE23: =IF($C23>"",AC23+AD23,"") -> 16.08 | AF23: =RatingChange(D23,OFFSET($D$20,$AF$20,0),F23,G23) -> -7.06 | AG23: =RatingChange(D23,OFFSET($D$20,$AG$20,0),H23,I23) -> 4.9 | AH23: XXX | AI23: =RatingChange(D23,OFFSET($D$20,$AI$20,0),L23,M23) -> 5.78 | AJ23: =RatingChange(D23,OFFSET($D$20,$AJ$20,0),N23,O23) -> 6.26 | AK23: =RatingChange(D23,OFFSET($D$20,$AK$20,0),P23,Q23) -> 6.2 | AL23: =RatingChange(D23,OFFSET($D$20,$AL$20,0),R23,S23) ->  | AM23: =RatingChange(D23,OFFSET($D$20,$AM$20,0),T23,U23) -> 
A24: 4 | B24: 1801 | C24: Tang, Daniel | D24: 2036 | E24: =IF($C24>"",MAX(ROUND(D24+AE24,0),200),"") -> 2024 | F24: =IF($C24>"",OFFSET($E20,G20,2*$A24),"") -> 0 | G24: =IF($C24>"",OFFSET($E20,G20,2*$A24-1),"") -> 3 | H24: =IF($C24>"",OFFSET($E20,I20,2*$A24),"") -> 1 | I24: =IF($C24>"",OFFSET($E20,I20,2*$A24-1),"") -> 3 | J24: =IF($C24>"",OFFSET($E20,K20,2*$A24),"") -> 1 | K24: =IF($C24>"",OFFSET($E20,K20,2*$A24-1),"") -> 3 | L24: XXX | M24: XXX | N24: 0 | O24: 0 | P24: 3 | Q24: 0 | W24: =IF($C24>"",(IF(F24=3,1,0)+IF(H24=3,1,0)+IF(J24=3,1,0)+IF(L24=3,1,0)+IF(N24=3,1,0)+IF(P24=3,1,0)+IF(R24=3,1,0)+IF(T24=3,1,0)),"") -> 1 | X24: =IF($C24>"",SUM(F24,H24,J24,L24,N24,P24,R24,T24),"") -> 5 | Y24: =IF(C24>"",IF(D24<2000,16,8),"") -> 8 | Z24: =IF($C24>"",IF($D24<2000,2,1),"") -> 1 | AA24: =IF($C24>"",IF($D24<2000,25,50),"") -> 50 | AC24: =IF($C24>"",SUM(AF24:AL24),"") -> -12.08 | AD24: =IF($C24>"",IF(AC24<=24,0,AC24-24),"") -> 0 | AE24: =IF($C24>"",AC24+AD24,"") -> -12.08 | AF24: =RatingChange(D24,OFFSET($D$20,$AF$20,0),F24,G24) -> -6.84 | AG24: =RatingChange(D24,OFFSET($D$20,$AG$20,0),H24,I24) -> -6.88 | AH24: =RatingChange(D24,OFFSET($D$20,$AH$20,0),J24,K24) -> -5.78 | AI24: XXX | AJ24: =RatingChange(D24,OFFSET($D$20,$AJ$20,0),N24,O24) -> 0 | AK24: =RatingChange(D24,OFFSET($D$20,$AK$20,0),P24,Q24) -> 7.42 | AL24: =RatingChange(D24,OFFSET($D$20,$AL$20,0),R24,S24) ->  | AM24: =RatingChange(D24,OFFSET($D$20,$AM$20,0),T24,U24) -> 
A25: 5 | B25: 2063 | C25: Gamero, Pedro | D25: 2010 | E25: =IF($C25>"",MAX(ROUND(D25+AE25,0),200),"") -> 2026 | F25: =IF($C25>"",OFFSET($E20,G20,2*$A25),"") -> 3 | G25: =IF($C25>"",OFFSET($E20,G20,2*$A25-1),"") -> 2 | H25: =IF($C25>"",OFFSET($E20,I20,2*$A25),"") -> 3 | I25: =IF($C25>"",OFFSET($E20,I20,2*$A25-1),"") -> 2 | J25: =IF($C25>"",OFFSET($E20,K20,2*$A25),"") -> 0 | K25: =IF($C25>"",OFFSET($E20,K20,2*$A25-1),"") -> 3 | L25: =IF($C25>"",OFFSET($E20,M20,2*$A25),"") -> 0 | M25: =IF($C25>"",OFFSET($E20,M20,2*$A25-1),"") -> 0 | N25: XXX | O25: XXX | P25: 3 | Q25: 0 | W25: =IF($C25>"",(IF(F25=3,1,0)+IF(H25=3,1,0)+IF(J25=3,1,0)+IF(L25=3,1,0)+IF(N25=3,1,0)+IF(P25=3,1,0)+IF(R25=3,1,0)+IF(T25=3,1,0)),"") -> 3 | X25: =IF($C25>"",SUM(F25,H25,J25,L25,N25,P25,R25,T25),"") -> 9 | Y25: =IF(C25>"",IF(D25<2000,16,8),"") -> 8 | Z25: =IF($C25>"",IF($D25<2000,2,1),"") -> 1 | AA25: =IF($C25>"",IF($D25<2000,25,50),"") -> 50 | AC25: =IF($C25>"",SUM(AF25:AL25),"") -> 16 | AD25: =IF($C25>"",IF(AC25<=24,0,AC25-24),"") -> 0 | AE25: =IF($C25>"",AC25+AD25,"") -> 16 | AF25: =RatingChange(D25,OFFSET($D$20,$AF$20,0),F25,G25) -> 7.68 | AG25: =RatingChange(D25,OFFSET($D$20,$AG$20,0),H25,I25) -> 6.64 | AH25: =RatingChange(D25,OFFSET($D$20,$AH$20,0),J25,K25) -> -6.26 | AI25: =RatingChange(D25,OFFSET($D$20,$AI$20,0),L25,M25) -> 0 | AJ25: XXX | AK25: =RatingChange(D25,OFFSET($D$20,$AK$20,0),P25,Q25) -> 7.94 | AL25: =RatingChange(D25,OFFSET($D$20,$AL$20,0),R25,S25) ->  | AM25: =RatingChange(D25,OFFSET($D$20,$AM$20,0),T25,U25) -> 
A26: 6 | B26: 2000 | C26: Roberson, Sam | D26: 2007 | E26: =IF($C26>"",MAX(ROUND(D26+AE26,0),200),"") -> 1986 | F26: =IF($C26>"",OFFSET($E20,G20,2*$A26),"") -> 0 | G26: =IF($C26>"",OFFSET($E20,G20,2*$A26-1),"") -> 3 | H26: =IF($C26>"",OFFSET($E20,I20,2*$A26),"") -> 3 | I26: =IF($C26>"",OFFSET($E20,I20,2*$A26-1),"") -> 2 | J26: =IF($C26>"",OFFSET($E20,K20,2*$A26),"") -> 0 | K26: =IF($C26>"",OFFSET($E20,K20,2*$A26-1),"") -> 3 | L26: =IF($C26>"",OFFSET($E20,M20,2*$A26),"") -> 0 | M26: =IF($C26>"",OFFSET($E20,M20,2*$A26-1),"") -> 3 | N26: =IF($C26>"",OFFSET($E20,O20,2*$A26),"") -> 0 | O26: =IF($C26>"",OFFSET($E20,O20,2*$A26-1),"") -> 3 | P26: XXX | Q26: XXX | W26: =IF($C26>"",(IF(F26=3,1,0)+IF(H26=3,1,0)+IF(J26=3,1,0)+IF(L26=3,1,0)+IF(N26=3,1,0)+IF(P26=3,1,0)+IF(R26=3,1,0)+IF(T26=3,1,0)),"") -> 1 | X26: =IF($C26>"",SUM(F26,H26,J26,L26,N26,P26,R26,T26),"") -> 3 | Y26: =IF(C26>"",IF(D26<2000,16,8),"") -> 8 | Z26: =IF($C26>"",IF($D26<2000,2,1),"") -> 1 | AA26: =IF($C26>"",IF($D26<2000,25,50),"") -> 50 | AC26: =IF($C26>"",SUM(AF26:AL26),"") -> -21.12 | AD26: =IF($C26>"",IF(AC26<=24,0,AC26-24),"") -> 0 | AE26: =IF($C26>"",AC26+AD26,"") -> -21.12 | AF26: =RatingChange(D26,OFFSET($D$20,$AF$20,0),F26,G26) -> -6.26 | AG26: =RatingChange(D26,OFFSET($D$20,$AG$20,0),H26,I26) -> 6.7 | AH26: =RatingChange(D26,OFFSET($D$20,$AH$20,0),J26,K26) -> -6.2 | AI26: =RatingChange(D26,OFFSET($D$20,$AI$20,0),L26,M26) -> -7.42 | AJ26: =RatingChange(D26,OFFSET($D$20,$AJ$20,0),N26,O26) -> -7.94 | AK26: XXX | AL26: =RatingChange(D26,OFFSET($D$20,$AL$20,0),R26,S26) ->  | AM26: =RatingChange(D26,OFFSET($D$20,$AM$20,0),T26,U26) -> 
A27: 7 | E27: =IF($C27>"",MAX(ROUND(D27+AE27,0),200),"") ->  | F27: =IF($C27>"",OFFSET($E20,G20,2*$A27),"") ->  | G27: =IF($C27>"",OFFSET($E20,G20,2*$A27-1),"") ->  | H27: =IF($C27>"",OFFSET($E20,I20,2*$A27),"") ->  | I27: =IF($C27>"",OFFSET($E20,I20,2*$A27-1),"") ->  | J27: =IF($C27>"",OFFSET($E20,K20,2*$A27),"") ->  | K27: =IF($C27>"",OFFSET($E20,K20,2*$A27-1),"") ->  | L27: =IF($C27>"",OFFSET($E20,M20,2*$A27),"") ->  | M27: =IF($C27>"",OFFSET($E20,M20,2*$A27-1),"") ->  | N27: =IF($C27>"",OFFSET($E20,O20,2*$A27),"") ->  | O27: =IF($C27>"",OFFSET($E20,O20,2*$A27-1),"") ->  | P27: =IF($C27>"",OFFSET($E20,Q20,2*$A27),"") ->  | Q27: =IF($C27>"",OFFSET($E20,Q20,2*$A27-1),"") ->  | R27: XXX | S27: XXX | W27: =IF($C27>"",(IF(F27=3,1,0)+IF(H27=3,1,0)+IF(J27=3,1,0)+IF(L27=3,1,0)+IF(N27=3,1,0)+IF(P27=3,1,0)+IF(R27=3,1,0)+IF(T27=3,1,0)),"") ->  | X27: =IF($C27>"",SUM(F27,H27,J27,L27,N27,P27,R27,T27),"") ->  | Y27: =IF(C27>"",IF(D27<2000,16,8),"") ->  | Z27: =IF($C27>"",IF($D27<2000,2,1),"") ->  | AA27: =IF($C27>"",IF($D27<2000,25,50),"") ->  | AC27: =IF($C27>"",SUM(AF27:AL27),"") ->  | AD27: =IF($C27>"",IF(AC27<=24,0,AC27-24),"") ->  | AE27: =IF($C27>"",AC27+AD27,"") ->  | AF27: =RatingChange(D27,OFFSET($D$20,$AF$20,0),F27,G27) ->  | AG27: =RatingChange(D27,OFFSET($D$20,$AG$20,0),H27,I27) ->  | AH27: =RatingChange(D27,OFFSET($D$20,$AH$20,0),J27,K27) ->  | AI27: =RatingChange(D27,OFFSET($D$20,$AI$20,0),L27,M27) ->  | AJ27: =RatingChange(D27,OFFSET($D$20,$AJ$20,0),N27,O27) ->  | AK27: =RatingChange(D27,OFFSET($D$20,$AK$20,0),P27,Q27) ->  | AL27: XXX | AM27: =RatingChange(D27,OFFSET($D$20,$AM$20,0),T27,U27) -> 
A28: 8 | E28: =IF($C28>"",MAX(ROUND(D28+AE28,0),200),"") ->  | F28: =IF($C28>"",OFFSET($E20,G20,2*$A28),"") ->  | G28: =IF($C28>"",OFFSET($E20,G20,2*$A28-1),"") ->  | H28: =IF($C28>"",OFFSET($E20,I20,2*$A28),"") ->  | I28: =IF($C28>"",OFFSET($E20,I20,2*$A28-1),"") ->  | J28: =IF($C28>"",OFFSET($E20,K20,2*$A28),"") ->  | K28: =IF($C28>"",OFFSET($E20,K20,2*$A28-1),"") ->  | L28: =IF($C28>"",OFFSET($E20,M20,2*$A28),"") ->  | M28: =IF($C28>"",OFFSET($E20,M20,2*$A28-1),"") ->  | N28: =IF($C28>"",OFFSET($E20,O20,2*$A28),"") ->  | O28: =IF($C28>"",OFFSET($E20,O20,2*$A28-1),"") ->  | P28: =IF($C28>"",OFFSET($E20,Q20,2*$A28),"") ->  | Q28: =IF($C28>"",OFFSET($E20,Q20,2*$A28-1),"") ->  | R28: =IF($C28>"",OFFSET($E20,S20,2*$A28),"") ->  | S28: =IF($C28>"",OFFSET($E20,S20,2*$A28-1),"") ->  | T28: XXX | U28: XXX | W28: =IF($C28>"",(IF(F28=3,1,0)+IF(H28=3,1,0)+IF(J28=3,1,0)+IF(L28=3,1,0)+IF(N28=3,1,0)+IF(P28=3,1,0)+IF(R28=3,1,0)+IF(T28=3,1,0)),"") ->  | X28: =IF($C28>"",SUM(F28,H28,J28,L28,N28,P28,R28,T28),"") ->  | Y28: =IF(C28>"",IF(D28<2000,16,8),"") ->  | Z28: =IF($C28>"",IF($D28<2000,2,1),"") ->  | AA28: =IF($C28>"",IF($D28<2000,25,50),"") ->  | AC28: =IF($C28>"",SUM(AF28:AL28),"") ->  | AD28: =IF($C28>"",IF(AC28<=24,0,AC28-24),"") ->  | AE28: =IF($C28>"",AC28+AD28,"") ->  | AF28: =RatingChange(D28,OFFSET($D$20,$AF$20,0),F28,G28) ->  | AG28: =RatingChange(D28,OFFSET($D$20,$AG$20,0),H28,I28) ->  | AH28: =RatingChange(D28,OFFSET($D$20,$AH$20,0),J28,K28) ->  | AI28: =RatingChange(D28,OFFSET($D$20,$AI$20,0),L28,M28) ->  | AJ28: =RatingChange(D28,OFFSET($D$20,$AJ$20,0),N28,O28) ->  | AK28: =RatingChange(D28,OFFSET($D$20,$AK$20,0),P28,Q28) ->  | AL28: =RatingChange(D28,OFFSET($D$20,$AL$20,0),R28,S28) ->  | AM28: XXX
A34: # | B34: ID | C34: Name | D34: Rating | E34: Rating | J34: Games Won/Lost against | W34: Matches | X34: Games | AC34: Rating | AD34: Bonus | AE34: Change | AF34: Rating change vs.
A35: 3 | D35: Pre | E35: Post | G35: 1 | I35: 2 | K35: 3 | M35: 4 | O35: 5 | Q35: 6 | S35: 7 | U35: 8 | W35: Won | X35: Won | AC35: Change | AD35: Points | AE35: w/Bonus | AF35: 1 | AG35: 2 | AH35: 3 | AI35: 4 | AJ35: 5 | AK35: 6 | AL35: 7 | AM35: 8
A36: 1 | B36: 1054 | C36: Chan, Channing | D36: 1988 | E36: =IF($C36>"",MAX(ROUND(D36+AE36,0),200),"") -> 2004 | F36: XXX | G36: XXX | H36: 2 | I36: 1 | J36: 3 | K36: 0 | L36: 3 | M36: 2 | N36: 3 | O36: 1 | P36: 2 | Q36: 3 | W36: =IF($C36>"",(IF(F36=3,1,0)+IF(H36=3,1,0)+IF(J36=3,1,0)+IF(L36=3,1,0)+IF(N36=3,1,0)+IF(P36=3,1,0)+IF(R36=3,1,0)+IF(T36=3,1,0)),"") -> 3 | X36: =IF($C36>"",SUM(F36,H36,J36,L36,N36,P36,R36,T36),"") -> 13 | Y36: =IF(C36>"",IF(D36<2000,16,8),"") -> 16 | Z36: =IF($C36>"",IF($D36<2000,2,1),"") -> 2 | AA36: =IF($C36>"",IF($D36<2000,25,50),"") -> 25 | AC36: =IF($C36>"",SUM(AF36:AL36),"") -> 16.4 | AD36: =IF($C36>"",IF(AC36<=24,0,AC36-24),"") -> 0 | AE36: =IF($C36>"",AC36+AD36,"") -> 16.4 | AF36: XXX | AG36: =RatingChange(D36,OFFSET($D$35,$AG$35,0),H36,I36) -> 2 | AH36: =RatingChange(D36,OFFSET($D$35,AH$35,0),J36,K36) -> 13.4 | AI36: =RatingChange($D36,OFFSET($D$35,AI$35,0),L36,M36) -> 8.32 | AJ36: =RatingChange(D36,OFFSET($D$35,$AJ$35,0),N36,O36) -> 10.08 | AK36: =RatingChange(D36,OFFSET($D$35,$AK$35,0),P36,Q36) -> -17.4 | AL36: =RatingChange(D36,OFFSET($D$35,$AL$35,0),R36,S36) ->  | AM36: =RatingChange(D36,OFFSET($D$35,$AM$35,0),T36,U36) -> 
A37: 2 | B37: 1422 | C37: Hong, Randy | D37: 1958 | E37: =IF($C37>"",MAX(ROUND(D37+AE37,0),200),"") -> 1943 | F37: =IF($C37>"",OFFSET($E35,G35,2*$A37),"") -> 1 | G37: =IF($C37>"",OFFSET($E35,G35,2*$A37-1),"") -> 2 | H37: XXX | I37: XXX | J37: 3 | K37: 2 | L37: 2 | M37: 3 | N37: 0 | O37: 3 | P37: 3 | Q37: 1 | W37: =IF($C37>"",(IF(F37=3,1,0)+IF(H37=3,1,0)+IF(J37=3,1,0)+IF(L37=3,1,0)+IF(N37=3,1,0)+IF(P37=3,1,0)+IF(R37=3,1,0)+IF(T37=3,1,0)),"") -> 2 | X37: =IF($C37>"",SUM(F37,H37,J37,L37,N37,P37,R37,T37),"") -> 9 | Y37: =IF(C37>"",IF(D37<2000,16,8),"") -> 16 | Z37: =IF($C37>"",IF($D37<2000,2,1),"") -> 2 | AA37: =IF($C37>"",IF($D37<2000,25,50),"") -> 25 | AC37: =IF($C37>"",SUM(AF37:AL37),"") -> -14.8 | AD37: =IF($C37>"",IF(AC37<=24,0,AC37-24),"") -> 0 | AE37: =IF($C37>"",AC37+AD37,"") -> -14.8 | AF37: =RatingChange(D37,OFFSET($D$35,AF$35,0),F37,G37) -> -2 | AG37: XXX | AH37: =RatingChange(D37,OFFSET($D$35,AH$35,0),J37,K37) -> 10.6 | AI37: =RatingChange($D37,OFFSET($D$35,AI$35,0),L37,M37) -> -14.48 | AJ37: =RatingChange(D37,OFFSET($D$35,$AJ$35,0),N37,O37) -> -18.72 | AK37: =RatingChange(D37,OFFSET($D$35,$AK$35,0),P37,Q37) -> 9.8 | AL37: =RatingChange(D37,OFFSET($D$35,$AL$35,0),R37,S37) ->  | AM37: =RatingChange(D37,OFFSET($D$35,$AM$35,0),T37,U37) -> 
A38: 3 | B38: 1064 | C38: Hanson, Dave | D38: 1923 | E38: =IF($C38>"",MAX(ROUND(D38+AE38,0),200),"") -> 1908 | F38: =IF($C38>"",OFFSET($E35,G35,2*$A38),"") -> 0 | G38: =IF($C38>"",OFFSET($E35,G35,2*$A38-1),"") -> 3 | H38: =IF($C38>"",OFFSET($E35,I35,2*$A38),"") -> 2 | I38: =IF($C38>"",OFFSET($E35,I35,2*$A38-1),"") -> 3 | J38: XXX | K38: XXX | L38: 1 | M38: 3 | N38: 3 | O38: 2 | P38: 3 | Q38: 0 | W38: =IF($C38>"",(IF(F38=3,1,0)+IF(H38=3,1,0)+IF(J38=3,1,0)+IF(L38=3,1,0)+IF(N38=3,1,0)+IF(P38=3,1,0)+IF(R38=3,1,0)+IF(T38=3,1,0)),"") -> 2 | X38: =IF($C38>"",SUM(F38,H38,J38,L38,N38,P38,R38,T38),"") -> 9 | Y38: =IF(C38>"",IF(D38<2000,16,8),"") -> 16 | Z38: =IF($C38>"",IF($D38<2000,2,1),"") -> 2 | AA38: =IF($C38>"",IF($D38<2000,25,50),"") -> 25 | AC38: =IF($C38>"",SUM(AF38:AL38),"") -> -15.2 | AD38: =IF($C38>"",IF(AC38<=24,0,AC38-24),"") -> 0 | AE38: =IF($C38>"",AC38+AD38,"") -> -15.2 | AF38: =RatingChange(D38,OFFSET($D$35,AF$35,0),F38,G38) -> -13.4 | AG38: =RatingChange(D38,OFFSET($D$35,$AG$35,0),H38,I38) -> -10.6 | AH38: XXX | AI38: =RatingChange($D38,OFFSET($D$35,AI$35,0),L38,M38) -> -15.08 | AJ38: =RatingChange(D38,OFFSET($D$35,$AJ$35,0),N38,O38) -> 10.68 | AK38: =RatingChange(D38,OFFSET($D$35,$AK$35,0),P38,Q38) -> 13.2 | AL38: =RatingChange(D38,OFFSET($D$35,$AL$35,0),R38,S38) ->  | AM38: =RatingChange(D38,OFFSET($D$35,$AM$35,0),T38,U38) -> 
A39: 4 | B39: 1881 | C39: Eng, David | D39: 1896 | E39: =IF($C39>"",MAX(ROUND(D39+AE39,0),200),"") -> 1885 | F39: =IF($C39>"",OFFSET($E35,G35,2*$A39),"") -> 2 | G39: =IF($C39>"",OFFSET($E35,G35,2*$A39-1),"") -> 3 | H39: =IF($C39>"",OFFSET($E35,I35,2*$A39),"") -> 3 | I39: =IF($C39>"",OFFSET($E35,I35,2*$A39-1),"") -> 2 | J39: =IF($C39>"",OFFSET($E35,K35,2*$A39),"") -> 3 | K39: =IF($C39>"",OFFSET($E35,K35,2*$A39-1),"") -> 1 | L39: XXX | M39: XXX | N39: 0 | O39: 3 | P39: 1 | Q39: 3 | W39: =IF($C39>"",(IF(F39=3,1,0)+IF(H39=3,1,0)+IF(J39=3,1,0)+IF(L39=3,1,0)+IF(N39=3,1,0)+IF(P39=3,1,0)+IF(R39=3,1,0)+IF(T39=3,1,0)),"") -> 2 | X39: =IF($C39>"",SUM(F39,H39,J39,L39,N39,P39,R39,T39),"") -> 9 | Y39: =IF(C39>"",IF(D39<2000,16,8),"") -> 16 | Z39: =IF($C39>"",IF($D39<2000,2,1),"") -> 2 | AA39: =IF($C39>"",IF($D39<2000,25,50),"") -> 25 | AC39: =IF($C39>"",SUM(AF39:AL39),"") -> -10.72 | AD39: =IF($C39>"",IF(AC39<=24,0,AC39-24),"") -> 0 | AE39: =IF($C39>"",AC39+AD39,"") -> -10.72 | AF39: =RatingChange(D39,OFFSET($D$35,AF$35,0),F39,G39) -> -8.32 | AG39: =RatingChange(D39,OFFSET($D$35,$AG$35,0),H39,I39) -> 14.48 | AH39: =RatingChange(D39,OFFSET($D$35,AH$35,0),J39,K39) -> 15.08 | AI39: XXX | AJ39: =RatingChange(D39,OFFSET($D$35,$AJ$35,0),N39,O39) -> -16.24 | AK39: =RatingChange(D39,OFFSET($D$35,$AK$35,0),P39,Q39) -> -15.72 | AL39: =RatingChange(D39,OFFSET($D$35,$AL$35,0),R39,S39) ->  | AM39: =RatingChange(D39,OFFSET($D$35,$AM$35,0),T39,U39) -> 
A40: 5 | B40: 1836 | C40: Chan, Paul | D40: 1890 | E40: =IF($C40>"",MAX(ROUND(D40+AE40,0),200),"") -> 1919 | F40: =IF($C40>"",OFFSET($E35,G35,2*$A40),"") -> 1 | G40: =IF($C40>"",OFFSET($E35,G35,2*$A40-1),"") -> 3 | H40: =IF($C40>"",OFFSET($E35,I35,2*$A40),"") -> 3 | I40: =IF($C40>"",OFFSET($E35,I35,2*$A40-1),"") -> 0 | J40: =IF($C40>"",OFFSET($E35,K35,2*$A40),"") -> 2 | K40: =IF($C40>"",OFFSET($E35,K35,2*$A40-1),"") -> 3 | L40: =IF($C40>"",OFFSET($E35,M35,2*$A40),"") -> 3 | M40: =IF($C40>"",OFFSET($E35,M35,2*$A40-1),"") -> 0 | N40: XXX | O40: XXX | P40: 3 | Q40: 1 | W40: =IF($C40>"",(IF(F40=3,1,0)+IF(H40=3,1,0)+IF(J40=3,1,0)+IF(L40=3,1,0)+IF(N40=3,1,0)+IF(P40=3,1,0)+IF(R40=3,1,0)+IF(T40=3,1,0)),"") -> 3 | X40: =IF($C40>"",SUM(F40,H40,J40,L40,N40,P40,R40,T40),"") -> 12 | Y40: =IF(C40>"",IF(D40<2000,16,8),"") -> 16 | Z40: =IF($C40>"",IF($D40<2000,2,1),"") -> 2 | AA40: =IF($C40>"",IF($D40<2000,25,50),"") -> 25 | AC40: =IF($C40>"",SUM(AF40:AL40),"") -> 26.72 | AD40: =IF($C40>"",IF(AC40<=24,0,AC40-24),"") -> 2.72 | AE40: =IF($C40>"",AC40+AD40,"") -> 29.44 | AF40: =RatingChange(D40,OFFSET($D$35,AF$35,0),F40,G40) -> -10.08 | AG40: =RatingChange(D40,OFFSET($D$35,$AG$35,0),H40,I40) -> 18.72 | AH40: =RatingChange(D40,OFFSET($D$35,AH$35,0),J40,K40) -> -10.68 | AI40: =RatingChange($D40,OFFSET($D$35,AI$35,0),L40,M40) -> 16.24 | AJ40: XXX | AK40: =RatingChange(D40,OFFSET($D$35,$AK$35,0),P40,Q40) -> 12.52 | AL40: =RatingChange(D40,OFFSET($D$35,$AL$35,0),R40,S40) ->  | AM40: =RatingChange(D40,OFFSET($D$35,$AM$35,0),T40,U40) -> 
A41: 6 | B41: 1239 | C41: Lam, Sam | D41: 1853 | E41: =IF($C41>"",MAX(ROUND(D41+AE41,0),200),"") -> 1851 | F41: =IF($C41>"",OFFSET($E35,G35,2*$A41),"") -> 3 | G41: =IF($C41>"",OFFSET($E35,G35,2*$A41-1),"") -> 2 | H41: =IF($C41>"",OFFSET($E35,I35,2*$A41),"") -> 1 | I41: =IF($C41>"",OFFSET($E35,I35,2*$A41-1),"") -> 3 | J41: =IF($C41>"",OFFSET($E35,K35,2*$A41),"") -> 0 | K41: =IF($C41>"",OFFSET($E35,K35,2*$A41-1),"") -> 3 | L41: =IF($C41>"",OFFSET($E35,M35,2*$A41),"") -> 3 | M41: =IF($C41>"",OFFSET($E35,M35,2*$A41-1),"") -> 1 | N41: =IF($C41>"",OFFSET($E35,O35,2*$A41),"") -> 1 | O41: =IF($C41>"",OFFSET($E35,O35,2*$A41-1),"") -> 3 | P41: XXX | Q41: XXX | W41: =IF($C41>"",(IF(F41=3,1,0)+IF(H41=3,1,0)+IF(J41=3,1,0)+IF(L41=3,1,0)+IF(N41=3,1,0)+IF(P41=3,1,0)+IF(R41=3,1,0)+IF(T41=3,1,0)),"") -> 2 | X41: =IF($C41>"",SUM(F41,H41,J41,L41,N41,P41,R41,T41),"") -> 8 | Y41: =IF(C41>"",IF(D41<2000,16,8),"") -> 16 | Z41: =IF($C41>"",IF($D41<2000,2,1),"") -> 2 | AA41: =IF($C41>"",IF($D41<2000,25,50),"") -> 25 | AC41: =IF($C41>"",SUM(AF41:AL41),"") -> -2.4 | AD41: =IF($C41>"",IF(AC41<=24,0,AC41-24),"") -> 0 | AE41: =IF($C41>"",AC41+AD41,"") -> -2.4 | AF41: =RatingChange(D41,OFFSET($D$35,AF$35,0),F41,G41) -> 17.4 | AG41: =RatingChange(D41,OFFSET($D$35,$AG$35,0),H41,I41) -> -9.8 | AH41: =RatingChange(D41,OFFSET($D$35,AH$35,0),J41,K41) -> -13.2 | AI41: =RatingChange($D41,OFFSET($D$35,AI$35,0),L41,M41) -> 15.72 | AJ41: =RatingChange(D41,OFFSET($D$35,$AJ$35,0),N41,O41) -> -12.52 | AK41: XXX | AL41: =RatingChange(D41,OFFSET($D$35,$AL$35,0),R41,S41) ->  | AM41: =RatingChange(D41,OFFSET($D$35,$AM$35,0),T41,U41) -> 
A42: 7 | E42: =IF($C42>"",MAX(ROUND(D42+AE42,0),200),"") ->  | F42: =IF($C42>"",OFFSET($E35,G35,2*$A42),"") ->  | G42: =IF($C42>"",OFFSET($E35,G35,2*$A42-1),"") ->  | H42: =IF($C42>"",OFFSET($E35,I35,2*$A42),"") ->  | I42: =IF($C42>"",OFFSET($E35,I35,2*$A42-1),"") ->  | J42: =IF($C42>"",OFFSET($E35,K35,2*$A42),"") ->  | K42: =IF($C42>"",OFFSET($E35,K35,2*$A42-1),"") ->  | L42: =IF($C42>"",OFFSET($E35,M35,2*$A42),"") ->  | M42: =IF($C42>"",OFFSET($E35,M35,2*$A42-1),"") ->  | N42: =IF($C42>"",OFFSET($E35,O35,2*$A42),"") ->  | O42: =IF($C42>"",OFFSET($E35,O35,2*$A42-1),"") ->  | P42: =IF($C42>"",OFFSET($E35,Q35,2*$A42),"") ->  | Q42: =IF($C42>"",OFFSET($E35,Q35,2*$A42-1),"") ->  | R42: XXX | S42: XXX | W42: =IF($C42>"",(IF(F42=3,1,0)+IF(H42=3,1,0)+IF(J42=3,1,0)+IF(L42=3,1,0)+IF(N42=3,1,0)+IF(P42=3,1,0)+IF(R42=3,1,0)+IF(T42=3,1,0)),"") ->  | X42: =IF($C42>"",SUM(F42,H42,J42,L42,N42,P42,R42,T42),"") ->  | Y42: =IF(C42>"",IF(D42<2000,16,8),"") ->  | Z42: =IF($C42>"",IF($D42<2000,2,1),"") ->  | AA42: =IF($C42>"",IF($D42<2000,25,50),"") ->  | AC42: =IF($C42>"",SUM(AF42:AL42),"") ->  | AD42: =IF($C42>"",IF(AC42<=24,0,AC42-24),"") ->  | AE42: =IF($C42>"",AC42+AD42,"") ->  | AF42: =RatingChange(D42,OFFSET($D$35,AF$35,0),F42,G42) ->  | AG42: =RatingChange(D42,OFFSET($D$35,$AG$35,0),H42,I42) ->  | AH42: =RatingChange(D42,OFFSET($D$35,AH$35,0),J42,K42) ->  | AI42: =RatingChange($D42,OFFSET($D$35,AI$35,0),L42,M42) ->  | AJ42: =RatingChange(D42,OFFSET($D$35,$AJ$35,0),N42,O42) ->  | AK42: =RatingChange(D42,OFFSET($D$35,$AK$35,0),P42,Q42) ->  | AL42: XXX | AM42: =RatingChange(D42,OFFSET($D$35,$AM$35,0),T42,U42) -> 
A43: 8 | E43: =IF($C43>"",MAX(ROUND(D43+AE43,0),200),"") ->  | F43: =IF($C43>"",OFFSET($E35,G35,2*$A43),"") ->  | G43: =IF($C43>"",OFFSET($E35,G35,2*$A43-1),"") ->  | H43: =IF($C43>"",OFFSET($E35,I35,2*$A43),"") ->  | I43: =IF($C43>"",OFFSET($E35,I35,2*$A43-1),"") ->  | J43: =IF($C43>"",OFFSET($E35,K35,2*$A43),"") ->  | K43: =IF($C43>"",OFFSET($E35,K35,2*$A43-1),"") ->  | L43: =IF($C43>"",OFFSET($E35,M35,2*$A43),"") ->  | M43: =IF($C43>"",OFFSET($E35,M35,2*$A43-1),"") ->  | N43: =IF($C43>"",OFFSET($E35,O35,2*$A43),"") ->  | O43: =IF($C43>"",OFFSET($E35,O35,2*$A43-1),"") ->  | P43: =IF($C43>"",OFFSET($E35,Q35,2*$A43),"") ->  | Q43: =IF($C43>"",OFFSET($E35,Q35,2*$A43-1),"") ->  | R43: =IF($C43>"",OFFSET($E35,S35,2*$A43),"") ->  | S43: =IF($C43>"",OFFSET($E35,S35,2*$A43-1),"") ->  | T43: XXX | U43: XXX | W43: =IF($C43>"",(IF(F43=3,1,0)+IF(H43=3,1,0)+IF(J43=3,1,0)+IF(L43=3,1,0)+IF(N43=3,1,0)+IF(P43=3,1,0)+IF(R43=3,1,0)+IF(T43=3,1,0)),"") ->  | X43: =IF($C43>"",SUM(F43,H43,J43,L43,N43,P43,R43,T43),"") ->  | Y43: =IF(C43>"",IF(D43<2000,16,8),"") ->  | Z43: =IF($C43>"",IF($D43<2000,2,1),"") ->  | AA43: =IF($C43>"",IF($D43<2000,25,50),"") ->  | AC43: =IF($C43>"",SUM(AF43:AL43),"") ->  | AD43: =IF($C43>"",IF(AC43<=24,0,AC43-24),"") ->  | AE43: =IF($C43>"",AC43+AD43,"") ->  | AF43: =RatingChange(D43,OFFSET($D$35,AF$35,0),F43,G43) ->  | AG43: =RatingChange(D43,OFFSET($D$35,$AG$35,0),H43,I43) ->  | AH43: =RatingChange(D43,OFFSET($D$35,AH$35,0),J43,K43) ->  | AI43: =RatingChange($D43,OFFSET($D$35,AI$35,0),L43,M43) ->  | AJ43: =RatingChange(D43,OFFSET($D$35,$AJ$35,0),N43,O43) ->  | AK43: =RatingChange(D43,OFFSET($D$35,$AK$35,0),P43,Q43) ->  | AL43: =RatingChange(D43,OFFSET($D$35,$AL$35,0),R43,S43) ->  | AM43: XXX
A49: # | B49: ID | C49: Name | D49: Rating | E49: Rating | J49: Games Won/Lost against | W49: Matches | X49: Games | AC49: Rating | AD49: Bonus | AE49: Change | AF49: Rating change vs.
A50: 4 | D50: Pre | E50: Post | G50: 1 | I50: 2 | K50: 3 | M50: 4 | O50: 5 | Q50: 6 | S50: 7 | U50: 8 | W50: Won | X50: Won | AC50: Change | AD50: Points | AE50: w/Bonus | AF50: 1 | AG50: 2 | AH50: 3 | AI50: 4 | AJ50: 5 | AK50: 6 | AL50: 7 | AM50: 8
A51: 1 | B51: 1046 | C51: Siu, Calvin | D51: 1884 | E51: =IF($C51>"",MAX(ROUND(D51+AE51,0),200),"") -> 1858 | F51: XXX | G51: XXX | H51: 0 | I51: 3 | J51: 3 | K51: 0 | L51: 0 | M51: 3 | N51: 3 | O51: 1 | P51: 1 | Q51: 3 | W51: =IF($C51>"",(IF(F51=3,1,0)+IF(H51=3,1,0)+IF(J51=3,1,0)+IF(L51=3,1,0)+IF(N51=3,1,0)+IF(P51=3,1,0)+IF(R51=3,1,0)+IF(T51=3,1,0)),"") -> 2 | X51: =IF($C51>"",SUM(F51,H51,J51,L51,N51,P51,R51,T51),"") -> 7 | Y51: =IF(C51>"",IF(D51<2000,16,8),"") -> 16 | Z51: =IF($C51>"",IF($D51<2000,2,1),"") -> 2 | AA51: =IF($C51>"",IF($D51<2000,25,50),"") -> 25 | AC51: =IF($C51>"",SUM(AF51:AL51),"") -> -25.96 | AD51: =IF($C51>"",IF(AC51<=24,0,AC51-24),"") -> 0 | AE51: =IF($C51>"",AC51+AD51,"") -> -25.96 | AF51: XXX | AG51: =RatingChange(D51,OFFSET($D$50,$AG$50,0),H51,I51) -> -16.56 | AH51: =RatingChange(D51,OFFSET($D$50,AH$50,0),J51,K51) -> 15.36 | AI51: =RatingChange($D51,OFFSET($D$50,AI$50,0),L51,M51) -> -18.04 | AJ51: =RatingChange(D51,OFFSET($D$50,$AJ$50,0),N51,O51) -> 11.2 | AK51: =RatingChange(D51,OFFSET($D$50,$AK$50,0),P51,Q51) -> -17.92 | AL51: =RatingChange(D51,OFFSET($D$50,$AL$50,0),R51,S51) ->  | AM51: =RatingChange(D51,OFFSET($D$50,$AM$50,0),T51,U51) -> 
A52: 2 | B52: 2100 | C52: Kim, Wonhyung | D52: 1870 | E52: =IF($C52>"",MAX(ROUND(D52+AE52,0),200),"") -> 1929 | F52: =IF($C52>"",OFFSET($E50,G50,2*$A52),"") -> 3 | G52: =IF($C52>"",OFFSET($E50,G50,2*$A52-1),"") -> 0 | H52: XXX | I52: XXX | J52: 3 | K52: 2 | L52: 3 | M52: 0 | N52: 2 | O52: 3 | P52: 3 | Q52: 0 | W52: =IF($C52>"",(IF(F52=3,1,0)+IF(H52=3,1,0)+IF(J52=3,1,0)+IF(L52=3,1,0)+IF(N52=3,1,0)+IF(P52=3,1,0)+IF(R52=3,1,0)+IF(T52=3,1,0)),"") -> 4 | X52: =IF($C52>"",SUM(F52,H52,J52,L52,N52,P52,R52,T52),"") -> 14 | Y52: =IF(C52>"",IF(D52<2000,16,8),"") -> 16 | Z52: =IF($C52>"",IF($D52<2000,2,1),"") -> 2 | AA52: =IF($C52>"",IF($D52<2000,25,50),"") -> 25 | AC52: =IF($C52>"",SUM(AF52:AL52),"") -> 41.4 | AD52: =IF($C52>"",IF(AC52<=24,0,AC52-24),"") -> 17.4 | AE52: =IF($C52>"",AC52+AD52,"") -> 58.8 | AF52: =RatingChange(D52,OFFSET($D$50,AF$50,0),F52,G52) -> 16.56 | AG52: XXX | AH52: =RatingChange(D52,OFFSET($D$50,AH$50,0),J52,K52) -> 11.92 | AI52: =RatingChange($D52,OFFSET($D$50,AI$50,0),L52,M52) -> 14.52 | AJ52: =RatingChange(D52,OFFSET($D$50,$AJ$50,0),N52,O52) -> -14.24 | AK52: =RatingChange(D52,OFFSET($D$50,$AK$50,0),P52,Q52) -> 12.64 | AL52: =RatingChange(D52,OFFSET($D$50,$AL$50,0),R52,S52) ->  | AM52: =RatingChange(D52,OFFSET($D$50,$AM$50,0),T52,U52) -> 
A53: 3 | B53: 1406 | C53: Sun, Terence | D53: 1868 | E53: =IF($C53>"",MAX(ROUND(D53+AE53,0),200),"") -> 1820 | F53: =IF($C53>"",OFFSET($E50,G50,2*$A53),"") -> 0 | G53: =IF($C53>"",OFFSET($E50,G50,2*$A53-1),"") -> 3 | H53: =IF($C53>"",OFFSET($E50,I50,2*$A53),"") -> 2 | I53: =IF($C53>"",OFFSET($E50,I50,2*$A53-1),"") -> 3 | J53: XXX | K53: XXX | L53: 3 | M53: 1 | N53: 1 | O53: 3 | P53: 1 | Q53: 3 | W53: =IF($C53>"",(IF(F53=3,1,0)+IF(H53=3,1,0)+IF(J53=3,1,0)+IF(L53=3,1,0)+IF(N53=3,1,0)+IF(P53=3,1,0)+IF(R53=3,1,0)+IF(T53=3,1,0)),"") -> 1 | X53: =IF($C53>"",SUM(F53,H53,J53,L53,N53,P53,R53,T53),"") -> 7 | Y53: =IF(C53>"",IF(D53<2000,16,8),"") -> 16 | Z53: =IF($C53>"",IF($D53<2000,2,1),"") -> 2 | AA53: =IF($C53>"",IF($D53<2000,25,50),"") -> 25 | AC53: =IF($C53>"",SUM(AF53:AL53),"") -> -48.12 | AD53: =IF($C53>"",IF(AC53<=24,0,AC53-24),"") -> 0 | AE53: =IF($C53>"",AC53+AD53,"") -> -48.12 | AF53: =RatingChange(D53,OFFSET($D$50,AF$50,0),F53,G53) -> -15.36 | AG53: =RatingChange(D53,OFFSET($D$50,$AG$50,0),H53,I53) -> -11.92 | AH53: XXX | AI53: =RatingChange($D53,OFFSET($D$50,AI$50,0),L53,M53) -> 12.6 | AJ53: =RatingChange(D53,OFFSET($D$50,$AJ$50,0),N53,O53) -> -16.16 | AK53: =RatingChange(D53,OFFSET($D$50,$AK$50,0),P53,Q53) -> -17.28 | AL53: =RatingChange(D53,OFFSET($D$50,$AL$50,0),R53,S53) ->  | AM53: =RatingChange(D53,OFFSET($D$50,$AM$50,0),T53,U53) -> 
A54: 4 | B54: 1155 | C54: Dai, Kang | D54: 1833 | E54: =IF($C54>"",MAX(ROUND(D54+AE54,0),200),"") -> 1849 | F54: =IF($C54>"",OFFSET($E50,G50,2*$A54),"") -> 3 | G54: =IF($C54>"",OFFSET($E50,G50,2*$A54-1),"") -> 0 | H54: =IF($C54>"",OFFSET($E50,I50,2*$A54),"") -> 0 | I54: =IF($C54>"",OFFSET($E50,I50,2*$A54-1),"") -> 3 | J54: =IF($C54>"",OFFSET($E50,K50,2*$A54),"") -> 1 | K54: =IF($C54>"",OFFSET($E50,K50,2*$A54-1),"") -> 3 | L54: XXX | M54: XXX | N54: 3 | O54: 1 | P54: 3 | Q54: 1 | W54: =IF($C54>"",(IF(F54=3,1,0)+IF(H54=3,1,0)+IF(J54=3,1,0)+IF(L54=3,1,0)+IF(N54=3,1,0)+IF(P54=3,1,0)+IF(R54=3,1,0)+IF(T54=3,1,0)),"") -> 3 | X54: =IF($C54>"",SUM(F54,H54,J54,L54,N54,P54,R54,T54),"") -> 10 | Y54: =IF(C54>"",IF(D54<2000,16,8),"") -> 16 | Z54: =IF($C54>"",IF($D54<2000,2,1),"") -> 2 | AA54: =IF($C54>"",IF($D54<2000,25,50),"") -> 25 | AC54: =IF($C54>"",SUM(AF54:AL54),"") -> 16.28 | AD54: =IF($C54>"",IF(AC54<=24,0,AC54-24),"") -> 0 | AE54: =IF($C54>"",AC54+AD54,"") -> 16.28 | AF54: =RatingChange(D54,OFFSET($D$50,AF$50,0),F54,G54) -> 18.04 | AG54: =RatingChange(D54,OFFSET($D$50,$AG$50,0),H54,I54) -> -14.52 | AH54: =RatingChange(D54,OFFSET($D$50,AH$50,0),J54,K54) -> -12.6 | AI54: XXX | AJ54: =RatingChange(D54,OFFSET($D$50,$AJ$50,0),N54,O54) -> 13.24 | AK54: =RatingChange(D54,OFFSET($D$50,$AK$50,0),P54,Q54) -> 12.12 | AL54: =RatingChange(D54,OFFSET($D$50,$AL$50,0),R54,S54) ->  | AM54: =RatingChange(D54,OFFSET($D$50,$AM$50,0),T54,U54) -> 
A55: 5 | B55: 1393 | C55: Lin, Andrew | D55: 1814 | E55: =IF($C55>"",MAX(ROUND(D55+AE55,0),200),"") -> 1831 | F55: =IF($C55>"",OFFSET($E50,G50,2*$A55),"") -> 1 | G55: =IF($C55>"",OFFSET($E50,G50,2*$A55-1),"") -> 3 | H55: =IF($C55>"",OFFSET($E50,I50,2*$A55),"") -> 3 | I55: =IF($C55>"",OFFSET($E50,I50,2*$A55-1),"") -> 2 | J55: =IF($C55>"",OFFSET($E50,K50,2*$A55),"") -> 3 | K55: =IF($C55>"",OFFSET($E50,K50,2*$A55-1),"") -> 1 | L55: =IF($C55>"",OFFSET($E50,M50,2*$A55),"") -> 1 | M55: =IF($C55>"",OFFSET($E50,M50,2*$A55-1),"") -> 3 | N55: XXX | O55: XXX | P55: 3 | Q55: 2 | W55: =IF($C55>"",(IF(F55=3,1,0)+IF(H55=3,1,0)+IF(J55=3,1,0)+IF(L55=3,1,0)+IF(N55=3,1,0)+IF(P55=3,1,0)+IF(R55=3,1,0)+IF(T55=3,1,0)),"") -> 3 | X55: =IF($C55>"",SUM(F55,H55,J55,L55,N55,P55,R55,T55),"") -> 11 | Y55: =IF(C55>"",IF(D55<2000,16,8),"") -> 16 | Z55: =IF($C55>"",IF($D55<2000,2,1),"") -> 2 | AA55: =IF($C55>"",IF($D55<2000,25,50),"") -> 25 | AC55: =IF($C55>"",SUM(AF55:AL55),"") -> 16.84 | AD55: =IF($C55>"",IF(AC55<=24,0,AC55-24),"") -> 0 | AE55: =IF($C55>"",AC55+AD55,"") -> 16.84 | AF55: =RatingChange(D55,OFFSET($D$50,AF$50,0),F55,G55) -> -11.2 | AG55: =RatingChange(D55,OFFSET($D$50,$AG$50,0),H55,I55) -> 14.24 | AH55: =RatingChange(D55,OFFSET($D$50,AH$50,0),J55,K55) -> 16.16 | AI55: =RatingChange($D55,OFFSET($D$50,AI$50,0),L55,M55) -> -13.24 | AJ55: XXX | AK55: =RatingChange(D55,OFFSET($D$50,$AK$50,0),P55,Q55) -> 10.88 | AL55: =RatingChange(D55,OFFSET($D$50,$AL$50,0),R55,S55) ->  | AM55: =RatingChange(D55,OFFSET($D$50,$AM$50,0),T55,U55) -> 
A56: 6 | B56: 1254 | C56: Adams, Steve | D56: 1786 | E56: =IF($C56>"",MAX(ROUND(D56+AE56,0),200),"") -> 1786 | F56: =IF($C56>"",OFFSET($E50,G50,2*$A56),"") -> 3 | G56: =IF($C56>"",OFFSET($E50,G50,2*$A56-1),"") -> 1 | H56: =IF($C56>"",OFFSET($E50,I50,2*$A56),"") -> 0 | I56: =IF($C56>"",OFFSET($E50,I50,2*$A56-1),"") -> 3 | J56: =IF($C56>"",OFFSET($E50,K50,2*$A56),"") -> 3 | K56: =IF($C56>"",OFFSET($E50,K50,2*$A56-1),"") -> 1 | L56: =IF($C56>"",OFFSET($E50,M50,2*$A56),"") -> 1 | M56: =IF($C56>"",OFFSET($E50,M50,2*$A56-1),"") -> 3 | N56: =IF($C56>"",OFFSET($E50,O50,2*$A56),"") -> 2 | O56: =IF($C56>"",OFFSET($E50,O50,2*$A56-1),"") -> 3 | P56: XXX | Q56: XXX | W56: =IF($C56>"",(IF(F56=3,1,0)+IF(H56=3,1,0)+IF(J56=3,1,0)+IF(L56=3,1,0)+IF(N56=3,1,0)+IF(P56=3,1,0)+IF(R56=3,1,0)+IF(T56=3,1,0)),"") -> 2 | X56: =IF($C56>"",SUM(F56,H56,J56,L56,N56,P56,R56,T56),"") -> 9 | Y56: =IF(C56>"",IF(D56<2000,16,8),"") -> 16 | Z56: =IF($C56>"",IF($D56<2000,2,1),"") -> 2 | AA56: =IF($C56>"",IF($D56<2000,25,50),"") -> 25 | AC56: =IF($C56>"",SUM(AF56:AL56),"") -> -0.43999999999999773 | AD56: =IF($C56>"",IF(AC56<=24,0,AC56-24),"") -> 0 | AE56: =IF($C56>"",AC56+AD56,"") -> -0.43999999999999773 | AF56: =RatingChange(D56,OFFSET($D$50,AF$50,0),F56,G56) -> 17.92 | AG56: =RatingChange(D56,OFFSET($D$50,$AG$50,0),H56,I56) -> -12.64 | AH56: =RatingChange(D56,OFFSET($D$50,AH$50,0),J56,K56) -> 17.28 | AI56: =RatingChange($D56,OFFSET($D$50,AI$50,0),L56,M56) -> -12.12 | AJ56: =RatingChange(D56,OFFSET($D$50,$AJ$50,0),N56,O56) -> -10.88 | AK56: XXX | AL56: =RatingChange(D56,OFFSET($D$50,$AL$50,0),R56,S56) ->  | AM56: =RatingChange(D56,OFFSET($D$50,$AM$50,0),T56,U56) -> 
A57: 7 | E57: =IF($C57>"",MAX(ROUND(D57+AE57,0),200),"") ->  | F57: =IF($C57>"",OFFSET($E50,G50,2*$A57),"") ->  | G57: =IF($C57>"",OFFSET($E50,G50,2*$A57-1),"") ->  | H57: =IF($C57>"",OFFSET($E50,I50,2*$A57),"") ->  | I57: =IF($C57>"",OFFSET($E50,I50,2*$A57-1),"") ->  | J57: =IF($C57>"",OFFSET($E50,K50,2*$A57),"") ->  | K57: =IF($C57>"",OFFSET($E50,K50,2*$A57-1),"") ->  | L57: =IF($C57>"",OFFSET($E50,M50,2*$A57),"") ->  | M57: =IF($C57>"",OFFSET($E50,M50,2*$A57-1),"") ->  | N57: =IF($C57>"",OFFSET($E50,O50,2*$A57),"") ->  | O57: =IF($C57>"",OFFSET($E50,O50,2*$A57-1),"") ->  | P57: =IF($C57>"",OFFSET($E50,Q50,2*$A57),"") ->  | Q57: =IF($C57>"",OFFSET($E50,Q50,2*$A57-1),"") ->  | R57: XXX | S57: XXX | Y57: =IF(C57>"",IF(D57<2000,16,8),"") ->  | Z57: =IF($C57>"",IF($D57<2000,2,1),"") ->  | AA57: =IF($C57>"",IF($D57<2000,25,50),"") ->  | AL57: XXX | AM57: =RatingChange(D57,OFFSET($D$50,$AM$50,0),T57,U57) -> 
A58: 8 | E58: =IF($C58>"",MAX(ROUND(D58+AE58,0),200),"") ->  | F58: =IF($C58>"",OFFSET($E50,G50,2*$A58),"") ->  | G58: =IF($C58>"",OFFSET($E50,G50,2*$A58-1),"") ->  | H58: =IF($C58>"",OFFSET($E50,I50,2*$A58),"") ->  | I58: =IF($C58>"",OFFSET($E50,I50,2*$A58-1),"") ->  | J58: =IF($C58>"",OFFSET($E50,K50,2*$A58),"") ->  | K58: =IF($C58>"",OFFSET($E50,K50,2*$A58-1),"") ->  | L58: =IF($C58>"",OFFSET($E50,M50,2*$A58),"") ->  | M58: =IF($C58>"",OFFSET($E50,M50,2*$A58-1),"") ->  | N58: =IF($C58>"",OFFSET($E50,O50,2*$A58),"") ->  | O58: =IF($C58>"",OFFSET($E50,O50,2*$A58-1),"") ->  | P58: =IF($C58>"",OFFSET($E50,Q50,2*$A58),"") ->  | Q58: =IF($C58>"",OFFSET($E50,Q50,2*$A58-1),"") ->  | R58: =IF($C58>"",OFFSET($E50,S50,2*$A58),"") ->  | S58: =IF($C58>"",OFFSET($E50,S50,2*$A58-1),"") ->  | T58: XXX | U58: XXX | W58: =IF($C58>"",(IF(F58=3,1,0)+IF(H58=3,1,0)+IF(J58=3,1,0)+IF(L58=3,1,0)+IF(N58=3,1,0)+IF(P58=3,1,0)+IF(R58=3,1,0)+IF(T58=3,1,0)),"") ->  | X58: =IF($C58>"",SUM(F58,H58,J58,L58,N58,P58,R58,T58),"") ->  | Y58: =IF(C58>"",IF(D58<2000,16,8),"") ->  | Z58: =IF($C58>"",IF($D58<2000,2,1),"") ->  | AA58: =IF($C58>"",IF($D58<2000,25,50),"") ->  | AC58: =IF($C58>"",SUM(AF58:AL58),"") ->  | AD58: =IF($C58>"",IF(AC58<=24,0,AC58-24),"") ->  | AE58: =IF($C58>"",AC58+AD58,"") ->  | AF58: =RatingChange(D58,OFFSET($D$50,AF$50,0),F58,G58) ->  | AG58: =RatingChange(D58,OFFSET($D$50,$AG$50,0),H58,I58) ->  | AH58: =RatingChange(D58,OFFSET($D$50,AH$50,0),J58,K58) ->  | AI58: =RatingChange($D58,OFFSET($D$50,AI$50,0),L58,M58) ->  | AJ58: =RatingChange(D58,OFFSET($D$50,$AJ$50,0),N58,O58) ->  | AK58: =RatingChange(D58,OFFSET($D$50,$AK$50,0),P58,Q58) ->  | AL58: =RatingChange(D58,OFFSET($D$50,$AL$50,0),R58,S58) ->  | AM58: XXX
A64: # | B64: ID | C64: Name | D64: Rating | E64: Rating | J64: Games Won/Lost against | W64: Matches | X64: Games | AC64: Rating | AD64: Bonus | AE64: Change | AF64: Rating change vs.
A65: 5 | D65: Pre | E65: Post | G65: 1 | I65: 2 | K65: 3 | M65: 4 | O65: 5 | Q65: 6 | S65: 7 | U65: 8 | W65: Won | X65: Won | AC65: Change | AD65: Points | AE65: w/Bonus | AF65: 1 | AG65: 2 | AH65: 3 | AI65: 4 | AJ65: 5 | AK65: 6 | AL65: 7 | AM65: 8
A66: 1 | B66: 2109 | C66: Dupont, Nick | D66: 1742 | E66: =IF($C66>"",MAX(ROUND(D66+AE66,0),200),"") -> 1807 | F66: XXX | G66: XXX | H66: 3 | I66: 1 | J66: 3 | K66: 1 | L66: 3 | M66: 0 | N66: 3 | O66: 1 | P66: 0 | Q66: 0 | R66: 0 | S66: 0 | W66: =IF($C66>"",(IF(F66=3,1,0)+IF(H66=3,1,0)+IF(J66=3,1,0)+IF(L66=3,1,0)+IF(N66=3,1,0)+IF(P66=3,1,0)+IF(R66=3,1,0)+IF(T66=3,1,0)),"") -> 4 | X66: =IF($C66>"",SUM(F66,H66,J66,L66,N66,P66,R66,T66),"") -> 12 | Y66: =IF(C66>"",IF(D66<2000,16,8),"") -> 16 | Z66: =IF($C66>"",IF($D66<2000,2,1),"") -> 2 | AA66: =IF($C66>"",IF($D66<2000,25,50),"") -> 25 | AC66: =IF($C66>"",SUM(AF66:AL66),"") -> 44.6 | AD66: =IF($C66>"",IF(AC66<=24,0,AC66-24),"") -> 20.6 | AE66: =IF($C66>"",AC66+AD66,"") -> 65.2 | AF66: XXX | AG66: =RatingChange(D66,OFFSET($D$65,$AG$65,0),H66,I66) -> 13.96 | AH66: =RatingChange(D66,OFFSET($D$65,AH$65,0),J66,K66) -> 10.28 | AI66: =RatingChange($D66,OFFSET($D$65,AI$65,0),L66,M66) -> 11.56 | AJ66: =RatingChange(D66,OFFSET($D$65,$AJ$65,0),N66,O66) -> 8.8 | AK66: =RatingChange(D66,OFFSET($D$65,$AK$65,0),P66,Q66) -> 0 | AL66: =RatingChange(D66,OFFSET($D$65,$AL$65,0),R66,S66) -> 0 | AM66: =RatingChange(D66,OFFSET($D$65,$AM$65,0),T66,U66) -> 
A67: 2 | B67: 1201 | C67: Labins, Mike | D67: 1741 | E67: =IF($C67>"",MAX(ROUND(D67+AE67,0),200),"") -> 1700 | F67: =IF($C67>"",OFFSET($E65,G65,2*$A67),"") -> 1 | G67: =IF($C67>"",OFFSET($E65,G65,2*$A67-1),"") -> 3 | H67: XXX | I67: XXX | J67: 0 | K67: 0 | L67: 2 | M67: 3 | N67: 0 | O67: 0 | P67: 3 | Q67: 1 | R67: 2 | S67: 3 | W67: =IF($C67>"",(IF(F67=3,1,0)+IF(H67=3,1,0)+IF(J67=3,1,0)+IF(L67=3,1,0)+IF(N67=3,1,0)+IF(P67=3,1,0)+IF(R67=3,1,0)+IF(T67=3,1,0)),"") -> 1 | X67: =IF($C67>"",SUM(F67,H67,J67,L67,N67,P67,R67,T67),"") -> 8 | Y67: =IF(C67>"",IF(D67<2000,16,8),"") -> 16 | Z67: =IF($C67>"",IF($D67<2000,2,1),"") -> 2 | AA67: =IF($C67>"",IF($D67<2000,25,50),"") -> 25 | AC67: =IF($C67>"",SUM(AF67:AL67),"") -> -40.84 | AD67: =IF($C67>"",IF(AC67<=24,0,AC67-24),"") -> 0 | AE67: =IF($C67>"",AC67+AD67,"") -> -40.84 | AF67: =RatingChange(D67,OFFSET($D$65,AF$65,0),F67,G67) -> -13.96 | AG67: XXX | AH67: =RatingChange(D67,OFFSET($D$65,AH$65,0),J67,K67) -> 0 | AI67: =RatingChange($D67,OFFSET($D$65,AI$65,0),L67,M67) -> -16.4 | AJ67: =RatingChange(D67,OFFSET($D$65,$AJ$65,0),N67,O67) -> 0 | AK67: =RatingChange(D67,OFFSET($D$65,$AK$65,0),P67,Q67) -> 8 | AL67: =RatingChange(D67,OFFSET($D$65,$AL$65,0),R67,S67) -> -18.48 | AM67: =RatingChange(D67,OFFSET($D$65,$AM$65,0),T67,U67) -> 
A68: 3 | B68: 2005 | C68: Wu, Sean | D68: 1649 | E68: =IF($C68>"",MAX(ROUND(D68+AE68,0),200),"") -> 1665 | F68: =IF($C68>"",OFFSET($E65,G65,2*$A68),"") -> 1 | G68: =IF($C68>"",OFFSET($E65,G65,2*$A68-1),"") -> 3 | H68: =IF($C68>"",OFFSET($E65,I65,2*$A68),"") -> 0 | I68: =IF($C68>"",OFFSET($E65,I65,2*$A68-1),"") -> 0 | J68: XXX | K68: XXX | L68: 3 | M68: 1 | N68: 2 | O68: 3 | P68: 3 | Q68: 0 | R68: 3 | S68: 0 | W68: =IF($C68>"",(IF(F68=3,1,0)+IF(H68=3,1,0)+IF(J68=3,1,0)+IF(L68=3,1,0)+IF(N68=3,1,0)+IF(P68=3,1,0)+IF(R68=3,1,0)+IF(T68=3,1,0)),"") -> 3 | X68: =IF($C68>"",SUM(F68,H68,J68,L68,N68,P68,R68,T68),"") -> 12 | Y68: =IF(C68>"",IF(D68<2000,16,8),"") -> 16 | Z68: =IF($C68>"",IF($D68<2000,2,1),"") -> 2 | AA68: =IF($C68>"",IF($D68<2000,25,50),"") -> 25 | AC68: =IF($C68>"",SUM(AF68:AL68),"") -> 16.4 | AD68: =IF($C68>"",IF(AC68<=24,0,AC68-24),"") -> 0 | AE68: =IF($C68>"",AC68+AD68,"") -> 16.4 | AF68: =RatingChange(D68,OFFSET($D$65,AF$65,0),F68,G68) -> -10.28 | AG68: =RatingChange(D68,OFFSET($D$65,$AG$65,0),H68,I68) -> 0 | AH68: XXX | AI68: =RatingChange($D68,OFFSET($D$65,AI$65,0),L68,M68) -> 13.28 | AJ68: =RatingChange(D68,OFFSET($D$65,$AJ$65,0),N68,O68) -> -13.48 | AK68: =RatingChange(D68,OFFSET($D$65,$AK$65,0),P68,Q68) -> 13.68 | AL68: =RatingChange(D68,OFFSET($D$65,$AL$65,0),R68,S68) -> 13.2 | AM68: =RatingChange(D68,OFFSET($D$65,$AM$65,0),T68,U68) -> 
A69: 4 | B69: 1326 | C69: Szumilo, Anthony | D69: 1631 | E69: =IF($C69>"",MAX(ROUND(D69+AE69,0),200),"") -> 1634 | F69: =IF($C69>"",OFFSET($E65,G65,2*$A69),"") -> 0 | G69: =IF($C69>"",OFFSET($E65,G65,2*$A69-1),"") -> 3 | H69: =IF($C69>"",OFFSET($E65,I65,2*$A69),"") -> 3 | I69: =IF($C69>"",OFFSET($E65,I65,2*$A69-1),"") -> 2 | J69: =IF($C69>"",OFFSET($E65,K65,2*$A69),"") -> 1 | K69: =IF($C69>"",OFFSET($E65,K65,2*$A69-1),"") -> 3 | L69: XXX | M69: XXX | N69: 3 | O69: 2 | P69: 0 | Q69: 0 | R69: 0 | S69: 0 | W69: =IF($C69>"",(IF(F69=3,1,0)+IF(H69=3,1,0)+IF(J69=3,1,0)+IF(L69=3,1,0)+IF(N69=3,1,0)+IF(P69=3,1,0)+IF(R69=3,1,0)+IF(T69=3,1,0)),"") -> 2 | X69: =IF($C69>"",SUM(F69,H69,J69,L69,N69,P69,R69,T69),"") -> 7 | Y69: =IF(C69>"",IF(D69<2000,16,8),"") -> 16 | Z69: =IF($C69>"",IF($D69<2000,2,1),"") -> 2 | AA69: =IF($C69>"",IF($D69<2000,25,50),"") -> 25 | AC69: =IF($C69>"",SUM(AF69:AL69),"") -> 2.8 | AD69: =IF($C69>"",IF(AC69<=24,0,AC69-24),"") -> 0 | AE69: =IF($C69>"",AC69+AD69,"") -> 2.8 | AF69: =RatingChange(D69,OFFSET($D$65,AF$65,0),F69,G69) -> -11.56 | AG69: =RatingChange(D69,OFFSET($D$65,$AG$65,0),H69,I69) -> 16.4 | AH69: =RatingChange(D69,OFFSET($D$65,AH$65,0),J69,K69) -> -13.28 | AI69: XXX | AJ69: =RatingChange(D69,OFFSET($D$65,$AJ$65,0),N69,O69) -> 11.24 | AK69: =RatingChange(D69,OFFSET($D$65,$AK$65,0),P69,Q69) -> 0 | AL69: =RatingChange(D69,OFFSET($D$65,$AL$65,0),R69,S69) -> 0 | AM69: =RatingChange(D69,OFFSET($D$65,$AM$65,0),T69,U69) -> 
A70: 5 | B70: 1131 | C70: Cembura, Jim | D70: 1612 | E70: =IF($C70>"",MAX(ROUND(D70+AE70,0),200),"") -> 1573 | F70: =IF($C70>"",OFFSET($E65,G65,2*$A70),"") -> 1 | G70: =IF($C70>"",OFFSET($E65,G65,2*$A70-1),"") -> 3 | H70: =IF($C70>"",OFFSET($E65,I65,2*$A70),"") -> 0 | I70: =IF($C70>"",OFFSET($E65,I65,2*$A70-1),"") -> 0 | J70: =IF($C70>"",OFFSET($E65,K65,2*$A70),"") -> 3 | K70: =IF($C70>"",OFFSET($E65,K65,2*$A70-1),"") -> 2 | L70: =IF($C70>"",OFFSET($E65,M65,2*$A70),"") -> 2 | M70: =IF($C70>"",OFFSET($E65,M65,2*$A70-1),"") -> 3 | N70: XXX | O70: XXX | P70: 1 | Q70: 3 | R70: 0 | S70: 3 | W70: =IF($C70>"",(IF(F70=3,1,0)+IF(H70=3,1,0)+IF(J70=3,1,0)+IF(L70=3,1,0)+IF(N70=3,1,0)+IF(P70=3,1,0)+IF(R70=3,1,0)+IF(T70=3,1,0)),"") -> 1 | X70: =IF($C70>"",SUM(F70,H70,J70,L70,N70,P70,R70,T70),"") -> 7 | Y70: =IF(C70>"",IF(D70<2000,16,8),"") -> 16 | Z70: =IF($C70>"",IF($D70<2000,2,1),"") -> 2 | AA70: =IF($C70>"",IF($D70<2000,25,50),"") -> 25 | AC70: =IF($C70>"",SUM(AF70:AL70),"") -> -38.72 | AD70: =IF($C70>"",IF(AC70<=24,0,AC70-24),"") -> 0 | AE70: =IF($C70>"",AC70+AD70,"") -> -38.72 | AF70: =RatingChange(D70,OFFSET($D$65,AF$65,0),F70,G70) -> -8.8 | AG70: =RatingChange(D70,OFFSET($D$65,$AG$65,0),H70,I70) -> 0 | AH70: =RatingChange(D70,OFFSET($D$65,AH$65,0),J70,K70) -> 13.48 | AI70: =RatingChange($D70,OFFSET($D$65,AI$65,0),L70,M70) -> -11.24 | AJ70: XXX | AK70: =RatingChange(D70,OFFSET($D$65,$AK$65,0),P70,Q70) -> -14.84 | AL70: =RatingChange(D70,OFFSET($D$65,$AL$65,0),R70,S70) -> -17.32 | AM70: =RatingChange(D70,OFFSET($D$65,$AM$65,0),T70,U70) -> 
A71: 6 | B71: 1407 | C71: Sun, Vivian | D71: 1591 | E71: =IF($C71>"",MAX(ROUND(D71+AE71,0),200),"") -> 1606 | F71: =IF($C71>"",OFFSET($E65,G65,2*$A71),"") -> 0 | G71: =IF($C71>"",OFFSET($E65,G65,2*$A71-1),"") -> 0 | H71: =IF($C71>"",OFFSET($E65,I65,2*$A71),"") -> 1 | I71: =IF($C71>"",OFFSET($E65,I65,2*$A71-1),"") -> 3 | J71: =IF($C71>"",OFFSET($E65,K65,2*$A71),"") -> 0 | K71: =IF($C71>"",OFFSET($E65,K65,2*$A71-1),"") -> 3 | L71: =IF($C71>"",OFFSET($E65,M65,2*$A71),"") -> 0 | M71: =IF($C71>"",OFFSET($E65,M65,2*$A71-1),"") -> 0 | N71: =IF($C71>"",OFFSET($E65,O65,2*$A71),"") -> 3 | O71: =IF($C71>"",OFFSET($E65,O65,2*$A71-1),"") -> 1 | P71: XXX | Q71: XXX | R71: 3 | S71: 1 | W71: =IF($C71>"",(IF(F71=3,1,0)+IF(H71=3,1,0)+IF(J71=3,1,0)+IF(L71=3,1,0)+IF(N71=3,1,0)+IF(P71=3,1,0)+IF(R71=3,1,0)+IF(T71=3,1,0)),"") -> 2 | X71: =IF($C71>"",SUM(F71,H71,J71,L71,N71,P71,R71,T71),"") -> 7 | Y71: =IF(C71>"",IF(D71<2000,16,8),"") -> 16 | Z71: =IF($C71>"",IF($D71<2000,2,1),"") -> 2 | AA71: =IF($C71>"",IF($D71<2000,25,50),"") -> 25 | AC71: =IF($C71>"",SUM(AF71:AL71),"") -> 15.16 | AD71: =IF($C71>"",IF(AC71<=24,0,AC71-24),"") -> 0 | AE71: =IF($C71>"",AC71+AD71,"") -> 15.16 | AF71: =RatingChange(D71,OFFSET($D$50,AF$50,0),F71,G71) -> 0 | AG71: =RatingChange(D71,OFFSET($D$50,$AG$50,0),H71,I71) -> -2.84 | AH71: =RatingChange(D71,OFFSET($D$50,AH$50,0),J71,K71) -> -4.92 | AI71: =RatingChange($D71,OFFSET($D$50,AI$50,0),L71,M71) -> 0 | AJ71: =RatingChange(D71,OFFSET($D$50,$AJ$50,0),N71,O71) -> 22.92 | AK71: XXX | AL71: =RatingChange(D71,OFFSET($D$50,$AL$50,0),R71,S71) -> 0 | AM71: =RatingChange(D71,OFFSET($D$65,$AM$65,0),T71,U71) -> 
A72: 7 | B72: 1156 | C72: Lee, Kanon | D72: 1579 | E72: =IF($C72>"",MAX(ROUND(D72+AE72,0),200),"") -> 1588 | F72: =IF($C72>"",OFFSET($E65,G65,2*$A72),"") -> 0 | G72: =IF($C72>"",OFFSET($E65,G65,2*$A72-1),"") -> 0 | H72: =IF($C72>"",OFFSET($E65,I65,2*$A72),"") -> 3 | I72: =IF($C72>"",OFFSET($E65,I65,2*$A72-1),"") -> 2 | J72: =IF($C72>"",OFFSET($E65,K65,2*$A72),"") -> 0 | K72: =IF($C72>"",OFFSET($E65,K65,2*$A72-1),"") -> 3 | L72: =IF($C72>"",OFFSET($E65,M65,2*$A72),"") -> 0 | M72: =IF($C72>"",OFFSET($E65,M65,2*$A72-1),"") -> 0 | N72: =IF($C72>"",OFFSET($E65,O65,2*$A72),"") -> 3 | O72: =IF($C72>"",OFFSET($E65,O65,2*$A72-1),"") -> 0 | P72: =IF($C72>"",OFFSET($E65,Q65,2*$A72),"") -> 1 | Q72: =IF($C72>"",OFFSET($E65,Q65,2*$A72-1),"") -> 3 | R72: XXX | S72: XXX | W72: =IF($C72>"",(IF(F72=3,1,0)+IF(H72=3,1,0)+IF(J72=3,1,0)+IF(L72=3,1,0)+IF(N72=3,1,0)+IF(P72=3,1,0)+IF(R72=3,1,0)+IF(T72=3,1,0)),"") -> 2 | X72: =IF($C72>"",SUM(F72,H72,J72,L72,N72,P72,R72,T72),"") -> 7 | Y72: =IF(C72>"",IF(D72<2000,16,8),"") -> 16 | Z72: =IF($C72>"",IF($D72<2000,2,1),"") -> 2 | AA72: =IF($C72>"",IF($D72<2000,25,50),"") -> 25 | AC72: =IF($C72>"",SUM(AF72:AL72),"") -> 9.08 | AD72: =IF($C72>"",IF(AC72<=24,0,AC72-24),"") -> 0 | AE72: =IF($C72>"",AC72+AD72,"") -> 9.08 | AF72: =RatingChange(D72,OFFSET($D$65,AF$65,0),F72,G72) -> 0 | AG72: =RatingChange(D72,OFFSET($D$65,$AG$65,0),H72,I72) -> 18.48 | AH72: =RatingChange(D72,OFFSET($D$65,AH$65,0),J72,K72) -> -13.2 | AI72: =RatingChange($D72,OFFSET($D$65,AI$65,0),L72,M72) -> 0 | AJ72: =RatingChange(D72,OFFSET($D$65,$AJ$65,0),N72,O72) -> 17.32 | AK72: =RatingChange(D72,OFFSET($D$65,$AK$65,0),P72,Q72) -> -13.52 | AL72: XXX | AM72: =RatingChange(D72,OFFSET($D$65,$AM$65,0),T72,U72) -> 
A73: 8 | E73: =IF($C73>"",MAX(ROUND(D73+AE73,0),200),"") ->  | F73: =IF($C73>"",OFFSET($E65,G65,2*$A73),"") ->  | G73: =IF($C73>"",OFFSET($E65,G65,2*$A73-1),"") ->  | H73: =IF($C73>"",OFFSET($E65,I65,2*$A73),"") ->  | I73: =IF($C73>"",OFFSET($E65,I65,2*$A73-1),"") ->  | J73: =IF($C73>"",OFFSET($E65,K65,2*$A73),"") ->  | K73: =IF($C73>"",OFFSET($E65,K65,2*$A73-1),"") ->  | L73: =IF($C73>"",OFFSET($E65,M65,2*$A73),"") ->  | M73: =IF($C73>"",OFFSET($E65,M65,2*$A73-1),"") ->  | N73: =IF($C73>"",OFFSET($E65,O65,2*$A73),"") ->  | O73: =IF($C73>"",OFFSET($E65,O65,2*$A73-1),"") ->  | P73: =IF($C73>"",OFFSET($E65,Q65,2*$A73),"") ->  | Q73: =IF($C73>"",OFFSET($E65,Q65,2*$A73-1),"") ->  | R73: =IF($C73>"",OFFSET($E65,S65,2*$A73),"") ->  | S73: =IF($C73>"",OFFSET($E65,S65,2*$A73-1),"") ->  | T73: XXX | U73: XXX | W73: =IF($C73>"",(IF(F73=3,1,0)+IF(H73=3,1,0)+IF(J73=3,1,0)+IF(L73=3,1,0)+IF(N73=3,1,0)+IF(P73=3,1,0)+IF(R73=3,1,0)+IF(T73=3,1,0)),"") ->  | X73: =IF($C73>"",SUM(F73,H73,J73,L73,N73,P73,R73,T73),"") ->  | Y73: =IF(C73>"",IF(D73<2000,16,8),"") ->  | Z73: =IF($C73>"",IF($D73<2000,2,1),"") ->  | AA73: =IF($C73>"",IF($D73<2000,25,50),"") ->  | AC73: =IF($C73>"",SUM(AF73:AL73),"") ->  | AD73: =IF($C73>"",IF(AC73<=24,0,AC73-24),"") ->  | AE73: =IF($C73>"",AC73+AD73,"") ->  | AF73: =RatingChange(D73,OFFSET($D$65,AF$65,0),F73,G73) ->  | AG73: =RatingChange(D73,OFFSET($D$65,$AG$65,0),H73,I73) ->  | AH73: =RatingChange(D73,OFFSET($D$65,AH$65,0),J73,K73) ->  | AI73: =RatingChange($D73,OFFSET($D$65,AI$65,0),L73,M73) ->  | AJ73: =RatingChange(D73,OFFSET($D$65,$AJ$65,0),N73,O73) ->  | AK73: =RatingChange(D73,OFFSET($D$65,$AK$65,0),P73,Q73) ->  | AL73: =RatingChange(D73,OFFSET($D$65,$AL$65,0),R73,S73) ->  | AM73: XXX
A79: # | B79: ID | C79: Name | D79: Rating | E79: Rating | J79: Games Won/Lost against | W79: Matches | X79: Games | AC79: Rating | AD79: Bonus | AE79: Change | AF79: Rating change vs.
A80: 6 | D80: Pre | E80: Post | G80: 1 | I80: 2 | K80: 3 | M80: 4 | O80: 5 | Q80: 6 | S80: 7 | U80: 8 | W80: Won | X80: Won | AC80: Change | AD80: Points | AE80: w/Bonus | AF80: 1 | AG80: 2 | AH80: 3 | AI80: 4 | AJ80: 5 | AK80: 6 | AL80: 7 | AM80: 8
A81: 1 | B81: 1603 | C81: Cheung, Carson | D81: 1560 | E81: =IF($C81>"",MAX(ROUND(D81+AE81,0),200),"") -> 1580 | F81: XXX | G81: XXX | H81: 0 | I81: 3 | J81: 3 | K81: 0 | L81: 3 | M81: 1 | N81: 3 | O81: 2 | P81: 3 | Q81: 1 | R81: 3 | S81: 1 | W81: =IF($C81>"",(IF(F81=3,1,0)+IF(H81=3,1,0)+IF(J81=3,1,0)+IF(L81=3,1,0)+IF(N81=3,1,0)+IF(P81=3,1,0)+IF(R81=3,1,0)+IF(T81=3,1,0)),"") -> 5 | X81: =IF($C81>"",SUM(F81,H81,J81,L81,N81,P81,R81,T81),"") -> 15 | Y81: =IF(C81>"",IF(D81<2000,16,8),"") -> 16 | Z81: =IF($C81>"",IF($D81<2000,2,1),"") -> 2 | AA81: =IF($C81>"",IF($D81<2000,25,50),"") -> 25 | AC81: =IF($C81>"",SUM(AF81:AL81),"") -> 20.12 | AD81: =IF($C81>"",IF(AC81<=24,0,AC81-24),"") -> 0 | AE81: =IF($C81>"",AC81+AD81,"") -> 20.12 | AF81: XXX | AG81: =RatingChange(D81,OFFSET($D$80,$AG$80,0),H81,I81) -> -16.88 | AH81: =RatingChange(D81,OFFSET($D$80,AH$80,0),J81,K81) -> 11.92 | AI81: =RatingChange($D81,OFFSET($D$80,AI$80,0),L81,M81) -> 7.84 | AJ81: =RatingChange(D81,OFFSET($D$80,$AJ$80,0),N81,O81) -> 5.72 | AK81: =RatingChange(D81,OFFSET($D$80,$AK$80,0),P81,Q81) -> 6.36 | AL81: =RatingChange(D81,OFFSET($D$80,$AL$80,0),R81,S81) -> 5.16 | AM81: =RatingChange(D81,OFFSET($D$80,$AM$80,0),T81,U81) -> 
A82: 2 | B82: 2126 | C82: Lindo, Aristides | D82: 1538 | E82: =IF($C82>"",MAX(ROUND(D82+AE82,0),200),"") -> 1546 | F82: =IF($C82>"",OFFSET($E80,G80,2*$A82),"") -> 3 | G82: =IF($C82>"",OFFSET($E80,G80,2*$A82-1),"") -> 0 | H82: XXX | I82: XXX | J82: 1 | K82: 3 | L82: 1 | M82: 3 | N82: 3 | O82: 0 | P82: 3 | Q82: 0 | R82: 3 | S82: 0 | W82: =IF($C82>"",(IF(F82=3,1,0)+IF(H82=3,1,0)+IF(J82=3,1,0)+IF(L82=3,1,0)+IF(N82=3,1,0)+IF(P82=3,1,0)+IF(R82=3,1,0)+IF(T82=3,1,0)),"") -> 4 | X82: =IF($C82>"",SUM(F82,H82,J82,L82,N82,P82,R82,T82),"") -> 14 | Y82: =IF(C82>"",IF(D82<2000,16,8),"") -> 16 | Z82: =IF($C82>"",IF($D82<2000,2,1),"") -> 2 | AA82: =IF($C82>"",IF($D82<2000,25,50),"") -> 25 | AC82: =IF($C82>"",SUM(AF82:AL82),"") -> 8.28 | AD82: =IF($C82>"",IF(AC82<=24,0,AC82-24),"") -> 0 | AE82: =IF($C82>"",AC82+AD82,"") -> 8.28 | AF82: =RatingChange(D82,OFFSET($D$80,AF$80,0),F82,G82) -> 16.88 | AG82: XXX | AH82: =RatingChange(D82,OFFSET($D$80,AH$80,0),J82,K82) -> -17.2 | AI82: =RatingChange($D82,OFFSET($D$80,AI$80,0),L82,M82) -> -19.28 | AJ82: =RatingChange(D82,OFFSET($D$80,$AJ$80,0),N82,O82) -> 10.6 | AK82: =RatingChange(D82,OFFSET($D$80,$AK$80,0),P82,Q82) -> 9.24 | AL82: =RatingChange(D82,OFFSET($D$80,$AL$80,0),R82,S82) -> 8.04 | AM82: =RatingChange(D82,OFFSET($D$80,$AM$80,0),T82,U82) -> 
A83: 3 | B83: 1778 | C83: Lungu, Adrian | D83: 1458 | E83: =IF($C83>"",MAX(ROUND(D83+AE83,0),200),"") -> 1439 | F83: =IF($C83>"",OFFSET($E80,G80,2*$A83),"") -> 0 | G83: =IF($C83>"",OFFSET($E80,G80,2*$A83-1),"") -> 3 | H83: =IF($C83>"",OFFSET($E80,I80,2*$A83),"") -> 3 | I83: =IF($C83>"",OFFSET($E80,I80,2*$A83-1),"") -> 1 | J83: XXX | K83: XXX | L83: 0 | M83: 3 | N83: 1 | O83: 1 | P83: 3 | Q83: 0 | R83: 1 | S83: 3 | W83: =IF($C83>"",(IF(F83=3,1,0)+IF(H83=3,1,0)+IF(J83=3,1,0)+IF(L83=3,1,0)+IF(N83=3,1,0)+IF(P83=3,1,0)+IF(R83=3,1,0)+IF(T83=3,1,0)),"") -> 2 | X83: =IF($C83>"",SUM(F83,H83,J83,L83,N83,P83,R83,T83),"") -> 8 | Y83: =IF(C83>"",IF(D83<2000,16,8),"") -> 16 | Z83: =IF($C83>"",IF($D83<2000,2,1),"") -> 2 | AA83: =IF($C83>"",IF($D83<2000,25,50),"") -> 25 | AC83: =IF($C83>"",SUM(AF83:AL83),"") -> -19.12 | AD83: =IF($C83>"",IF(AC83<=24,0,AC83-24),"") -> 0 | AE83: =IF($C83>"",AC83+AD83,"") -> -19.12 | AF83: =RatingChange(D83,OFFSET($D$80,AF$80,0),F83,G83) -> -11.92 | AG83: =RatingChange(D83,OFFSET($D$80,$AG$80,0),H83,I83) -> 17.2 | AH83: XXX | AI83: =RatingChange($D83,OFFSET($D$80,AI$80,0),L83,M83) -> -18.08 | AJ83: =RatingChange(D83,OFFSET($D$80,$AJ$80,0),N83,O83) -> 0 | AK83: =RatingChange(D83,OFFSET($D$80,$AK$80,0),P83,Q83) -> 12.44 | AL83: =RatingChange(D83,OFFSET($D$80,$AL$80,0),R83,S83) -> -18.76 | AM83: =RatingChange(D83,OFFSET($D$80,$AM$80,0),T83,U83) -> 
A84: 4 | B84: 1812 | C84: Tang, Isaac | D84: 1406 | E84: =IF($C84>"",MAX(ROUND(D84+AE84,0),200),"") -> 1438 | F84: =IF($C84>"",OFFSET($E80,G80,2*$A84),"") -> 1 | G84: =IF($C84>"",OFFSET($E80,G80,2*$A84-1),"") -> 3 | H84: =IF($C84>"",OFFSET($E80,I80,2*$A84),"") -> 3 | I84: =IF($C84>"",OFFSET($E80,I80,2*$A84-1),"") -> 1 | J84: =IF($C84>"",OFFSET($E80,K80,2*$A84),"") -> 3 | K84: =IF($C84>"",OFFSET($E80,K80,2*$A84-1),"") -> 0 | L84: XXX | M84: XXX | N84: 1 | O84: 3 | P84: 3 | Q84: 1 | R84: 0 | S84: 0 | W84: =IF($C84>"",(IF(F84=3,1,0)+IF(H84=3,1,0)+IF(J84=3,1,0)+IF(L84=3,1,0)+IF(N84=3,1,0)+IF(P84=3,1,0)+IF(R84=3,1,0)+IF(T84=3,1,0)),"") -> 3 | X84: =IF($C84>"",SUM(F84,H84,J84,L84,N84,P84,R84,T84),"") -> 11 | Y84: =IF(C84>"",IF(D84<2000,16,8),"") -> 16 | Z84: =IF($C84>"",IF($D84<2000,2,1),"") -> 2 | AA84: =IF($C84>"",IF($D84<2000,25,50),"") -> 25 | AC84: =IF($C84>"",SUM(AF84:AL84),"") -> 27.92 | AD84: =IF($C84>"",IF(AC84<=24,0,AC84-24),"") -> 3.92 | AE84: =IF($C84>"",AC84+AD84,"") -> 31.84 | AF84: =RatingChange(D84,OFFSET($D$80,AF$80,0),F84,G84) -> -7.84 | AG84: =RatingChange(D84,OFFSET($D$80,$AG$80,0),H84,I84) -> 19.28 | AH84: =RatingChange(D84,OFFSET($D$80,AH$80,0),J84,K84) -> 18.08 | AI84: XXX | AJ84: =RatingChange(D84,OFFSET($D$80,$AJ$80,0),N84,O84) -> -14.12 | AK84: =RatingChange(D84,OFFSET($D$80,$AK$80,0),P84,Q84) -> 12.52 | AL84: =RatingChange(D84,OFFSET($D$80,$AL$80,0),R84,S84) -> 0 | AM84: =RatingChange(D84,OFFSET($D$80,$AM$80,0),T84,U84) -> 
A85: 5 | B85: 1365 | C85: Kong, Casey | D85: 1403 | E85: =IF($C85>"",MAX(ROUND(D85+AE85,0),200),"") -> 1367 | F85: =IF($C85>"",OFFSET($E80,G80,2*$A85),"") -> 2 | G85: =IF($C85>"",OFFSET($E80,G80,2*$A85-1),"") -> 3 | H85: =IF($C85>"",OFFSET($E80,I80,2*$A85),"") -> 0 | I85: =IF($C85>"",OFFSET($E80,I80,2*$A85-1),"") -> 3 | J85: =IF($C85>"",OFFSET($E80,K80,2*$A85),"") -> 1 | K85: =IF($C85>"",OFFSET($E80,K80,2*$A85-1),"") -> 1 | L85: =IF($C85>"",OFFSET($E80,M80,2*$A85),"") -> 3 | M85: =IF($C85>"",OFFSET($E80,M80,2*$A85-1),"") -> 1 | N85: XXX | O85: XXX | P85: 1 | Q85: 3 | R85: 0 | S85: 3 | W85: =IF($C85>"",(IF(F85=3,1,0)+IF(H85=3,1,0)+IF(J85=3,1,0)+IF(L85=3,1,0)+IF(N85=3,1,0)+IF(P85=3,1,0)+IF(R85=3,1,0)+IF(T85=3,1,0)),"") -> 1 | X85: =IF($C85>"",SUM(F85,H85,J85,L85,N85,P85,R85,T85),"") -> 7 | Y85: =IF(C85>"",IF(D85<2000,16,8),"") -> 16 | Z85: =IF($C85>"",IF($D85<2000,2,1),"") -> 2 | AA85: =IF($C85>"",IF($D85<2000,25,50),"") -> 25 | AC85: =IF($C85>"",SUM(AF85:AL85),"") -> -36.12 | AD85: =IF($C85>"",IF(AC85<=24,0,AC85-24),"") -> 0 | AE85: =IF($C85>"",AC85+AD85,"") -> -36.12 | AF85: =RatingChange(D85,OFFSET($D$80,AF$80,0),F85,G85) -> -5.72 | AG85: =RatingChange(D85,OFFSET($D$80,$AG$80,0),H85,I85) -> -10.6 | AH85: =RatingChange(D85,OFFSET($D$80,AH$80,0),J85,K85) -> 0 | AI85: =RatingChange($D85,OFFSET($D$80,AI$80,0),L85,M85) -> 14.12 | AJ85: XXX | AK85: =RatingChange(D85,OFFSET($D$80,$AK$80,0),P85,Q85) -> -15.36 | AL85: =RatingChange(D85,OFFSET($D$80,$AL$80,0),R85,S85) -> -18.56 | AM85: =RatingChange(D85,OFFSET($D$80,$AM$80,0),T85,U85) -> 
A86: 6 | B86: 1906 | C86: Wang, Jim | D86: 1369 | E86: =IF($C86>"",MAX(ROUND(D86+AE86,0),200),"") -> 1327 | F86: =IF($C86>"",OFFSET($E80,G80,2*$A86),"") -> 1 | G86: =IF($C86>"",OFFSET($E80,G80,2*$A86-1),"") -> 3 | H86: =IF($C86>"",OFFSET($E80,I80,2*$A86),"") -> 0 | I86: =IF($C86>"",OFFSET($E80,I80,2*$A86-1),"") -> 3 | J86: =IF($C86>"",OFFSET($E80,K80,2*$A86),"") -> 0 | K86: =IF($C86>"",OFFSET($E80,K80,2*$A86-1),"") -> 3 | L86: =IF($C86>"",OFFSET($E80,M80,2*$A86),"") -> 1 | M86: =IF($C86>"",OFFSET($E80,M80,2*$A86-1),"") -> 3 | N86: =IF($C86>"",OFFSET($E80,O80,2*$A86),"") -> 3 | O86: =IF($C86>"",OFFSET($E80,O80,2*$A86-1),"") -> 1 | P86: XXX | Q86: XXX | R86: 0 | S86: 3 | W86: =IF($C86>"",(IF(F86=3,1,0)+IF(H86=3,1,0)+IF(J86=3,1,0)+IF(L86=3,1,0)+IF(N86=3,1,0)+IF(P86=3,1,0)+IF(R86=3,1,0)+IF(T86=3,1,0)),"") -> 1 | X86: =IF($C86>"",SUM(F86,H86,J86,L86,N86,P86,R86,T86),"") -> 5 | Y86: =IF(C86>"",IF(D86<2000,16,8),"") -> 16 | Z86: =IF($C86>"",IF($D86<2000,2,1),"") -> 2 | AA86: =IF($C86>"",IF($D86<2000,25,50),"") -> 25 | AC86: =IF($C86>"",SUM(AF86:AL86),"") -> -42.4 | AD86: =IF($C86>"",IF(AC86<=24,0,AC86-24),"") -> 0 | AE86: =IF($C86>"",AC86+AD86,"") -> -42.4 | AF86: =RatingChange(D86,OFFSET($D$80,AF$80,0),F86,G86) -> -6.36 | AG86: =RatingChange(D86,OFFSET($D$80,$AG$80,0),H86,I86) -> -9.24 | AH86: =RatingChange(D86,OFFSET($D$80,AH$80,0),J86,K86) -> -12.44 | AI86: =RatingChange($D86,OFFSET($D$80,AI$80,0),L86,M86) -> -12.52 | AJ86: =RatingChange(D86,OFFSET($D$80,$AJ$80,0),N86,O86) -> 15.36 | AK86: XXX | AL86: =RatingChange(D86,OFFSET($D$80,$AL$80,0),R86,S86) -> -17.2 | AM86: =RatingChange(D86,OFFSET($D$80,$AM$80,0),T86,U86) -> 
A87: 7 | B87: 1827 | C87: Philips, Peter | D87: 1339 | E87: =IF($C87>"",MAX(ROUND(D87+AE87,0),200),"") -> 1398 | F87: =IF($C87>"",OFFSET($E80,G80,2*$A87),"") -> 1 | G87: =IF($C87>"",OFFSET($E80,G80,2*$A87-1),"") -> 3 | H87: =IF($C87>"",OFFSET($E80,I80,2*$A87),"") -> 0 | I87: =IF($C87>"",OFFSET($E80,I80,2*$A87-1),"") -> 3 | J87: =IF($C87>"",OFFSET($E80,K80,2*$A87),"") -> 3 | K87: =IF($C87>"",OFFSET($E80,K80,2*$A87-1),"") -> 1 | L87: =IF($C87>"",OFFSET($E80,M80,2*$A87),"") -> 0 | M87: =IF($C87>"",OFFSET($E80,M80,2*$A87-1),"") -> 0 | N87: =IF($C87>"",OFFSET($E80,O80,2*$A87),"") -> 3 | O87: =IF($C87>"",OFFSET($E80,O80,2*$A87-1),"") -> 0 | P87: =IF($C87>"",OFFSET($E80,Q80,2*$A87),"") -> 3 | Q87: =IF($C87>"",OFFSET($E80,Q80,2*$A87-1),"") -> 0 | R87: XXX | S87: XXX | W87: =IF($C87>"",(IF(F87=3,1,0)+IF(H87=3,1,0)+IF(J87=3,1,0)+IF(L87=3,1,0)+IF(N87=3,1,0)+IF(P87=3,1,0)+IF(R87=3,1,0)+IF(T87=3,1,0)),"") -> 3 | X87: =IF($C87>"",SUM(F87,H87,J87,L87,N87,P87,R87,T87),"") -> 10 | Y87: =IF(C87>"",IF(D87<2000,16,8),"") -> 16 | Z87: =IF($C87>"",IF($D87<2000,2,1),"") -> 2 | AA87: =IF($C87>"",IF($D87<2000,25,50),"") -> 25 | AC87: =IF($C87>"",SUM(AF87:AL87),"") -> 41.32 | AD87: =IF($C87>"",IF(AC87<=24,0,AC87-24),"") -> 17.32 | AE87: =IF($C87>"",AC87+AD87,"") -> 58.64 | AF87: =RatingChange(D87,OFFSET($D$80,AF$80,0),F87,G87) -> -5.16 | AG87: =RatingChange(D87,OFFSET($D$80,$AG$80,0),H87,I87) -> -8.04 | AH87: =RatingChange(D87,OFFSET($D$80,AH$80,0),J87,K87) -> 18.76 | AI87: =RatingChange($D87,OFFSET($D$80,AI$80,0),L87,M87) -> 0 | AJ87: =RatingChange(D87,OFFSET($D$80,$AJ$80,0),N87,O87) -> 18.56 | AK87: =RatingChange(D87,OFFSET($D$80,$AK$80,0),P87,Q87) -> 17.2 | AL87: XXX | AM87: =RatingChange(D87,OFFSET($D$80,$AM$80,0),T87,U87) -> 
A88: 8 | E88: =IF($C88>"",MAX(ROUND(D88+AE88,0),200),"") ->  | F88: =IF($C88>"",OFFSET($E80,G80,2*$A88),"") ->  | G88: =IF($C88>"",OFFSET($E80,G80,2*$A88-1),"") ->  | H88: =IF($C88>"",OFFSET($E80,I80,2*$A88),"") ->  | I88: =IF($C88>"",OFFSET($E80,I80,2*$A88-1),"") ->  | J88: =IF($C88>"",OFFSET($E80,K80,2*$A88),"") ->  | K88: =IF($C88>"",OFFSET($E80,K80,2*$A88-1),"") ->  | L88: =IF($C88>"",OFFSET($E80,M80,2*$A88),"") ->  | M88: =IF($C88>"",OFFSET($E80,M80,2*$A88-1),"") ->  | N88: =IF($C88>"",OFFSET($E80,O80,2*$A88),"") ->  | O88: =IF($C88>"",OFFSET($E80,O80,2*$A88-1),"") ->  | P88: =IF($C88>"",OFFSET($E80,Q80,2*$A88),"") ->  | Q88: =IF($C88>"",OFFSET($E80,Q80,2*$A88-1),"") ->  | R88: =IF($C88>"",OFFSET($E80,S80,2*$A88),"") ->  | S88: =IF($C88>"",OFFSET($E80,S80,2*$A88-1),"") ->  | T88: XXX | U88: XXX | W88: =IF($C88>"",(IF(F88=3,1,0)+IF(H88=3,1,0)+IF(J88=3,1,0)+IF(L88=3,1,0)+IF(N88=3,1,0)+IF(P88=3,1,0)+IF(R88=3,1,0)+IF(T88=3,1,0)),"") ->  | X88: =IF($C88>"",SUM(F88,H88,J88,L88,N88,P88,R88,T88),"") ->  | Y88: =IF(C88>"",IF(D88<2000,16,8),"") ->  | Z88: =IF($C88>"",IF($D88<2000,2,1),"") ->  | AA88: =IF($C88>"",IF($D88<2000,25,50),"") ->  | AC88: =IF($C88>"",SUM(AF88:AL88),"") ->  | AD88: =IF($C88>"",IF(AC88<=24,0,AC88-24),"") ->  | AE88: =IF($C88>"",AC88+AD88,"") ->  | AF88: =RatingChange(D88,OFFSET($D$80,AF$80,0),F88,G88) ->  | AG88: =RatingChange(D88,OFFSET($D$80,$AG$80,0),H88,I88) ->  | AH88: =RatingChange(D88,OFFSET($D$80,AH$80,0),J88,K88) ->  | AI88: =RatingChange($D88,OFFSET($D$80,AI$80,0),L88,M88) ->  | AJ88: =RatingChange(D88,OFFSET($D$80,$AJ$80,0),N88,O88) ->  | AK88: =RatingChange(D88,OFFSET($D$80,$AK$80,0),P88,Q88) ->  | AL88: =RatingChange(D88,OFFSET($D$80,$AL$80,0),R88,S88) ->  | AM88: XXX
A94: # | B94: ID | C94: Name | D94: Rating | E94: Rating | J94: Games Won/Lost against | W94: Matches | X94: Games | AC94: Rating | AD94: Bonus | AE94: Change | AF94: Rating change vs.
A95: 7 | D95: Pre | E95: Post | G95: 1 | I95: 2 | K95: 3 | M95: 4 | O95: 5 | Q95: 6 | S95: 7 | U95: 8 | W95: Won | X95: Won | AC95: Change | AD95: Points | AE95: w/Bonus | AF95: 1 | AG95: 2 | AH95: 3 | AI95: 4 | AJ95: 5 | AK95: 6 | AL95: 7 | AM95: 8
A96: 1 | B96: 1185 | C96: Sun, Lynn | D96: 1319 | E96: =IF($C96>"",MAX(ROUND(D96+AE96,0),200),"") -> 1387 | F96: XXX | G96: XXX | H96: 3 | I96: 2 | J96: 3 | K96: 1 | L96: 3 | M96: 0 | N96: 3 | O96: 1 | W96: =IF($C96>"",(IF(F96=3,1,0)+IF(H96=3,1,0)+IF(J96=3,1,0)+IF(L96=3,1,0)+IF(N96=3,1,0)+IF(P96=3,1,0)+IF(R96=3,1,0)+IF(T96=3,1,0)),"") -> 4 | X96: =IF($C96>"",SUM(F96,H96,J96,L96,N96,P96,R96,T96),"") -> 12 | Y96: =IF(C96>"",IF(D96<2000,16,8),"") -> 16 | Z96: =IF($C96>"",IF($D96<2000,2,1),"") -> 2 | AA96: =IF($C96>"",IF($D96<2000,25,50),"") -> 25 | AC96: =IF($C96>"",SUM(AF96:AL96),"") -> 46.12 | AD96: =IF($C96>"",IF(AC96<=24,0,AC96-24),"") -> 22.12 | AE96: =IF($C96>"",AC96+AD96,"") -> 68.24 | AF96: XXX | AG96: =RatingChange(D96,OFFSET($D$95,$AG$95,0),H96,I96) -> 11.24 | AH96: =RatingChange(D96,OFFSET($D$95,AH$95,0),J96,K96) -> 13.08 | AI96: =RatingChange($D96,OFFSET($D$95,AI$95,0),L96,M96) -> 12.96 | AJ96: =RatingChange(D96,OFFSET($D$95,$AJ$95,0),N96,O96) -> 8.84 | AK96: =RatingChange(D96,OFFSET($D$95,$AK$95,0),P96,Q96) ->  | AL96: =RatingChange(D96,OFFSET($D$95,$AL$95,0),R96,S96) ->  | AM96: =RatingChange(D96,OFFSET($D$95,$AM$95,0),T96,U96) -> 
A97: 2 | B97: 2163 | C97: Zhou, Tieren | D97: 1300 | E97: =IF($C97>"",MAX(ROUND(D97+AE97,0),200),"") -> 1256 | F97: =IF($C97>"",OFFSET($E95,G95,2*$A97),"") -> 2 | G97: =IF($C97>"",OFFSET($E95,G95,2*$A97-1),"") -> 3 | H97: XXX | I97: XXX | J97: 0 | K97: 0 | L97: 1 | M97: 3 | N97: 2 | O97: 3 | W97: =IF($C97>"",(IF(F97=3,1,0)+IF(H97=3,1,0)+IF(J97=3,1,0)+IF(L97=3,1,0)+IF(N97=3,1,0)+IF(P97=3,1,0)+IF(R97=3,1,0)+IF(T97=3,1,0)),"") -> 0 | X97: =IF($C97>"",SUM(F97,H97,J97,L97,N97,P97,R97,T97),"") -> 5 | Y97: =IF(C97>"",IF(D97<2000,16,8),"") -> 16 | Z97: =IF($C97>"",IF($D97<2000,2,1),"") -> 2 | AA97: =IF($C97>"",IF($D97<2000,25,50),"") -> 25 | AC97: =IF($C97>"",SUM(AF97:AL97),"") -> -43.92 | AD97: =IF($C97>"",IF(AC97<=24,0,AC97-24),"") -> 0 | AE97: =IF($C97>"",AC97+AD97,"") -> -43.92 | AF97: =RatingChange(D97,OFFSET($D$95,AF$95,0),F97,G97) -> -11.24 | AG97: XXX | AH97: =RatingChange(D97,OFFSET($D$95,AH$95,0),J97,K97) -> 0 | AI97: =RatingChange($D97,OFFSET($D$95,AI$95,0),L97,M97) -> -16.28 | AJ97: =RatingChange(D97,OFFSET($D$95,$AJ$95,0),N97,O97) -> -16.4 | AK97: =RatingChange(D97,OFFSET($D$95,$AK$95,0),P97,Q97) ->  | AL97: =RatingChange(D97,OFFSET($D$95,$AL$95,0),R97,S97) ->  | AM97: =RatingChange(D97,OFFSET($D$95,$AM$95,0),T97,U97) -> 
A98: 3 | B98: 1132 | C98: Ritz, Jim | D98: 1296 | E98: =IF($C98>"",MAX(ROUND(D98+AE98,0),200),"") -> 1247 | F98: =IF($C98>"",OFFSET($E95,G95,2*$A98),"") -> 1 | G98: =IF($C98>"",OFFSET($E95,G95,2*$A98-1),"") -> 3 | H98: =IF($C98>"",OFFSET($E95,I95,2*$A98),"") -> 0 | I98: =IF($C98>"",OFFSET($E95,I95,2*$A98-1),"") -> 0 | J98: XXX | K98: XXX | L98: 0 | M98: 3 | N98: 1 | O98: 3 | W98: =IF($C98>"",(IF(F98=3,1,0)+IF(H98=3,1,0)+IF(J98=3,1,0)+IF(L98=3,1,0)+IF(N98=3,1,0)+IF(P98=3,1,0)+IF(R98=3,1,0)+IF(T98=3,1,0)),"") -> 0 | X98: =IF($C98>"",SUM(F98,H98,J98,L98,N98,P98,R98,T98),"") -> 2 | Y98: =IF(C98>"",IF(D98<2000,16,8),"") -> 16 | Z98: =IF($C98>"",IF($D98<2000,2,1),"") -> 2 | AA98: =IF($C98>"",IF($D98<2000,25,50),"") -> 25 | AC98: =IF($C98>"",SUM(AF98:AL98),"") -> -49.44 | AD98: =IF($C98>"",IF(AC98<=24,0,AC98-24),"") -> 0 | AE98: =IF($C98>"",AC98+AD98,"") -> -49.44 | AF98: =RatingChange(D98,OFFSET($D$95,AF$95,0),F98,G98) -> -13.08 | AG98: =RatingChange(D98,OFFSET($D$95,$AG$95,0),H98,I98) -> 0 | AH98: XXX | AI98: =RatingChange($D98,OFFSET($D$95,AI$95,0),L98,M98) -> -18.12 | AJ98: =RatingChange(D98,OFFSET($D$95,$AJ$95,0),N98,O98) -> -18.24 | AK98: =RatingChange(D98,OFFSET($D$95,$AK$95,0),P98,Q98) ->  | AL98: =RatingChange(D98,OFFSET($D$95,$AL$95,0),R98,S98) ->  | AM98: =RatingChange(D98,OFFSET($D$95,$AM$95,0),T98,U98) -> 
A99: 4 | B99: 1670 | C99: Li, Joe | D99: 1243 | E99: =IF($C99>"",MAX(ROUND(D99+AE99,0),200),"") -> 1264 | F99: =IF($C99>"",OFFSET($E95,G95,2*$A99),"") -> 0 | G99: =IF($C99>"",OFFSET($E95,G95,2*$A99-1),"") -> 3 | H99: =IF($C99>"",OFFSET($E95,I95,2*$A99),"") -> 3 | I99: =IF($C99>"",OFFSET($E95,I95,2*$A99-1),"") -> 1 | J99: =IF($C99>"",OFFSET($E95,K95,2*$A99),"") -> 3 | K99: =IF($C99>"",OFFSET($E95,K95,2*$A99-1),"") -> 0 | L99: XXX | M99: XXX | N99: 0 | O99: 0 | W99: =IF($C99>"",(IF(F99=3,1,0)+IF(H99=3,1,0)+IF(J99=3,1,0)+IF(L99=3,1,0)+IF(N99=3,1,0)+IF(P99=3,1,0)+IF(R99=3,1,0)+IF(T99=3,1,0)),"") -> 2 | X99: =IF($C99>"",SUM(F99,H99,J99,L99,N99,P99,R99,T99),"") -> 6 | Y99: =IF(C99>"",IF(D99<2000,16,8),"") -> 16 | Z99: =IF($C99>"",IF($D99<2000,2,1),"") -> 2 | AA99: =IF($C99>"",IF($D99<2000,25,50),"") -> 25 | AC99: =IF($C99>"",SUM(AF99:AL99),"") -> 21.44 | AD99: =IF($C99>"",IF(AC99<=24,0,AC99-24),"") -> 0 | AE99: =IF($C99>"",AC99+AD99,"") -> 21.44 | AF99: =RatingChange(D99,OFFSET($D$95,AF$95,0),F99,G99) -> -12.96 | AG99: =RatingChange(D99,OFFSET($D$95,$AG$95,0),H99,I99) -> 16.28 | AH99: =RatingChange(D99,OFFSET($D$95,AH$95,0),J99,K99) -> 18.12 | AI99: XXX | AJ99: =RatingChange(D99,OFFSET($D$95,$AJ$95,0),N99,O99) -> 0 | AK99: =RatingChange(D99,OFFSET($D$95,$AK$95,0),P99,Q99) ->  | AL99: =RatingChange(D99,OFFSET($D$95,$AL$95,0),R99,S99) ->  | AM99: =RatingChange(D99,OFFSET($D$95,$AM$95,0),T99,U99) -> 
A100: 5 | B100: 2021 | C100: Chung, Michael | D100: 1190 | E100: =IF($C100>"",MAX(ROUND(D100+AE100,0),200),"") -> 1218 | F100: =IF($C100>"",OFFSET($E95,G95,2*$A100),"") -> 1 | G100: =IF($C100>"",OFFSET($E95,G95,2*$A100-1),"") -> 3 | H100: =IF($C100>"",OFFSET($E95,I95,2*$A100),"") -> 3 | I100: =IF($C100>"",OFFSET($E95,I95,2*$A100-1),"") -> 2 | J100: =IF($C100>"",OFFSET($E95,K95,2*$A100),"") -> 3 | K100: =IF($C100>"",OFFSET($E95,K95,2*$A100-1),"") -> 1 | L100: =IF($C100>"",OFFSET($E95,M95,2*$A100),"") -> 0 | M100: =IF($C100>"",OFFSET($E95,M95,2*$A100-1),"") -> 0 | N100: XXX | O100: XXX | W100: =IF($C100>"",(IF(F100=3,1,0)+IF(H100=3,1,0)+IF(J100=3,1,0)+IF(L100=3,1,0)+IF(N100=3,1,0)+IF(P100=3,1,0)+IF(R100=3,1,0)+IF(T100=3,1,0)),"") -> 2 | X100: =IF($C100>"",SUM(F100,H100,J100,L100,N100,P100,R100,T100),"") -> 7 | Y100: =IF(C100>"",IF(D100<2000,16,8),"") -> 16 | Z100: =IF($C100>"",IF($D100<2000,2,1),"") -> 2 | AA100: =IF($C100>"",IF($D100<2000,25,50),"") -> 25 | AC100: =IF($C100>"",SUM(AF100:AL100),"") -> 25.8 | AD100: =IF($C100>"",IF(AC100<=24,0,AC100-24),"") -> 1.8 | AE100: =IF($C100>"",AC100+AD100,"") -> 27.6 | AF100: =RatingChange(D100,OFFSET($D$95,AF$95,0),F100,G100) -> -8.84 | AG100: =RatingChange(D100,OFFSET($D$95,$AG$95,0),H100,I100) -> 16.4 | AH100: =RatingChange(D100,OFFSET($D$95,AH$95,0),J100,K100) -> 18.24 | AI100: =RatingChange($D100,OFFSET($D$95,AI$95,0),L100,M100) -> 0 | AJ100: XXX | AK100: =RatingChange(D100,OFFSET($D$95,$AK$95,0),P100,Q100) ->  | AL100: =RatingChange(D100,OFFSET($D$95,$AL$95,0),R100,S100) ->  | AM100: =RatingChange(D100,OFFSET($D$95,$AM$95,0),T100,U100) -> 
A101: 6 | E101: =IF($C101>"",MAX(ROUND(D101+AE101,0),200),"") ->  | F101: =IF($C101>"",OFFSET($E95,G95,2*$A101),"") ->  | G101: =IF($C101>"",OFFSET($E95,G95,2*$A101-1),"") ->  | H101: =IF($C101>"",OFFSET($E95,I95,2*$A101),"") ->  | I101: =IF($C101>"",OFFSET($E95,I95,2*$A101-1),"") ->  | J101: =IF($C101>"",OFFSET($E95,K95,2*$A101),"") ->  | K101: =IF($C101>"",OFFSET($E95,K95,2*$A101-1),"") ->  | L101: =IF($C101>"",OFFSET($E95,M95,2*$A101),"") ->  | M101: =IF($C101>"",OFFSET($E95,M95,2*$A101-1),"") ->  | N101: =IF($C101>"",OFFSET($E95,O95,2*$A101),"") ->  | O101: =IF($C101>"",OFFSET($E95,O95,2*$A101-1),"") ->  | P101: XXX | Q101: XXX | W101: =IF($C101>"",(IF(F101=3,1,0)+IF(H101=3,1,0)+IF(J101=3,1,0)+IF(L101=3,1,0)+IF(N101=3,1,0)+IF(P101=3,1,0)+IF(R101=3,1,0)+IF(T101=3,1,0)),"") ->  | X101: =IF($C101>"",SUM(F101,H101,J101,L101,N101,P101,R101,T101),"") ->  | Y101: =IF(C101>"",IF(D101<2000,16,8),"") ->  | Z101: =IF($C101>"",IF($D101<2000,2,1),"") ->  | AA101: =IF($C101>"",IF($D101<2000,25,50),"") ->  | AC101: =IF($C101>"",SUM(AF101:AL101),"") ->  | AD101: =IF($C101>"",IF(AC101<=24,0,AC101-24),"") ->  | AE101: =IF($C101>"",AC101+AD101,"") ->  | AF101: =RatingChange(D101,OFFSET($D$95,AF$95,0),F101,G101) ->  | AG101: =RatingChange(D101,OFFSET($D$95,$AG$95,0),H101,I101) ->  | AH101: =RatingChange(D101,OFFSET($D$95,AH$95,0),J101,K101) ->  | AI101: =RatingChange($D101,OFFSET($D$95,AI$95,0),L101,M101) ->  | AJ101: =RatingChange(D101,OFFSET($D$95,$AJ$95,0),N101,O101) ->  | AK101: XXX | AL101: =RatingChange(D101,OFFSET($D$95,$AL$95,0),R101,S101) ->  | AM101: =RatingChange(D101,OFFSET($D$95,$AM$95,0),T101,U101) -> 
A102: 7 | E102: =IF($C102>"",MAX(ROUND(D102+AE102,0),200),"") ->  | F102: =IF($C102>"",OFFSET($E95,G95,2*$A102),"") ->  | G102: =IF($C102>"",OFFSET($E95,G95,2*$A102-1),"") ->  | H102: =IF($C102>"",OFFSET($E95,I95,2*$A102),"") ->  | I102: =IF($C102>"",OFFSET($E95,I95,2*$A102-1),"") ->  | J102: =IF($C102>"",OFFSET($E95,K95,2*$A102),"") ->  | K102: =IF($C102>"",OFFSET($E95,K95,2*$A102-1),"") ->  | L102: =IF($C102>"",OFFSET($E95,M95,2*$A102),"") ->  | M102: =IF($C102>"",OFFSET($E95,M95,2*$A102-1),"") ->  | N102: =IF($C102>"",OFFSET($E95,O95,2*$A102),"") ->  | O102: =IF($C102>"",OFFSET($E95,O95,2*$A102-1),"") ->  | P102: =IF($C102>"",OFFSET($E95,Q95,2*$A102),"") ->  | Q102: =IF($C102>"",OFFSET($E95,Q95,2*$A102-1),"") ->  | R102: XXX | S102: XXX | W102: =IF($C102>"",(IF(F102=3,1,0)+IF(H102=3,1,0)+IF(J102=3,1,0)+IF(L102=3,1,0)+IF(N102=3,1,0)+IF(P102=3,1,0)+IF(R102=3,1,0)+IF(T102=3,1,0)),"") ->  | X102: =IF($C102>"",SUM(F102,H102,J102,L102,N102,P102,R102,T102),"") ->  | Y102: =IF(C102>"",IF(D102<2000,16,8),"") ->  | Z102: =IF($C102>"",IF($D102<2000,2,1),"") ->  | AA102: =IF($C102>"",IF($D102<2000,25,50),"") ->  | AC102: =IF($C102>"",SUM(AF102:AL102),"") ->  | AD102: =IF($C102>"",IF(AC102<=24,0,AC102-24),"") ->  | AE102: =IF($C102>"",AC102+AD102,"") ->  | AF102: =RatingChange(D102,OFFSET($D$95,AF$95,0),F102,G102) ->  | AG102: =RatingChange(D102,OFFSET($D$95,$AG$95,0),H102,I102) ->  | AH102: =RatingChange(D102,OFFSET($D$95,AH$95,0),J102,K102) ->  | AI102: =RatingChange($D102,OFFSET($D$95,AI$95,0),L102,M102) ->  | AJ102: =RatingChange(D102,OFFSET($D$95,$AJ$95,0),N102,O102) ->  | AK102: =RatingChange(D102,OFFSET($D$95,$AK$95,0),P102,Q102) ->  | AL102: XXX | AM102: =RatingChange(D102,OFFSET($D$95,$AM$95,0),T102,U102) -> 
A103: 8 | E103: =IF($C103>"",MAX(ROUND(D103+AE103,0),200),"") ->  | F103: =IF($C103>"",OFFSET($E95,G95,2*$A103),"") ->  | G103: =IF($C103>"",OFFSET($E95,G95,2*$A103-1),"") ->  | H103: =IF($C103>"",OFFSET($E95,I95,2*$A103),"") ->  | I103: =IF($C103>"",OFFSET($E95,I95,2*$A103-1),"") ->  | J103: =IF($C103>"",OFFSET($E95,K95,2*$A103),"") ->  | K103: =IF($C103>"",OFFSET($E95,K95,2*$A103-1),"") ->  | L103: =IF($C103>"",OFFSET($E95,M95,2*$A103),"") ->  | M103: =IF($C103>"",OFFSET($E95,M95,2*$A103-1),"") ->  | N103: =IF($C103>"",OFFSET($E95,O95,2*$A103),"") ->  | O103: =IF($C103>"",OFFSET($E95,O95,2*$A103-1),"") ->  | P103: =IF($C103>"",OFFSET($E95,Q95,2*$A103),"") ->  | Q103: =IF($C103>"",OFFSET($E95,Q95,2*$A103-1),"") ->  | R103: =IF($C103>"",OFFSET($E95,S95,2*$A103),"") ->  | S103: =IF($C103>"",OFFSET($E95,S95,2*$A103-1),"") ->  | T103: XXX | U103: XXX | W103: =IF($C103>"",(IF(F103=3,1,0)+IF(H103=3,1,0)+IF(J103=3,1,0)+IF(L103=3,1,0)+IF(N103=3,1,0)+IF(P103=3,1,0)+IF(R103=3,1,0)+IF(T103=3,1,0)),"") ->  | X103: =IF($C103>"",SUM(F103,H103,J103,L103,N103,P103,R103,T103),"") ->  | Y103: =IF(C103>"",IF(D103<2000,16,8),"") ->  | Z103: =IF($C103>"",IF($D103<2000,2,1),"") ->  | AA103: =IF($C103>"",IF($D103<2000,25,50),"") ->  | AC103: =IF($C103>"",SUM(AF103:AL103),"") ->  | AD103: =IF($C103>"",IF(AC103<=24,0,AC103-24),"") ->  | AE103: =IF($C103>"",AC103+AD103,"") ->  | AF103: =RatingChange(D103,OFFSET($D$95,AF$95,0),F103,G103) ->  | AG103: =RatingChange(D103,OFFSET($D$95,$AG$95,0),H103,I103) ->  | AH103: =RatingChange(D103,OFFSET($D$95,AH$95,0),J103,K103) ->  | AI103: =RatingChange($D103,OFFSET($D$95,AI$95,0),L103,M103) ->  | AJ103: =RatingChange(D103,OFFSET($D$95,$AJ$95,0),N103,O103) ->  | AK103: =RatingChange(D103,OFFSET($D$95,$AK$95,0),P103,Q103) ->  | AL103: =RatingChange(D103,OFFSET($D$95,$AL$95,0),R103,S103) ->  | AM103: XXX
A109: # | B109: ID | C109: Name | D109: Rating | E109: Rating | J109: Games Won/Lost against | W109: Matches | X109: Games | AC109: Rating | AD109: Bonus | AE109: Change | AF109: Rating change vs.
A110: 8 | D110: Pre | E110: Post | G110: 1 | I110: 2 | K110: 3 | M110: 4 | O110: 5 | Q110: 6 | S110: 7 | U110: 8 | W110: Won | X110: Won | AC110: Change | AD110: Points | AE110: w/Bonus | AF110: 1 | AG110: 2 | AH110: 3 | AI110: 4 | AJ110: 5 | AK110: 6 | AL110: 7 | AM110: 8
A111: 1 | B111: 1231 | C111: Schwartz, Robert | D111: 1242 | E111: =IF($C111>"",MAX(ROUND(D111+AE111,0),200),"") -> 1298 | F111: XXX | G111: XXX | H111: 3 | I111: 1 | J111: 3 | K111: 0 | L111: 3 | M111: 1 | N111: 3 | O111: 1 | W111: =IF($C111>"",(IF(F111=3,1,0)+IF(H111=3,1,0)+IF(J111=3,1,0)+IF(L111=3,1,0)+IF(N111=3,1,0)+IF(P111=3,1,0)+IF(R111=3,1,0)+IF(T111=3,1,0)),"") -> 4 | X111: =IF($C111>"",SUM(F111,H111,J111,L111,N111,P111,R111,T111),"") -> 12 | Y111: =IF(C111>"",IF(D111<2000,16,8),"") -> 16 | Z111: =IF($C111>"",IF($D111<2000,2,1),"") -> 2 | AA111: =IF($C111>"",IF($D111<2000,25,50),"") -> 25 | AC111: =IF($C111>"",SUM(AF111:AL111),"") -> 40.08 | AD111: =IF($C111>"",IF(AC111<=24,0,AC111-24),"") -> 16.08 | AE111: =IF($C111>"",AC111+AD111,"") -> 56.16 | AF111: XXX | AG111: =RatingChange(D111,OFFSET($D$110,$AG$110,0),H111,I111) -> 11.04 | AH111: =RatingChange(D111,OFFSET($D$110,AH$110,0),J111,K111) -> 12.6 | AI111: =RatingChange($D111,OFFSET($D$110,AI$110,0),L111,M111) -> 8.92 | AJ111: =RatingChange(D111,OFFSET($D$110,$AJ$110,0),N111,O111) -> 7.52 | AK111: =RatingChange(D111,OFFSET($D$110,$AK$110,0),P111,Q111) ->  | AL111: =RatingChange(D111,OFFSET($D$110,$AL$110,0),R111,S111) ->  | AM111: =RatingChange(D111,OFFSET($D$110,$AM$110,0),T111,U111) -> 
A112: 2 | B112: 2106 | C112: Rich, Alan | D112: 1168 | E112: =IF($C112>"",MAX(ROUND(D112+AE112,0),200),"") -> 1167 | F112: =IF($C112>"",OFFSET($E110,G110,2*$A112),"") -> 1 | G112: =IF($C112>"",OFFSET($E110,G110,2*$A112-1),"") -> 3 | H112: XXX | I112: XXX | J112: 3 | K112: 1 | L112: 3 | M112: 1 | N112: 2 | O112: 3 | W112: =IF($C112>"",(IF(F112=3,1,0)+IF(H112=3,1,0)+IF(J112=3,1,0)+IF(L112=3,1,0)+IF(N112=3,1,0)+IF(P112=3,1,0)+IF(R112=3,1,0)+IF(T112=3,1,0)),"") -> 2 | X112: =IF($C112>"",SUM(F112,H112,J112,L112,N112,P112,R112,T112),"") -> 9 | Y112: =IF(C112>"",IF(D112<2000,16,8),"") -> 16 | Z112: =IF($C112>"",IF($D112<2000,2,1),"") -> 2 | AA112: =IF($C112>"",IF($D112<2000,25,50),"") -> 25 | AC112: =IF($C112>"",SUM(AF112:AL112),"") -> -1.12 | AD112: =IF($C112>"",IF(AC112<=24,0,AC112-24),"") -> 0 | AE112: =IF($C112>"",AC112+AD112,"") -> -1.12 | AF112: =RatingChange(D112,OFFSET($D$110,AF$110,0),F112,G112) -> -11.04 | AG112: XXX | AH112: =RatingChange(D112,OFFSET($D$110,AH$110,0),J112,K112) -> 13.56 | AI112: =RatingChange($D112,OFFSET($D$110,AI$110,0),L112,M112) -> 11.88 | AJ112: =RatingChange(D112,OFFSET($D$110,$AJ$110,0),N112,O112) -> -15.52 | AK112: =RatingChange(D112,OFFSET($D$110,$AK$110,0),P112,Q112) ->  | AL112: =RatingChange(D112,OFFSET($D$110,$AL$110,0),R112,S112) ->  | AM112: =RatingChange(D112,OFFSET($D$110,$AM$110,0),T112,U112) -> 
A113: 3 | B113: 1704 | C113: Tong, Roger | D113: 1157 | E113: =IF($C113>"",MAX(ROUND(D113+AE113,0),200),"") -> 1094 | F113: =IF($C113>"",OFFSET($E110,G110,2*$A113),"") -> 0 | G113: =IF($C113>"",OFFSET($E110,G110,2*$A113-1),"") -> 3 | H113: =IF($C113>"",OFFSET($E110,I110,2*$A113),"") -> 1 | I113: =IF($C113>"",OFFSET($E110,I110,2*$A113-1),"") -> 3 | J113: XXX | K113: XXX | L113: 0 | M113: 3 | N113: 0 | O113: 3 | W113: =IF($C113>"",(IF(F113=3,1,0)+IF(H113=3,1,0)+IF(J113=3,1,0)+IF(L113=3,1,0)+IF(N113=3,1,0)+IF(P113=3,1,0)+IF(R113=3,1,0)+IF(T113=3,1,0)),"") -> 0 | X113: =IF($C113>"",SUM(F113,H113,J113,L113,N113,P113,R113,T113),"") -> 1 | Y113: =IF(C113>"",IF(D113<2000,16,8),"") -> 16 | Z113: =IF($C113>"",IF($D113<2000,2,1),"") -> 2 | AA113: =IF($C113>"",IF($D113<2000,25,50),"") -> 25 | AC113: =IF($C113>"",SUM(AF113:AL113),"") -> -62.92 | AD113: =IF($C113>"",IF(AC113<=24,0,AC113-24),"") -> 0 | AE113: =IF($C113>"",AC113+AD113,"") -> -62.92 | AF113: =RatingChange(D113,OFFSET($D$110,AF$110,0),F113,G113) -> -12.6 | AG113: =RatingChange(D113,OFFSET($D$110,$AG$110,0),H113,I113) -> -13.56 | AH113: XXX | AI113: =RatingChange($D113,OFFSET($D$110,AI$110,0),L113,M113) -> -17.68 | AJ113: =RatingChange(D113,OFFSET($D$110,$AJ$110,0),N113,O113) -> -19.08 | AK113: =RatingChange(D113,OFFSET($D$110,$AK$110,0),P113,Q113) ->  | AL113: =RatingChange(D113,OFFSET($D$110,$AL$110,0),R113,S113) ->  | AM113: =RatingChange(D113,OFFSET($D$110,$AM$110,0),T113,U113) -> 
A114: 4 | B114: 2025 | C114: Salmeron, Geovanny | D114: 1115 | E114: =IF($C114>"",MAX(ROUND(D114+AE114,0),200),"") -> 1096 | F114: =IF($C114>"",OFFSET($E110,G110,2*$A114),"") -> 1 | G114: =IF($C114>"",OFFSET($E110,G110,2*$A114-1),"") -> 3 | H114: =IF($C114>"",OFFSET($E110,I110,2*$A114),"") -> 1 | I114: =IF($C114>"",OFFSET($E110,I110,2*$A114-1),"") -> 3 | J114: =IF($C114>"",OFFSET($E110,K110,2*$A114),"") -> 3 | K114: =IF($C114>"",OFFSET($E110,K110,2*$A114-1),"") -> 0 | L114: XXX | M114: XXX | N114: 1 | O114: 3 | W114: =IF($C114>"",(IF(F114=3,1,0)+IF(H114=3,1,0)+IF(J114=3,1,0)+IF(L114=3,1,0)+IF(N114=3,1,0)+IF(P114=3,1,0)+IF(R114=3,1,0)+IF(T114=3,1,0)),"") -> 1 | X114: =IF($C114>"",SUM(F114,H114,J114,L114,N114,P114,R114,T114),"") -> 6 | Y114: =IF(C114>"",IF(D114<2000,16,8),"") -> 16 | Z114: =IF($C114>"",IF($D114<2000,2,1),"") -> 2 | AA114: =IF($C114>"",IF($D114<2000,25,50),"") -> 25 | AC114: =IF($C114>"",SUM(AF114:AL114),"") -> -18.52 | AD114: =IF($C114>"",IF(AC114<=24,0,AC114-24),"") -> 0 | AE114: =IF($C114>"",AC114+AD114,"") -> -18.52 | AF114: =RatingChange(D114,OFFSET($D$110,AF$110,0),F114,G114) -> -8.92 | AG114: =RatingChange(D114,OFFSET($D$110,$AG$110,0),H114,I114) -> -11.88 | AH114: =RatingChange(D114,OFFSET($D$110,AH$110,0),J114,K114) -> 17.68 | AI114: XXX | AJ114: =RatingChange(D114,OFFSET($D$110,$AJ$110,0),N114,O114) -> -15.4 | AK114: =RatingChange(D114,OFFSET($D$110,$AK$110,0),P114,Q114) ->  | AL114: =RatingChange(D114,OFFSET($D$110,$AL$110,0),R114,S114) ->  | AM114: =RatingChange(D114,OFFSET($D$110,$AM$110,0),T114,U114) -> 
A115: 5 | B115: 2123 | C115: Lu, Son | D115: 1080 | E115: =IF($C115>"",MAX(ROUND(D115+AE115,0),200),"") -> 1141 | F115: =IF($C115>"",OFFSET($E110,G110,2*$A115),"") -> 1 | G115: =IF($C115>"",OFFSET($E110,G110,2*$A115-1),"") -> 3 | H115: =IF($C115>"",OFFSET($E110,I110,2*$A115),"") -> 3 | I115: =IF($C115>"",OFFSET($E110,I110,2*$A115-1),"") -> 2 | J115: =IF($C115>"",OFFSET($E110,K110,2*$A115),"") -> 3 | K115: =IF($C115>"",OFFSET($E110,K110,2*$A115-1),"") -> 0 | L115: =IF($C115>"",OFFSET($E110,M110,2*$A115),"") -> 3 | M115: =IF($C115>"",OFFSET($E110,M110,2*$A115-1),"") -> 1 | N115: XXX | O115: XXX | W115: =IF($C115>"",(IF(F115=3,1,0)+IF(H115=3,1,0)+IF(J115=3,1,0)+IF(L115=3,1,0)+IF(N115=3,1,0)+IF(P115=3,1,0)+IF(R115=3,1,0)+IF(T115=3,1,0)),"") -> 3 | X115: =IF($C115>"",SUM(F115,H115,J115,L115,N115,P115,R115,T115),"") -> 10 | Y115: =IF(C115>"",IF(D115<2000,16,8),"") -> 16 | Z115: =IF($C115>"",IF($D115<2000,2,1),"") -> 2 | AA115: =IF($C115>"",IF($D115<2000,25,50),"") -> 25 | AC115: =IF($C115>"",SUM(AF115:AL115),"") -> 42.48 | AD115: =IF($C115>"",IF(AC115<=24,0,AC115-24),"") -> 18.48 | AE115: =IF($C115>"",AC115+AD115,"") -> 60.96 | AF115: =RatingChange(D115,OFFSET($D$110,AF$110,0),F115,G115) -> -7.52 | AG115: =RatingChange(D115,OFFSET($D$110,$AG$110,0),H115,I115) -> 15.52 | AH115: =RatingChange(D115,OFFSET($D$110,AH$110,0),J115,K115) -> 19.08 | AI115: =RatingChange($D115,OFFSET($D$110,AI$110,0),L115,M115) -> 15.4 | AJ115: XXX | AK115: =RatingChange(D115,OFFSET($D$110,$AK$110,0),P115,Q115) ->  | AL115: =RatingChange(D115,OFFSET($D$110,$AL$110,0),R115,S115) ->  | AM115: =RatingChange(D115,OFFSET($D$110,$AM$110,0),T115,U115) -> 
A116: 6 | E116: =IF($C116>"",MAX(ROUND(D116+AE116,0),200),"") ->  | F116: =IF($C116>"",OFFSET($E110,G110,2*$A116),"") ->  | G116: =IF($C116>"",OFFSET($E110,G110,2*$A116-1),"") ->  | H116: =IF($C116>"",OFFSET($E110,I110,2*$A116),"") ->  | I116: =IF($C116>"",OFFSET($E110,I110,2*$A116-1),"") ->  | J116: =IF($C116>"",OFFSET($E110,K110,2*$A116),"") ->  | K116: =IF($C116>"",OFFSET($E110,K110,2*$A116-1),"") ->  | L116: =IF($C116>"",OFFSET($E110,M110,2*$A116),"") ->  | M116: =IF($C116>"",OFFSET($E110,M110,2*$A116-1),"") ->  | N116: =IF($C116>"",OFFSET($E110,O110,2*$A116),"") ->  | O116: =IF($C116>"",OFFSET($E110,O110,2*$A116-1),"") ->  | P116: XXX | Q116: XXX | W116: =IF($C116>"",(IF(F116=3,1,0)+IF(H116=3,1,0)+IF(J116=3,1,0)+IF(L116=3,1,0)+IF(N116=3,1,0)+IF(P116=3,1,0)+IF(R116=3,1,0)+IF(T116=3,1,0)),"") ->  | X116: =IF($C116>"",SUM(F116,H116,J116,L116,N116,P116,R116,T116),"") ->  | Y116: =IF(C116>"",IF(D116<2000,16,8),"") ->  | Z116: =IF($C116>"",IF($D116<2000,2,1),"") ->  | AA116: =IF($C116>"",IF($D116<2000,25,50),"") ->  | AC116: =IF($C116>"",SUM(AF116:AL116),"") ->  | AD116: =IF($C116>"",IF(AC116<=24,0,AC116-24),"") ->  | AE116: =IF($C116>"",AC116+AD116,"") ->  | AF116: =RatingChange(D116,OFFSET($D$110,AF$110,0),F116,G116) ->  | AG116: =RatingChange(D116,OFFSET($D$110,$AG$110,0),H116,I116) ->  | AH116: =RatingChange(D116,OFFSET($D$110,AH$110,0),J116,K116) ->  | AI116: =RatingChange($D116,OFFSET($D$110,AI$110,0),L116,M116) ->  | AJ116: =RatingChange(D116,OFFSET($D$110,$AJ$110,0),N116,O116) ->  | AK116: XXX | AL116: =RatingChange(D116,OFFSET($D$110,$AL$110,0),R116,S116) ->  | AM116: =RatingChange(D116,OFFSET($D$110,$AM$110,0),T116,U116) -> 
A117: 7 | E117: =IF($C117>"",MAX(ROUND(D117+AE117,0),200),"") ->  | F117: =IF($C117>"",OFFSET($E110,G110,2*$A117),"") ->  | G117: =IF($C117>"",OFFSET($E110,G110,2*$A117-1),"") ->  | H117: =IF($C117>"",OFFSET($E110,I110,2*$A117),"") ->  | I117: =IF($C117>"",OFFSET($E110,I110,2*$A117-1),"") ->  | J117: =IF($C117>"",OFFSET($E110,K110,2*$A117),"") ->  | K117: =IF($C117>"",OFFSET($E110,K110,2*$A117-1),"") ->  | L117: =IF($C117>"",OFFSET($E110,M110,2*$A117),"") ->  | M117: =IF($C117>"",OFFSET($E110,M110,2*$A117-1),"") ->  | N117: =IF($C117>"",OFFSET($E110,O110,2*$A117),"") ->  | O117: =IF($C117>"",OFFSET($E110,O110,2*$A117-1),"") ->  | P117: =IF($C117>"",OFFSET($E110,Q110,2*$A117),"") ->  | Q117: =IF($C117>"",OFFSET($E110,Q110,2*$A117-1),"") ->  | R117: XXX | S117: XXX | W117: =IF($C117>"",(IF(F117=3,1,0)+IF(H117=3,1,0)+IF(J117=3,1,0)+IF(L117=3,1,0)+IF(N117=3,1,0)+IF(P117=3,1,0)+IF(R117=3,1,0)+IF(T117=3,1,0)),"") ->  | X117: =IF($C117>"",SUM(F117,H117,J117,L117,N117,P117,R117,T117),"") ->  | Y117: =IF(C117>"",IF(D117<2000,16,8),"") ->  | Z117: =IF($C117>"",IF($D117<2000,2,1),"") ->  | AA117: =IF($C117>"",IF($D117<2000,25,50),"") ->  | AC117: =IF($C117>"",SUM(AF117:AL117),"") ->  | AD117: =IF($C117>"",IF(AC117<=24,0,AC117-24),"") ->  | AE117: =IF($C117>"",AC117+AD117,"") ->  | AF117: =RatingChange(D117,OFFSET($D$110,AF$110,0),F117,G117) ->  | AG117: =RatingChange(D117,OFFSET($D$110,$AG$110,0),H117,I117) ->  | AH117: =RatingChange(D117,OFFSET($D$110,AH$110,0),J117,K117) ->  | AI117: =RatingChange($D117,OFFSET($D$110,AI$110,0),L117,M117) ->  | AJ117: =RatingChange(D117,OFFSET($D$110,$AJ$110,0),N117,O117) ->  | AK117: =RatingChange(D117,OFFSET($D$110,$AK$110,0),P117,Q117) ->  | AL117: XXX | AM117: =RatingChange(D117,OFFSET($D$110,$AM$110,0),T117,U117) -> 
A118: 8 | E118: =IF($C118>"",MAX(ROUND(D118+AE118,0),200),"") ->  | F118: =IF($C118>"",OFFSET($E110,G110,2*$A118),"") ->  | G118: =IF($C118>"",OFFSET($E110,G110,2*$A118-1),"") ->  | H118: =IF($C118>"",OFFSET($E110,I110,2*$A118),"") ->  | I118: =IF($C118>"",OFFSET($E110,I110,2*$A118-1),"") ->  | J118: =IF($C118>"",OFFSET($E110,K110,2*$A118),"") ->  | K118: =IF($C118>"",OFFSET($E110,K110,2*$A118-1),"") ->  | L118: =IF($C118>"",OFFSET($E110,M110,2*$A118),"") ->  | M118: =IF($C118>"",OFFSET($E110,M110,2*$A118-1),"") ->  | N118: =IF($C118>"",OFFSET($E110,O110,2*$A118),"") ->  | O118: =IF($C118>"",OFFSET($E110,O110,2*$A118-1),"") ->  | P118: =IF($C118>"",OFFSET($E110,Q110,2*$A118),"") ->  | Q118: =IF($C118>"",OFFSET($E110,Q110,2*$A118-1),"") ->  | R118: =IF($C118>"",OFFSET($E110,S110,2*$A118),"") ->  | S118: =IF($C118>"",OFFSET($E110,S110,2*$A118-1),"") ->  | T118: XXX | U118: XXX | W118: =IF($C118>"",(IF(F118=3,1,0)+IF(H118=3,1,0)+IF(J118=3,1,0)+IF(L118=3,1,0)+IF(N118=3,1,0)+IF(P118=3,1,0)+IF(R118=3,1,0)+IF(T118=3,1,0)),"") ->  | X118: =IF($C118>"",SUM(F118,H118,J118,L118,N118,P118,R118,T118),"") ->  | Y118: =IF(C118>"",IF(D118<2000,16,8),"") ->  | Z118: =IF($C118>"",IF($D118<2000,2,1),"") ->  | AA118: =IF($C118>"",IF($D118<2000,25,50),"") ->  | AC118: =IF($C118>"",SUM(AF118:AL118),"") ->  | AD118: =IF($C118>"",IF(AC118<=24,0,AC118-24),"") ->  | AE118: =IF($C118>"",AC118+AD118,"") ->  | AF118: =RatingChange(D118,OFFSET($D$110,AF$110,0),F118,G118) ->  | AG118: =RatingChange(D118,OFFSET($D$110,$AG$110,0),H118,I118) ->  | AH118: =RatingChange(D118,OFFSET($D$110,AH$110,0),J118,K118) ->  | AI118: =RatingChange($D118,OFFSET($D$110,AI$110,0),L118,M118) ->  | AJ118: =RatingChange(D118,OFFSET($D$110,$AJ$110,0),N118,O118) ->  | AK118: =RatingChange(D118,OFFSET($D$110,$AK$110,0),P118,Q118) ->  | AL118: =RatingChange(D118,OFFSET($D$110,$AL$110,0),R118,S118) ->  | AM118: XXX
A124: # | B124: ID | C124: Name | D124: Rating | E124: Rating | J124: Games Won/Lost against | W124: Matches | X124: Games | AC124: Rating | AD124: Bonus | AE124: Change | AF124: Rating change vs.
A125: 9 | D125: Pre | E125: Post | G125: 1 | I125: 2 | K125: 3 | M125: 4 | O125: 5 | Q125: 6 | S125: 7 | U125: 8 | W125: Won | X125: Won | AC125: Change | AD125: Points | AE125: w/Bonus | AF125: 1 | AG125: 2 | AH125: 3 | AI125: 4 | AJ125: 5 | AK125: 6 | AL125: 7 | AM125: 8
A126: 1 | B126: 1976 | C126: Karan, Vadi | D126: 1074 | E126: =IF($C126>"",MAX(ROUND(D126+AE126,0),200),"") -> 1027 | F126: XXX | G126: XXX | H126: 1 | I126: 3 | J126: 1 | K126: 3 | L126: 0 | M126: 0 | N126: 1 | O126: 3 | W126: =IF($C126>"",(IF(F126=3,1,0)+IF(H126=3,1,0)+IF(J126=3,1,0)+IF(L126=3,1,0)+IF(N126=3,1,0)+IF(P126=3,1,0)+IF(R126=3,1,0)+IF(T126=3,1,0)),"") -> 0 | X126: =IF($C126>"",SUM(F126,H126,J126,L126,N126,P126,R126,T126),"") -> 3 | Y126: =IF(C126>"",IF(D126<2000,16,8),"") -> 16 | Z126: =IF($C126>"",IF($D126<2000,2,1),"") -> 2 | AA126: =IF($C126>"",IF($D126<2000,25,50),"") -> 25 | AC126: =IF($C126>"",SUM(AF126:AL126),"") -> -47 | AD126: =IF($C126>"",IF(AC126<=24,0,AC126-24),"") -> 0 | AE126: =IF($C126>"",AC126+AD126,"") -> -47 | AF126: XXX | AG126: =RatingChange(D126,OFFSET($D$125,$AG$125,0),H126,I126) -> -14.08 | AH126: =RatingChange(D126,OFFSET($D$125,AH$125,0),J126,K126) -> -15.32 | AI126: =RatingChange($D126,OFFSET($D$125,AI$125,0),L126,M126) -> 0 | AJ126: =RatingChange(D126,OFFSET($D$125,$AJ$125,0),N126,O126) -> -17.6 | AK126: =RatingChange(D126,OFFSET($D$125,$AK$125,0),P126,Q126) ->  | AL126: =RatingChange(D126,OFFSET($D$125,$AL$125,0),R126,S126) ->  | AM126: =RatingChange(D126,OFFSET($D$125,$AM$125,0),T126,U126) -> 
A127: 2 | B127: 1725 | C127: Lim, Matt (Plays Free) | D127: 1072 | E127: =IF($C127>"",MAX(ROUND(D127+AE127,0),200),"") -> 1092 | F127: =IF($C127>"",OFFSET($E125,G125,2*$A127),"") -> 3 | G127: =IF($C127>"",OFFSET($E125,G125,2*$A127-1),"") -> 1 | H127: XXX | I127: XXX | J127: 1 | K127: 3 | L127: 3 | M127: 0 | N127: 3 | O127: 2 | W127: =IF($C127>"",(IF(F127=3,1,0)+IF(H127=3,1,0)+IF(J127=3,1,0)+IF(L127=3,1,0)+IF(N127=3,1,0)+IF(P127=3,1,0)+IF(R127=3,1,0)+IF(T127=3,1,0)),"") -> 3 | X127: =IF($C127>"",SUM(F127,H127,J127,L127,N127,P127,R127,T127),"") -> 10 | Y127: =IF(C127>"",IF(D127<2000,16,8),"") -> 16 | Z127: =IF($C127>"",IF($D127<2000,2,1),"") -> 2 | AA127: =IF($C127>"",IF($D127<2000,25,50),"") -> 25 | AC127: =IF($C127>"",SUM(AF127:AL127),"") -> 20.44 | AD127: =IF($C127>"",IF(AC127<=24,0,AC127-24),"") -> 0 | AE127: =IF($C127>"",AC127+AD127,"") -> 20.44 | AF127: =RatingChange(D127,OFFSET($D$125,AF$125,0),F127,G127) -> 14.08 | AG127: XXX | AH127: =RatingChange(D127,OFFSET($D$125,AH$125,0),J127,K127) -> -15.24 | AI127: =RatingChange($D127,OFFSET($D$125,AI$125,0),L127,M127) -> 13.12 | AJ127: =RatingChange(D127,OFFSET($D$125,$AJ$125,0),N127,O127) -> 8.48 | AK127: =RatingChange(D127,OFFSET($D$125,$AK$125,0),P127,Q127) ->  | AL127: =RatingChange(D127,OFFSET($D$125,$AL$125,0),R127,S127) ->  | AM127: =RatingChange(D127,OFFSET($D$125,$AM$125,0),T127,U127) -> 
A128: 3 | B128: 2117 | C128: Wong, Curtis | D128: 1041 | E128: =IF($C128>"",MAX(ROUND(D128+AE128,0),200),"") -> 1098 | F128: =IF($C128>"",OFFSET($E125,G125,2*$A128),"") -> 3 | G128: =IF($C128>"",OFFSET($E125,G125,2*$A128-1),"") -> 1 | H128: =IF($C128>"",OFFSET($E125,I125,2*$A128),"") -> 3 | I128: =IF($C128>"",OFFSET($E125,I125,2*$A128-1),"") -> 1 | J128: XXX | K128: XXX | L128: 0 | M128: 0 | N128: 3 | O128: 2 | W128: =IF($C128>"",(IF(F128=3,1,0)+IF(H128=3,1,0)+IF(J128=3,1,0)+IF(L128=3,1,0)+IF(N128=3,1,0)+IF(P128=3,1,0)+IF(R128=3,1,0)+IF(T128=3,1,0)),"") -> 3 | X128: =IF($C128>"",SUM(F128,H128,J128,L128,N128,P128,R128,T128),"") -> 9 | Y128: =IF(C128>"",IF(D128<2000,16,8),"") -> 16 | Z128: =IF($C128>"",IF($D128<2000,2,1),"") -> 2 | AA128: =IF($C128>"",IF($D128<2000,25,50),"") -> 25 | AC128: =IF($C128>"",SUM(AF128:AL128),"") -> 40.28 | AD128: =IF($C128>"",IF(AC128<=24,0,AC128-24),"") -> 16.28 | AE128: =IF($C128>"",AC128+AD128,"") -> 56.56 | AF128: =RatingChange(D128,OFFSET($D$125,AF$125,0),F128,G128) -> 15.32 | AG128: =RatingChange(D128,OFFSET($D$125,$AG$125,0),H128,I128) -> 15.24 | AH128: XXX | AI128: =RatingChange($D128,OFFSET($D$125,AI$125,0),L128,M128) -> 0 | AJ128: =RatingChange(D128,OFFSET($D$125,$AJ$125,0),N128,O128) -> 9.72 | AK128: =RatingChange(D128,OFFSET($D$125,$AK$125,0),P128,Q128) ->  | AL128: =RatingChange(D128,OFFSET($D$125,$AL$125,0),R128,S128) ->  | AM128: =RatingChange(D128,OFFSET($D$125,$AM$125,0),T128,U128) -> 
A129: 4 | B129: 2162 | C129: Yee, Benson | D129: 1000 | E129: =IF($C129>"",MAX(ROUND(D129+AE129,0),200),"") -> 987 | F129: =IF($C129>"",OFFSET($E125,G125,2*$A129),"") -> 0 | G129: =IF($C129>"",OFFSET($E125,G125,2*$A129-1),"") -> 0 | H129: =IF($C129>"",OFFSET($E125,I125,2*$A129),"") -> 0 | I129: =IF($C129>"",OFFSET($E125,I125,2*$A129-1),"") -> 3 | J129: =IF($C129>"",OFFSET($E125,K125,2*$A129),"") -> 0 | K129: =IF($C129>"",OFFSET($E125,K125,2*$A129-1),"") -> 0 | L129: XXX | M129: XXX | N129: 0 | O129: 0 | W129: =IF($C129>"",(IF(F129=3,1,0)+IF(H129=3,1,0)+IF(J129=3,1,0)+IF(L129=3,1,0)+IF(N129=3,1,0)+IF(P129=3,1,0)+IF(R129=3,1,0)+IF(T129=3,1,0)),"") -> 0 | X129: =IF($C129>"",SUM(F129,H129,J129,L129,N129,P129,R129,T129),"") -> 0 | Y129: =IF(C129>"",IF(D129<2000,16,8),"") -> 16 | Z129: =IF($C129>"",IF($D129<2000,2,1),"") -> 2 | AA129: =IF($C129>"",IF($D129<2000,25,50),"") -> 25 | AC129: =IF($C129>"",SUM(AF129:AL129),"") -> -13.12 | AD129: =IF($C129>"",IF(AC129<=24,0,AC129-24),"") -> 0 | AE129: =IF($C129>"",AC129+AD129,"") -> -13.12 | AF129: =RatingChange(D129,OFFSET($D$125,AF$125,0),F129,G129) -> 0 | AG129: =RatingChange(D129,OFFSET($D$125,$AG$125,0),H129,I129) -> -13.12 | AH129: =RatingChange(D129,OFFSET($D$125,AH$125,0),J129,K129) -> 0 | AI129: XXX | AJ129: =RatingChange(D129,OFFSET($D$125,$AJ$125,0),N129,O129) -> 0 | AK129: =RatingChange(D129,OFFSET($D$125,$AK$125,0),P129,Q129) ->  | AL129: =RatingChange(D129,OFFSET($D$125,$AL$125,0),R129,S129) ->  | AM129: =RatingChange(D129,OFFSET($D$125,$AM$125,0),T129,U129) -> 
A130: 5 | B130: 1936 | C130: Thorn, Jon | D130: 984 | E130: =IF($C130>"",MAX(ROUND(D130+AE130,0),200),"") -> 983 | F130: =IF($C130>"",OFFSET($E125,G125,2*$A130),"") -> 3 | G130: =IF($C130>"",OFFSET($E125,G125,2*$A130-1),"") -> 1 | H130: =IF($C130>"",OFFSET($E125,$I125,2*$A130),"") -> 2 | I130: =IF($C130>"",OFFSET($E125,I125,2*$A130-1),"") -> 3 | J130: =IF($C130>"",OFFSET($E125,$K125,2*$A130),"") -> 2 | K130: =IF($C130>"",OFFSET($E125,K125,2*$A130-1),"") -> 3 | L130: =IF($C130>"",OFFSET($E125,$M125,2*$A130),"") -> 0 | M130: =IF($C130>"",OFFSET($E125,M125,2*$A130-1),"") -> 0 | N130: XXX | O130: XXX | W130: =IF($C130>"",(IF(F130=3,1,0)+IF(H130=3,1,0)+IF(J130=3,1,0)+IF(L130=3,1,0)+IF(N130=3,1,0)+IF(P130=3,1,0)+IF(R130=3,1,0)+IF(T130=3,1,0)),"") -> 1 | X130: =IF($C130>"",SUM(F130,H130,J130,L130,N130,P130,R130,T130),"") -> 7 | Y130: =IF(C130>"",IF(D130<2000,16,8),"") -> 16 | Z130: =IF($C130>"",IF($D130<2000,2,1),"") -> 2 | AA130: =IF($C130>"",IF($D130<2000,25,50),"") -> 25 | AC130: =IF($C130>"",SUM(AF130:AL130),"") -> -00.6 | AD130: =IF($C130>"",IF(AC130<=24,0,AC130-24),"") -> 0 | AE130: =IF($C130>"",AC130+AD130,"") -> -00.6 | AF130: =RatingChange(D130,OFFSET($D$125,AF$125,0),F130,G130) -> 17.6 | AG130: =RatingChange(D130,OFFSET($D$125,$AG$125,0),H130,I130) -> -8.48 | AH130: =RatingChange(D130,OFFSET($D$125,AH$125,0),J130,K130) -> -9.72 | AI130: =RatingChange($D130,OFFSET($D$125,AI$125,0),L130,M130) -> 0 | AJ130: XXX | AK130: =RatingChange(D130,OFFSET($D$125,$AK$125,0),P130,Q130) ->  | AL130: =RatingChange(D130,OFFSET($D$125,$AL$125,0),R130,S130) ->  | AM130: =RatingChange(D130,OFFSET($D$125,$AM$125,0),T130,U130) -> 
A131: 6 | E131: =IF($C131>"",MAX(ROUND(D131+AE131,0),200),"") ->  | F131: =IF($C131>"",OFFSET($E125,G125,2*$A131),"") ->  | G131: =IF($C131>"",OFFSET($E125,G125,2*$A131-1),"") ->  | H131: =IF($C131>"",OFFSET($E125,I125,2*$A131),"") ->  | I131: =IF($C131>"",OFFSET($E125,I125,2*$A131-1),"") ->  | J131: =IF($C131>"",OFFSET($E125,K125,2*$A131),"") ->  | K131: =IF($C131>"",OFFSET($E125,K125,2*$A131-1),"") ->  | L131: =IF($C131>"",OFFSET($E125,M125,2*$A131),"") ->  | M131: =IF($C131>"",OFFSET($E125,M125,2*$A131-1),"") ->  | N131: =IF($C131>"",OFFSET($E125,O125,2*$A131),"") ->  | O131: =IF($C131>"",OFFSET($E125,O125,2*$A131-1),"") ->  | P131: XXX | Q131: XXX | W131: =IF($C131>"",(IF(F131=3,1,0)+IF(H131=3,1,0)+IF(J131=3,1,0)+IF(L131=3,1,0)+IF(N131=3,1,0)+IF(P131=3,1,0)+IF(R131=3,1,0)+IF(T131=3,1,0)),"") ->  | X131: =IF($C131>"",SUM(F131,H131,J131,L131,N131,P131,R131,T131),"") ->  | Y131: =IF(C131>"",IF(D131<2000,16,8),"") ->  | Z131: =IF($C131>"",IF($D131<2000,2,1),"") ->  | AA131: =IF($C131>"",IF($D131<2000,25,50),"") ->  | AC131: =IF($C131>"",SUM(AF131:AL131),"") ->  | AD131: =IF($C131>"",IF(AC131<=24,0,AC131-24),"") ->  | AE131: =IF($C131>"",AC131+AD131,"") ->  | AF131: =RatingChange(D131,OFFSET($D$125,AF$125,0),F131,G131) ->  | AG131: =RatingChange(D131,OFFSET($D$125,$AG$125,0),H131,I131) ->  | AH131: =RatingChange(D131,OFFSET($D$125,AH$125,0),J131,K131) ->  | AI131: =RatingChange($D131,OFFSET($D$125,AI$125,0),L131,M131) ->  | AJ131: 14 | AK131: XXX | AL131: =RatingChange(D131,OFFSET($D$125,$AL$125,0),R131,S131) ->  | AM131: =RatingChange(D131,OFFSET($D$125,$AM$125,0),T131,U131) -> 
A132: 7 | E132: =IF($C132>"",MAX(ROUND(D132+AE132,0),200),"") ->  | F132: =IF($C132>"",OFFSET($E125,G125,2*$A132),"") ->  | G132: =IF($C132>"",OFFSET($E125,G125,2*$A132-1),"") ->  | H132: =IF($C132>"",OFFSET($E125,I125,2*$A132),"") ->  | I132: =IF($C132>"",OFFSET($E125,I125,2*$A132-1),"") ->  | J132: =IF($C132>"",OFFSET($E125,K125,2*$A132),"") ->  | K132: =IF($C132>"",OFFSET($E125,K125,2*$A132-1),"") ->  | L132: =IF($C132>"",OFFSET($E125,M125,2*$A132),"") ->  | M132: =IF($C132>"",OFFSET($E125,M125,2*$A132-1),"") ->  | N132: =IF($C132>"",OFFSET($E125,O125,2*$A132),"") ->  | O132: =IF($C132>"",OFFSET($E125,O125,2*$A132-1),"") ->  | P132: =IF($C132>"",OFFSET($E125,Q125,2*$A132),"") ->  | Q132: =IF($C132>"",OFFSET($E125,Q125,2*$A132-1),"") ->  | R132: XXX | S132: XXX | W132: =IF($C132>"",(IF(F132=3,1,0)+IF(H132=3,1,0)+IF(J132=3,1,0)+IF(L132=3,1,0)+IF(N132=3,1,0)+IF(P132=3,1,0)+IF(R132=3,1,0)+IF(T132=3,1,0)),"") ->  | X132: =IF($C132>"",SUM(F132,H132,J132,L132,N132,P132,R132,T132),"") ->  | Y132: =IF(C132>"",IF(D132<2000,16,8),"") ->  | Z132: =IF($C132>"",IF($D132<2000,2,1),"") ->  | AA132: =IF($C132>"",IF($D132<2000,25,50),"") ->  | AC132: =IF($C132>"",SUM(AF132:AL132),"") ->  | AD132: =IF($C132>"",IF(AC132<=24,0,AC132-24),"") ->  | AE132: =IF($C132>"",AC132+AD132,"") ->  | AF132: =RatingChange(D132,OFFSET($D$125,AF$125,0),F132,G132) ->  | AG132: =RatingChange(D132,OFFSET($D$125,$AG$125,0),H132,I132) ->  | AH132: =RatingChange(D132,OFFSET($D$125,AH$125,0),J132,K132) ->  | AI132: =RatingChange($D132,OFFSET($D$125,AI$125,0),L132,M132) ->  | AJ132: =RatingChange(D132,OFFSET($D$125,$AJ$125,0),N132,O132) ->  | AK132: =RatingChange(D132,OFFSET($D$125,$AK$125,0),P132,Q132) ->  | AL132: XXX | AM132: =RatingChange(D132,OFFSET($D$125,$AM$125,0),T132,U132) -> 
A133: 8 | E133: =IF($C133>"",MAX(ROUND(D133+AE133,0),200),"") ->  | F133: =IF($C133>"",OFFSET($E125,G125,2*$A133),"") ->  | G133: =IF($C133>"",OFFSET($E125,G125,2*$A133-1),"") ->  | H133: =IF($C133>"",OFFSET($E125,I125,2*$A133),"") ->  | I133: =IF($C133>"",OFFSET($E125,I125,2*$A133-1),"") ->  | J133: =IF($C133>"",OFFSET($E125,K125,2*$A133),"") ->  | K133: =IF($C133>"",OFFSET($E125,K125,2*$A133-1),"") ->  | L133: =IF($C133>"",OFFSET($E125,M125,2*$A133),"") ->  | M133: =IF($C133>"",OFFSET($E125,M125,2*$A133-1),"") ->  | N133: =IF($C133>"",OFFSET($E125,O125,2*$A133),"") ->  | O133: =IF($C133>"",OFFSET($E125,O125,2*$A133-1),"") ->  | P133: =IF($C133>"",OFFSET($E125,Q125,2*$A133),"") ->  | Q133: =IF($C133>"",OFFSET($E125,Q125,2*$A133-1),"") ->  | R133: =IF($C133>"",OFFSET($E125,S125,2*$A133),"") ->  | S133: =IF($C133>"",OFFSET($E125,S125,2*$A133-1),"") ->  | T133: XXX | U133: XXX | W133: =IF($C133>"",(IF(F133=3,1,0)+IF(H133=3,1,0)+IF(J133=3,1,0)+IF(L133=3,1,0)+IF(N133=3,1,0)+IF(P133=3,1,0)+IF(R133=3,1,0)+IF(T133=3,1,0)),"") ->  | X133: =IF($C133>"",SUM(F133,H133,J133,L133,N133,P133,R133,T133),"") ->  | Y133: =IF(C133>"",IF(D133<2000,16,8),"") ->  | Z133: =IF($C133>"",IF($D133<2000,2,1),"") ->  | AA133: =IF($C133>"",IF($D133<2000,25,50),"") ->  | AC133: =IF($C133>"",SUM(AF133:AL133),"") ->  | AD133: =IF($C133>"",IF(AC133<=24,0,AC133-24),"") ->  | AE133: =IF($C133>"",AC133+AD133,"") ->  | AF133: =RatingChange(D133,OFFSET($D$125,AF$125,0),F133,G133) ->  | AG133: =RatingChange(D133,OFFSET($D$125,$AG$125,0),H133,I133) ->  | AH133: =RatingChange(D133,OFFSET($D$125,AH$125,0),J133,K133) ->  | AI133: =RatingChange($D133,OFFSET($D$125,AI$125,0),L133,M133) ->  | AJ133: =RatingChange(D133,OFFSET($D$125,$AJ$125,0),N133,O133) ->  | AK133: =RatingChange(D133,OFFSET($D$125,$AK$125,0),P133,Q133) ->  | AL133: =RatingChange(D133,OFFSET($D$125,$AL$125,0),R133,S133) ->  | AM133: XXX
A139: # | B139: ID | C139: Name | D139: Rating | E139: Rating | J139: Games Won/Lost against | W139: Matches | X139: Games | AC139: Rating | AD139: Bonus | AE139: Change | AF139: Rating change vs.
A140: 10 | D140: Pre | E140: Post | G140: 1 | I140: 2 | K140: 3 | M140: 4 | O140: 5 | Q140: 6 | S140: 7 | U140: 8 | W140: Won | X140: Won | AC140: Change | AD140: Points | AE140: w/Bonus | AF140: 1 | AG140: 2 | AH140: 3 | AI140: 4 | AJ140: 5 | AK140: 6 | AL140: 7 | AM140: 8
A141: 1 | B141: 1671 | C141: Tang, Kenneth | D141: 985 | E141: =IF($C141>"",MAX(ROUND(D141+AE141,0),200),"") -> 1065 | F141: XXX | G141: XXX | H141: 3 | I141: 2 | J141: 3 | K141: 0 | L141: 3 | M141: 1 | N141: 3 | O141: 0 | W141: =IF($C141>"",(IF(F141=3,1,0)+IF(H141=3,1,0)+IF(J141=3,1,0)+IF(L141=3,1,0)+IF(N141=3,1,0)+IF(P141=3,1,0)+IF(R141=3,1,0)+IF(T141=3,1,0)),"") -> 4 | X141: =IF($C141>"",SUM(F141,H141,J141,L141,N141,P141,R141,T141),"") -> 12 | Y141: =IF(C141>"",IF(D141<2000,16,8),"") -> 16 | Z141: =IF($C141>"",IF($D141<2000,2,1),"") -> 2 | AA141: =IF($C141>"",IF($D141<2000,25,50),"") -> 25 | AC141: =IF($C141>"",SUM(AF141:AL141),"") -> 52.12 | AD141: =IF($C141>"",IF(AC141<=24,0,AC141-24),"") -> 28.12 | AE141: =IF($C141>"",AC141+AD141,"") -> 80.24 | AF141: XXX | AG141: =RatingChange(D141,OFFSET($D$140,$AG$140,0),H141,I141) -> 12 | AH141: =RatingChange(D141,OFFSET($D$140,AH$140,0),J141,K141) -> 15.92 | AI141: =RatingChange($D141,OFFSET($D$140,AI$140,0),L141,M141) -> 11.8 | AJ141: =RatingChange(D141,OFFSET($D$140,$AJ$140,0),N141,O141) -> 12.4 | AK141: =RatingChange(D141,OFFSET($D$140,$AK$140,0),P141,Q141) ->  | AL141: =RatingChange(D141,OFFSET($D$140,$AL$140,0),R141,S141) ->  | AM141: =RatingChange(D141,OFFSET($D$140,$AM$140,0),T141,U141) -> 
A142: 2 | B142: 1405 | C142: Sun, Winnie | D142: 985 | E142: =IF($C142>"",MAX(ROUND(D142+AE142,0),200),"") -> 991 | F142: =IF($C142>"",OFFSET($E140,G140,2*$A142),"") -> 2 | G142: =IF($C142>"",OFFSET($E140,G140,2*$A142-1),"") -> 3 | H142: XXX | I142: XXX | J142: 1 | K142: 2 | L142: 3 | M142: 2 | N142: 3 | O142: 1 | W142: =IF($C142>"",(IF(F142=3,1,0)+IF(H142=3,1,0)+IF(J142=3,1,0)+IF(L142=3,1,0)+IF(N142=3,1,0)+IF(P142=3,1,0)+IF(R142=3,1,0)+IF(T142=3,1,0)),"") -> 2 | X142: =IF($C142>"",SUM(F142,H142,J142,L142,N142,P142,R142,T142),"") -> 9 | Y142: =IF(C142>"",IF(D142<2000,16,8),"") -> 16 | Z142: =IF($C142>"",IF($D142<2000,2,1),"") -> 2 | AA142: =IF($C142>"",IF($D142<2000,25,50),"") -> 25 | AC142: =IF($C142>"",SUM(AF142:AL142),"") -> 6.2 | AD142: =IF($C142>"",IF(AC142<=24,0,AC142-24),"") -> 0 | AE142: =IF($C142>"",AC142+AD142,"") -> 6.2 | AF142: =RatingChange(D142,OFFSET($D$140,AF$140,0),F142,G142) -> -12 | AG142: XXX | AH142: =RatingChange(D142,OFFSET($D$140,AH$140,0),J142,K142) -> -2 | AI142: =RatingChange($D142,OFFSET($D$140,AI$140,0),L142,M142) -> 9.8 | AJ142: =RatingChange(D142,OFFSET($D$140,$AJ$140,0),N142,O142) -> 10.4 | AK142: =RatingChange(D142,OFFSET($D$140,$AK$140,0),P142,Q142) ->  | AL142: =RatingChange(D142,OFFSET($D$140,$AL$140,0),R142,S142) ->  | AM142: =RatingChange(D142,OFFSET($D$140,$AM$140,0),T142,U142) -> 
A143: 3 | B143: 1593 | C143: Ginsburg, Leonard | D143: 983 | E143: =IF($C143>"",MAX(ROUND(D143+AE143,0),200),"") -> 991 | F143: =IF($C143>"",OFFSET($E140,G140,2*$A143),"") -> 0 | G143: =IF($C143>"",OFFSET($E140,G140,2*$A143-1),"") -> 3 | H143: =IF($C143>"",OFFSET($E140,I140,2*$A143),"") -> 2 | I143: =IF($C143>"",OFFSET($E140,I140,2*$A143-1),"") -> 1 | J143: XXX | K143: XXX | L143: 3 | M143: 1 | N143: 3 | O143: 1 | W143: =IF($C143>"",(IF(F143=3,1,0)+IF(H143=3,1,0)+IF(J143=3,1,0)+IF(L143=3,1,0)+IF(N143=3,1,0)+IF(P143=3,1,0)+IF(R143=3,1,0)+IF(T143=3,1,0)),"") -> 2 | X143: =IF($C143>"",SUM(F143,H143,J143,L143,N143,P143,R143,T143),"") -> 8 | Y143: =IF(C143>"",IF(D143<2000,16,8),"") -> 16 | Z143: =IF($C143>"",IF($D143<2000,2,1),"") -> 2 | AA143: =IF($C143>"",IF($D143<2000,25,50),"") -> 25 | AC143: =IF($C143>"",SUM(AF143:AL143),"") -> 8.44 | AD143: =IF($C143>"",IF(AC143<=24,0,AC143-24),"") -> 0 | AE143: =IF($C143>"",AC143+AD143,"") -> 8.44 | AF143: =RatingChange(D143,OFFSET($D$140,AF$140,0),F143,G143) -> -15.92 | AG143: =RatingChange(D143,OFFSET($D$140,$AG$140,0),H143,I143) -> 2 | AH143: XXX | AI143: =RatingChange($D143,OFFSET($D$140,AI$140,0),L143,M143) -> 11.88 | AJ143: =RatingChange(D143,OFFSET($D$140,$AJ$140,0),N143,O143) -> 10.48 | AK143: =RatingChange(D143,OFFSET($D$140,$AK$140,0),P143,Q143) ->  | AL143: =RatingChange(D143,OFFSET($D$140,$AL$140,0),R143,S143) ->  | AM143: =RatingChange(D143,OFFSET($D$140,$AM$140,0),T143,U143) -> 
A144: 4 | B144: 2078 | C144: Chen, Er | D144: 930 | E144: =IF($C144>"",MAX(ROUND(D144+AE144,0),200),"") -> 897 | F144: =IF($C144>"",OFFSET($E140,G140,2*$A144),"") -> 1 | G144: =IF($C144>"",OFFSET($E140,G140,2*$A144-1),"") -> 3 | H144: =IF($C144>"",OFFSET($E140,I140,2*$A144),"") -> 2 | I144: =IF($C144>"",OFFSET($E140,I140,2*$A144-1),"") -> 3 | J144: =IF($C144>"",OFFSET($E140,K140,2*$A144),"") -> 1 | K144: =IF($C144>"",OFFSET($E140,K140,2*$A144-1),"") -> 3 | L144: XXX | M144: XXX | N144: 1 | O144: 1 | W144: =IF($C144>"",(IF(F144=3,1,0)+IF(H144=3,1,0)+IF(J144=3,1,0)+IF(L144=3,1,0)+IF(N144=3,1,0)+IF(P144=3,1,0)+IF(R144=3,1,0)+IF(T144=3,1,0)),"") -> 0 | X144: =IF($C144>"",SUM(F144,H144,J144,L144,N144,P144,R144,T144),"") -> 5 | Y144: =IF(C144>"",IF(D144<2000,16,8),"") -> 16 | Z144: =IF($C144>"",IF($D144<2000,2,1),"") -> 2 | AA144: =IF($C144>"",IF($D144<2000,25,50),"") -> 25 | AC144: =IF($C144>"",SUM(AF144:AL144),"") -> -33.48 | AD144: =IF($C144>"",IF(AC144<=24,0,AC144-24),"") -> 0 | AE144: =IF($C144>"",AC144+AD144,"") -> -33.48 | AF144: =RatingChange(D144,OFFSET($D$140,AF$140,0),F144,G144) -> -11.8 | AG144: =RatingChange(D144,OFFSET($D$140,$AG$140,0),H144,I144) -> -9.8 | AH144: =RatingChange(D144,OFFSET($D$140,AH$140,0),J144,K144) -> -11.88 | AI144: XXX | AJ144: =RatingChange(D144,OFFSET($D$140,$AJ$140,0),N144,O144) -> 0 | AK144: =RatingChange(D144,OFFSET($D$140,$AK$140,0),P144,Q144) ->  | AL144: =RatingChange(D144,OFFSET($D$140,$AL$140,0),R144,S144) ->  | AM144: =RatingChange(D144,OFFSET($D$140,$AM$140,0),T144,U144) -> 
A145: 5 | B145: 2060 | C145: Higgins, Joseph | D145: 895 | E145: =IF($C145>"",MAX(ROUND(D145+AE145,0),200),"") -> 862 | F145: =IF($C145>"",OFFSET($E140,G140,2*$A145),"") -> 0 | G145: =IF($C145>"",OFFSET($E140,G140,2*$A145-1),"") -> 3 | H145: =IF($C145>"",OFFSET($E140,I140,2*$A145),"") -> 1 | I145: =IF($C145>"",OFFSET($E140,I140,2*$A145-1),"") -> 3 | J145: =IF($C145>"",OFFSET($E140,K140,2*$A145),"") -> 1 | K145: =IF($C145>"",OFFSET($E140,K140,2*$A145-1),"") -> 3 | L145: =IF($C145>"",OFFSET($E140,M140,2*$A145),"") -> 1 | M145: =IF($C145>"",OFFSET($E140,M140,2*$A145-1),"") -> 1 | N145: XXX | O145: XXX | W145: =IF($C145>"",(IF(F145=3,1,0)+IF(H145=3,1,0)+IF(J145=3,1,0)+IF(L145=3,1,0)+IF(N145=3,1,0)+IF(P145=3,1,0)+IF(R145=3,1,0)+IF(T145=3,1,0)),"") -> 0 | X145: =IF($C145>"",SUM(F145,H145,J145,L145,N145,P145,R145,T145),"") -> 3 | Y145: =IF(C145>"",IF(D145<2000,16,8),"") -> 16 | Z145: =IF($C145>"",IF($D145<2000,2,1),"") -> 2 | AA145: =IF($C145>"",IF($D145<2000,25,50),"") -> 25 | AC145: =IF($C145>"",SUM(AF145:AL145),"") -> -33.28 | AD145: =IF($C145>"",IF(AC145<=24,0,AC145-24),"") -> 0 | AE145: =IF($C145>"",AC145+AD145,"") -> -33.28 | AF145: =RatingChange(D145,OFFSET($D$140,AF$140,0),F145,G145) -> -12.4 | AG145: =RatingChange(D145,OFFSET($D$140,$AG$140,0),H145,I145) -> -10.4 | AH145: =RatingChange(D145,OFFSET($D$140,AH$140,0),J145,K145) -> -10.48 | AI145: =RatingChange($D145,OFFSET($D$140,AI$140,0),L145,M145) -> 0 | AJ145: XXX | AK145: =RatingChange(D145,OFFSET($D$140,$AK$140,0),P145,Q145) ->  | AL145: =RatingChange(D145,OFFSET($D$140,$AL$140,0),R145,S145) ->  | AM145: =RatingChange(D145,OFFSET($D$140,$AM$140,0),T145,U145) -> 
A146: 6 | E146: =IF($C146>"",MAX(ROUND(D146+AE146,0),200),"") ->  | F146: =IF($C146>"",OFFSET($E140,G140,2*$A146),"") ->  | G146: =IF($C146>"",OFFSET($E140,G140,2*$A146-1),"") ->  | H146: =IF($C146>"",OFFSET($E140,I140,2*$A146),"") ->  | I146: =IF($C146>"",OFFSET($E140,I140,2*$A146-1),"") ->  | J146: =IF($C146>"",OFFSET($E140,K140,2*$A146),"") ->  | K146: =IF($C146>"",OFFSET($E140,K140,2*$A146-1),"") ->  | L146: =IF($C146>"",OFFSET($E140,M140,2*$A146),"") ->  | M146: =IF($C146>"",OFFSET($E140,M140,2*$A146-1),"") ->  | N146: =IF($C146>"",OFFSET($E140,O140,2*$A146),"") ->  | O146: =IF($C146>"",OFFSET($E140,O140,2*$A146-1),"") ->  | P146: XXX | Q146: XXX | W146: =IF($C146>"",(IF(F146=3,1,0)+IF(H146=3,1,0)+IF(J146=3,1,0)+IF(L146=3,1,0)+IF(N146=3,1,0)+IF(P146=3,1,0)+IF(R146=3,1,0)+IF(T146=3,1,0)),"") ->  | X146: =IF($C146>"",SUM(F146,H146,J146,L146,N146,P146,R146,T146),"") ->  | Y146: =IF(C146>"",IF(D146<2000,16,8),"") ->  | Z146: =IF($C146>"",IF($D146<2000,2,1),"") ->  | AA146: =IF($C146>"",IF($D146<2000,25,50),"") ->  | AC146: =IF($C146>"",SUM(AF146:AL146),"") ->  | AD146: =IF($C146>"",IF(AC146<=24,0,AC146-24),"") ->  | AE146: =IF($C146>"",AC146+AD146,"") ->  | AF146: =RatingChange(D146,OFFSET($D$140,AF$140,0),F146,G146) ->  | AG146: =RatingChange(D146,OFFSET($D$140,$AG$140,0),H146,I146) ->  | AH146: =RatingChange(D146,OFFSET($D$140,AH$140,0),J146,K146) ->  | AI146: =RatingChange($D146,OFFSET($D$140,AI$140,0),L146,M146) ->  | AJ146: =RatingChange(D146,OFFSET($D$140,$AJ$140,0),N146,O146) ->  | AK146: XXX | AL146: =RatingChange(D146,OFFSET($D$140,$AL$140,0),R146,S146) ->  | AM146: =RatingChange(D146,OFFSET($D$140,$AM$140,0),T146,U146) -> 
A147: 7 | E147: =IF($C147>"",MAX(ROUND(D147+AE147,0),200),"") ->  | F147: =IF($C147>"",OFFSET($E140,G140,2*$A147),"") ->  | G147: =IF($C147>"",OFFSET($E140,G140,2*$A147-1),"") ->  | H147: =IF($C147>"",OFFSET($E140,I140,2*$A147),"") ->  | I147: =IF($C147>"",OFFSET($E140,I140,2*$A147-1),"") ->  | J147: =IF($C147>"",OFFSET($E140,K140,2*$A147),"") ->  | K147: =IF($C147>"",OFFSET($E140,K140,2*$A147-1),"") ->  | L147: =IF($C147>"",OFFSET($E140,M140,2*$A147),"") ->  | M147: =IF($C147>"",OFFSET($E140,M140,2*$A147-1),"") ->  | N147: =IF($C147>"",OFFSET($E140,O140,2*$A147),"") ->  | O147: =IF($C147>"",OFFSET($E140,O140,2*$A147-1),"") ->  | P147: =IF($C147>"",OFFSET($E140,Q140,2*$A147),"") ->  | Q147: =IF($C147>"",OFFSET($E140,Q140,2*$A147-1),"") ->  | R147: XXX | S147: XXX | W147: =IF($C147>"",(IF(F147=3,1,0)+IF(H147=3,1,0)+IF(J147=3,1,0)+IF(L147=3,1,0)+IF(N147=3,1,0)+IF(P147=3,1,0)+IF(R147=3,1,0)+IF(T147=3,1,0)),"") ->  | X147: =IF($C147>"",SUM(F147,H147,J147,L147,N147,P147,R147,T147),"") ->  | Y147: =IF(C147>"",IF(D147<2000,16,8),"") ->  | Z147: =IF($C147>"",IF($D147<2000,2,1),"") ->  | AA147: =IF($C147>"",IF($D147<2000,25,50),"") ->  | AC147: =IF($C147>"",SUM(AF147:AL147),"") ->  | AD147: =IF($C147>"",IF(AC147<=24,0,AC147-24),"") ->  | AE147: =IF($C147>"",AC147+AD147,"") ->  | AF147: =RatingChange(D147,OFFSET($D$140,AF$140,0),F147,G147) ->  | AG147: =RatingChange(D147,OFFSET($D$140,$AG$140,0),H147,I147) ->  | AH147: =RatingChange(D147,OFFSET($D$140,AH$140,0),J147,K147) ->  | AI147: =RatingChange($D147,OFFSET($D$140,AI$140,0),L147,M147) ->  | AJ147: =RatingChange(D147,OFFSET($D$140,$AJ$140,0),N147,O147) ->  | AK147: =RatingChange(D147,OFFSET($D$140,$AK$140,0),P147,Q147) ->  | AL147: XXX | AM147: =RatingChange(D147,OFFSET($D$140,$AM$140,0),T147,U147) -> 
A148: 8 | E148: =IF($C148>"",MAX(ROUND(D148+AE148,0),200),"") ->  | F148: =IF($C148>"",OFFSET($E140,G140,2*$A148),"") ->  | G148: =IF($C148>"",OFFSET($E140,G140,2*$A148-1),"") ->  | H148: =IF($C148>"",OFFSET($E140,I140,2*$A148),"") ->  | I148: =IF($C148>"",OFFSET($E140,I140,2*$A148-1),"") ->  | J148: =IF($C148>"",OFFSET($E140,K140,2*$A148),"") ->  | K148: =IF($C148>"",OFFSET($E140,K140,2*$A148-1),"") ->  | L148: =IF($C148>"",OFFSET($E140,M140,2*$A148),"") ->  | M148: =IF($C148>"",OFFSET($E140,M140,2*$A148-1),"") ->  | N148: =IF($C148>"",OFFSET($E140,O140,2*$A148),"") ->  | O148: =IF($C148>"",OFFSET($E140,O140,2*$A148-1),"") ->  | P148: =IF($C148>"",OFFSET($E140,Q140,2*$A148),"") ->  | Q148: =IF($C148>"",OFFSET($E140,Q140,2*$A148-1),"") ->  | R148: =IF($C148>"",OFFSET($E140,S140,2*$A148),"") ->  | S148: =IF($C148>"",OFFSET($E140,S140,2*$A148-1),"") ->  | T148: XXX | U148: XXX | W148: =IF($C148>"",(IF(F148=3,1,0)+IF(H148=3,1,0)+IF(J148=3,1,0)+IF(L148=3,1,0)+IF(N148=3,1,0)+IF(P148=3,1,0)+IF(R148=3,1,0)+IF(T148=3,1,0)),"") ->  | X148: =IF($C148>"",SUM(F148,H148,J148,L148,N148,P148,R148,T148),"") ->  | Y148: =IF(C148>"",IF(D148<2000,16,8),"") ->  | Z148: =IF($C148>"",IF($D148<2000,2,1),"") ->  | AA148: =IF($C148>"",IF($D148<2000,25,50),"") ->  | AC148: =IF($C148>"",SUM(AF148:AL148),"") ->  | AD148: =IF($C148>"",IF(AC148<=24,0,AC148-24),"") ->  | AE148: =IF($C148>"",AC148+AD148,"") ->  | AF148: =RatingChange(D148,OFFSET($D$140,AF$140,0),F148,G148) ->  | AG148: =RatingChange(D148,OFFSET($D$140,$AG$140,0),H148,I148) ->  | AH148: =RatingChange(D148,OFFSET($D$140,AH$140,0),J148,K148) ->  | AI148: =RatingChange($D148,OFFSET($D$140,AI$140,0),L148,M148) ->  | AJ148: =RatingChange(D148,OFFSET($D$140,$AJ$140,0),N148,O148) ->  | AK148: =RatingChange(D148,OFFSET($D$140,$AK$140,0),P148,Q148) ->  | AL148: =RatingChange(D148,OFFSET($D$140,$AL$140,0),R148,S148) ->  | AM148: XXX
A154: # | B154: ID | C154: Name | D154: Rating | E154: Rating | J154: Games Won/Lost against | W154: Matches | X154: Games | AC154: Rating | AD154: Bonus | AE154: Change | AF154: Rating change vs.
A155: 11 | D155: Pre | E155: Post | G155: 1 | I155: 2 | K155: 3 | M155: 4 | O155: 5 | Q155: 6 | S155: 7 | U155: 8 | W155: Won | X155: Won | AC155: Change | AD155: Points | AE155: w/Bonus | AF155: 1 | AG155: 2 | AH155: 3 | AI155: 4 | AJ155: 5 | AK155: 6 | AL155: 7 | AM155: 8
A156: 1 | B156: 1658 | C156: Yuen, Ting | D156: 883 | E156: =IF($C156>"",MAX(ROUND(D156+AE156,0),200),"") -> 907 | F156: XXX | G156: XXX | H156: 3 | I156: 1 | J156: 3 | K156: 1 | L156: 1 | M156: 3 | N156: 3 | O156: 1 | W156: =IF($C156>"",(IF(F156=3,1,0)+IF(H156=3,1,0)+IF(J156=3,1,0)+IF(L156=3,1,0)+IF(N156=3,1,0)+IF(P156=3,1,0)+IF(R156=3,1,0)+IF(T156=3,1,0)),"") -> 3 | X156: =IF($C156>"",SUM(F156,H156,J156,L156,N156,P156,R156,T156),"") -> 10 | Y156: =IF(C156>"",IF(D156<2000,16,8),"") -> 16 | Z156: =IF($C156>"",IF($D156<2000,2,1),"") -> 2 | AA156: =IF($C156>"",IF($D156<2000,25,50),"") -> 25 | AC156: =IF($C156>"",SUM(AF156:AL156),"") -> 23.84 | AD156: =IF($C156>"",IF(AC156<=24,0,AC156-24),"") -> 0 | AE156: =IF($C156>"",AC156+AD156,"") -> 23.84 | AF156: XXX | AG156: =RatingChange(D156,OFFSET($D$155,$AG$155,0),H156,I156) -> 13.96 | AH156: =RatingChange(D156,OFFSET($D$155,AH$155,0),J156,K156) -> 13.68 | AI156: =RatingChange($D156,OFFSET($D$155,AI$155,0),L156,M156) -> -14.76 | AJ156: =RatingChange(D156,OFFSET($D$155,$AJ$155,0),N156,O156) -> 10.96 | AK156: =RatingChange(D156,OFFSET($D$155,$AK$155,0),P156,Q156) ->  | AL156: =RatingChange(D156,OFFSET($D$155,$AL$155,0),R156,S156) ->  | AM156: =RatingChange(D156,OFFSET($D$155,$AM$155,0),T156,U156) -> 
A157: 2 | B157: 1489 | C157: Kong, Kailyn | D157: 882 | E157: =IF($C157>"",MAX(ROUND(D157+AE157,0),200),"") -> 818 | F157: =IF($C157>"",OFFSET($E155,G155,2*$A157),"") -> 1 | G157: =IF($C157>"",OFFSET($E155,G155,2*$A157-1),"") -> 3 | H157: XXX | I157: XXX | J157: 0 | K157: 3 | L157: 0 | M157: 3 | N157: 1 | O157: 3 | W157: =IF($C157>"",(IF(F157=3,1,0)+IF(H157=3,1,0)+IF(J157=3,1,0)+IF(L157=3,1,0)+IF(N157=3,1,0)+IF(P157=3,1,0)+IF(R157=3,1,0)+IF(T157=3,1,0)),"") -> 0 | X157: =IF($C157>"",SUM(F157,H157,J157,L157,N157,P157,R157,T157),"") -> 2 | Y157: =IF(C157>"",IF(D157<2000,16,8),"") -> 16 | Z157: =IF($C157>"",IF($D157<2000,2,1),"") -> 2 | AA157: =IF($C157>"",IF($D157<2000,25,50),"") -> 25 | AC157: =IF($C157>"",SUM(AF157:AL157),"") -> -63.96 | AD157: =IF($C157>"",IF(AC157<=24,0,AC157-24),"") -> 0 | AE157: =IF($C157>"",AC157+AD157,"") -> -63.96 | AF157: =RatingChange(D157,OFFSET($D$155,AF$155,0),F157,G157) -> -13.96 | AG157: XXX | AH157: =RatingChange(D157,OFFSET($D$155,AH$155,0),J157,K157) -> -16.28 | AI157: =RatingChange($D157,OFFSET($D$155,AI$155,0),L157,M157) -> -16.72 | AJ157: =RatingChange(D157,OFFSET($D$155,$AJ$155,0),N157,O157) -> -17 | AK157: =RatingChange(D157,OFFSET($D$155,$AK$155,0),P157,Q157) ->  | AL157: =RatingChange(D157,OFFSET($D$155,$AL$155,0),R157,S157) ->  | AM157: =RatingChange(D157,OFFSET($D$155,$AM$155,0),T157,U157) -> 
A158: 3 | B158: 1353 | C158: Lee, Aria | D158: 875 | E158: =IF($C158>"",MAX(ROUND(D158+AE158,0),200),"") -> 874 | F158: =IF($C158>"",OFFSET($E155,G155,2*$A158),"") -> 1 | G158: =IF($C158>"",OFFSET($E155,G155,2*$A158-1),"") -> 3 | H158: =IF($C158>"",OFFSET($E155,I155,2*$A158),"") -> 3 | I158: =IF($C158>"",OFFSET($E155,I155,2*$A158-1),"") -> 0 | J158: XXX | K158: XXX | L158: 1 | M158: 3 | N158: 3 | O158: 1 | W158: =IF($C158>"",(IF(F158=3,1,0)+IF(H158=3,1,0)+IF(J158=3,1,0)+IF(L158=3,1,0)+IF(N158=3,1,0)+IF(P158=3,1,0)+IF(R158=3,1,0)+IF(T158=3,1,0)),"") -> 2 | X158: =IF($C158>"",SUM(F158,H158,J158,L158,N158,P158,R158,T158),"") -> 8 | Y158: =IF(C158>"",IF(D158<2000,16,8),"") -> 16 | Z158: =IF($C158>"",IF($D158<2000,2,1),"") -> 2 | AA158: =IF($C158>"",IF($D158<2000,25,50),"") -> 25 | AC158: =IF($C158>"",SUM(AF158:AL158),"") -> -0.55999999999999872 | AD158: =IF($C158>"",IF(AC158<=24,0,AC158-24),"") -> 0 | AE158: =IF($C158>"",AC158+AD158,"") -> -0.55999999999999872 | AF158: =RatingChange(D158,OFFSET($D$155,AF$155,0),F158,G158) -> -13.68 | AG158: =RatingChange(D158,OFFSET($D$155,$AG$155,0),H158,I158) -> 16.28 | AH158: XXX | AI158: =RatingChange($D158,OFFSET($D$155,AI$155,0),L158,M158) -> -14.44 | AJ158: =RatingChange(D158,OFFSET($D$155,$AJ$155,0),N158,O158) -> 11.28 | AK158: =RatingChange(D158,OFFSET($D$155,$AK$155,0),P158,Q158) ->  | AL158: =RatingChange(D158,OFFSET($D$155,$AL$155,0),R158,S158) ->  | AM158: =RatingChange(D158,OFFSET($D$155,$AM$155,0),T158,U158) -> 
A159: 4 | B159: 1967 | C159: Chen, Jeffrey | D159: 864 | E159: =IF($C159>"",MAX(ROUND(D159+AE159,0),200),"") -> 959 | F159: =IF($C159>"",OFFSET($E155,G155,2*$A159),"") -> 3 | G159: =IF($C159>"",OFFSET($E155,G155,2*$A159-1),"") -> 1 | H159: =IF($C159>"",OFFSET($E155,I155,2*$A159),"") -> 3 | I159: =IF($C159>"",OFFSET($E155,I155,2*$A159-1),"") -> 0 | J159: =IF($C159>"",OFFSET($E155,K155,2*$A159),"") -> 3 | K159: =IF($C159>"",OFFSET($E155,K155,2*$A159-1),"") -> 1 | L159: XXX | M159: XXX | N159: 3 | O159: 0 | W159: =IF($C159>"",(IF(F159=3,1,0)+IF(H159=3,1,0)+IF(J159=3,1,0)+IF(L159=3,1,0)+IF(N159=3,1,0)+IF(P159=3,1,0)+IF(R159=3,1,0)+IF(T159=3,1,0)),"") -> 4 | X159: =IF($C159>"",SUM(F159,H159,J159,L159,N159,P159,R159,T159),"") -> 12 | Y159: =IF(C159>"",IF(D159<2000,16,8),"") -> 16 | Z159: =IF($C159>"",IF($D159<2000,2,1),"") -> 2 | AA159: =IF($C159>"",IF($D159<2000,25,50),"") -> 25 | AC159: =IF($C159>"",SUM(AF159:AL159),"") -> 59.64 | AD159: =IF($C159>"",IF(AC159<=24,0,AC159-24),"") -> 35.64 | AE159: =IF($C159>"",AC159+AD159,"") -> 95.28 | AF159: =RatingChange(D159,OFFSET($D$155,AF$155,0),F159,G159) -> 14.76 | AG159: =RatingChange(D159,OFFSET($D$155,$AG$155,0),H159,I159) -> 16.72 | AH159: =RatingChange(D159,OFFSET($D$155,AH$155,0),J159,K159) -> 14.44 | AI159: XXX | AJ159: =RatingChange(D159,OFFSET($D$155,$AJ$155,0),N159,O159) -> 13.72 | AK159: =RatingChange(D159,OFFSET($D$155,$AK$155,0),P159,Q159) ->  | AL159: =RatingChange(D159,OFFSET($D$155,$AL$155,0),R159,S159) ->  | AM159: =RatingChange(D159,OFFSET($D$155,$AM$155,0),T159,U159) -> 
A160: 5 | B160: 2140 | C160: Frye, Scott | D160: 807 | E160: =IF($C160>"",MAX(ROUND(D160+AE160,0),200),"") -> 788 | F160: =IF($C160>"",OFFSET($E155,G155,2*$A160),"") -> 1 | G160: =IF($C160>"",OFFSET($E155,G155,2*$A160-1),"") -> 3 | H160: =IF($C160>"",OFFSET($E155,I155,2*$A160),"") -> 3 | I160: =IF($C160>"",OFFSET($E155,I155,2*$A160-1),"") -> 1 | J160: =IF($C160>"",OFFSET($E155,K155,2*$A160),"") -> 1 | K160: =IF($C160>"",OFFSET($E155,K155,2*$A160-1),"") -> 3 | L160: =IF($C160>"",OFFSET($E155,M155,2*$A160),"") -> 0 | M160: =IF($C160>"",OFFSET($E155,M155,2*$A160-1),"") -> 3 | N160: XXX | O160: XXX | W160: =IF($C160>"",(IF(F160=3,1,0)+IF(H160=3,1,0)+IF(J160=3,1,0)+IF(L160=3,1,0)+IF(N160=3,1,0)+IF(P160=3,1,0)+IF(R160=3,1,0)+IF(T160=3,1,0)),"") -> 1 | X160: =IF($C160>"",SUM(F160,H160,J160,L160,N160,P160,R160,T160),"") -> 5 | Y160: =IF(C160>"",IF(D160<2000,16,8),"") -> 16 | Z160: =IF($C160>"",IF($D160<2000,2,1),"") -> 2 | AA160: =IF($C160>"",IF($D160<2000,25,50),"") -> 25 | AC160: =IF($C160>"",SUM(AF160:AL160),"") -> -18.96 | AD160: =IF($C160>"",IF(AC160<=24,0,AC160-24),"") -> 0 | AE160: =IF($C160>"",AC160+AD160,"") -> -18.96 | AF160: =RatingChange(D160,OFFSET($D$155,AF$155,0),F160,G160) -> -10.96 | AG160: =RatingChange(D160,OFFSET($D$155,$AG$155,0),H160,I160) -> 17 | AH160: =RatingChange(D160,OFFSET($D$155,AH$155,0),J160,K160) -> -11.28 | AI160: =RatingChange($D160,OFFSET($D$155,AI$155,0),L160,M160) -> -13.72 | AJ160: XXX | AK160: =RatingChange(D160,OFFSET($D$155,$AK$155,0),P160,Q160) ->  | AL160: =RatingChange(D160,OFFSET($D$155,$AL$155,0),R160,S160) ->  | AM160: =RatingChange(D160,OFFSET($D$155,$AM$155,0),T160,U160) -> 
A161: 6 | E161: =IF($C161>"",MAX(ROUND(D161+AE161,0),200),"") ->  | F161: =IF($C161>"",OFFSET($E155,G155,2*$A161),"") ->  | G161: =IF($C161>"",OFFSET($E155,G155,2*$A161-1),"") ->  | H161: =IF($C161>"",OFFSET($E155,I155,2*$A161),"") ->  | I161: =IF($C161>"",OFFSET($E155,I155,2*$A161-1),"") ->  | J161: =IF($C161>"",OFFSET($E155,K155,2*$A161),"") ->  | K161: =IF($C161>"",OFFSET($E155,K155,2*$A161-1),"") ->  | L161: =IF($C161>"",OFFSET($E155,M155,2*$A161),"") ->  | M161: =IF($C161>"",OFFSET($E155,M155,2*$A161-1),"") ->  | N161: =IF($C161>"",OFFSET($E155,O155,2*$A161),"") ->  | O161: =IF($C161>"",OFFSET($E155,O155,2*$A161-1),"") ->  | P161: XXX | Q161: XXX | W161: =IF($C161>"",(IF(F161=3,1,0)+IF(H161=3,1,0)+IF(J161=3,1,0)+IF(L161=3,1,0)+IF(N161=3,1,0)+IF(P161=3,1,0)+IF(R161=3,1,0)+IF(T161=3,1,0)),"") ->  | X161: =IF($C161>"",SUM(F161,H161,J161,L161,N161,P161,R161,T161),"") ->  | Y161: =IF(C161>"",IF(D161<2000,16,8),"") ->  | Z161: =IF($C161>"",IF($D161<2000,2,1),"") ->  | AA161: =IF($C161>"",IF($D161<2000,25,50),"") ->  | AC161: =IF($C161>"",SUM(AF161:AL161),"") ->  | AD161: =IF($C161>"",IF(AC161<=24,0,AC161-24),"") ->  | AE161: =IF($C161>"",AC161+AD161,"") ->  | AF161: =RatingChange(D161,OFFSET($D$155,AF$155,0),F161,G161) ->  | AG161: =RatingChange(D161,OFFSET($D$155,$AG$155,0),H161,I161) ->  | AH161: =RatingChange(D161,OFFSET($D$155,AH$155,0),J161,K161) ->  | AI161: =RatingChange($D161,OFFSET($D$155,AI$155,0),L161,M161) ->  | AJ161: =RatingChange(D161,OFFSET($D$155,$AJ$155,0),N161,O161) ->  | AK161: XXX | AL161: =RatingChange(D161,OFFSET($D$155,$AL$155,0),R161,S161) ->  | AM161: =RatingChange(D161,OFFSET($D$155,$AM$155,0),T161,U161) -> 
A162: 7 | E162: =IF($C162>"",MAX(ROUND(D162+AE162,0),200),"") ->  | F162: =IF($C162>"",OFFSET($E155,G155,2*$A162),"") ->  | G162: =IF($C162>"",OFFSET($E155,G155,2*$A162-1),"") ->  | H162: =IF($C162>"",OFFSET($E155,I155,2*$A162),"") ->  | I162: =IF($C162>"",OFFSET($E155,I155,2*$A162-1),"") ->  | J162: =IF($C162>"",OFFSET($E155,K155,2*$A162),"") ->  | K162: =IF($C162>"",OFFSET($E155,K155,2*$A162-1),"") ->  | L162: =IF($C162>"",OFFSET($E155,M155,2*$A162),"") ->  | M162: =IF($C162>"",OFFSET($E155,M155,2*$A162-1),"") ->  | N162: =IF($C162>"",OFFSET($E155,O155,2*$A162),"") ->  | O162: =IF($C162>"",OFFSET($E155,O155,2*$A162-1),"") ->  | P162: =IF($C162>"",OFFSET($E155,Q155,2*$A162),"") ->  | Q162: =IF($C162>"",OFFSET($E155,Q155,2*$A162-1),"") ->  | R162: XXX | S162: XXX | W162: =IF($C162>"",(IF(F162=3,1,0)+IF(H162=3,1,0)+IF(J162=3,1,0)+IF(L162=3,1,0)+IF(N162=3,1,0)+IF(P162=3,1,0)+IF(R162=3,1,0)+IF(T162=3,1,0)),"") ->  | X162: =IF($C162>"",SUM(F162,H162,J162,L162,N162,P162,R162,T162),"") ->  | Y162: =IF(C162>"",IF(D162<2000,16,8),"") ->  | Z162: =IF($C162>"",IF($D162<2000,2,1),"") ->  | AA162: =IF($C162>"",IF($D162<2000,25,50),"") ->  | AC162: =IF($C162>"",SUM(AF162:AL162),"") ->  | AD162: =IF($C162>"",IF(AC162<=24,0,AC162-24),"") ->  | AE162: =IF($C162>"",AC162+AD162,"") ->  | AF162: =RatingChange(D162,OFFSET($D$155,AF$155,0),F162,G162) ->  | AG162: =RatingChange(D162,OFFSET($D$155,$AG$155,0),H162,I162) ->  | AH162: =RatingChange(D162,OFFSET($D$155,AH$155,0),J162,K162) ->  | AI162: =RatingChange($D162,OFFSET($D$155,AI$155,0),L162,M162) ->  | AJ162: =RatingChange(D162,OFFSET($D$155,$AJ$155,0),N162,O162) ->  | AK162: =RatingChange(D162,OFFSET($D$155,$AK$155,0),P162,Q162) ->  | AL162: XXX | AM162: =RatingChange(D162,OFFSET($D$155,$AM$155,0),T162,U162) -> 
A163: 8 | E163: =IF($C163>"",MAX(ROUND(D163+AE163,0),200),"") ->  | F163: =IF($C163>"",OFFSET($E155,G155,2*$A163),"") ->  | G163: =IF($C163>"",OFFSET($E155,G155,2*$A163-1),"") ->  | H163: =IF($C163>"",OFFSET($E155,I155,2*$A163),"") ->  | I163: =IF($C163>"",OFFSET($E155,I155,2*$A163-1),"") ->  | J163: =IF($C163>"",OFFSET($E155,K155,2*$A163),"") ->  | K163: =IF($C163>"",OFFSET($E155,K155,2*$A163-1),"") ->  | L163: =IF($C163>"",OFFSET($E155,M155,2*$A163),"") ->  | M163: =IF($C163>"",OFFSET($E155,M155,2*$A163-1),"") ->  | N163: =IF($C163>"",OFFSET($E155,O155,2*$A163),"") ->  | O163: =IF($C163>"",OFFSET($E155,O155,2*$A163-1),"") ->  | P163: =IF($C163>"",OFFSET($E155,Q155,2*$A163),"") ->  | Q163: =IF($C163>"",OFFSET($E155,Q155,2*$A163-1),"") ->  | R163: =IF($C163>"",OFFSET($E155,S155,2*$A163),"") ->  | S163: =IF($C163>"",OFFSET($E155,S155,2*$A163-1),"") ->  | T163: XXX | U163: XXX | W163: =IF($C163>"",(IF(F163=3,1,0)+IF(H163=3,1,0)+IF(J163=3,1,0)+IF(L163=3,1,0)+IF(N163=3,1,0)+IF(P163=3,1,0)+IF(R163=3,1,0)+IF(T163=3,1,0)),"") ->  | X163: =IF($C163>"",SUM(F163,H163,J163,L163,N163,P163,R163,T163),"") ->  | Y163: =IF(C163>"",IF(D163<2000,16,8),"") ->  | Z163: =IF($C163>"",IF($D163<2000,2,1),"") ->  | AA163: =IF($C163>"",IF($D163<2000,25,50),"") ->  | AC163: =IF($C163>"",SUM(AF163:AL163),"") ->  | AD163: =IF($C163>"",IF(AC163<=24,0,AC163-24),"") ->  | AE163: =IF($C163>"",AC163+AD163,"") ->  | AF163: =RatingChange(D163,OFFSET($D$155,AF$155,0),F163,G163) ->  | AG163: =RatingChange(D163,OFFSET($D$155,$AG$155,0),H163,I163) ->  | AH163: =RatingChange(D163,OFFSET($D$155,AH$155,0),J163,K163) ->  | AI163: =RatingChange($D163,OFFSET($D$155,AI$155,0),L163,M163) ->  | AJ163: =RatingChange(D163,OFFSET($D$155,$AJ$155,0),N163,O163) ->  | AK163: =RatingChange(D163,OFFSET($D$155,$AK$155,0),P163,Q163) ->  | AL163: =RatingChange(D163,OFFSET($D$155,$AL$155,0),R163,S163) ->  | AM163: XXX
A169: # | B169: ID | C169: Name | D169: Rating | E169: Rating | J169: Games Won/Lost against | W169: Matches | X169: Games | AC169: Rating | AD169: Bonus | AE169: Change | AF169: Rating change vs.
A170: 12 | D170: Pre | E170: Post | G170: 1 | I170: 2 | K170: 3 | M170: 4 | O170: 5 | Q170: 6 | S170: 7 | U170: 8 | W170: Won | X170: Won | AC170: Change | AD170: Points | AE170: w/Bonus | AF170: 1 | AG170: 2 | AH170: 3 | AI170: 4 | AJ170: 5 | AK170: 6 | AL170: 7 | AM170: 8
A171: 1 | B171: 1828 | C171: Khatilov, Alex | D171: 860 | E171: =IF($C171>"",MAX(ROUND(D171+AE171,0),200),"") -> 844 | F171: XXX | G171: XXX | H171: 1 | I171: 3 | J171: 3 | K171: 0 | L171: 2 | M171: 3 | N171: 3 | O171: 2 | W171: =IF($C171>"",(IF(F171=3,1,0)+IF(H171=3,1,0)+IF(J171=3,1,0)+IF(L171=3,1,0)+IF(N171=3,1,0)+IF(P171=3,1,0)+IF(R171=3,1,0)+IF(T171=3,1,0)),"") -> 2 | X171: =IF($C171>"",SUM(F171,H171,J171,L171,N171,P171,R171,T171),"") -> 9 | Y171: =IF(C171>"",IF(D171<2000,16,8),"") -> 16 | Z171: =IF($C171>"",IF($D171<2000,2,1),"") -> 2 | AA171: =IF($C171>"",IF($D171<2000,25,50),"") -> 25 | AC171: =IF($C171>"",SUM(AF171:AL171),"") -> -15.88 | AD171: =IF($C171>"",IF(AC171<=24,0,AC171-24),"") -> 0 | AE171: =IF($C171>"",AC171+AD171,"") -> -15.88 | AF171: XXX | AG171: =RatingChange(D171,OFFSET($D$170,$AG$170,0),H171,I171) -> -15.72 | AH171: =RatingChange(D171,OFFSET($D$170,AH$170,0),J171,K171) -> 13.32 | AI171: =RatingChange($D171,OFFSET($D$170,AI$170,0),L171,M171) -> -16.88 | AJ171: =RatingChange(D171,OFFSET($D$170,$AJ$170,0),N171,O171) -> 3.4 | AK171: =RatingChange(D171,OFFSET($D$170,$AK$170,0),P171,Q171) ->  | AL171: =RatingChange(D171,OFFSET($D$170,$AL$170,0),R171,S171) ->  | AM171: =RatingChange(D171,OFFSET($D$170,$AM$170,0),T171,U171) -> 
A172: 2 | B172: 1724 | C172: Lim, Gene | D172: 817 | E172: =IF($C172>"",MAX(ROUND(D172+AE172,0),200),"") -> 834 | F172: =IF($C172>"",OFFSET($E170,G170,2*$A172),"") -> 3 | G172: =IF($C172>"",OFFSET($E170,G170,2*$A172-1),"") -> 1 | H172: XXX | I172: XXX | J172: 0 | K172: 3 | L172: 3 | M172: 1 | N172: 3 | O172: 1 | W172: =IF($C172>"",(IF(F172=3,1,0)+IF(H172=3,1,0)+IF(J172=3,1,0)+IF(L172=3,1,0)+IF(N172=3,1,0)+IF(P172=3,1,0)+IF(R172=3,1,0)+IF(T172=3,1,0)),"") -> 3 | X172: =IF($C172>"",SUM(F172,H172,J172,L172,N172,P172,R172,T172),"") -> 9 | Y172: =IF(C172>"",IF(D172<2000,16,8),"") -> 16 | Z172: =IF($C172>"",IF($D172<2000,2,1),"") -> 2 | AA172: =IF($C172>"",IF($D172<2000,25,50),"") -> 25 | AC172: =IF($C172>"",SUM(AF172:AL172),"") -> 16.72 | AD172: =IF($C172>"",IF(AC172<=24,0,AC172-24),"") -> 0 | AE172: =IF($C172>"",AC172+AD172,"") -> 16.72 | AF172: =RatingChange(D172,OFFSET($D$170,AF$170,0),F172,G172) -> 15.72 | AG172: XXX | AH172: =RatingChange(D172,OFFSET($D$170,AH$170,0),J172,K172) -> -16.96 | AI172: =RatingChange($D172,OFFSET($D$170,AI$170,0),L172,M172) -> 10.84 | AJ172: =RatingChange(D172,OFFSET($D$170,$AJ$170,0),N172,O172) -> 7.12 | AK172: =RatingChange(D172,OFFSET($D$170,$AK$170,0),P172,Q172) ->  | AL172: =RatingChange(D172,OFFSET($D$170,$AL$170,0),R172,S172) ->  | AM172: =RatingChange(D172,OFFSET($D$170,$AM$170,0),T172,U172) -> 
A173: 3 | B173: 1798 | C173: Lindsay, Jim | D173: 793 | E173: =IF($C173>"",MAX(ROUND(D173+AE173,0),200),"") -> 815 | F173: =IF($C173>"",OFFSET($E170,G170,2*$A173),"") -> 0 | G173: =IF($C173>"",OFFSET($E170,G170,2*$A173-1),"") -> 3 | H173: =IF($C173>"",OFFSET($E170,I170,2*$A173),"") -> 3 | I173: =IF($C173>"",OFFSET($E170,I170,2*$A173-1),"") -> 0 | J173: XXX | K173: XXX | L173: 3 | M173: 2 | N173: 3 | O173: 1 | W173: =IF($C173>"",(IF(F173=3,1,0)+IF(H173=3,1,0)+IF(J173=3,1,0)+IF(L173=3,1,0)+IF(N173=3,1,0)+IF(P173=3,1,0)+IF(R173=3,1,0)+IF(T173=3,1,0)),"") -> 3 | X173: =IF($C173>"",SUM(F173,H173,J173,L173,N173,P173,R173,T173),"") -> 9 | Y173: =IF(C173>"",IF(D173<2000,16,8),"") -> 16 | Z173: =IF($C173>"",IF($D173<2000,2,1),"") -> 2 | AA173: =IF($C173>"",IF($D173<2000,25,50),"") -> 25 | AC173: =IF($C173>"",SUM(AF173:AL173),"") -> 21.52 | AD173: =IF($C173>"",IF(AC173<=24,0,AC173-24),"") -> 0 | AE173: =IF($C173>"",AC173+AD173,"") -> 21.52 | AF173: =RatingChange(D173,OFFSET($D$170,AF$170,0),F173,G173) -> -13.32 | AG173: =RatingChange(D173,OFFSET($D$170,$AG$170,0),H173,I173) -> 16.96 | AH173: XXX | AI173: =RatingChange($D173,OFFSET($D$170,AI$170,0),L173,M173) -> 9.8 | AJ173: =RatingChange(D173,OFFSET($D$170,$AJ$170,0),N173,O173) -> 8.08 | AK173: =RatingChange(D173,OFFSET($D$170,$AK$170,0),P173,Q173) ->  | AL173: =RatingChange(D173,OFFSET($D$170,$AL$170,0),R173,S173) ->  | AM173: =RatingChange(D173,OFFSET($D$170,$AM$170,0),T173,U173) -> 
A174: 4 | B174: 1777 | C174: Li, Ivy | D174: 738 | E174: =IF($C174>"",MAX(ROUND(D174+AE174,0),200),"") -> 734 | F174: =IF($C174>"",OFFSET($E170,G170,2*$A174),"") -> 3 | G174: =IF($C174>"",OFFSET($E170,G170,2*$A174-1),"") -> 2 | H174: =IF($C174>"",OFFSET($E170,I170,2*$A174),"") -> 1 | I174: =IF($C174>"",OFFSET($E170,I170,2*$A174-1),"") -> 3 | J174: =IF($C174>"",OFFSET($E170,K170,2*$A174),"") -> 2 | K174: =IF($C174>"",OFFSET($E170,K170,2*$A174-1),"") -> 3 | L174: XXX | M174: XXX | N174: 0 | O174: 0 | W174: =IF($C174>"",(IF(F174=3,1,0)+IF(H174=3,1,0)+IF(J174=3,1,0)+IF(L174=3,1,0)+IF(N174=3,1,0)+IF(P174=3,1,0)+IF(R174=3,1,0)+IF(T174=3,1,0)),"") -> 1 | X174: =IF($C174>"",SUM(F174,H174,J174,L174,N174,P174,R174,T174),"") -> 6 | Y174: =IF(C174>"",IF(D174<2000,16,8),"") -> 16 | Z174: =IF($C174>"",IF($D174<2000,2,1),"") -> 2 | AA174: =IF($C174>"",IF($D174<2000,25,50),"") -> 25 | AC174: =IF($C174>"",SUM(AF174:AL174),"") -> -3.76 | AD174: =IF($C174>"",IF(AC174<=24,0,AC174-24),"") -> 0 | AE174: =IF($C174>"",AC174+AD174,"") -> -3.76 | AF174: =RatingChange(D174,OFFSET($D$170,AF$170,0),F174,G174) -> 16.88 | AG174: =RatingChange(D174,OFFSET($D$170,$AG$170,0),H174,I174) -> -10.84 | AH174: =RatingChange(D174,OFFSET($D$170,AH$170,0),J174,K174) -> -9.8 | AI174: XXX | AJ174: =RatingChange(D174,OFFSET($D$170,$AJ$170,0),N174,O174) -> 0 | AK174: =RatingChange(D174,OFFSET($D$170,$AK$170,0),P174,Q174) ->  | AL174: =RatingChange(D174,OFFSET($D$170,$AL$170,0),R174,S174) ->  | AM174: =RatingChange(D174,OFFSET($D$170,$AM$170,0),T174,U174) -> 
A175: 5 | B175: 2119 | C175: Fan, Jason | D175: 645 | E175: =IF($C175>"",MAX(ROUND(D175+AE175,0),200),"") -> 626 | F175: =IF($C175>"",OFFSET($E170,G170,2*$A175),"") -> 2 | G175: =IF($C175>"",OFFSET($E170,G170,2*$A175-1),"") -> 3 | H175: =IF($C175>"",OFFSET($E170,I170,2*$A175),"") -> 1 | I175: =IF($C175>"",OFFSET($E170,I170,2*$A175-1),"") -> 3 | J175: =IF($C175>"",OFFSET($E170,K170,2*$A175),"") -> 1 | K175: =IF($C175>"",OFFSET($E170,K170,2*$A175-1),"") -> 3 | L175: =IF($C175>"",OFFSET($E170,M170,2*$A175),"") -> 0 | M175: =IF($C175>"",OFFSET($E170,M170,2*$A175-1),"") -> 0 | N175: XXX | O175: XXX | W175: =IF($C175>"",(IF(F175=3,1,0)+IF(H175=3,1,0)+IF(J175=3,1,0)+IF(L175=3,1,0)+IF(N175=3,1,0)+IF(P175=3,1,0)+IF(R175=3,1,0)+IF(T175=3,1,0)),"") -> 0 | X175: =IF($C175>"",SUM(F175,H175,J175,L175,N175,P175,R175,T175),"") -> 4 | Y175: =IF(C175>"",IF(D175<2000,16,8),"") -> 16 | Z175: =IF($C175>"",IF($D175<2000,2,1),"") -> 2 | AA175: =IF($C175>"",IF($D175<2000,25,50),"") -> 25 | AC175: =IF($C175>"",SUM(AF175:AL175),"") -> -18.6 | AD175: =IF($C175>"",IF(AC175<=24,0,AC175-24),"") -> 0 | AE175: =IF($C175>"",AC175+AD175,"") -> -18.6 | AF175: =RatingChange(D175,OFFSET($D$170,AF$170,0),F175,G175) -> -3.4 | AG175: =RatingChange(D175,OFFSET($D$170,$AG$170,0),H175,I175) -> -7.12 | AH175: =RatingChange(D175,OFFSET($D$170,AH$170,0),J175,K175) -> -8.08 | AI175: =RatingChange($D175,OFFSET($D$170,AI$170,0),L175,M175) -> 0 | AJ175: XXX | AK175: =RatingChange(D175,OFFSET($D$170,$AK$170,0),P175,Q175) ->  | AL175: =RatingChange(D175,OFFSET($D$170,$AL$170,0),R175,S175) ->  | AM175: =RatingChange(D175,OFFSET($D$170,$AM$170,0),T175,U175) -> 
A176: 6 | E176: =IF($C176>"",MAX(ROUND(D176+AE176,0),200),"") ->  | F176: =IF($C176>"",OFFSET($E170,G170,2*$A176),"") ->  | G176: =IF($C176>"",OFFSET($E170,G170,2*$A176-1),"") ->  | H176: =IF($C176>"",OFFSET($E170,I170,2*$A176),"") ->  | I176: =IF($C176>"",OFFSET($E170,I170,2*$A176-1),"") ->  | J176: =IF($C176>"",OFFSET($E170,K170,2*$A176),"") ->  | K176: =IF($C176>"",OFFSET($E170,K170,2*$A176-1),"") ->  | L176: =IF($C176>"",OFFSET($E170,M170,2*$A176),"") ->  | M176: =IF($C176>"",OFFSET($E170,M170,2*$A176-1),"") ->  | N176: =IF($C176>"",OFFSET($E170,O170,2*$A176),"") ->  | O176: =IF($C176>"",OFFSET($E170,O170,2*$A176-1),"") ->  | P176: XXX | Q176: XXX | W176: =IF($C176>"",(IF(F176=3,1,0)+IF(H176=3,1,0)+IF(J176=3,1,0)+IF(L176=3,1,0)+IF(N176=3,1,0)+IF(P176=3,1,0)+IF(R176=3,1,0)+IF(T176=3,1,0)),"") ->  | X176: =IF($C176>"",SUM(F176,H176,J176,L176,N176,P176,R176,T176),"") ->  | Y176: =IF(C176>"",IF(D176<2000,16,8),"") ->  | Z176: =IF($C176>"",IF($D176<2000,2,1),"") ->  | AA176: =IF($C176>"",IF($D176<2000,25,50),"") ->  | AC176: =IF($C176>"",SUM(AF176:AL176),"") ->  | AD176: =IF($C176>"",IF(AC176<=24,0,AC176-24),"") ->  | AE176: =IF($C176>"",AC176+AD176,"") ->  | AF176: =RatingChange(D176,OFFSET($D$170,AF$170,0),F176,G176) ->  | AG176: =RatingChange(D176,OFFSET($D$170,$AG$170,0),H176,I176) ->  | AH176: =RatingChange(D176,OFFSET($D$170,AH$170,0),J176,K176) ->  | AI176: =RatingChange($D176,OFFSET($D$170,AI$170,0),L176,M176) ->  | AJ176: =RatingChange(D176,OFFSET($D$170,$AJ$170,0),N176,O176) ->  | AK176: XXX | AL176: =RatingChange(D176,OFFSET($D$170,$AL$170,0),R176,S176) ->  | AM176: =RatingChange(D176,OFFSET($D$170,$AM$170,0),T176,U176) -> 
A177: 7 | E177: =IF($C177>"",MAX(ROUND(D177+AE177,0),200),"") ->  | F177: =IF($C177>"",OFFSET($E170,G170,2*$A177),"") ->  | G177: =IF($C177>"",OFFSET($E170,G170,2*$A177-1),"") ->  | H177: =IF($C177>"",OFFSET($E170,I170,2*$A177),"") ->  | I177: =IF($C177>"",OFFSET($E170,I170,2*$A177-1),"") ->  | J177: =IF($C177>"",OFFSET($E170,K170,2*$A177),"") ->  | K177: =IF($C177>"",OFFSET($E170,K170,2*$A177-1),"") ->  | L177: =IF($C177>"",OFFSET($E170,M170,2*$A177),"") ->  | M177: =IF($C177>"",OFFSET($E170,M170,2*$A177-1),"") ->  | N177: =IF($C177>"",OFFSET($E170,O170,2*$A177),"") ->  | O177: =IF($C177>"",OFFSET($E170,O170,2*$A177-1),"") ->  | P177: =IF($C177>"",OFFSET($E170,Q170,2*$A177),"") ->  | Q177: =IF($C177>"",OFFSET($E170,Q170,2*$A177-1),"") ->  | R177: XXX | S177: XXX | W177: =IF($C177>"",(IF(F177=3,1,0)+IF(H177=3,1,0)+IF(J177=3,1,0)+IF(L177=3,1,0)+IF(N177=3,1,0)+IF(P177=3,1,0)+IF(R177=3,1,0)+IF(T177=3,1,0)),"") ->  | X177: =IF($C177>"",SUM(F177,H177,J177,L177,N177,P177,R177,T177),"") ->  | Y177: =IF(C177>"",IF(D177<2000,16,8),"") ->  | Z177: =IF($C177>"",IF($D177<2000,2,1),"") ->  | AA177: =IF($C177>"",IF($D177<2000,25,50),"") ->  | AC177: =IF($C177>"",SUM(AF177:AL177),"") ->  | AD177: =IF($C177>"",IF(AC177<=24,0,AC177-24),"") ->  | AE177: =IF($C177>"",AC177+AD177,"") ->  | AF177: =RatingChange(D177,OFFSET($D$170,AF$170,0),F177,G177) ->  | AG177: =RatingChange(D177,OFFSET($D$170,$AG$170,0),H177,I177) ->  | AH177: =RatingChange(D177,OFFSET($D$170,AH$170,0),J177,K177) ->  | AI177: =RatingChange($D177,OFFSET($D$170,AI$170,0),L177,M177) ->  | AJ177: =RatingChange(D177,OFFSET($D$170,$AJ$170,0),N177,O177) ->  | AK177: =RatingChange(D177,OFFSET($D$170,$AK$170,0),P177,Q177) ->  | AL177: XXX | AM177: =RatingChange(D177,OFFSET($D$170,$AM$170,0),T177,U177) -> 
A178: 8 | E178: =IF($C178>"",MAX(ROUND(D178+AE178,0),200),"") ->  | F178: =IF($C178>"",OFFSET($E170,G170,2*$A178),"") ->  | G178: =IF($C178>"",OFFSET($E170,G170,2*$A178-1),"") ->  | H178: =IF($C178>"",OFFSET($E170,I170,2*$A178),"") ->  | I178: =IF($C178>"",OFFSET($E170,I170,2*$A178-1),"") ->  | J178: =IF($C178>"",OFFSET($E170,K170,2*$A178),"") ->  | K178: =IF($C178>"",OFFSET($E170,K170,2*$A178-1),"") ->  | L178: =IF($C178>"",OFFSET($E170,M170,2*$A178),"") ->  | M178: =IF($C178>"",OFFSET($E170,M170,2*$A178-1),"") ->  | N178: =IF($C178>"",OFFSET($E170,O170,2*$A178),"") ->  | O178: =IF($C178>"",OFFSET($E170,O170,2*$A178-1),"") ->  | P178: =IF($C178>"",OFFSET($E170,Q170,2*$A178),"") ->  | Q178: =IF($C178>"",OFFSET($E170,Q170,2*$A178-1),"") ->  | R178: =IF($C178>"",OFFSET($E170,S170,2*$A178),"") ->  | S178: =IF($C178>"",OFFSET($E170,S170,2*$A178-1),"") ->  | T178: XXX | U178: XXX | W178: =IF($C178>"",(IF(F178=3,1,0)+IF(H178=3,1,0)+IF(J178=3,1,0)+IF(L178=3,1,0)+IF(N178=3,1,0)+IF(P178=3,1,0)+IF(R178=3,1,0)+IF(T178=3,1,0)),"") ->  | X178: =IF($C178>"",SUM(F178,H178,J178,L178,N178,P178,R178,T178),"") ->  | Y178: =IF(C178>"",IF(D178<2000,16,8),"") ->  | Z178: =IF($C178>"",IF($D178<2000,2,1),"") ->  | AA178: =IF($C178>"",IF($D178<2000,25,50),"") ->  | AC178: =IF($C178>"",SUM(AF178:AL178),"") ->  | AD178: =IF($C178>"",IF(AC178<=24,0,AC178-24),"") ->  | AE178: =IF($C178>"",AC178+AD178,"") ->  | AF178: =RatingChange(D178,OFFSET($D$170,AF$170,0),F178,G178) ->  | AG178: =RatingChange(D178,OFFSET($D$170,$AG$170,0),H178,I178) ->  | AH178: =RatingChange(D178,OFFSET($D$170,AH$170,0),J178,K178) ->  | AI178: =RatingChange($D178,OFFSET($D$170,AI$170,0),L178,M178) ->  | AJ178: =RatingChange(D178,OFFSET($D$170,$AJ$170,0),N178,O178) ->  | AK178: =RatingChange(D178,OFFSET($D$170,$AK$170,0),P178,Q178) ->  | AL178: =RatingChange(D178,OFFSET($D$170,$AL$170,0),R178,S178) ->  | AM178: XXX
A184: # | B184: ID | C184: Name | D184: Rating | E184: Rating | J184: Games Won/Lost against | W184: Matches | X184: Games | AC184: Rating | AD184: Bonus | AE184: Change | AF184: Rating change vs.
A185: 13 | D185: Pre | E185: Post | G185: 1 | I185: 2 | K185: 3 | M185: 4 | O185: 5 | Q185: 6 | S185: 7 | U185: 8 | W185: Won | X185: Won | AC185: Change | AD185: Points | AE185: w/Bonus | AF185: 1 | AG185: 2 | AH185: 3 | AI185: 4 | AJ185: 5 | AK185: 6 | AL185: 7 | AM185: 8
A186: 1 | B186: 1408 | C186: Wang, Tony | D186: 616 | E186: =IF($C186>"",MAX(ROUND(D186+AE186,0),200),"") -> 650 | F186: XXX | G186: XXX | H186: 3 | I186: 1 | J186: 3 | K186: 1 | L186: 3 | M186: 1 | N186: 3 | O186: 0 | W186: =IF($C186>"",(IF(F186=3,1,0)+IF(H186=3,1,0)+IF(J186=3,1,0)+IF(L186=3,1,0)+IF(N186=3,1,0)+IF(P186=3,1,0)+IF(R186=3,1,0)+IF(T186=3,1,0)),"") -> 4 | X186: =IF($C186>"",SUM(F186,H186,J186,L186,N186,P186,R186,T186),"") -> 12 | Y186: =IF(C186>"",IF(D186<2000,16,8),"") -> 16 | Z186: =IF($C186>"",IF($D186<2000,2,1),"") -> 2 | AA186: =IF($C186>"",IF($D186<2000,25,50),"") -> 25 | AC186: =IF($C186>"",SUM(AF186:AL186),"") -> 28.76 | AD186: =IF($C186>"",IF(AC186<=24,0,AC186-24),"") -> 4.76 | AE186: =IF($C186>"",AC186+AD186,"") -> 33.52 | AF186: XXX | AG186: =RatingChange(D186,OFFSET($D$185,$AG$185,0),H186,I186) -> 8.16 | AH186: =RatingChange(D186,OFFSET($D$185,AH$185,0),J186,K186) -> 7.92 | AI186: =RatingChange($D186,OFFSET($D$185,AI$185,0),L186,M186) -> 6.2 | AJ186: =RatingChange(D186,OFFSET($D$185,$AJ$185,0),N186,O186) -> 6.48 | AK186: =RatingChange(D186,OFFSET($D$185,$AK$185,0),P186,Q186) ->  | AL186: =RatingChange(D186,OFFSET($D$185,$AL$185,0),R186,S186) ->  | AM186: =RatingChange(D186,OFFSET($D$185,$AM$185,0),T186,U186) -> 
A187: 2 | B187: 2092 | C187: Snyder, Rich | D187: 470 | E187: =IF($C187>"",MAX(ROUND(D187+AE187,0),200),"") -> 470 | F187: =IF($C187>"",OFFSET($E185,G185,2*$A187),"") -> 1 | G187: =IF($C187>"",OFFSET($E185,G185,2*$A187-1),"") -> 3 | H187: XXX | I187: XXX | J187: 0 | K187: 3 | L187: 3 | M187: 1 | N187: 3 | O187: 0 | W187: =IF($C187>"",(IF(F187=3,1,0)+IF(H187=3,1,0)+IF(J187=3,1,0)+IF(L187=3,1,0)+IF(N187=3,1,0)+IF(P187=3,1,0)+IF(R187=3,1,0)+IF(T187=3,1,0)),"") -> 2 | X187: =IF($C187>"",SUM(F187,H187,J187,L187,N187,P187,R187,T187),"") -> 7 | Y187: =IF(C187>"",IF(D187<2000,16,8),"") -> 16 | Z187: =IF($C187>"",IF($D187<2000,2,1),"") -> 2 | AA187: =IF($C187>"",IF($D187<2000,25,50),"") -> 25 | AC187: =IF($C187>"",SUM(AF187:AL187),"") -> -3.9999999999999147E-2 | AD187: =IF($C187>"",IF(AC187<=24,0,AC187-24),"") -> 0 | AE187: =IF($C187>"",AC187+AD187,"") -> -3.9999999999999147E-2 | AF187: =RatingChange(D187,OFFSET($D$185,AF$185,0),F187,G187) -> -8.16 | AG187: XXX | AH187: =RatingChange(D187,OFFSET($D$185,AH$185,0),J187,K187) -> -16.24 | AI187: =RatingChange($D187,OFFSET($D$185,AI$185,0),L187,M187) -> 12.04 | AJ187: =RatingChange(D187,OFFSET($D$185,$AJ$185,0),N187,O187) -> 12.32 | AK187: =RatingChange(D187,OFFSET($D$185,$AK$185,0),P187,Q187) ->  | AL187: =RatingChange(D187,OFFSET($D$185,$AL$185,0),R187,S187) ->  | AM187: =RatingChange(D187,OFFSET($D$185,$AM$185,0),T187,U187) -> 
A188: 3 | B188: 1197 | C188: Yuen, Michael | D188: 464 | E188: =IF($C188>"",MAX(ROUND(D188+AE188,0),200),"") -> 441 | F188: =IF($C188>"",OFFSET($E185,G185,2*$A188),"") -> 1 | G188: =IF($C188>"",OFFSET($E185,G185,2*$A188-1),"") -> 3 | H188: =IF($C188>"",OFFSET($E185,I185,2*$A188),"") -> 3 | I188: =IF($C188>"",OFFSET($E185,I185,2*$A188-1),"") -> 0 | J188: XXX | K188: XXX | L188: 2 | M188: 3 | N188: 1 | O188: 3 | W188: =IF($C188>"",(IF(F188=3,1,0)+IF(H188=3,1,0)+IF(J188=3,1,0)+IF(L188=3,1,0)+IF(N188=3,1,0)+IF(P188=3,1,0)+IF(R188=3,1,0)+IF(T188=3,1,0)),"") -> 1 | X188: =IF($C188>"",SUM(F188,H188,J188,L188,N188,P188,R188,T188),"") -> 7 | Y188: =IF(C188>"",IF(D188<2000,16,8),"") -> 16 | Z188: =IF($C188>"",IF($D188<2000,2,1),"") -> 2 | AA188: =IF($C188>"",IF($D188<2000,25,50),"") -> 25 | AC188: =IF($C188>"",SUM(AF188:AL188),"") -> -22.84 | AD188: =IF($C188>"",IF(AC188<=24,0,AC188-24),"") -> 0 | AE188: =IF($C188>"",AC188+AD188,"") -> -22.84 | AF188: =RatingChange(D188,OFFSET($D$185,AF$185,0),F188,G188) -> -7.92 | AG188: =RatingChange(D188,OFFSET($D$185,$AG$185,0),H188,I188) -> 16.24 | AH188: XXX | AI188: =RatingChange($D188,OFFSET($D$185,AI$185,0),L188,M188) -> -13.72 | AJ188: =RatingChange(D188,OFFSET($D$185,$AJ$185,0),N188,O188) -> -17.44 | AK188: =RatingChange(D188,OFFSET($D$185,$AK$185,0),P188,Q188) ->  | AL188: =RatingChange(D188,OFFSET($D$185,$AL$185,0),R188,S188) ->  | AM188: =RatingChange(D188,OFFSET($D$185,$AM$185,0),T188,U188) -> 
A189: 4 | B189: 1981 | C189: Leung, Leo | D189: 421 | E189: =IF($C189>"",MAX(ROUND(D189+AE189,0),200),"") -> 431 | F189: =IF($C189>"",OFFSET($E185,G185,2*$A189),"") -> 1 | G189: =IF($C189>"",OFFSET($E185,G185,2*$A189-1),"") -> 3 | H189: =IF($C189>"",OFFSET($E185,I185,2*$A189),"") -> 1 | I189: =IF($C189>"",OFFSET($E185,I185,2*$A189-1),"") -> 3 | J189: =IF($C189>"",OFFSET($E185,K185,2*$A189),"") -> 3 | K189: =IF($C189>"",OFFSET($E185,K185,2*$A189-1),"") -> 2 | L189: XXX | M189: XXX | N189: 3 | O189: 0 | W189: =IF($C189>"",(IF(F189=3,1,0)+IF(H189=3,1,0)+IF(J189=3,1,0)+IF(L189=3,1,0)+IF(N189=3,1,0)+IF(P189=3,1,0)+IF(R189=3,1,0)+IF(T189=3,1,0)),"") -> 2 | X189: =IF($C189>"",SUM(F189,H189,J189,L189,N189,P189,R189,T189),"") -> 8 | Y189: =IF(C189>"",IF(D189<2000,16,8),"") -> 16 | Z189: =IF($C189>"",IF($D189<2000,2,1),"") -> 2 | AA189: =IF($C189>"",IF($D189<2000,25,50),"") -> 25 | AC189: =IF($C189>"",SUM(AF189:AL189),"") -> 9.76 | AD189: =IF($C189>"",IF(AC189<=24,0,AC189-24),"") -> 0 | AE189: =IF($C189>"",AC189+AD189,"") -> 9.76 | AF189: =RatingChange(D189,OFFSET($D$185,AF$185,0),F189,G189) -> -6.2 | AG189: =RatingChange(D189,OFFSET($D$185,$AG$185,0),H189,I189) -> -12.04 | AH189: =RatingChange(D189,OFFSET($D$185,AH$185,0),J189,K189) -> 13.72 | AI189: XXX | AJ189: =RatingChange(D189,OFFSET($D$185,$AJ$185,0),N189,O189) -> 14.28 | AK189: =RatingChange(D189,OFFSET($D$185,$AK$185,0),P189,Q189) ->  | AL189: =RatingChange(D189,OFFSET($D$185,$AL$185,0),R189,S189) ->  | AM189: =RatingChange(D189,OFFSET($D$185,$AM$185,0),T189,U189) -> 
A190: 5 | B190: 1576 | C190: Iseyama, Aiko | D190: 378 | E190: =IF($C190>"",MAX(ROUND(D190+AE190,0),200),"") -> 362 | F190: =IF($C190>"",OFFSET($E185,G185,2*$A190),"") -> 0 | G190: =IF($C190>"",OFFSET($E185,G185,2*$A190-1),"") -> 3 | H190: =IF($C190>"",OFFSET($E185,I185,2*$A190),"") -> 0 | I190: =IF($C190>"",OFFSET($E185,I185,2*$A190-1),"") -> 3 | J190: =IF($C190>"",OFFSET($E185,K185,2*$A190),"") -> 3 | K190: =IF($C190>"",OFFSET($E185,K185,2*$A190-1),"") -> 1 | L190: =IF($C190>"",OFFSET($E185,M185,2*$A190),"") -> 0 | M190: =IF($C190>"",OFFSET($E185,M185,2*$A190-1),"") -> 3 | N190: XXX | O190: XXX | W190: =IF($C190>"",(IF(F190=3,1,0)+IF(H190=3,1,0)+IF(J190=3,1,0)+IF(L190=3,1,0)+IF(N190=3,1,0)+IF(P190=3,1,0)+IF(R190=3,1,0)+IF(T190=3,1,0)),"") -> 1 | X190: =IF($C190>"",SUM(F190,H190,J190,L190,N190,P190,R190,T190),"") -> 3 | Y190: =IF(C190>"",IF(D190<2000,16,8),"") -> 16 | Z190: =IF($C190>"",IF($D190<2000,2,1),"") -> 2 | AA190: =IF($C190>"",IF($D190<2000,25,50),"") -> 25 | AC190: =IF($C190>"",SUM(AF190:AL190),"") -> -15.64 | AD190: =IF($C190>"",IF(AC190<=24,0,AC190-24),"") -> 0 | AE190: =IF($C190>"",AC190+AD190,"") -> -15.64 | AF190: =RatingChange(D190,OFFSET($D$185,AF$185,0),F190,G190) -> -6.48 | AG190: =RatingChange(D190,OFFSET($D$185,$AG$185,0),H190,I190) -> -12.32 | AH190: =RatingChange(D190,OFFSET($D$185,AH$185,0),J190,K190) -> 17.44 | AI190: =RatingChange($D190,OFFSET($D$185,AI$185,0),L190,M190) -> -14.28 | AJ190: XXX | AK190: =RatingChange(D190,OFFSET($D$185,$AK$185,0),P190,Q190) ->  | AL190: =RatingChange(D190,OFFSET($D$185,$AL$185,0),R190,S190) ->  | AM190: =RatingChange(D190,OFFSET($D$185,$AM$185,0),T190,U190) -> 
A191: 6 | E191: =IF($C191>"",MAX(ROUND(D191+AE191,0),200),"") ->  | F191: =IF($C191>"",OFFSET($E185,G185,2*$A191),"") ->  | G191: =IF($C191>"",OFFSET($E185,G185,2*$A191-1),"") ->  | H191: =IF($C191>"",OFFSET($E185,I185,2*$A191),"") ->  | I191: =IF($C191>"",OFFSET($E185,I185,2*$A191-1),"") ->  | J191: =IF($C191>"",OFFSET($E185,K185,2*$A191),"") ->  | K191: =IF($C191>"",OFFSET($E185,K185,2*$A191-1),"") ->  | L191: =IF($C191>"",OFFSET($E185,M185,2*$A191),"") ->  | M191: =IF($C191>"",OFFSET($E185,M185,2*$A191-1),"") ->  | N191: =IF($C191>"",OFFSET($E185,O185,2*$A191),"") ->  | O191: =IF($C191>"",OFFSET($E185,O185,2*$A191-1),"") ->  | P191: XXX | Q191: XXX | W191: =IF($C191>"",(IF(F191=3,1,0)+IF(H191=3,1,0)+IF(J191=3,1,0)+IF(L191=3,1,0)+IF(N191=3,1,0)+IF(P191=3,1,0)+IF(R191=3,1,0)+IF(T191=3,1,0)),"") ->  | X191: =IF($C191>"",SUM(F191,H191,J191,L191,N191,P191,R191,T191),"") ->  | Y191: =IF(C191>"",IF(D191<2000,16,8),"") ->  | Z191: =IF($C191>"",IF($D191<2000,2,1),"") ->  | AA191: =IF($C191>"",IF($D191<2000,25,50),"") ->  | AC191: =IF($C191>"",SUM(AF191:AL191),"") ->  | AD191: =IF($C191>"",IF(AC191<=24,0,AC191-24),"") ->  | AE191: =IF($C191>"",AC191+AD191,"") ->  | AF191: =RatingChange(D191,OFFSET($D$185,AF$185,0),F191,G191) ->  | AG191: =RatingChange(D191,OFFSET($D$185,$AG$185,0),H191,I191) ->  | AH191: =RatingChange(D191,OFFSET($D$185,AH$185,0),J191,K191) ->  | AI191: =RatingChange($D191,OFFSET($D$185,AI$185,0),L191,M191) ->  | AJ191: =RatingChange(D191,OFFSET($D$185,$AJ$185,0),N191,O191) ->  | AK191: XXX | AL191: =RatingChange(D191,OFFSET($D$185,$AL$185,0),R191,S191) ->  | AM191: =RatingChange(D191,OFFSET($D$185,$AM$185,0),T191,U191) -> 
A192: 7 | E192: =IF($C192>"",MAX(ROUND(D192+AE192,0),200),"") ->  | F192: =IF($C192>"",OFFSET($E185,G185,2*$A192),"") ->  | G192: =IF($C192>"",OFFSET($E185,G185,2*$A192-1),"") ->  | H192: =IF($C192>"",OFFSET($E185,I185,2*$A192),"") ->  | I192: =IF($C192>"",OFFSET($E185,I185,2*$A192-1),"") ->  | J192: =IF($C192>"",OFFSET($E185,K185,2*$A192),"") ->  | K192: =IF($C192>"",OFFSET($E185,K185,2*$A192-1),"") ->  | L192: =IF($C192>"",OFFSET($E185,M185,2*$A192),"") ->  | M192: =IF($C192>"",OFFSET($E185,M185,2*$A192-1),"") ->  | N192: =IF($C192>"",OFFSET($E185,O185,2*$A192),"") ->  | O192: =IF($C192>"",OFFSET($E185,O185,2*$A192-1),"") ->  | P192: =IF($C192>"",OFFSET($E185,Q185,2*$A192),"") ->  | Q192: =IF($C192>"",OFFSET($E185,Q185,2*$A192-1),"") ->  | R192: XXX | S192: XXX | W192: =IF($C192>"",(IF(F192=3,1,0)+IF(H192=3,1,0)+IF(J192=3,1,0)+IF(L192=3,1,0)+IF(N192=3,1,0)+IF(P192=3,1,0)+IF(R192=3,1,0)+IF(T192=3,1,0)),"") ->  | X192: =IF($C192>"",SUM(F192,H192,J192,L192,N192,P192,R192,T192),"") ->  | Y192: =IF(C192>"",IF(D192<2000,16,8),"") ->  | Z192: =IF($C192>"",IF($D192<2000,2,1),"") ->  | AA192: =IF($C192>"",IF($D192<2000,25,50),"") ->  | AC192: =IF($C192>"",SUM(AF192:AL192),"") ->  | AD192: =IF($C192>"",IF(AC192<=24,0,AC192-24),"") ->  | AE192: =IF($C192>"",AC192+AD192,"") ->  | AF192: =RatingChange(D192,OFFSET($D$185,AF$185,0),F192,G192) ->  | AG192: =RatingChange(D192,OFFSET($D$185,$AG$185,0),H192,I192) ->  | AH192: =RatingChange(D192,OFFSET($D$185,AH$185,0),J192,K192) ->  | AI192: =RatingChange($D192,OFFSET($D$185,AI$185,0),L192,M192) ->  | AJ192: =RatingChange(D192,OFFSET($D$185,$AJ$185,0),N192,O192) ->  | AK192: =RatingChange(D192,OFFSET($D$185,$AK$185,0),P192,Q192) ->  | AL192: XXX | AM192: =RatingChange(D192,OFFSET($D$185,$AM$185,0),T192,U192) -> 
A193: 8 | E193: =IF($C193>"",MAX(ROUND(D193+AE193,0),200),"") ->  | F193: =IF($C193>"",OFFSET($E185,G185,2*$A193),"") ->  | G193: =IF($C193>"",OFFSET($E185,G185,2*$A193-1),"") ->  | H193: =IF($C193>"",OFFSET($E185,I185,2*$A193),"") ->  | I193: =IF($C193>"",OFFSET($E185,I185,2*$A193-1),"") ->  | J193: =IF($C193>"",OFFSET($E185,K185,2*$A193),"") ->  | K193: =IF($C193>"",OFFSET($E185,K185,2*$A193-1),"") ->  | L193: =IF($C193>"",OFFSET($E185,M185,2*$A193),"") ->  | M193: =IF($C193>"",OFFSET($E185,M185,2*$A193-1),"") ->  | N193: =IF($C193>"",OFFSET($E185,O185,2*$A193),"") ->  | O193: =IF($C193>"",OFFSET($E185,O185,2*$A193-1),"") ->  | P193: =IF($C193>"",OFFSET($E185,Q185,2*$A193),"") ->  | Q193: =IF($C193>"",OFFSET($E185,Q185,2*$A193-1),"") ->  | R193: =IF($C193>"",OFFSET($E185,S185,2*$A193),"") ->  | S193: =IF($C193>"",OFFSET($E185,S185,2*$A193-1),"") ->  | T193: XXX | U193: XXX | W193: =IF($C193>"",(IF(F193=3,1,0)+IF(H193=3,1,0)+IF(J193=3,1,0)+IF(L193=3,1,0)+IF(N193=3,1,0)+IF(P193=3,1,0)+IF(R193=3,1,0)+IF(T193=3,1,0)),"") ->  | X193: =IF($C193>"",SUM(F193,H193,J193,L193,N193,P193,R193,T193),"") ->  | Y193: =IF(C193>"",IF(D193<2000,16,8),"") ->  | Z193: =IF($C193>"",IF($D193<2000,2,1),"") ->  | AA193: =IF($C193>"",IF($D193<2000,25,50),"") ->  | AC193: =IF($C193>"",SUM(AF193:AL193),"") ->  | AD193: =IF($C193>"",IF(AC193<=24,0,AC193-24),"") ->  | AE193: =IF($C193>"",AC193+AD193,"") ->  | AF193: =RatingChange(D193,OFFSET($D$185,AF$185,0),F193,G193) ->  | AG193: =RatingChange(D193,OFFSET($D$185,$AG$185,0),H193,I193) ->  | AH193: =RatingChange(D193,OFFSET($D$185,AH$185,0),J193,K193) ->  | AI193: =RatingChange($D193,OFFSET($D$185,AI$185,0),L193,M193) ->  | AJ193: =RatingChange(D193,OFFSET($D$185,$AJ$185,0),N193,O193) ->  | AK193: =RatingChange(D193,OFFSET($D$185,$AK$185,0),P193,Q193) ->  | AL193: =RatingChange(D193,OFFSET($D$185,$AL$185,0),R193,S193) ->  | AM193: XXX
A199: # | B199: ID | C199: Name | D199: Rating | E199: Rating | J199: Games Won/Lost against | W199: Matches | X199: Games | AC199: Rating | AD199: Bonus | AE199: Change | AF199: Rating change vs.
A200: 14 | D200: Pre | E200: Post | G200: 1 | I200: 2 | K200: 3 | M200: 4 | O200: 5 | Q200: 6 | S200: 7 | U200: 8 | W200: Won | X200: Won | AC200: Change | AD200: Points | AE200: w/Bonus | AF200: 1 | AG200: 2 | AH200: 3 | AI200: 4 | AJ200: 5 | AK200: 6 | AL200: 7 | AM200: 8
A201: 1 | B201: 2010 | C201: Marcus, Lev | D201: 368 | E201: =IF($C201>"",MAX(ROUND(D201+AE201,0),200),"") -> 381 | F201: XXX | G201: XXX | H201: 2 | I201: 3 | J201: 3 | K201: 1 | L201: 3 | M201: 2 | N201: 3 | O201: 0 | W201: =IF($C201>"",(IF(F201=3,1,0)+IF(H201=3,1,0)+IF(J201=3,1,0)+IF(L201=3,1,0)+IF(N201=3,1,0)+IF(P201=3,1,0)+IF(R201=3,1,0)+IF(T201=3,1,0)),"") -> 3 | X201: =IF($C201>"",SUM(F201,H201,J201,L201,N201,P201,R201,T201),"") -> 11 | Y201: =IF(C201>"",IF(D201<2000,16,8),"") -> 16 | Z201: =IF($C201>"",IF($D201<2000,2,1),"") -> 2 | AA201: =IF($C201>"",IF($D201<2000,25,50),"") -> 25 | AC201: =IF($C201>"",SUM(AF201:AL201),"") -> 13.48 | AD201: =IF($C201>"",IF(AC201<=24,0,AC201-24),"") -> 0 | AE201: =IF($C201>"",AC201+AD201,"") -> 13.48 | AF201: XXX | AG201: =RatingChange(D201,OFFSET($D$200,$AG$200,0),H201,I201) -> -12.48 | AH201: =RatingChange(D201,OFFSET($D$200,AH$200,0),J201,K201) -> 11.24 | AI201: =RatingChange($D201,OFFSET($D$200,AI$200,0),L201,M201) -> 5.44 | AJ201: =RatingChange(D201,OFFSET($D$200,$AJ$200,0),N201,O201) -> 9.28 | AK201: =RatingChange(D201,OFFSET($D$200,$AK$200,0),P201,Q201) ->  | AL201: =RatingChange(D201,OFFSET($D$200,$AL$200,0),R201,S201) ->  | AM201: =RatingChange(D201,OFFSET($D$200,$AM$200,0),T201,U201) -> 
A202: 2 | B202: 1397 | C202: Lin, Grace | D202: 356 | E202: =IF($C202>"",MAX(ROUND(D202+AE202,0),200),"") -> 368 | F202: =IF($C202>"",OFFSET($E200,G200,2*$A202),"") -> 3 | G202: =IF($C202>"",OFFSET($E200,G200,2*$A202-1),"") -> 2 | H202: XXX | I202: XXX | J202: 0 | K202: 3 | L202: 3 | M202: 1 | N202: 3 | O202: 0 | W202: =IF($C202>"",(IF(F202=3,1,0)+IF(H202=3,1,0)+IF(J202=3,1,0)+IF(L202=3,1,0)+IF(N202=3,1,0)+IF(P202=3,1,0)+IF(R202=3,1,0)+IF(T202=3,1,0)),"") -> 3 | X202: =IF($C202>"",SUM(F202,H202,J202,L202,N202,P202,R202,T202),"") -> 9 | Y202: =IF(C202>"",IF(D202<2000,16,8),"") -> 16 | Z202: =IF($C202>"",IF($D202<2000,2,1),"") -> 2 | AA202: =IF($C202>"",IF($D202<2000,25,50),"") -> 25 | AC202: =IF($C202>"",SUM(AF202:AL202),"") -> 11.88 | AD202: =IF($C202>"",IF(AC202<=24,0,AC202-24),"") -> 0 | AE202: =IF($C202>"",AC202+AD202,"") -> 11.88 | AF202: =RatingChange(D202,OFFSET($D$200,AF$200,0),F202,G202) -> 12.48 | AG202: XXX | AH202: =RatingChange(D202,OFFSET($D$200,AH$200,0),J202,K202) -> -18.28 | AI202: =RatingChange($D202,OFFSET($D$200,AI$200,0),L202,M202) -> 7.92 | AJ202: =RatingChange(D202,OFFSET($D$200,$AJ$200,0),N202,O202) -> 9.76 | AK202: =RatingChange(D202,OFFSET($D$200,$AK$200,0),P202,Q202) ->  | AL202: =RatingChange(D202,OFFSET($D$200,$AL$200,0),R202,S202) ->  | AM202: =RatingChange(D202,OFFSET($D$200,$AM$200,0),T202,U202) -> 
A203: 3 | B203: 2090 | C203: Fong, Scott | D203: 299 | E203: =IF($C203>"",MAX(ROUND(D203+AE203,0),200),"") -> 334 | F203: =IF($C203>"",OFFSET($E200,G200,2*$A203),"") -> 1 | G203: =IF($C203>"",OFFSET($E200,G200,2*$A203-1),"") -> 3 | H203: =IF($C203>"",OFFSET($E200,I200,2*$A203),"") -> 3 | I203: =IF($C203>"",OFFSET($E200,I200,2*$A203-1),"") -> 0 | J203: XXX | K203: XXX | L203: 3 | M203: 0 | N203: 3 | O203: 1 | W203: =IF($C203>"",(IF(F203=3,1,0)+IF(H203=3,1,0)+IF(J203=3,1,0)+IF(L203=3,1,0)+IF(N203=3,1,0)+IF(P203=3,1,0)+IF(R203=3,1,0)+IF(T203=3,1,0)),"") -> 3 | X203: =IF($C203>"",SUM(F203,H203,J203,L203,N203,P203,R203,T203),"") -> 10 | Y203: =IF(C203>"",IF(D203<2000,16,8),"") -> 16 | Z203: =IF($C203>"",IF($D203<2000,2,1),"") -> 2 | AA203: =IF($C203>"",IF($D203<2000,25,50),"") -> 25 | AC203: =IF($C203>"",SUM(AF203:AL203),"") -> 29.28 | AD203: =IF($C203>"",IF(AC203<=24,0,AC203-24),"") -> 5.28 | AE203: =IF($C203>"",AC203+AD203,"") -> 34.56 | AF203: =RatingChange(D203,OFFSET($D$200,AF$200,0),F203,G203) -> -11.24 | AG203: =RatingChange(D203,OFFSET($D$200,$AG$200,0),H203,I203) -> 18.28 | AH203: XXX | AI203: =RatingChange($D203,OFFSET($D$200,AI$200,0),L203,M203) -> 12.2 | AJ203: =RatingChange(D203,OFFSET($D$200,$AJ$200,0),N203,O203) -> 10.04 | AK203: =RatingChange(D203,OFFSET($D$200,$AK$200,0),P203,Q203) ->  | AL203: =RatingChange(D203,OFFSET($D$200,$AL$200,0),R203,S203) ->  | AM203: =RatingChange(D203,OFFSET($D$200,$AM$200,0),T203,U203) -> 
A204: 4 | B204: 2114 | C204: Spindler, Eva | D204: 204 | E204: =IF($C204>"",MAX(ROUND(D204+AE204,0),200),"") -> 200 | F204: =IF($C204>"",OFFSET($E200,G200,2*$A204),"") -> 2 | G204: =IF($C204>"",OFFSET($E200,G200,2*$A204-1),"") -> 3 | H204: =IF($C204>"",OFFSET($E200,I200,2*$A204),"") -> 1 | I204: =IF($C204>"",OFFSET($E200,I200,2*$A204-1),"") -> 3 | J204: =IF($C204>"",OFFSET($E200,K200,2*$A204),"") -> 0 | K204: =IF($C204>"",OFFSET($E200,K200,2*$A204-1),"") -> 3 | L204: XXX | M204: XXX | N204: 0 | O204: 0 | W204: =IF($C204>"",(IF(F204=3,1,0)+IF(H204=3,1,0)+IF(J204=3,1,0)+IF(L204=3,1,0)+IF(N204=3,1,0)+IF(P204=3,1,0)+IF(R204=3,1,0)+IF(T204=3,1,0)),"") -> 0 | X204: =IF($C204>"",SUM(F204,H204,J204,L204,N204,P204,R204,T204),"") -> 3 | Y204: =IF(C204>"",IF(D204<2000,16,8),"") -> 16 | Z204: =IF($C204>"",IF($D204<2000,2,1),"") -> 2 | AA204: =IF($C204>"",IF($D204<2000,25,50),"") -> 25 | AC204: =IF($C204>"",SUM(AF204:AL204),"") -> -25.56 | AD204: =IF($C204>"",IF(AC204<=24,0,AC204-24),"") -> 0 | AE204: =IF($C204>"",AC204+AD204,"") -> -25.56 | AF204: =RatingChange(D204,OFFSET($D$200,AF$200,0),F204,G204) -> -5.44 | AG204: =RatingChange(D204,OFFSET($D$200,$AG$200,0),H204,I204) -> -7.92 | AH204: =RatingChange(D204,OFFSET($D$200,AH$200,0),J204,K204) -> -12.2 | AI204: XXX | AJ204: =RatingChange(D204,OFFSET($D$200,$AJ$200,0),N204,O204) -> 0 | AK204: =RatingChange(D204,OFFSET($D$200,$AK$200,0),P204,Q204) ->  | AL204: =RatingChange(D204,OFFSET($D$200,$AL$200,0),R204,S204) ->  | AM204: =RatingChange(D204,OFFSET($D$200,$AM$200,0),T204,U204) -> 
A205: 5 | B205: 2138 | C205: Spindler, Lilana | D205: 200 | E205: =IF($C205>"",MAX(ROUND(D205+AE205,0),200),"") -> 200 | F205: =IF($C205>"",OFFSET($E200,G200,2*$A205),"") -> 0 | G205: =IF($C205>"",OFFSET($E200,G200,2*$A205-1),"") -> 3 | H205: =IF($C205>"",OFFSET($E200,I200,2*$A205),"") -> 0 | I205: =IF($C205>"",OFFSET($E200,I200,2*$A205-1),"") -> 3 | J205: =IF($C205>"",OFFSET($E200,K200,2*$A205),"") -> 1 | K205: =IF($C205>"",OFFSET($E200,K200,2*$A205-1),"") -> 3 | L205: =IF($C205>"",OFFSET($E200,M200,2*$A205),"") -> 0 | M205: =IF($C205>"",OFFSET($E200,M200,2*$A205-1),"") -> 0 | N205: XXX | O205: XXX | W205: =IF($C205>"",(IF(F205=3,1,0)+IF(H205=3,1,0)+IF(J205=3,1,0)+IF(L205=3,1,0)+IF(N205=3,1,0)+IF(P205=3,1,0)+IF(R205=3,1,0)+IF(T205=3,1,0)),"") -> 0 | X205: =IF($C205>"",SUM(F205,H205,J205,L205,N205,P205,R205,T205),"") -> 1 | Y205: =IF(C205>"",IF(D205<2000,16,8),"") -> 16 | Z205: =IF($C205>"",IF($D205<2000,2,1),"") -> 2 | AA205: =IF($C205>"",IF($D205<2000,25,50),"") -> 25 | AC205: =IF($C205>"",SUM(AF205:AL205),"") -> -29.08 | AD205: =IF($C205>"",IF(AC205<=24,0,AC205-24),"") -> 0 | AE205: =IF($C205>"",AC205+AD205,"") -> -29.08 | AF205: =RatingChange(D205,OFFSET($D$200,AF$200,0),F205,G205) -> -9.28 | AG205: =RatingChange(D205,OFFSET($D$200,$AG$200,0),H205,I205) -> -9.76 | AH205: =RatingChange(D205,OFFSET($D$200,AH$200,0),J205,K205) -> -10.04 | AI205: =RatingChange($D205,OFFSET($D$200,AI$200,0),L205,M205) -> 0 | AJ205: XXX | AK205: =RatingChange(D205,OFFSET($D$200,$AK$200,0),P205,Q205) ->  | AL205: =RatingChange(D205,OFFSET($D$200,$AL$200,0),R205,S205) ->  | AM205: =RatingChange(D205,OFFSET($D$200,$AM$200,0),T205,U205) -> 
A206: 6 | E206: =IF($C206>"",MAX(ROUND(D206+AE206,0),200),"") ->  | F206: =IF($C206>"",OFFSET($E200,G200,2*$A206),"") ->  | G206: =IF($C206>"",OFFSET($E200,G200,2*$A206-1),"") ->  | H206: =IF($C206>"",OFFSET($E200,I200,2*$A206),"") ->  | I206: =IF($C206>"",OFFSET($E200,I200,2*$A206-1),"") ->  | J206: =IF($C206>"",OFFSET($E200,K200,2*$A206),"") ->  | K206: =IF($C206>"",OFFSET($E200,K200,2*$A206-1),"") ->  | L206: =IF($C206>"",OFFSET($E200,M200,2*$A206),"") ->  | M206: =IF($C206>"",OFFSET($E200,M200,2*$A206-1),"") ->  | N206: =IF($C206>"",OFFSET($E200,O200,2*$A206),"") ->  | O206: =IF($C206>"",OFFSET($E200,O200,2*$A206-1),"") ->  | P206: XXX | Q206: XXX | W206: =IF($C206>"",(IF(F206=3,1,0)+IF(H206=3,1,0)+IF(J206=3,1,0)+IF(L206=3,1,0)+IF(N206=3,1,0)+IF(P206=3,1,0)+IF(R206=3,1,0)+IF(T206=3,1,0)),"") ->  | X206: =IF($C206>"",SUM(F206,H206,J206,L206,N206,P206,R206,T206),"") ->  | Y206: =IF(C206>"",IF(D206<2000,16,8),"") ->  | Z206: =IF($C206>"",IF($D206<2000,2,1),"") ->  | AA206: =IF($C206>"",IF($D206<2000,25,50),"") ->  | AC206: =IF($C206>"",SUM(AF206:AL206),"") ->  | AD206: =IF($C206>"",IF(AC206<=24,0,AC206-24),"") ->  | AE206: =IF($C206>"",AC206+AD206,"") ->  | AF206: =RatingChange(D206,OFFSET($D$200,AF$200,0),F206,G206) ->  | AG206: =RatingChange(D206,OFFSET($D$200,$AG$200,0),H206,I206) ->  | AH206: =RatingChange(D206,OFFSET($D$200,AH$200,0),J206,K206) ->  | AI206: =RatingChange($D206,OFFSET($D$200,AI$200,0),L206,M206) ->  | AJ206: =RatingChange(D206,OFFSET($D$200,$AJ$200,0),N206,O206) ->  | AK206: XXX | AL206: =RatingChange(D206,OFFSET($D$200,$AL$200,0),R206,S206) ->  | AM206: =RatingChange(D206,OFFSET($D$200,$AM$200,0),T206,U206) -> 
A207: 7 | E207: =IF($C207>"",MAX(ROUND(D207+AE207,0),200),"") ->  | F207: =IF($C207>"",OFFSET($E200,G200,2*$A207),"") ->  | G207: =IF($C207>"",OFFSET($E200,G200,2*$A207-1),"") ->  | H207: =IF($C207>"",OFFSET($E200,I200,2*$A207),"") ->  | I207: =IF($C207>"",OFFSET($E200,I200,2*$A207-1),"") ->  | J207: =IF($C207>"",OFFSET($E200,K200,2*$A207),"") ->  | K207: =IF($C207>"",OFFSET($E200,K200,2*$A207-1),"") ->  | L207: =IF($C207>"",OFFSET($E200,M200,2*$A207),"") ->  | M207: =IF($C207>"",OFFSET($E200,M200,2*$A207-1),"") ->  | N207: =IF($C207>"",OFFSET($E200,O200,2*$A207),"") ->  | O207: =IF($C207>"",OFFSET($E200,O200,2*$A207-1),"") ->  | P207: =IF($C207>"",OFFSET($E200,Q200,2*$A207),"") ->  | Q207: =IF($C207>"",OFFSET($E200,Q200,2*$A207-1),"") ->  | R207: XXX | S207: XXX | W207: =IF($C207>"",(IF(F207=3,1,0)+IF(H207=3,1,0)+IF(J207=3,1,0)+IF(L207=3,1,0)+IF(N207=3,1,0)+IF(P207=3,1,0)+IF(R207=3,1,0)+IF(T207=3,1,0)),"") ->  | X207: =IF($C207>"",SUM(F207,H207,J207,L207,N207,P207,R207,T207),"") ->  | Y207: =IF(C207>"",IF(D207<2000,16,8),"") ->  | Z207: =IF($C207>"",IF($D207<2000,2,1),"") ->  | AA207: =IF($C207>"",IF($D207<2000,25,50),"") ->  | AC207: =IF($C207>"",SUM(AF207:AL207),"") ->  | AD207: =IF($C207>"",IF(AC207<=24,0,AC207-24),"") ->  | AE207: =IF($C207>"",AC207+AD207,"") ->  | AF207: =RatingChange(D207,OFFSET($D$200,AF$200,0),F207,G207) ->  | AG207: =RatingChange(D207,OFFSET($D$200,$AG$200,0),H207,I207) ->  | AH207: =RatingChange(D207,OFFSET($D$200,AH$200,0),J207,K207) ->  | AI207: =RatingChange($D207,OFFSET($D$200,AI$200,0),L207,M207) ->  | AJ207: =RatingChange(D207,OFFSET($D$200,$AJ$200,0),N207,O207) ->  | AK207: =RatingChange(D207,OFFSET($D$200,$AK$200,0),P207,Q207) ->  | AL207: XXX | AM207: =RatingChange(D207,OFFSET($D$200,$AM$200,0),T207,U207) -> 
A208: 8 | E208: =IF($C208>"",MAX(ROUND(D208+AE208,0),200),"") ->  | F208: =IF($C208>"",OFFSET($E200,G200,2*$A208),"") ->  | G208: =IF($C208>"",OFFSET($E200,G200,2*$A208-1),"") ->  | H208: =IF($C208>"",OFFSET($E200,I200,2*$A208),"") ->  | I208: =IF($C208>"",OFFSET($E200,I200,2*$A208-1),"") ->  | J208: =IF($C208>"",OFFSET($E200,K200,2*$A208),"") ->  | K208: =IF($C208>"",OFFSET($E200,K200,2*$A208-1),"") ->  | L208: =IF($C208>"",OFFSET($E200,M200,2*$A208),"") ->  | M208: =IF($C208>"",OFFSET($E200,M200,2*$A208-1),"") ->  | N208: =IF($C208>"",OFFSET($E200,O200,2*$A208),"") ->  | O208: =IF($C208>"",OFFSET($E200,O200,2*$A208-1),"") ->  | P208: =IF($C208>"",OFFSET($E200,Q200,2*$A208),"") ->  | Q208: =IF($C208>"",OFFSET($E200,Q200,2*$A208-1),"") ->  | R208: =IF($C208>"",OFFSET($E200,S200,2*$A208),"") ->  | S208: =IF($C208>"",OFFSET($E200,S200,2*$A208-1),"") ->  | T208: XXX | U208: XXX | W208: =IF($C208>"",(IF(F208=3,1,0)+IF(H208=3,1,0)+IF(J208=3,1,0)+IF(L208=3,1,0)+IF(N208=3,1,0)+IF(P208=3,1,0)+IF(R208=3,1,0)+IF(T208=3,1,0)),"") ->  | X208: =IF($C208>"",SUM(F208,H208,J208,L208,N208,P208,R208,T208),"") ->  | Y208: =IF(C208>"",IF(D208<2000,16,8),"") ->  | Z208: =IF($C208>"",IF($D208<2000,2,1),"") ->  | AA208: =IF($C208>"",IF($D208<2000,25,50),"") ->  | AC208: =IF($C208>"",SUM(AF208:AL208),"") ->  | AD208: =IF($C208>"",IF(AC208<=24,0,AC208-24),"") ->  | AE208: =IF($C208>"",AC208+AD208,"") ->  | AF208: =RatingChange(D208,OFFSET($D$200,AF$200,0),F208,G208) ->  | AG208: =RatingChange(D208,OFFSET($D$200,$AG$200,0),H208,I208) ->  | AH208: =RatingChange(D208,OFFSET($D$200,AH$200,0),J208,K208) ->  | AI208: =RatingChange($D208,OFFSET($D$200,AI$200,0),L208,M208) ->  | AJ208: =RatingChange(D208,OFFSET($D$200,$AJ$200,0),N208,O208) ->  | AK208: =RatingChange(D208,OFFSET($D$200,$AK$200,0),P208,Q208) ->  | AL208: =RatingChange(D208,OFFSET($D$200,$AL$200,0),R208,S208) ->  | AM208: XXX
A214: # | B214: ID | C214: Name | D214: Rating | E214: Rating | J214: Games Won/Lost against | W214: Matches | X214: Games | AC214: Rating | AD214: Bonus | AE214: Change | AF214: Rating change vs.
A215: 15 | D215: Pre | E215: Post | G215: 1 | I215: 2 | K215: 3 | M215: 4 | O215: 5 | Q215: 6 | S215: 7 | U215: 8 | W215: Won | X215: Won | AC215: Change | AD215: Points | AE215: w/Bonus | AF215: 1 | AG215: 2 | AH215: 3 | AI215: 4 | AJ215: 5 | AK215: 6 | AL215: 7 | AM215: 8
A216: 1 | E216: =IF($C216>"",MAX(ROUND(D216+AE216,0),200),"") ->  | F216: XXX | G216: XXX | W216: =IF($C216>"",(IF(F216=3,1,0)+IF(H216=3,1,0)+IF(J216=3,1,0)+IF(L216=3,1,0)+IF(N216=3,1,0)+IF(P216=3,1,0)+IF(R216=3,1,0)+IF(T216=3,1,0)),"") ->  | X216: =IF($C216>"",SUM(F216,H216,J216,L216,N216,P216,R216,T216),"") ->  | Y216: =IF(C216>"",IF(D216<2000,16,8),"") ->  | Z216: =IF($C216>"",IF($D216<2000,2,1),"") ->  | AA216: =IF($C216>"",IF($D216<2000,25,50),"") ->  | AC216: =IF($C216>"",SUM(AF216:AL216),"") ->  | AD216: =IF($C216>"",IF(AC216<=24,0,AC216-24),"") ->  | AE216: =IF($C216>"",AC216+AD216,"") ->  | AF216: XXX | AG216: =RatingChange(D216,OFFSET($D$215,$AG$215,0),H216,I216) ->  | AH216: =RatingChange(D216,OFFSET($D$215,AH$215,0),J216,K216) ->  | AI216: =RatingChange($D216,OFFSET($D$215,AI$215,0),L216,M216) ->  | AJ216: =RatingChange(D216,OFFSET($D$215,$AJ$215,0),N216,O216) ->  | AK216: =RatingChange(D216,OFFSET($D$215,$AK$215,0),P216,Q216) ->  | AL216: =RatingChange(D216,OFFSET($D$215,$AL$215,0),R216,S216) ->  | AM216: =RatingChange(D216,OFFSET($D$215,$AM$215,0),T216,U216) -> 
A217: 2 | E217: =IF($C217>"",MAX(ROUND(D217+AE217,0),200),"") ->  | F217: =IF($C217>"",OFFSET($E215,G215,2*$A217),"") ->  | G217: =IF($C217>"",OFFSET($E215,G215,2*$A217-1),"") ->  | H217: XXX | I217: XXX | W217: =IF($C217>"",(IF(F217=3,1,0)+IF(H217=3,1,0)+IF(J217=3,1,0)+IF(L217=3,1,0)+IF(N217=3,1,0)+IF(P217=3,1,0)+IF(R217=3,1,0)+IF(T217=3,1,0)),"") ->  | X217: =IF($C217>"",SUM(F217,H217,J217,L217,N217,P217,R217,T217),"") ->  | Y217: =IF(C217>"",IF(D217<2000,16,8),"") ->  | Z217: =IF($C217>"",IF($D217<2000,2,1),"") ->  | AA217: =IF($C217>"",IF($D217<2000,25,50),"") ->  | AC217: =IF($C217>"",SUM(AF217:AL217),"") ->  | AD217: =IF($C217>"",IF(AC217<=24,0,AC217-24),"") ->  | AE217: =IF($C217>"",AC217+AD217,"") ->  | AF217: =RatingChange(D217,OFFSET($D$215,AF$215,0),F217,G217) ->  | AG217: XXX | AH217: =RatingChange(D217,OFFSET($D$215,AH$215,0),J217,K217) ->  | AI217: =RatingChange($D217,OFFSET($D$215,AI$215,0),L217,M217) ->  | AJ217: =RatingChange(D217,OFFSET($D$215,$AJ$215,0),N217,O217) ->  | AK217: =RatingChange(D217,OFFSET($D$215,$AK$215,0),P217,Q217) ->  | AL217: =RatingChange(D217,OFFSET($D$215,$AL$215,0),R217,S217) ->  | AM217: =RatingChange(D217,OFFSET($D$215,$AM$215,0),T217,U217) -> 
A218: 3 | E218: =IF($C218>"",MAX(ROUND(D218+AE218,0),200),"") ->  | F218: =IF($C218>"",OFFSET($E215,G215,2*$A218),"") ->  | G218: =IF($C218>"",OFFSET($E215,G215,2*$A218-1),"") ->  | H218: =IF($C218>"",OFFSET($E215,I215,2*$A218),"") ->  | I218: =IF($C218>"",OFFSET($E215,I215,2*$A218-1),"") ->  | J218: XXX | K218: XXX | W218: =IF($C218>"",(IF(F218=3,1,0)+IF(H218=3,1,0)+IF(J218=3,1,0)+IF(L218=3,1,0)+IF(N218=3,1,0)+IF(P218=3,1,0)+IF(R218=3,1,0)+IF(T218=3,1,0)),"") ->  | X218: =IF($C218>"",SUM(F218,H218,J218,L218,N218,P218,R218,T218),"") ->  | Y218: =IF(C218>"",IF(D218<2000,16,8),"") ->  | Z218: =IF($C218>"",IF($D218<2000,2,1),"") ->  | AA218: =IF($C218>"",IF($D218<2000,25,50),"") ->  | AC218: =IF($C218>"",SUM(AF218:AL218),"") ->  | AD218: =IF($C218>"",IF(AC218<=24,0,AC218-24),"") ->  | AE218: =IF($C218>"",AC218+AD218,"") ->  | AF218: =RatingChange(D218,OFFSET($D$215,AF$215,0),F218,G218) ->  | AG218: =RatingChange(D218,OFFSET($D$215,$AG$215,0),H218,I218) ->  | AH218: XXX | AI218: =RatingChange($D218,OFFSET($D$215,AI$215,0),L218,M218) ->  | AJ218: =RatingChange(D218,OFFSET($D$215,$AJ$215,0),N218,O218) ->  | AK218: =RatingChange(D218,OFFSET($D$215,$AK$215,0),P218,Q218) ->  | AL218: =RatingChange(D218,OFFSET($D$215,$AL$215,0),R218,S218) ->  | AM218: =RatingChange(D218,OFFSET($D$215,$AM$215,0),T218,U218) -> 
A219: 4 | E219: =IF($C219>"",MAX(ROUND(D219+AE219,0),200),"") ->  | F219: =IF($C219>"",OFFSET($E215,G215,2*$A219),"") ->  | G219: =IF($C219>"",OFFSET($E215,G215,2*$A219-1),"") ->  | H219: =IF($C219>"",OFFSET($E215,I215,2*$A219),"") ->  | I219: =IF($C219>"",OFFSET($E215,I215,2*$A219-1),"") ->  | J219: =IF($C219>"",OFFSET($E215,K215,2*$A219),"") ->  | K219: =IF($C219>"",OFFSET($E215,K215,2*$A219-1),"") ->  | L219: XXX | M219: XXX | W219: =IF($C219>"",(IF(F219=3,1,0)+IF(H219=3,1,0)+IF(J219=3,1,0)+IF(L219=3,1,0)+IF(N219=3,1,0)+IF(P219=3,1,0)+IF(R219=3,1,0)+IF(T219=3,1,0)),"") ->  | X219: =IF($C219>"",SUM(F219,H219,J219,L219,N219,P219,R219,T219),"") ->  | Y219: =IF(C219>"",IF(D219<2000,16,8),"") ->  | Z219: =IF($C219>"",IF($D219<2000,2,1),"") ->  | AA219: =IF($C219>"",IF($D219<2000,25,50),"") ->  | AC219: =IF($C219>"",SUM(AF219:AL219),"") ->  | AD219: =IF($C219>"",IF(AC219<=24,0,AC219-24),"") ->  | AE219: =IF($C219>"",AC219+AD219,"") ->  | AF219: =RatingChange(D219,OFFSET($D$215,AF$215,0),F219,G219) ->  | AG219: =RatingChange(D219,OFFSET($D$215,$AG$215,0),H219,I219) ->  | AH219: =RatingChange(D219,OFFSET($D$215,AH$215,0),J219,K219) ->  | AI219: XXX | AJ219: =RatingChange(D219,OFFSET($D$215,$AJ$215,0),N219,O219) ->  | AK219: =RatingChange(D219,OFFSET($D$215,$AK$215,0),P219,Q219) ->  | AL219: =RatingChange(D219,OFFSET($D$215,$AL$215,0),R219,S219) ->  | AM219: =RatingChange(D219,OFFSET($D$215,$AM$215,0),T219,U219) -> 
A220: 5 | E220: =IF($C220>"",MAX(ROUND(D220+AE220,0),200),"") ->  | F220: =IF($C220>"",OFFSET($E215,G215,2*$A220),"") ->  | G220: =IF($C220>"",OFFSET($E215,G215,2*$A220-1),"") ->  | H220: =IF($C220>"",OFFSET($E215,I215,2*$A220),"") ->  | I220: =IF($C220>"",OFFSET($E215,I215,2*$A220-1),"") ->  | J220: =IF($C220>"",OFFSET($E215,K215,2*$A220),"") ->  | K220: =IF($C220>"",OFFSET($E215,K215,2*$A220-1),"") ->  | L220: =IF($C220>"",OFFSET($E215,M215,2*$A220),"") ->  | M220: =IF($C220>"",OFFSET($E215,M215,2*$A220-1),"") ->  | N220: XXX | O220: XXX | W220: =IF($C220>"",(IF(F220=3,1,0)+IF(H220=3,1,0)+IF(J220=3,1,0)+IF(L220=3,1,0)+IF(N220=3,1,0)+IF(P220=3,1,0)+IF(R220=3,1,0)+IF(T220=3,1,0)),"") ->  | X220: =IF($C220>"",SUM(F220,H220,J220,L220,N220,P220,R220,T220),"") ->  | Y220: =IF(C220>"",IF(D220<2000,16,8),"") ->  | Z220: =IF($C220>"",IF($D220<2000,2,1),"") ->  | AA220: =IF($C220>"",IF($D220<2000,25,50),"") ->  | AC220: =IF($C220>"",SUM(AF220:AL220),"") ->  | AD220: =IF($C220>"",IF(AC220<=24,0,AC220-24),"") ->  | AE220: =IF($C220>"",AC220+AD220,"") ->  | AF220: =RatingChange(D220,OFFSET($D$215,AF$215,0),F220,G220) ->  | AG220: =RatingChange(D220,OFFSET($D$215,$AG$215,0),H220,I220) ->  | AH220: =RatingChange(D220,OFFSET($D$215,AH$215,0),J220,K220) ->  | AI220: =RatingChange($D220,OFFSET($D$215,AI$215,0),L220,M220) ->  | AJ220: XXX | AK220: =RatingChange(D220,OFFSET($D$215,$AK$215,0),P220,Q220) ->  | AL220: =RatingChange(D220,OFFSET($D$215,$AL$215,0),R220,S220) ->  | AM220: =RatingChange(D220,OFFSET($D$215,$AM$215,0),T220,U220) -> 
A221: 6 | E221: =IF($C221>"",MAX(ROUND(D221+AE221,0),200),"") ->  | F221: =IF($C221>"",OFFSET($E215,G215,2*$A221),"") ->  | G221: =IF($C221>"",OFFSET($E215,G215,2*$A221-1),"") ->  | H221: =IF($C221>"",OFFSET($E215,I215,2*$A221),"") ->  | I221: =IF($C221>"",OFFSET($E215,I215,2*$A221-1),"") ->  | J221: =IF($C221>"",OFFSET($E215,K215,2*$A221),"") ->  | K221: =IF($C221>"",OFFSET($E215,K215,2*$A221-1),"") ->  | L221: =IF($C221>"",OFFSET($E215,M215,2*$A221),"") ->  | M221: =IF($C221>"",OFFSET($E215,M215,2*$A221-1),"") ->  | N221: =IF($C221>"",OFFSET($E215,O215,2*$A221),"") ->  | O221: =IF($C221>"",OFFSET($E215,O215,2*$A221-1),"") ->  | P221: XXX | Q221: XXX | W221: =IF($C221>"",(IF(F221=3,1,0)+IF(H221=3,1,0)+IF(J221=3,1,0)+IF(L221=3,1,0)+IF(N221=3,1,0)+IF(P221=3,1,0)+IF(R221=3,1,0)+IF(T221=3,1,0)),"") ->  | X221: =IF($C221>"",SUM(F221,H221,J221,L221,N221,P221,R221,T221),"") ->  | Y221: =IF(C221>"",IF(D221<2000,16,8),"") ->  | Z221: =IF($C221>"",IF($D221<2000,2,1),"") ->  | AA221: =IF($C221>"",IF($D221<2000,25,50),"") ->  | AC221: =IF($C221>"",SUM(AF221:AL221),"") ->  | AD221: =IF($C221>"",IF(AC221<=24,0,AC221-24),"") ->  | AE221: =IF($C221>"",AC221+AD221,"") ->  | AF221: =RatingChange(D221,OFFSET($D$215,AF$215,0),F221,G221) ->  | AG221: =RatingChange(D221,OFFSET($D$215,$AG$215,0),H221,I221) ->  | AH221: =RatingChange(D221,OFFSET($D$215,AH$215,0),J221,K221) ->  | AI221: =RatingChange($D221,OFFSET($D$215,AI$215,0),L221,M221) ->  | AJ221: =RatingChange(D221,OFFSET($D$215,$AJ$215,0),N221,O221) ->  | AK221: XXX | AL221: =RatingChange(D221,OFFSET($D$215,$AL$215,0),R221,S221) ->  | AM221: =RatingChange(D221,OFFSET($D$215,$AM$215,0),T221,U221) -> 
A222: 7 | E222: =IF($C222>"",MAX(ROUND(D222+AE222,0),200),"") ->  | F222: =IF($C222>"",OFFSET($E215,G215,2*$A222),"") ->  | G222: =IF($C222>"",OFFSET($E215,G215,2*$A222-1),"") ->  | H222: =IF($C222>"",OFFSET($E215,I215,2*$A222),"") ->  | I222: =IF($C222>"",OFFSET($E215,I215,2*$A222-1),"") ->  | J222: =IF($C222>"",OFFSET($E215,K215,2*$A222),"") ->  | K222: =IF($C222>"",OFFSET($E215,K215,2*$A222-1),"") ->  | L222: =IF($C222>"",OFFSET($E215,M215,2*$A222),"") ->  | M222: =IF($C222>"",OFFSET($E215,M215,2*$A222-1),"") ->  | N222: =IF($C222>"",OFFSET($E215,O215,2*$A222),"") ->  | O222: =IF($C222>"",OFFSET($E215,O215,2*$A222-1),"") ->  | P222: =IF($C222>"",OFFSET($E215,Q215,2*$A222),"") ->  | Q222: =IF($C222>"",OFFSET($E215,Q215,2*$A222-1),"") ->  | R222: XXX | S222: XXX | W222: =IF($C222>"",(IF(F222=3,1,0)+IF(H222=3,1,0)+IF(J222=3,1,0)+IF(L222=3,1,0)+IF(N222=3,1,0)+IF(P222=3,1,0)+IF(R222=3,1,0)+IF(T222=3,1,0)),"") ->  | X222: =IF($C222>"",SUM(F222,H222,J222,L222,N222,P222,R222,T222),"") ->  | Y222: =IF(C222>"",IF(D222<2000,16,8),"") ->  | Z222: =IF($C222>"",IF($D222<2000,2,1),"") ->  | AA222: =IF($C222>"",IF($D222<2000,25,50),"") ->  | AC222: =IF($C222>"",SUM(AF222:AL222),"") ->  | AD222: =IF($C222>"",IF(AC222<=24,0,AC222-24),"") ->  | AE222: =IF($C222>"",AC222+AD222,"") ->  | AF222: =RatingChange(D222,OFFSET($D$215,AF$215,0),F222,G222) ->  | AG222: =RatingChange(D222,OFFSET($D$215,$AG$215,0),H222,I222) ->  | AH222: =RatingChange(D222,OFFSET($D$215,AH$215,0),J222,K222) ->  | AI222: =RatingChange($D222,OFFSET($D$215,AI$215,0),L222,M222) ->  | AJ222: =RatingChange(D222,OFFSET($D$215,$AJ$215,0),N222,O222) ->  | AK222: =RatingChange(D222,OFFSET($D$215,$AK$215,0),P222,Q222) ->  | AL222: XXX | AM222: =RatingChange(D222,OFFSET($D$215,$AM$215,0),T222,U222) -> 
A223: 8 | E223: =IF($C223>"",MAX(ROUND(D223+AE223,0),200),"") ->  | F223: =IF($C223>"",OFFSET($E215,G215,2*$A223),"") ->  | G223: =IF($C223>"",OFFSET($E215,G215,2*$A223-1),"") ->  | H223: =IF($C223>"",OFFSET($E215,I215,2*$A223),"") ->  | I223: =IF($C223>"",OFFSET($E215,I215,2*$A223-1),"") ->  | J223: =IF($C223>"",OFFSET($E215,K215,2*$A223),"") ->  | K223: =IF($C223>"",OFFSET($E215,K215,2*$A223-1),"") ->  | L223: =IF($C223>"",OFFSET($E215,M215,2*$A223),"") ->  | M223: =IF($C223>"",OFFSET($E215,M215,2*$A223-1),"") ->  | N223: =IF($C223>"",OFFSET($E215,O215,2*$A223),"") ->  | O223: =IF($C223>"",OFFSET($E215,O215,2*$A223-1),"") ->  | P223: =IF($C223>"",OFFSET($E215,Q215,2*$A223),"") ->  | Q223: =IF($C223>"",OFFSET($E215,Q215,2*$A223-1),"") ->  | R223: =IF($C223>"",OFFSET($E215,S215,2*$A223),"") ->  | S223: =IF($C223>"",OFFSET($E215,S215,2*$A223-1),"") ->  | T223: XXX | U223: XXX | W223: =IF($C223>"",(IF(F223=3,1,0)+IF(H223=3,1,0)+IF(J223=3,1,0)+IF(L223=3,1,0)+IF(N223=3,1,0)+IF(P223=3,1,0)+IF(R223=3,1,0)+IF(T223=3,1,0)),"") ->  | X223: =IF($C223>"",SUM(F223,H223,J223,L223,N223,P223,R223,T223),"") ->  | Y223: =IF(C223>"",IF(D223<2000,16,8),"") ->  | Z223: =IF($C223>"",IF($D223<2000,2,1),"") ->  | AA223: =IF($C223>"",IF($D223<2000,25,50),"") ->  | AC223: =IF($C223>"",SUM(AF223:AL223),"") ->  | AD223: =IF($C223>"",IF(AC223<=24,0,AC223-24),"") ->  | AE223: =IF($C223>"",AC223+AD223,"") ->  | AF223: =RatingChange(D223,OFFSET($D$215,AF$215,0),F223,G223) ->  | AG223: =RatingChange(D223,OFFSET($D$215,$AG$215,0),H223,I223) ->  | AH223: =RatingChange(D223,OFFSET($D$215,AH$215,0),J223,K223) ->  | AI223: =RatingChange($D223,OFFSET($D$215,AI$215,0),L223,M223) ->  | AJ223: =RatingChange(D223,OFFSET($D$215,$AJ$215,0),N223,O223) ->  | AK223: =RatingChange(D223,OFFSET($D$215,$AK$215,0),P223,Q223) ->  | AL223: =RatingChange(D223,OFFSET($D$215,$AL$215,0),R223,S223) ->  | AM223: XXX
A229: # | B229: ID | C229: Name | D229: Rating | E229: Rating | J229: Games Won/Lost against | W229: Matches | X229: Games | AC229: Rating | AD229: Bonus | AE229: Change | AF229: Rating change vs.
A230: 16 | D230: Pre | E230: Post | G230: 1 | I230: 2 | K230: 3 | M230: 4 | O230: 5 | Q230: 6 | S230: 7 | U230: 8 | W230: Won | X230: Won | AC230: Change | AD230: Points | AE230: w/Bonus | AF230: 1 | AG230: 2 | AH230: 3 | AI230: 4 | AJ230: 5 | AK230: 6 | AL230: 7 | AM230: 8
A231: 1 | E231: =IF($C231>"",MAX(ROUND(D231+AE231,0),200),"") ->  | F231: XXX | G231: XXX | W231: =IF($C231>"",(IF(F231=3,1,0)+IF(H231=3,1,0)+IF(J231=3,1,0)+IF(L231=3,1,0)+IF(N231=3,1,0)+IF(P231=3,1,0)+IF(R231=3,1,0)+IF(T231=3,1,0)),"") ->  | X231: =IF($C231>"",SUM(F231,H231,J231,L231,N231,P231,R231,T231),"") ->  | Y231: =IF(C231>"",IF(D231<2000,16,8),"") ->  | Z231: =IF($C231>"",IF($D231<2000,2,1),"") ->  | AA231: =IF($C231>"",IF($D231<2000,25,50),"") ->  | AC231: =IF($C231>"",SUM(AF231:AL231),"") ->  | AD231: =IF($C231>"",IF(AC231<=24,0,AC231-24),"") ->  | AE231: =IF($C231>"",AC231+AD231,"") ->  | AF231: XXX | AG231: =RatingChange(D231,OFFSET($D$230,$AG$230,0),H231,I231) ->  | AH231: =RatingChange(D231,OFFSET($D$230,AH$230,0),J231,K231) ->  | AI231: =RatingChange($D231,OFFSET($D$230,AI$230,0),L231,M231) ->  | AJ231: =RatingChange(D231,OFFSET($D$230,$AJ$230,0),N231,O231) ->  | AK231: =RatingChange(D231,OFFSET($D$230,$AK$230,0),P231,Q231) ->  | AL231: =RatingChange(D231,OFFSET($D$230,$AL$230,0),R231,S231) ->  | AM231: =RatingChange(D231,OFFSET($D$230,$AM$230,0),T231,U231) -> 
A232: 2 | E232: =IF($C232>"",MAX(ROUND(D232+AE232,0),200),"") ->  | F232: =IF($C232>"",OFFSET($E230,G230,2*$A232),"") ->  | G232: =IF($C232>"",OFFSET($E230,G230,2*$A232-1),"") ->  | H232: XXX | I232: XXX | W232: =IF($C232>"",(IF(F232=3,1,0)+IF(H232=3,1,0)+IF(J232=3,1,0)+IF(L232=3,1,0)+IF(N232=3,1,0)+IF(P232=3,1,0)+IF(R232=3,1,0)+IF(T232=3,1,0)),"") ->  | X232: =IF($C232>"",SUM(F232,H232,J232,L232,N232,P232,R232,T232),"") ->  | Y232: =IF(C232>"",IF(D232<2000,16,8),"") ->  | Z232: =IF($C232>"",IF($D232<2000,2,1),"") ->  | AA232: =IF($C232>"",IF($D232<2000,25,50),"") ->  | AC232: =IF($C232>"",SUM(AF232:AL232),"") ->  | AD232: =IF($C232>"",IF(AC232<=24,0,AC232-24),"") ->  | AE232: =IF($C232>"",AC232+AD232,"") ->  | AF232: =RatingChange(D232,OFFSET($D$230,AF$230,0),F232,G232) ->  | AG232: XXX | AH232: =RatingChange(D232,OFFSET($D$230,AH$230,0),J232,K232) ->  | AI232: =RatingChange($D232,OFFSET($D$230,AI$230,0),L232,M232) ->  | AJ232: =RatingChange(D232,OFFSET($D$230,$AJ$230,0),N232,O232) ->  | AK232: =RatingChange(D232,OFFSET($D$230,$AK$230,0),P232,Q232) ->  | AL232: =RatingChange(D232,OFFSET($D$230,$AL$230,0),R232,S232) ->  | AM232: =RatingChange(D232,OFFSET($D$230,$AM$230,0),T232,U232) -> 
A233: 3 | E233: =IF($C233>"",MAX(ROUND(D233+AE233,0),200),"") ->  | F233: =IF($C233>"",OFFSET($E230,G230,2*$A233),"") ->  | G233: =IF($C233>"",OFFSET($E230,G230,2*$A233-1),"") ->  | H233: =IF($C233>"",OFFSET($E230,I230,2*$A233),"") ->  | I233: =IF($C233>"",OFFSET($E230,I230,2*$A233-1),"") ->  | J233: XXX | K233: XXX | W233: =IF($C233>"",(IF(F233=3,1,0)+IF(H233=3,1,0)+IF(J233=3,1,0)+IF(L233=3,1,0)+IF(N233=3,1,0)+IF(P233=3,1,0)+IF(R233=3,1,0)+IF(T233=3,1,0)),"") ->  | X233: =IF($C233>"",SUM(F233,H233,J233,L233,N233,P233,R233,T233),"") ->  | Y233: =IF(C233>"",IF(D233<2000,16,8),"") ->  | Z233: =IF($C233>"",IF($D233<2000,2,1),"") ->  | AA233: =IF($C233>"",IF($D233<2000,25,50),"") ->  | AC233: =IF($C233>"",SUM(AF233:AL233),"") ->  | AD233: =IF($C233>"",IF(AC233<=24,0,AC233-24),"") ->  | AE233: =IF($C233>"",AC233+AD233,"") ->  | AF233: =RatingChange(D233,OFFSET($D$230,AF$230,0),F233,G233) ->  | AG233: =RatingChange(D233,OFFSET($D$230,$AG$230,0),H233,I233) ->  | AH233: XXX | AI233: =RatingChange($D233,OFFSET($D$230,AI$230,0),L233,M233) ->  | AJ233: =RatingChange(D233,OFFSET($D$230,$AJ$230,0),N233,O233) ->  | AK233: =RatingChange(D233,OFFSET($D$230,$AK$230,0),P233,Q233) ->  | AL233: =RatingChange(D233,OFFSET($D$230,$AL$230,0),R233,S233) ->  | AM233: =RatingChange(D233,OFFSET($D$230,$AM$230,0),T233,U233) -> 
A234: 4 | E234: =IF($C234>"",MAX(ROUND(D234+AE234,0),200),"") ->  | F234: =IF($C234>"",OFFSET($E230,G230,2*$A234),"") ->  | G234: =IF($C234>"",OFFSET($E230,G230,2*$A234-1),"") ->  | H234: =IF($C234>"",OFFSET($E230,I230,2*$A234),"") ->  | I234: =IF($C234>"",OFFSET($E230,I230,2*$A234-1),"") ->  | J234: =IF($C234>"",OFFSET($E230,K230,2*$A234),"") ->  | K234: =IF($C234>"",OFFSET($E230,K230,2*$A234-1),"") ->  | L234: XXX | M234: XXX | W234: =IF($C234>"",(IF(F234=3,1,0)+IF(H234=3,1,0)+IF(J234=3,1,0)+IF(L234=3,1,0)+IF(N234=3,1,0)+IF(P234=3,1,0)+IF(R234=3,1,0)+IF(T234=3,1,0)),"") ->  | X234: =IF($C234>"",SUM(F234,H234,J234,L234,N234,P234,R234,T234),"") ->  | Y234: =IF(C234>"",IF(D234<2000,16,8),"") ->  | Z234: =IF($C234>"",IF($D234<2000,2,1),"") ->  | AA234: =IF($C234>"",IF($D234<2000,25,50),"") ->  | AC234: =IF($C234>"",SUM(AF234:AL234),"") ->  | AD234: =IF($C234>"",IF(AC234<=24,0,AC234-24),"") ->  | AE234: =IF($C234>"",AC234+AD234,"") ->  | AF234: =RatingChange(D234,OFFSET($D$230,AF$230,0),F234,G234) ->  | AG234: =RatingChange(D234,OFFSET($D$230,$AG$230,0),H234,I234) ->  | AH234: =RatingChange(D234,OFFSET($D$230,AH$230,0),J234,K234) ->  | AI234: XXX | AJ234: =RatingChange(D234,OFFSET($D$230,$AJ$230,0),N234,O234) ->  | AK234: =RatingChange(D234,OFFSET($D$230,$AK$230,0),P234,Q234) ->  | AL234: =RatingChange(D234,OFFSET($D$230,$AL$230,0),R234,S234) ->  | AM234: =RatingChange(D234,OFFSET($D$230,$AM$230,0),T234,U234) -> 
A235: 5 | E235: =IF($C235>"",MAX(ROUND(D235+AE235,0),200),"") ->  | F235: =IF($C235>"",OFFSET($E230,G230,2*$A235),"") ->  | G235: =IF($C235>"",OFFSET($E230,G230,2*$A235-1),"") ->  | H235: =IF($C235>"",OFFSET($E230,I230,2*$A235),"") ->  | I235: =IF($C235>"",OFFSET($E230,I230,2*$A235-1),"") ->  | J235: =IF($C235>"",OFFSET($E230,K230,2*$A235),"") ->  | K235: =IF($C235>"",OFFSET($E230,K230,2*$A235-1),"") ->  | L235: =IF($C235>"",OFFSET($E230,M230,2*$A235),"") ->  | M235: =IF($C235>"",OFFSET($E230,M230,2*$A235-1),"") ->  | N235: XXX | O235: XXX | W235: =IF($C235>"",(IF(F235=3,1,0)+IF(H235=3,1,0)+IF(J235=3,1,0)+IF(L235=3,1,0)+IF(N235=3,1,0)+IF(P235=3,1,0)+IF(R235=3,1,0)+IF(T235=3,1,0)),"") ->  | X235: =IF($C235>"",SUM(F235,H235,J235,L235,N235,P235,R235,T235),"") ->  | Y235: =IF(C235>"",IF(D235<2000,16,8),"") ->  | Z235: =IF($C235>"",IF($D235<2000,2,1),"") ->  | AA235: =IF($C235>"",IF($D235<2000,25,50),"") ->  | AC235: =IF($C235>"",SUM(AF235:AL235),"") ->  | AD235: =IF($C235>"",IF(AC235<=24,0,AC235-24),"") ->  | AE235: =IF($C235>"",AC235+AD235,"") ->  | AF235: =RatingChange(D235,OFFSET($D$230,AF$230,0),F235,G235) ->  | AG235: =RatingChange(D235,OFFSET($D$230,$AG$230,0),H235,I235) ->  | AH235: =RatingChange(D235,OFFSET($D$230,AH$230,0),J235,K235) ->  | AI235: =RatingChange($D235,OFFSET($D$230,AI$230,0),L235,M235) ->  | AJ235: XXX | AK235: =RatingChange(D235,OFFSET($D$230,$AK$230,0),P235,Q235) ->  | AL235: =RatingChange(D235,OFFSET($D$230,$AL$230,0),R235,S235) ->  | AM235: =RatingChange(D235,OFFSET($D$230,$AM$230,0),T235,U235) -> 
A236: 6 | E236: =IF($C236>"",MAX(ROUND(D236+AE236,0),200),"") ->  | F236: =IF($C236>"",OFFSET($E230,G230,2*$A236),"") ->  | G236: =IF($C236>"",OFFSET($E230,G230,2*$A236-1),"") ->  | H236: =IF($C236>"",OFFSET($E230,I230,2*$A236),"") ->  | I236: =IF($C236>"",OFFSET($E230,I230,2*$A236-1),"") ->  | J236: =IF($C236>"",OFFSET($E230,K230,2*$A236),"") ->  | K236: =IF($C236>"",OFFSET($E230,K230,2*$A236-1),"") ->  | L236: =IF($C236>"",OFFSET($E230,M230,2*$A236),"") ->  | M236: =IF($C236>"",OFFSET($E230,M230,2*$A236-1),"") ->  | N236: =IF($C236>"",OFFSET($E230,O230,2*$A236),"") ->  | O236: =IF($C236>"",OFFSET($E230,O230,2*$A236-1),"") ->  | P236: XXX | Q236: XXX | W236: =IF($C236>"",(IF(F236=3,1,0)+IF(H236=3,1,0)+IF(J236=3,1,0)+IF(L236=3,1,0)+IF(N236=3,1,0)+IF(P236=3,1,0)+IF(R236=3,1,0)+IF(T236=3,1,0)),"") ->  | X236: =IF($C236>"",SUM(F236,H236,J236,L236,N236,P236,R236,T236),"") ->  | Y236: =IF(C236>"",IF(D236<2000,16,8),"") ->  | Z236: =IF($C236>"",IF($D236<2000,2,1),"") ->  | AA236: =IF($C236>"",IF($D236<2000,25,50),"") ->  | AC236: =IF($C236>"",SUM(AF236:AL236),"") ->  | AD236: =IF($C236>"",IF(AC236<=24,0,AC236-24),"") ->  | AE236: =IF($C236>"",AC236+AD236,"") ->  | AF236: =RatingChange(D236,OFFSET($D$230,AF$230,0),F236,G236) ->  | AG236: =RatingChange(D236,OFFSET($D$230,$AG$230,0),H236,I236) ->  | AH236: =RatingChange(D236,OFFSET($D$230,AH$230,0),J236,K236) ->  | AI236: =RatingChange($D236,OFFSET($D$230,AI$230,0),L236,M236) ->  | AJ236: =RatingChange(D236,OFFSET($D$230,$AJ$230,0),N236,O236) ->  | AK236: XXX | AL236: =RatingChange(D236,OFFSET($D$230,$AL$230,0),R236,S236) ->  | AM236: =RatingChange(D236,OFFSET($D$230,$AM$230,0),T236,U236) -> 
A237: 7 | E237: =IF($C237>"",MAX(ROUND(D237+AE237,0),200),"") ->  | F237: =IF($C237>"",OFFSET($E230,G230,2*$A237),"") ->  | G237: =IF($C237>"",OFFSET($E230,G230,2*$A237-1),"") ->  | H237: =IF($C237>"",OFFSET($E230,I230,2*$A237),"") ->  | I237: =IF($C237>"",OFFSET($E230,I230,2*$A237-1),"") ->  | J237: =IF($C237>"",OFFSET($E230,K230,2*$A237),"") ->  | K237: =IF($C237>"",OFFSET($E230,K230,2*$A237-1),"") ->  | L237: =IF($C237>"",OFFSET($E230,M230,2*$A237),"") ->  | M237: =IF($C237>"",OFFSET($E230,M230,2*$A237-1),"") ->  | N237: =IF($C237>"",OFFSET($E230,O230,2*$A237),"") ->  | O237: =IF($C237>"",OFFSET($E230,O230,2*$A237-1),"") ->  | P237: =IF($C237>"",OFFSET($E230,Q230,2*$A237),"") ->  | Q237: =IF($C237>"",OFFSET($E230,Q230,2*$A237-1),"") ->  | R237: XXX | S237: XXX | W237: =IF($C237>"",(IF(F237=3,1,0)+IF(H237=3,1,0)+IF(J237=3,1,0)+IF(L237=3,1,0)+IF(N237=3,1,0)+IF(P237=3,1,0)+IF(R237=3,1,0)+IF(T237=3,1,0)),"") ->  | X237: =IF($C237>"",SUM(F237,H237,J237,L237,N237,P237,R237,T237),"") ->  | Y237: =IF(C237>"",IF(D237<2000,16,8),"") ->  | Z237: =IF($C237>"",IF($D237<2000,2,1),"") ->  | AA237: =IF($C237>"",IF($D237<2000,25,50),"") ->  | AC237: =IF($C237>"",SUM(AF237:AL237),"") ->  | AD237: =IF($C237>"",IF(AC237<=24,0,AC237-24),"") ->  | AE237: =IF($C237>"",AC237+AD237,"") ->  | AF237: =RatingChange(D237,OFFSET($D$230,AF$230,0),F237,G237) ->  | AG237: =RatingChange(D237,OFFSET($D$230,$AG$230,0),H237,I237) ->  | AH237: =RatingChange(D237,OFFSET($D$230,AH$230,0),J237,K237) ->  | AI237: =RatingChange($D237,OFFSET($D$230,AI$230,0),L237,M237) ->  | AJ237: =RatingChange(D237,OFFSET($D$230,$AJ$230,0),N237,O237) ->  | AK237: =RatingChange(D237,OFFSET($D$230,$AK$230,0),P237,Q237) ->  | AL237: XXX | AM237: =RatingChange(D237,OFFSET($D$230,$AM$230,0),T237,U237) -> 
A238: 8 | E238: =IF($C238>"",MAX(ROUND(D238+AE238,0),200),"") ->  | F238: =IF($C238>"",OFFSET($E230,G230,2*$A238),"") ->  | G238: =IF($C238>"",OFFSET($E230,G230,2*$A238-1),"") ->  | H238: =IF($C238>"",OFFSET($E230,I230,2*$A238),"") ->  | I238: =IF($C238>"",OFFSET($E230,I230,2*$A238-1),"") ->  | J238: =IF($C238>"",OFFSET($E230,K230,2*$A238),"") ->  | K238: =IF($C238>"",OFFSET($E230,K230,2*$A238-1),"") ->  | L238: =IF($C238>"",OFFSET($E230,M230,2*$A238),"") ->  | M238: =IF($C238>"",OFFSET($E230,M230,2*$A238-1),"") ->  | N238: =IF($C238>"",OFFSET($E230,O230,2*$A238),"") ->  | O238: =IF($C238>"",OFFSET($E230,O230,2*$A238-1),"") ->  | P238: =IF($C238>"",OFFSET($E230,Q230,2*$A238),"") ->  | Q238: =IF($C238>"",OFFSET($E230,Q230,2*$A238-1),"") ->  | R238: =IF($C238>"",OFFSET($E230,S230,2*$A238),"") ->  | S238: =IF($C238>"",OFFSET($E230,S230,2*$A238-1),"") ->  | T238: XXX | U238: XXX | W238: =IF($C238>"",(IF(F238=3,1,0)+IF(H238=3,1,0)+IF(J238=3,1,0)+IF(L238=3,1,0)+IF(N238=3,1,0)+IF(P238=3,1,0)+IF(R238=3,1,0)+IF(T238=3,1,0)),"") ->  | X238: =IF($C238>"",SUM(F238,H238,J238,L238,N238,P238,R238,T238),"") ->  | Y238: =IF(C238>"",IF(D238<2000,16,8),"") ->  | Z238: =IF($C238>"",IF($D238<2000,2,1),"") ->  | AA238: =IF($C238>"",IF($D238<2000,25,50),"") ->  | AC238: =IF($C238>"",SUM(AF238:AL238),"") ->  | AD238: =IF($C238>"",IF(AC238<=24,0,AC238-24),"") ->  | AE238: =IF($C238>"",AC238+AD238,"") ->  | AF238: =RatingChange(D238,OFFSET($D$230,AF$230,0),F238,G238) ->  | AG238: =RatingChange(D238,OFFSET($D$230,$AG$230,0),H238,I238) ->  | AH238: =RatingChange(D238,OFFSET($D$230,AH$230,0),J238,K238) ->  | AI238: =RatingChange($D238,OFFSET($D$230,AI$230,0),L238,M238) ->  | AJ238: =RatingChange(D238,OFFSET($D$230,$AJ$230,0),N238,O238) ->  | AK238: =RatingChange(D238,OFFSET($D$230,$AK$230,0),P238,Q238) ->  | AL238: =RatingChange(D238,OFFSET($D$230,$AL$230,0),R238,S238) ->  | AM238: XXX
A244: # | B244: ID | C244: Name | D244: Rating | E244: Rating | J244: Games Won/Lost against | W244: Matches | X244: Games | AC244: Rating | AD244: Bonus | AE244: Change | AF244: Rating change vs.
A245: 17 | D245: Pre | E245: Post | G245: 1 | I245: 2 | K245: 3 | M245: 4 | O245: 5 | Q245: 6 | S245: 7 | U245: 8 | W245: Won | X245: Won | AC245: Change | AD245: Points | AE245: w/Bonus | AF245: 1 | AG245: 2 | AH245: 3 | AI245: 4 | AJ245: 5 | AK245: 6 | AL245: 7 | AM245: 8
A246: 1 | E246: =IF($C246>"",MAX(ROUND(D246+AE246,0),200),"") ->  | F246: XXX | G246: XXX | W246: =IF($C246>"",(IF(F246=3,1,0)+IF(H246=3,1,0)+IF(J246=3,1,0)+IF(L246=3,1,0)+IF(N246=3,1,0)+IF(P246=3,1,0)+IF(R246=3,1,0)+IF(T246=3,1,0)),"") ->  | X246: =IF($C246>"",SUM(F246,H246,J246,L246,N246,P246,R246,T246),"") ->  | Y246: =IF(C246>"",IF(D246<2000,16,8),"") ->  | Z246: =IF($C246>"",IF($D246<2000,2,1),"") ->  | AA246: =IF($C246>"",IF($D246<2000,25,50),"") ->  | AC246: =IF($C246>"",SUM(AF246:AL246),"") ->  | AD246: =IF($C246>"",IF(AC246<=24,0,AC246-24),"") ->  | AE246: =IF($C246>"",AC246+AD246,"") ->  | AF246: XXX | AG246: =RatingChange(D246,OFFSET($D$245,$AG$245,0),H246,I246) ->  | AH246: =RatingChange(D246,OFFSET($D$245,AH$245,0),J246,K246) ->  | AI246: =RatingChange($D246,OFFSET($D$245,AI$245,0),L246,M246) ->  | AJ246: =RatingChange(D246,OFFSET($D$245,$AJ$245,0),N246,O246) ->  | AK246: =RatingChange(D246,OFFSET($D$245,$AK$245,0),P246,Q246) ->  | AL246: =RatingChange(D246,OFFSET($D$245,$AL$245,0),R246,S246) ->  | AM246: =RatingChange(D246,OFFSET($D$245,$AM$245,0),T246,U246) -> 
A247: 2 | E247: =IF($C247>"",MAX(ROUND(D247+AE247,0),200),"") ->  | F247: =IF($C247>"",OFFSET($E245,G245,2*$A247),"") ->  | G247: =IF($C247>"",OFFSET($E245,G245,2*$A247-1),"") ->  | H247: XXX | I247: XXX | W247: =IF($C247>"",(IF(F247=3,1,0)+IF(H247=3,1,0)+IF(J247=3,1,0)+IF(L247=3,1,0)+IF(N247=3,1,0)+IF(P247=3,1,0)+IF(R247=3,1,0)+IF(T247=3,1,0)),"") ->  | X247: =IF($C247>"",SUM(F247,H247,J247,L247,N247,P247,R247,T247),"") ->  | Y247: =IF(C247>"",IF(D247<2000,16,8),"") ->  | Z247: =IF($C247>"",IF($D247<2000,2,1),"") ->  | AA247: =IF($C247>"",IF($D247<2000,25,50),"") ->  | AC247: =IF($C247>"",SUM(AF247:AL247),"") ->  | AD247: =IF($C247>"",IF(AC247<=24,0,AC247-24),"") ->  | AE247: =IF($C247>"",AC247+AD247,"") ->  | AF247: =RatingChange(D247,OFFSET($D$245,AF$245,0),F247,G247) ->  | AG247: XXX | AH247: =RatingChange(D247,OFFSET($D$245,AH$245,0),J247,K247) ->  | AI247: =RatingChange($D247,OFFSET($D$245,AI$245,0),L247,M247) ->  | AJ247: =RatingChange(D247,OFFSET($D$245,$AJ$245,0),N247,O247) ->  | AK247: =RatingChange(D247,OFFSET($D$245,$AK$245,0),P247,Q247) ->  | AL247: =RatingChange(D247,OFFSET($D$245,$AL$245,0),R247,S247) ->  | AM247: =RatingChange(D247,OFFSET($D$245,$AM$245,0),T247,U247) -> 
A248: 3 | E248: =IF($C248>"",MAX(ROUND(D248+AE248,0),200),"") ->  | F248: =IF($C248>"",OFFSET($E245,G245,2*$A248),"") ->  | G248: =IF($C248>"",OFFSET($E245,G245,2*$A248-1),"") ->  | H248: =IF($C248>"",OFFSET($E245,I245,2*$A248),"") ->  | I248: =IF($C248>"",OFFSET($E245,I245,2*$A248-1),"") ->  | J248: XXX | K248: XXX | W248: =IF($C248>"",(IF(F248=3,1,0)+IF(H248=3,1,0)+IF(J248=3,1,0)+IF(L248=3,1,0)+IF(N248=3,1,0)+IF(P248=3,1,0)+IF(R248=3,1,0)+IF(T248=3,1,0)),"") ->  | X248: =IF($C248>"",SUM(F248,H248,J248,L248,N248,P248,R248,T248),"") ->  | Y248: =IF(C248>"",IF(D248<2000,16,8),"") ->  | Z248: =IF($C248>"",IF($D248<2000,2,1),"") ->  | AA248: =IF($C248>"",IF($D248<2000,25,50),"") ->  | AC248: =IF($C248>"",SUM(AF248:AL248),"") ->  | AD248: =IF($C248>"",IF(AC248<=24,0,AC248-24),"") ->  | AE248: =IF($C248>"",AC248+AD248,"") ->  | AF248: =RatingChange(D248,OFFSET($D$245,AF$245,0),F248,G248) ->  | AG248: =RatingChange(D248,OFFSET($D$245,$AG$245,0),H248,I248) ->  | AH248: XXX | AI248: =RatingChange($D248,OFFSET($D$245,AI$245,0),L248,M248) ->  | AJ248: =RatingChange(D248,OFFSET($D$245,$AJ$245,0),N248,O248) ->  | AK248: =RatingChange(D248,OFFSET($D$245,$AK$245,0),P248,Q248) ->  | AL248: =RatingChange(D248,OFFSET($D$245,$AL$245,0),R248,S248) ->  | AM248: =RatingChange(D248,OFFSET($D$245,$AM$245,0),T248,U248) -> 
A249: 4 | E249: =IF($C249>"",MAX(ROUND(D249+AE249,0),200),"") ->  | F249: =IF($C249>"",OFFSET($E245,G245,2*$A249),"") ->  | G249: =IF($C249>"",OFFSET($E245,G245,2*$A249-1),"") ->  | H249: =IF($C249>"",OFFSET($E245,I245,2*$A249),"") ->  | I249: =IF($C249>"",OFFSET($E245,I245,2*$A249-1),"") ->  | J249: =IF($C249>"",OFFSET($E245,K245,2*$A249),"") ->  | K249: =IF($C249>"",OFFSET($E245,K245,2*$A249-1),"") ->  | L249: XXX | M249: XXX | W249: =IF($C249>"",(IF(F249=3,1,0)+IF(H249=3,1,0)+IF(J249=3,1,0)+IF(L249=3,1,0)+IF(N249=3,1,0)+IF(P249=3,1,0)+IF(R249=3,1,0)+IF(T249=3,1,0)),"") ->  | X249: =IF($C249>"",SUM(F249,H249,J249,L249,N249,P249,R249,T249),"") ->  | Y249: =IF(C249>"",IF(D249<2000,16,8),"") ->  | Z249: =IF($C249>"",IF($D249<2000,2,1),"") ->  | AA249: =IF($C249>"",IF($D249<2000,25,50),"") ->  | AC249: =IF($C249>"",SUM(AF249:AL249),"") ->  | AD249: =IF($C249>"",IF(AC249<=24,0,AC249-24),"") ->  | AE249: =IF($C249>"",AC249+AD249,"") ->  | AF249: =RatingChange(D249,OFFSET($D$245,AF$245,0),F249,G249) ->  | AG249: =RatingChange(D249,OFFSET($D$245,$AG$245,0),H249,I249) ->  | AH249: =RatingChange(D249,OFFSET($D$245,AH$245,0),J249,K249) ->  | AI249: XXX | AJ249: =RatingChange(D249,OFFSET($D$245,$AJ$245,0),N249,O249) ->  | AK249: =RatingChange(D249,OFFSET($D$245,$AK$245,0),P249,Q249) ->  | AL249: =RatingChange(D249,OFFSET($D$245,$AL$245,0),R249,S249) ->  | AM249: =RatingChange(D249,OFFSET($D$245,$AM$245,0),T249,U249) -> 
A250: 5 | E250: =IF($C250>"",MAX(ROUND(D250+AE250,0),200),"") ->  | F250: =IF($C250>"",OFFSET($E245,G245,2*$A250),"") ->  | G250: =IF($C250>"",OFFSET($E245,G245,2*$A250-1),"") ->  | H250: =IF($C250>"",OFFSET($E245,I245,2*$A250),"") ->  | I250: =IF($C250>"",OFFSET($E245,I245,2*$A250-1),"") ->  | J250: =IF($C250>"",OFFSET($E245,K245,2*$A250),"") ->  | K250: =IF($C250>"",OFFSET($E245,K245,2*$A250-1),"") ->  | L250: =IF($C250>"",OFFSET($E245,M245,2*$A250),"") ->  | M250: =IF($C250>"",OFFSET($E245,M245,2*$A250-1),"") ->  | N250: XXX | O250: XXX | W250: =IF($C250>"",(IF(F250=3,1,0)+IF(H250=3,1,0)+IF(J250=3,1,0)+IF(L250=3,1,0)+IF(N250=3,1,0)+IF(P250=3,1,0)+IF(R250=3,1,0)+IF(T250=3,1,0)),"") ->  | X250: =IF($C250>"",SUM(F250,H250,J250,L250,N250,P250,R250,T250),"") ->  | Y250: =IF(C250>"",IF(D250<2000,16,8),"") ->  | Z250: =IF($C250>"",IF($D250<2000,2,1),"") ->  | AA250: =IF($C250>"",IF($D250<2000,25,50),"") ->  | AC250: =IF($C250>"",SUM(AF250:AL250),"") ->  | AD250: =IF($C250>"",IF(AC250<=24,0,AC250-24),"") ->  | AE250: =IF($C250>"",AC250+AD250,"") ->  | AF250: =RatingChange(D250,OFFSET($D$245,AF$245,0),F250,G250) ->  | AG250: =RatingChange(D250,OFFSET($D$245,$AG$245,0),H250,I250) ->  | AH250: =RatingChange(D250,OFFSET($D$245,AH$245,0),J250,K250) ->  | AI250: =RatingChange($D250,OFFSET($D$245,AI$245,0),L250,M250) ->  | AJ250: XXX | AK250: =RatingChange(D250,OFFSET($D$245,$AK$245,0),P250,Q250) ->  | AL250: =RatingChange(D250,OFFSET($D$245,$AL$245,0),R250,S250) ->  | AM250: =RatingChange(D250,OFFSET($D$245,$AM$245,0),T250,U250) -> 
A251: 6 | E251: =IF($C251>"",MAX(ROUND(D251+AE251,0),200),"") ->  | F251: =IF($C251>"",OFFSET($E245,G245,2*$A251),"") ->  | G251: =IF($C251>"",OFFSET($E245,G245,2*$A251-1),"") ->  | H251: =IF($C251>"",OFFSET($E245,I245,2*$A251),"") ->  | I251: =IF($C251>"",OFFSET($E245,I245,2*$A251-1),"") ->  | J251: =IF($C251>"",OFFSET($E245,K245,2*$A251),"") ->  | K251: =IF($C251>"",OFFSET($E245,K245,2*$A251-1),"") ->  | L251: =IF($C251>"",OFFSET($E245,M245,2*$A251),"") ->  | M251: =IF($C251>"",OFFSET($E245,M245,2*$A251-1),"") ->  | N251: =IF($C251>"",OFFSET($E245,O245,2*$A251),"") ->  | O251: =IF($C251>"",OFFSET($E245,O245,2*$A251-1),"") ->  | P251: XXX | Q251: XXX | W251: =IF($C251>"",(IF(F251=3,1,0)+IF(H251=3,1,0)+IF(J251=3,1,0)+IF(L251=3,1,0)+IF(N251=3,1,0)+IF(P251=3,1,0)+IF(R251=3,1,0)+IF(T251=3,1,0)),"") ->  | X251: =IF($C251>"",SUM(F251,H251,J251,L251,N251,P251,R251,T251),"") ->  | Y251: =IF(C251>"",IF(D251<2000,16,8),"") ->  | Z251: =IF($C251>"",IF($D251<2000,2,1),"") ->  | AA251: =IF($C251>"",IF($D251<2000,25,50),"") ->  | AC251: =IF($C251>"",SUM(AF251:AL251),"") ->  | AD251: =IF($C251>"",IF(AC251<=24,0,AC251-24),"") ->  | AE251: =IF($C251>"",AC251+AD251,"") ->  | AF251: =RatingChange(D251,OFFSET($D$245,AF$245,0),F251,G251) ->  | AG251: =RatingChange(D251,OFFSET($D$245,$AG$245,0),H251,I251) ->  | AH251: =RatingChange(D251,OFFSET($D$245,AH$245,0),J251,K251) ->  | AI251: =RatingChange($D251,OFFSET($D$245,AI$245,0),L251,M251) ->  | AJ251: =RatingChange(D251,OFFSET($D$245,$AJ$245,0),N251,O251) ->  | AK251: XXX | AL251: =RatingChange(D251,OFFSET($D$245,$AL$245,0),R251,S251) ->  | AM251: =RatingChange(D251,OFFSET($D$245,$AM$245,0),T251,U251) -> 
A252: 7 | E252: =IF($C252>"",MAX(ROUND(D252+AE252,0),200),"") ->  | F252: =IF($C252>"",OFFSET($E245,G245,2*$A252),"") ->  | G252: =IF($C252>"",OFFSET($E245,G245,2*$A252-1),"") ->  | H252: =IF($C252>"",OFFSET($E245,I245,2*$A252),"") ->  | I252: =IF($C252>"",OFFSET($E245,I245,2*$A252-1),"") ->  | J252: =IF($C252>"",OFFSET($E245,K245,2*$A252),"") ->  | K252: =IF($C252>"",OFFSET($E245,K245,2*$A252-1),"") ->  | L252: =IF($C252>"",OFFSET($E245,M245,2*$A252),"") ->  | M252: =IF($C252>"",OFFSET($E245,M245,2*$A252-1),"") ->  | N252: =IF($C252>"",OFFSET($E245,O245,2*$A252),"") ->  | O252: =IF($C252>"",OFFSET($E245,O245,2*$A252-1),"") ->  | P252: =IF($C252>"",OFFSET($E245,Q245,2*$A252),"") ->  | Q252: =IF($C252>"",OFFSET($E245,Q245,2*$A252-1),"") ->  | R252: XXX | S252: XXX | W252: =IF($C252>"",(IF(F252=3,1,0)+IF(H252=3,1,0)+IF(J252=3,1,0)+IF(L252=3,1,0)+IF(N252=3,1,0)+IF(P252=3,1,0)+IF(R252=3,1,0)+IF(T252=3,1,0)),"") ->  | X252: =IF($C252>"",SUM(F252,H252,J252,L252,N252,P252,R252,T252),"") ->  | Y252: =IF(C252>"",IF(D252<2000,16,8),"") ->  | Z252: =IF($C252>"",IF($D252<2000,2,1),"") ->  | AA252: =IF($C252>"",IF($D252<2000,25,50),"") ->  | AC252: =IF($C252>"",SUM(AF252:AL252),"") ->  | AD252: =IF($C252>"",IF(AC252<=24,0,AC252-24),"") ->  | AE252: =IF($C252>"",AC252+AD252,"") ->  | AF252: =RatingChange(D252,OFFSET($D$245,AF$245,0),F252,G252) ->  | AG252: =RatingChange(D252,OFFSET($D$245,$AG$245,0),H252,I252) ->  | AH252: =RatingChange(D252,OFFSET($D$245,AH$245,0),J252,K252) ->  | AI252: =RatingChange($D252,OFFSET($D$245,AI$245,0),L252,M252) ->  | AJ252: =RatingChange(D252,OFFSET($D$245,$AJ$245,0),N252,O252) ->  | AK252: =RatingChange(D252,OFFSET($D$245,$AK$245,0),P252,Q252) ->  | AL252: XXX | AM252: =RatingChange(D252,OFFSET($D$245,$AM$245,0),T252,U252) -> 
A253: 8 | E253: =IF($C253>"",MAX(ROUND(D253+AE253,0),200),"") ->  | F253: =IF($C253>"",OFFSET($E245,G245,2*$A253),"") ->  | G253: =IF($C253>"",OFFSET($E245,G245,2*$A253-1),"") ->  | H253: =IF($C253>"",OFFSET($E245,I245,2*$A253),"") ->  | I253: =IF($C253>"",OFFSET($E245,I245,2*$A253-1),"") ->  | J253: =IF($C253>"",OFFSET($E245,K245,2*$A253),"") ->  | K253: =IF($C253>"",OFFSET($E245,K245,2*$A253-1),"") ->  | L253: =IF($C253>"",OFFSET($E245,M245,2*$A253),"") ->  | M253: =IF($C253>"",OFFSET($E245,M245,2*$A253-1),"") ->  | N253: =IF($C253>"",OFFSET($E245,O245,2*$A253),"") ->  | O253: =IF($C253>"",OFFSET($E245,O245,2*$A253-1),"") ->  | P253: =IF($C253>"",OFFSET($E245,Q245,2*$A253),"") ->  | Q253: =IF($C253>"",OFFSET($E245,Q245,2*$A253-1),"") ->  | R253: =IF($C253>"",OFFSET($E245,S245,2*$A253),"") ->  | S253: =IF($C253>"",OFFSET($E245,S245,2*$A253-1),"") ->  | T253: XXX | U253: XXX | W253: =IF($C253>"",(IF(F253=3,1,0)+IF(H253=3,1,0)+IF(J253=3,1,0)+IF(L253=3,1,0)+IF(N253=3,1,0)+IF(P253=3,1,0)+IF(R253=3,1,0)+IF(T253=3,1,0)),"") ->  | X253: =IF($C253>"",SUM(F253,H253,J253,L253,N253,P253,R253,T253),"") ->  | Y253: =IF(C253>"",IF(D253<2000,16,8),"") ->  | Z253: =IF($C253>"",IF($D253<2000,2,1),"") ->  | AA253: =IF($C253>"",IF($D253<2000,25,50),"") ->  | AC253: =IF($C253>"",SUM(AF253:AL253),"") ->  | AD253: =IF($C253>"",IF(AC253<=24,0,AC253-24),"") ->  | AE253: =IF($C253>"",AC253+AD253,"") ->  | AF253: =RatingChange(D253,OFFSET($D$245,AF$245,0),F253,G253) ->  | AG253: =RatingChange(D253,OFFSET($D$245,$AG$245,0),H253,I253) ->  | AH253: =RatingChange(D253,OFFSET($D$245,AH$245,0),J253,K253) ->  | AI253: =RatingChange($D253,OFFSET($D$245,AI$245,0),L253,M253) ->  | AJ253: =RatingChange(D253,OFFSET($D$245,$AJ$245,0),N253,O253) ->  | AK253: =RatingChange(D253,OFFSET($D$245,$AK$245,0),P253,Q253) ->  | AL253: =RatingChange(D253,OFFSET($D$245,$AL$245,0),R253,S253) ->  | AM253: XXX
A259: # | B259: ID | C259: Name | D259: Rating | E259: Rating | J259: Games Won/Lost against | W259: Matches | X259: Games | AC259: Rating | AD259: Bonus | AE259: Change | AF259: Rating change vs.
A260: 18 | D260: Pre | E260: Post | G260: 1 | I260: 2 | K260: 3 | M260: 4 | O260: 5 | Q260: 6 | S260: 7 | U260: 8 | W260: Won | X260: Won | AC260: Change | AD260: Points | AE260: w/Bonus | AF260: 1 | AG260: 2 | AH260: 3 | AI260: 4 | AJ260: 5 | AK260: 6 | AL260: 7 | AM260: 8
A261: 1 | E261: =IF($C261>"",MAX(ROUND(D261+AE261,0),200),"") ->  | F261: XXX | G261: XXX | W261: =IF($C261>"",(IF(F261=3,1,0)+IF(H261=3,1,0)+IF(J261=3,1,0)+IF(L261=3,1,0)+IF(N261=3,1,0)+IF(P261=3,1,0)+IF(R261=3,1,0)+IF(T261=3,1,0)),"") ->  | X261: =IF($C261>"",SUM(F261,H261,J261,L261,N261,P261,R261,T261),"") ->  | Y261: =IF(C261>"",IF(D261<2000,16,8),"") ->  | Z261: =IF($C261>"",IF($D261<2000,2,1),"") ->  | AA261: =IF($C261>"",IF($D261<2000,25,50),"") ->  | AC261: =IF($C261>"",SUM(AF261:AL261),"") ->  | AD261: =IF($C261>"",IF(AC261<=24,0,AC261-24),"") ->  | AE261: =IF($C261>"",AC261+AD261,"") ->  | AF261: XXX | AG261: =RatingChange(D261,OFFSET($D$260,$AG$260,0),H261,I261) ->  | AH261: =RatingChange(D261,OFFSET($D$260,AH$260,0),J261,K261) ->  | AI261: =RatingChange($D261,OFFSET($D$260,AI$260,0),L261,M261) ->  | AJ261: =RatingChange(D261,OFFSET($D$260,$AJ$260,0),N261,O261) ->  | AK261: =RatingChange(D261,OFFSET($D$260,$AK$260,0),P261,Q261) ->  | AL261: =RatingChange(D261,OFFSET($D$260,$AL$260,0),R261,S261) ->  | AM261: =RatingChange(D261,OFFSET($D$260,$AM$260,0),T261,U261) -> 
A262: 2 | E262: =IF($C262>"",MAX(ROUND(D262+AE262,0),200),"") ->  | F262: =IF($C262>"",OFFSET($E260,G260,2*$A262),"") ->  | G262: =IF($C262>"",OFFSET($E260,G260,2*$A262-1),"") ->  | H262: XXX | I262: XXX | W262: =IF($C262>"",(IF(F262=3,1,0)+IF(H262=3,1,0)+IF(J262=3,1,0)+IF(L262=3,1,0)+IF(N262=3,1,0)+IF(P262=3,1,0)+IF(R262=3,1,0)+IF(T262=3,1,0)),"") ->  | X262: =IF($C262>"",SUM(F262,H262,J262,L262,N262,P262,R262,T262),"") ->  | Y262: =IF(C262>"",IF(D262<2000,16,8),"") ->  | Z262: =IF($C262>"",IF($D262<2000,2,1),"") ->  | AA262: =IF($C262>"",IF($D262<2000,25,50),"") ->  | AC262: =IF($C262>"",SUM(AF262:AL262),"") ->  | AD262: =IF($C262>"",IF(AC262<=24,0,AC262-24),"") ->  | AE262: =IF($C262>"",AC262+AD262,"") ->  | AF262: =RatingChange(D262,OFFSET($D$260,AF$260,0),F262,G262) ->  | AG262: XXX | AH262: =RatingChange(D262,OFFSET($D$260,AH$260,0),J262,K262) ->  | AI262: =RatingChange($D262,OFFSET($D$260,AI$260,0),L262,M262) ->  | AJ262: =RatingChange(D262,OFFSET($D$260,$AJ$260,0),N262,O262) ->  | AK262: =RatingChange(D262,OFFSET($D$260,$AK$260,0),P262,Q262) ->  | AL262: =RatingChange(D262,OFFSET($D$260,$AL$260,0),R262,S262) ->  | AM262: =RatingChange(D262,OFFSET($D$260,$AM$260,0),T262,U262) -> 
A263: 3 | E263: =IF($C263>"",MAX(ROUND(D263+AE263,0),200),"") ->  | F263: =IF($C263>"",OFFSET($E260,G260,2*$A263),"") ->  | G263: =IF($C263>"",OFFSET($E260,G260,2*$A263-1),"") ->  | H263: =IF($C263>"",OFFSET($E260,I260,2*$A263),"") ->  | I263: =IF($C263>"",OFFSET($E260,I260,2*$A263-1),"") ->  | J263: XXX | K263: XXX | W263: =IF($C263>"",(IF(F263=3,1,0)+IF(H263=3,1,0)+IF(J263=3,1,0)+IF(L263=3,1,0)+IF(N263=3,1,0)+IF(P263=3,1,0)+IF(R263=3,1,0)+IF(T263=3,1,0)),"") ->  | X263: =IF($C263>"",SUM(F263,H263,J263,L263,N263,P263,R263,T263),"") ->  | Y263: =IF(C263>"",IF(D263<2000,16,8),"") ->  | Z263: =IF($C263>"",IF($D263<2000,2,1),"") ->  | AA263: =IF($C263>"",IF($D263<2000,25,50),"") ->  | AC263: =IF($C263>"",SUM(AF263:AL263),"") ->  | AD263: =IF($C263>"",IF(AC263<=24,0,AC263-24),"") ->  | AE263: =IF($C263>"",AC263+AD263,"") ->  | AF263: =RatingChange(D263,OFFSET($D$260,AF$260,0),F263,G263) ->  | AG263: =RatingChange(D263,OFFSET($D$260,$AG$260,0),H263,I263) ->  | AH263: XXX | AI263: =RatingChange($D263,OFFSET($D$260,AI$260,0),L263,M263) ->  | AJ263: =RatingChange(D263,OFFSET($D$260,$AJ$260,0),N263,O263) ->  | AK263: =RatingChange(D263,OFFSET($D$260,$AK$260,0),P263,Q263) ->  | AL263: =RatingChange(D263,OFFSET($D$260,$AL$260,0),R263,S263) ->  | AM263: =RatingChange(D263,OFFSET($D$260,$AM$260,0),T263,U263) -> 
A264: 4 | E264: =IF($C264>"",MAX(ROUND(D264+AE264,0),200),"") ->  | F264: =IF($C264>"",OFFSET($E260,G260,2*$A264),"") ->  | G264: =IF($C264>"",OFFSET($E260,G260,2*$A264-1),"") ->  | H264: =IF($C264>"",OFFSET($E260,I260,2*$A264),"") ->  | I264: =IF($C264>"",OFFSET($E260,I260,2*$A264-1),"") ->  | J264: =IF($C264>"",OFFSET($E260,K260,2*$A264),"") ->  | K264: =IF($C264>"",OFFSET($E260,K260,2*$A264-1),"") ->  | L264: XXX | M264: XXX | W264: =IF($C264>"",(IF(F264=3,1,0)+IF(H264=3,1,0)+IF(J264=3,1,0)+IF(L264=3,1,0)+IF(N264=3,1,0)+IF(P264=3,1,0)+IF(R264=3,1,0)+IF(T264=3,1,0)),"") ->  | X264: =IF($C264>"",SUM(F264,H264,J264,L264,N264,P264,R264,T264),"") ->  | Y264: =IF(C264>"",IF(D264<2000,16,8),"") ->  | Z264: =IF($C264>"",IF($D264<2000,2,1),"") ->  | AA264: =IF($C264>"",IF($D264<2000,25,50),"") ->  | AC264: =IF($C264>"",SUM(AF264:AL264),"") ->  | AD264: =IF($C264>"",IF(AC264<=24,0,AC264-24),"") ->  | AE264: =IF($C264>"",AC264+AD264,"") ->  | AF264: =RatingChange(D264,OFFSET($D$260,AF$260,0),F264,G264) ->  | AG264: =RatingChange(D264,OFFSET($D$260,$AG$260,0),H264,I264) ->  | AH264: =RatingChange(D264,OFFSET($D$260,AH$260,0),J264,K264) ->  | AI264: XXX | AJ264: =RatingChange(D264,OFFSET($D$260,$AJ$260,0),N264,O264) ->  | AK264: =RatingChange(D264,OFFSET($D$260,$AK$260,0),P264,Q264) ->  | AL264: =RatingChange(D264,OFFSET($D$260,$AL$260,0),R264,S264) ->  | AM264: =RatingChange(D264,OFFSET($D$260,$AM$260,0),T264,U264) -> 
A265: 5 | E265: =IF($C265>"",MAX(ROUND(D265+AE265,0),200),"") ->  | F265: =IF($C265>"",OFFSET($E260,G260,2*$A265),"") ->  | G265: =IF($C265>"",OFFSET($E260,G260,2*$A265-1),"") ->  | H265: =IF($C265>"",OFFSET($E260,I260,2*$A265),"") ->  | I265: =IF($C265>"",OFFSET($E260,I260,2*$A265-1),"") ->  | J265: =IF($C265>"",OFFSET($E260,K260,2*$A265),"") ->  | K265: =IF($C265>"",OFFSET($E260,K260,2*$A265-1),"") ->  | L265: =IF($C265>"",OFFSET($E260,M260,2*$A265),"") ->  | M265: =IF($C265>"",OFFSET($E260,M260,2*$A265-1),"") ->  | N265: XXX | O265: XXX | W265: =IF($C265>"",(IF(F265=3,1,0)+IF(H265=3,1,0)+IF(J265=3,1,0)+IF(L265=3,1,0)+IF(N265=3,1,0)+IF(P265=3,1,0)+IF(R265=3,1,0)+IF(T265=3,1,0)),"") ->  | X265: =IF($C265>"",SUM(F265,H265,J265,L265,N265,P265,R265,T265),"") ->  | Y265: =IF(C265>"",IF(D265<2000,16,8),"") ->  | Z265: =IF($C265>"",IF($D265<2000,2,1),"") ->  | AA265: =IF($C265>"",IF($D265<2000,25,50),"") ->  | AC265: =IF($C265>"",SUM(AF265:AL265),"") ->  | AD265: =IF($C265>"",IF(AC265<=24,0,AC265-24),"") ->  | AE265: =IF($C265>"",AC265+AD265,"") ->  | AF265: =RatingChange(D265,OFFSET($D$260,AF$260,0),F265,G265) ->  | AG265: =RatingChange(D265,OFFSET($D$260,$AG$260,0),H265,I265) ->  | AH265: =RatingChange(D265,OFFSET($D$260,AH$260,0),J265,K265) ->  | AI265: =RatingChange($D265,OFFSET($D$260,AI$260,0),L265,M265) ->  | AJ265: XXX | AK265: =RatingChange(D265,OFFSET($D$260,$AK$260,0),P265,Q265) ->  | AL265: =RatingChange(D265,OFFSET($D$260,$AL$260,0),R265,S265) ->  | AM265: =RatingChange(D265,OFFSET($D$260,$AM$260,0),T265,U265) -> 
A266: 6 | E266: =IF($C266>"",MAX(ROUND(D266+AE266,0),200),"") ->  | F266: =IF($C266>"",OFFSET($E260,G260,2*$A266),"") ->  | G266: =IF($C266>"",OFFSET($E260,G260,2*$A266-1),"") ->  | H266: =IF($C266>"",OFFSET($E260,I260,2*$A266),"") ->  | I266: =IF($C266>"",OFFSET($E260,I260,2*$A266-1),"") ->  | J266: =IF($C266>"",OFFSET($E260,K260,2*$A266),"") ->  | K266: =IF($C266>"",OFFSET($E260,K260,2*$A266-1),"") ->  | L266: =IF($C266>"",OFFSET($E260,M260,2*$A266),"") ->  | M266: =IF($C266>"",OFFSET($E260,M260,2*$A266-1),"") ->  | N266: =IF($C266>"",OFFSET($E260,O260,2*$A266),"") ->  | O266: =IF($C266>"",OFFSET($E260,O260,2*$A266-1),"") ->  | P266: XXX | Q266: XXX | W266: =IF($C266>"",(IF(F266=3,1,0)+IF(H266=3,1,0)+IF(J266=3,1,0)+IF(L266=3,1,0)+IF(N266=3,1,0)+IF(P266=3,1,0)+IF(R266=3,1,0)+IF(T266=3,1,0)),"") ->  | X266: =IF($C266>"",SUM(F266,H266,J266,L266,N266,P266,R266,T266),"") ->  | Y266: =IF(C266>"",IF(D266<2000,16,8),"") ->  | Z266: =IF($C266>"",IF($D266<2000,2,1),"") ->  | AA266: =IF($C266>"",IF($D266<2000,25,50),"") ->  | AC266: =IF($C266>"",SUM(AF266:AL266),"") ->  | AD266: =IF($C266>"",IF(AC266<=24,0,AC266-24),"") ->  | AE266: =IF($C266>"",AC266+AD266,"") ->  | AF266: =RatingChange(D266,OFFSET($D$260,AF$260,0),F266,G266) ->  | AG266: =RatingChange(D266,OFFSET($D$260,$AG$260,0),H266,I266) ->  | AH266: =RatingChange(D266,OFFSET($D$260,AH$260,0),J266,K266) ->  | AI266: =RatingChange($D266,OFFSET($D$260,AI$260,0),L266,M266) ->  | AJ266: =RatingChange(D266,OFFSET($D$260,$AJ$260,0),N266,O266) ->  | AK266: XXX | AL266: =RatingChange(D266,OFFSET($D$260,$AL$260,0),R266,S266) ->  | AM266: =RatingChange(D266,OFFSET($D$260,$AM$260,0),T266,U266) -> 
A267: 7 | E267: =IF($C267>"",MAX(ROUND(D267+AE267,0),200),"") ->  | F267: =IF($C267>"",OFFSET($E260,G260,2*$A267),"") ->  | G267: =IF($C267>"",OFFSET($E260,G260,2*$A267-1),"") ->  | H267: =IF($C267>"",OFFSET($E260,I260,2*$A267),"") ->  | I267: =IF($C267>"",OFFSET($E260,I260,2*$A267-1),"") ->  | J267: =IF($C267>"",OFFSET($E260,K260,2*$A267),"") ->  | K267: =IF($C267>"",OFFSET($E260,K260,2*$A267-1),"") ->  | L267: =IF($C267>"",OFFSET($E260,M260,2*$A267),"") ->  | M267: =IF($C267>"",OFFSET($E260,M260,2*$A267-1),"") ->  | N267: =IF($C267>"",OFFSET($E260,O260,2*$A267),"") ->  | O267: =IF($C267>"",OFFSET($E260,O260,2*$A267-1),"") ->  | P267: =IF($C267>"",OFFSET($E260,Q260,2*$A267),"") ->  | Q267: =IF($C267>"",OFFSET($E260,Q260,2*$A267-1),"") ->  | R267: XXX | S267: XXX | W267: =IF($C267>"",(IF(F267=3,1,0)+IF(H267=3,1,0)+IF(J267=3,1,0)+IF(L267=3,1,0)+IF(N267=3,1,0)+IF(P267=3,1,0)+IF(R267=3,1,0)+IF(T267=3,1,0)),"") ->  | X267: =IF($C267>"",SUM(F267,H267,J267,L267,N267,P267,R267,T267),"") ->  | Y267: =IF(C267>"",IF(D267<2000,16,8),"") ->  | Z267: =IF($C267>"",IF($D267<2000,2,1),"") ->  | AA267: =IF($C267>"",IF($D267<2000,25,50),"") ->  | AC267: =IF($C267>"",SUM(AF267:AL267),"") ->  | AD267: =IF($C267>"",IF(AC267<=24,0,AC267-24),"") ->  | AE267: =IF($C267>"",AC267+AD267,"") ->  | AF267: =RatingChange(D267,OFFSET($D$260,AF$260,0),F267,G267) ->  | AG267: =RatingChange(D267,OFFSET($D$260,$AG$260,0),H267,I267) ->  | AH267: =RatingChange(D267,OFFSET($D$260,AH$260,0),J267,K267) ->  | AI267: =RatingChange($D267,OFFSET($D$260,AI$260,0),L267,M267) ->  | AJ267: =RatingChange(D267,OFFSET($D$260,$AJ$260,0),N267,O267) ->  | AK267: =RatingChange(D267,OFFSET($D$260,$AK$260,0),P267,Q267) ->  | AL267: XXX | AM267: =RatingChange(D267,OFFSET($D$260,$AM$260,0),T267,U267) -> 
A268: 8 | E268: =IF($C268>"",MAX(ROUND(D268+AE268,0),200),"") ->  | F268: =IF($C268>"",OFFSET($E260,G260,2*$A268),"") ->  | G268: =IF($C268>"",OFFSET($E260,G260,2*$A268-1),"") ->  | H268: =IF($C268>"",OFFSET($E260,I260,2*$A268),"") ->  | I268: =IF($C268>"",OFFSET($E260,I260,2*$A268-1),"") ->  | J268: =IF($C268>"",OFFSET($E260,K260,2*$A268),"") ->  | K268: =IF($C268>"",OFFSET($E260,K260,2*$A268-1),"") ->  | L268: =IF($C268>"",OFFSET($E260,M260,2*$A268),"") ->  | M268: =IF($C268>"",OFFSET($E260,M260,2*$A268-1),"") ->  | N268: =IF($C268>"",OFFSET($E260,O260,2*$A268),"") ->  | O268: =IF($C268>"",OFFSET($E260,O260,2*$A268-1),"") ->  | P268: =IF($C268>"",OFFSET($E260,Q260,2*$A268),"") ->  | Q268: =IF($C268>"",OFFSET($E260,Q260,2*$A268-1),"") ->  | R268: =IF($C268>"",OFFSET($E260,S260,2*$A268),"") ->  | S268: =IF($C268>"",OFFSET($E260,S260,2*$A268-1),"") ->  | T268: XXX | U268: XXX | W268: =IF($C268>"",(IF(F268=3,1,0)+IF(H268=3,1,0)+IF(J268=3,1,0)+IF(L268=3,1,0)+IF(N268=3,1,0)+IF(P268=3,1,0)+IF(R268=3,1,0)+IF(T268=3,1,0)),"") ->  | X268: =IF($C268>"",SUM(F268,H268,J268,L268,N268,P268,R268,T268),"") ->  | Y268: =IF(C268>"",IF(D268<2000,16,8),"") ->  | Z268: =IF($C268>"",IF($D268<2000,2,1),"") ->  | AA268: =IF($C268>"",IF($D268<2000,25,50),"") ->  | AC268: =IF($C268>"",SUM(AF268:AL268),"") ->  | AD268: =IF($C268>"",IF(AC268<=24,0,AC268-24),"") ->  | AE268: =IF($C268>"",AC268+AD268,"") ->  | AF268: =RatingChange(D268,OFFSET($D$260,AF$260,0),F268,G268) ->  | AG268: =RatingChange(D268,OFFSET($D$260,$AG$260,0),H268,I268) ->  | AH268: =RatingChange(D268,OFFSET($D$260,AH$260,0),J268,K268) ->  | AI268: =RatingChange($D268,OFFSET($D$260,AI$260,0),L268,M268) ->  | AJ268: =RatingChange(D268,OFFSET($D$260,$AJ$260,0),N268,O268) ->  | AK268: =RatingChange(D268,OFFSET($D$260,$AK$260,0),P268,Q268) ->  | AL268: =RatingChange(D268,OFFSET($D$260,$AL$260,0),R268,S268) ->  | AM268: XXX
A274: # | B274: ID | C274: Name | D274: Rating | E274: Rating | J274: Games Won/Lost against | W274: Matches | X274: Games | AC274: Rating | AD274: Bonus | AE274: Change | AF274: Rating change vs.
A275: 19 | D275: Pre | E275: Post | G275: 1 | I275: 2 | K275: 3 | M275: 4 | O275: 5 | Q275: 6 | S275: 7 | U275: 8 | W275: Won | X275: Won | AC275: Change | AD275: Points | AE275: w/Bonus | AF275: 1 | AG275: 2 | AH275: 3 | AI275: 4 | AJ275: 5 | AK275: 6 | AL275: 7 | AM275: 8
A276: 1 | E276: =IF($C276>"",MAX(ROUND(D276+AE276,0),200),"") ->  | F276: XXX | G276: XXX | W276: =IF($C276>"",(IF(F276=3,1,0)+IF(H276=3,1,0)+IF(J276=3,1,0)+IF(L276=3,1,0)+IF(N276=3,1,0)+IF(P276=3,1,0)+IF(R276=3,1,0)+IF(T276=3,1,0)),"") ->  | X276: =IF($C276>"",SUM(F276,H276,J276,L276,N276,P276,R276,T276),"") ->  | Y276: =IF(C276>"",IF(D276<2000,16,8),"") ->  | Z276: =IF($C276>"",IF($D276<2000,2,1),"") ->  | AA276: =IF($C276>"",IF($D276<2000,25,50),"") ->  | AC276: =IF($C276>"",SUM(AF276:AL276),"") ->  | AD276: =IF($C276>"",IF(AC276<=24,0,AC276-24),"") ->  | AE276: =IF($C276>"",AC276+AD276,"") ->  | AF276: XXX | AG276: =RatingChange(D276,OFFSET($D$275,$AG$275,0),H276,I276) ->  | AH276: =RatingChange(D276,OFFSET($D$275,AH$275,0),J276,K276) ->  | AI276: =RatingChange($D276,OFFSET($D$275,AI$275,0),L276,M276) ->  | AJ276: =RatingChange(D276,OFFSET($D$275,$AJ$275,0),N276,O276) ->  | AK276: =RatingChange(D276,OFFSET($D$275,$AK$275,0),P276,Q276) ->  | AL276: =RatingChange(D276,OFFSET($D$275,$AL$275,0),R276,S276) ->  | AM276: =RatingChange(D276,OFFSET($D$275,$AM$275,0),T276,U276) -> 
A277: 2 | E277: =IF($C277>"",MAX(ROUND(D277+AE277,0),200),"") ->  | F277: =IF($C277>"",OFFSET($E275,G275,2*$A277),"") ->  | G277: =IF($C277>"",OFFSET($E275,G275,2*$A277-1),"") ->  | H277: XXX | I277: XXX | W277: =IF($C277>"",(IF(F277=3,1,0)+IF(H277=3,1,0)+IF(J277=3,1,0)+IF(L277=3,1,0)+IF(N277=3,1,0)+IF(P277=3,1,0)+IF(R277=3,1,0)+IF(T277=3,1,0)),"") ->  | X277: =IF($C277>"",SUM(F277,H277,J277,L277,N277,P277,R277,T277),"") ->  | Y277: =IF(C277>"",IF(D277<2000,16,8),"") ->  | Z277: =IF($C277>"",IF($D277<2000,2,1),"") ->  | AA277: =IF($C277>"",IF($D277<2000,25,50),"") ->  | AC277: =IF($C277>"",SUM(AF277:AL277),"") ->  | AD277: =IF($C277>"",IF(AC277<=24,0,AC277-24),"") ->  | AE277: =IF($C277>"",AC277+AD277,"") ->  | AF277: =RatingChange(D277,OFFSET($D$275,AF$275,0),F277,G277) ->  | AG277: XXX | AH277: =RatingChange(D277,OFFSET($D$275,AH$275,0),J277,K277) ->  | AI277: =RatingChange($D277,OFFSET($D$275,AI$275,0),L277,M277) ->  | AJ277: =RatingChange(D277,OFFSET($D$275,$AJ$275,0),N277,O277) ->  | AK277: =RatingChange(D277,OFFSET($D$275,$AK$275,0),P277,Q277) ->  | AL277: =RatingChange(D277,OFFSET($D$275,$AL$275,0),R277,S277) ->  | AM277: =RatingChange(D277,OFFSET($D$275,$AM$275,0),T277,U277) -> 
A278: 3 | E278: =IF($C278>"",MAX(ROUND(D278+AE278,0),200),"") ->  | F278: =IF($C278>"",OFFSET($E275,G275,2*$A278),"") ->  | G278: =IF($C278>"",OFFSET($E275,G275,2*$A278-1),"") ->  | H278: =IF($C278>"",OFFSET($E275,I275,2*$A278),"") ->  | I278: =IF($C278>"",OFFSET($E275,I275,2*$A278-1),"") ->  | J278: XXX | K278: XXX | W278: =IF($C278>"",(IF(F278=3,1,0)+IF(H278=3,1,0)+IF(J278=3,1,0)+IF(L278=3,1,0)+IF(N278=3,1,0)+IF(P278=3,1,0)+IF(R278=3,1,0)+IF(T278=3,1,0)),"") ->  | X278: =IF($C278>"",SUM(F278,H278,J278,L278,N278,P278,R278,T278),"") ->  | Y278: =IF(C278>"",IF(D278<2000,16,8),"") ->  | Z278: =IF($C278>"",IF($D278<2000,2,1),"") ->  | AA278: =IF($C278>"",IF($D278<2000,25,50),"") ->  | AC278: =IF($C278>"",SUM(AF278:AL278),"") ->  | AD278: =IF($C278>"",IF(AC278<=24,0,AC278-24),"") ->  | AE278: =IF($C278>"",AC278+AD278,"") ->  | AF278: =RatingChange(D278,OFFSET($D$275,AF$275,0),F278,G278) ->  | AG278: =RatingChange(D278,OFFSET($D$275,$AG$275,0),H278,I278) ->  | AH278: XXX | AI278: =RatingChange($D278,OFFSET($D$275,AI$275,0),L278,M278) ->  | AJ278: =RatingChange(D278,OFFSET($D$275,$AJ$275,0),N278,O278) ->  | AK278: =RatingChange(D278,OFFSET($D$275,$AK$275,0),P278,Q278) ->  | AL278: =RatingChange(D278,OFFSET($D$275,$AL$275,0),R278,S278) ->  | AM278: =RatingChange(D278,OFFSET($D$275,$AM$275,0),T278,U278) -> 
A279: 4 | E279: =IF($C279>"",MAX(ROUND(D279+AE279,0),200),"") ->  | F279: =IF($C279>"",OFFSET($E275,G275,2*$A279),"") ->  | G279: =IF($C279>"",OFFSET($E275,G275,2*$A279-1),"") ->  | H279: =IF($C279>"",OFFSET($E275,I275,2*$A279),"") ->  | I279: =IF($C279>"",OFFSET($E275,I275,2*$A279-1),"") ->  | J279: =IF($C279>"",OFFSET($E275,K275,2*$A279),"") ->  | K279: =IF($C279>"",OFFSET($E275,K275,2*$A279-1),"") ->  | L279: XXX | M279: XXX | W279: =IF($C279>"",(IF(F279=3,1,0)+IF(H279=3,1,0)+IF(J279=3,1,0)+IF(L279=3,1,0)+IF(N279=3,1,0)+IF(P279=3,1,0)+IF(R279=3,1,0)+IF(T279=3,1,0)),"") ->  | X279: =IF($C279>"",SUM(F279,H279,J279,L279,N279,P279,R279,T279),"") ->  | Y279: =IF(C279>"",IF(D279<2000,16,8),"") ->  | Z279: =IF($C279>"",IF($D279<2000,2,1),"") ->  | AA279: =IF($C279>"",IF($D279<2000,25,50),"") ->  | AC279: =IF($C279>"",SUM(AF279:AL279),"") ->  | AD279: =IF($C279>"",IF(AC279<=24,0,AC279-24),"") ->  | AE279: =IF($C279>"",AC279+AD279,"") ->  | AF279: =RatingChange(D279,OFFSET($D$275,AF$275,0),F279,G279) ->  | AG279: =RatingChange(D279,OFFSET($D$275,$AG$275,0),H279,I279) ->  | AH279: =RatingChange(D279,OFFSET($D$275,AH$275,0),J279,K279) ->  | AI279: XXX | AJ279: =RatingChange(D279,OFFSET($D$275,$AJ$275,0),N279,O279) ->  | AK279: =RatingChange(D279,OFFSET($D$275,$AK$275,0),P279,Q279) ->  | AL279: =RatingChange(D279,OFFSET($D$275,$AL$275,0),R279,S279) ->  | AM279: =RatingChange(D279,OFFSET($D$275,$AM$275,0),T279,U279) -> 
A280: 5 | E280: =IF($C280>"",MAX(ROUND(D280+AE280,0),200),"") ->  | F280: =IF($C280>"",OFFSET($E275,G275,2*$A280),"") ->  | G280: =IF($C280>"",OFFSET($E275,G275,2*$A280-1),"") ->  | H280: =IF($C280>"",OFFSET($E275,I275,2*$A280),"") ->  | I280: =IF($C280>"",OFFSET($E275,I275,2*$A280-1),"") ->  | J280: =IF($C280>"",OFFSET($E275,K275,2*$A280),"") ->  | K280: =IF($C280>"",OFFSET($E275,K275,2*$A280-1),"") ->  | L280: =IF($C280>"",OFFSET($E275,M275,2*$A280),"") ->  | M280: =IF($C280>"",OFFSET($E275,M275,2*$A280-1),"") ->  | N280: XXX | O280: XXX | W280: =IF($C280>"",(IF(F280=3,1,0)+IF(H280=3,1,0)+IF(J280=3,1,0)+IF(L280=3,1,0)+IF(N280=3,1,0)+IF(P280=3,1,0)+IF(R280=3,1,0)+IF(T280=3,1,0)),"") ->  | X280: =IF($C280>"",SUM(F280,H280,J280,L280,N280,P280,R280,T280),"") ->  | Y280: =IF(C280>"",IF(D280<2000,16,8),"") ->  | Z280: =IF($C280>"",IF($D280<2000,2,1),"") ->  | AA280: =IF($C280>"",IF($D280<2000,25,50),"") ->  | AC280: =IF($C280>"",SUM(AF280:AL280),"") ->  | AD280: =IF($C280>"",IF(AC280<=24,0,AC280-24),"") ->  | AE280: =IF($C280>"",AC280+AD280,"") ->  | AF280: =RatingChange(D280,OFFSET($D$275,AF$275,0),F280,G280) ->  | AG280: =RatingChange(D280,OFFSET($D$275,$AG$275,0),H280,I280) ->  | AH280: =RatingChange(D280,OFFSET($D$275,AH$275,0),J280,K280) ->  | AI280: =RatingChange($D280,OFFSET($D$275,AI$275,0),L280,M280) ->  | AJ280: XXX | AK280: =RatingChange(D280,OFFSET($D$275,$AK$275,0),P280,Q280) ->  | AL280: =RatingChange(D280,OFFSET($D$275,$AL$275,0),R280,S280) ->  | AM280: =RatingChange(D280,OFFSET($D$275,$AM$275,0),T280,U280) -> 
A281: 6 | E281: =IF($C281>"",MAX(ROUND(D281+AE281,0),200),"") ->  | F281: =IF($C281>"",OFFSET($E275,G275,2*$A281),"") ->  | G281: =IF($C281>"",OFFSET($E275,G275,2*$A281-1),"") ->  | H281: =IF($C281>"",OFFSET($E275,I275,2*$A281),"") ->  | I281: =IF($C281>"",OFFSET($E275,I275,2*$A281-1),"") ->  | J281: =IF($C281>"",OFFSET($E275,K275,2*$A281),"") ->  | K281: =IF($C281>"",OFFSET($E275,K275,2*$A281-1),"") ->  | L281: =IF($C281>"",OFFSET($E275,M275,2*$A281),"") ->  | M281: =IF($C281>"",OFFSET($E275,M275,2*$A281-1),"") ->  | N281: =IF($C281>"",OFFSET($E275,O275,2*$A281),"") ->  | O281: =IF($C281>"",OFFSET($E275,O275,2*$A281-1),"") ->  | P281: XXX | Q281: XXX | W281: =IF($C281>"",(IF(F281=3,1,0)+IF(H281=3,1,0)+IF(J281=3,1,0)+IF(L281=3,1,0)+IF(N281=3,1,0)+IF(P281=3,1,0)+IF(R281=3,1,0)+IF(T281=3,1,0)),"") ->  | X281: =IF($C281>"",SUM(F281,H281,J281,L281,N281,P281,R281,T281),"") ->  | Y281: =IF(C281>"",IF(D281<2000,16,8),"") ->  | Z281: =IF($C281>"",IF($D281<2000,2,1),"") ->  | AA281: =IF($C281>"",IF($D281<2000,25,50),"") ->  | AC281: =IF($C281>"",SUM(AF281:AL281),"") ->  | AD281: =IF($C281>"",IF(AC281<=24,0,AC281-24),"") ->  | AE281: =IF($C281>"",AC281+AD281,"") ->  | AF281: =RatingChange(D281,OFFSET($D$275,AF$275,0),F281,G281) ->  | AG281: =RatingChange(D281,OFFSET($D$275,$AG$275,0),H281,I281) ->  | AH281: =RatingChange(D281,OFFSET($D$275,AH$275,0),J281,K281) ->  | AI281: =RatingChange($D281,OFFSET($D$275,AI$275,0),L281,M281) ->  | AJ281: =RatingChange(D281,OFFSET($D$275,$AJ$275,0),N281,O281) ->  | AK281: XXX | AL281: =RatingChange(D281,OFFSET($D$275,$AL$275,0),R281,S281) ->  | AM281: =RatingChange(D281,OFFSET($D$275,$AM$275,0),T281,U281) -> 
A282: 7 | E282: =IF($C282>"",MAX(ROUND(D282+AE282,0),200),"") ->  | F282: =IF($C282>"",OFFSET($E275,G275,2*$A282),"") ->  | G282: =IF($C282>"",OFFSET($E275,G275,2*$A282-1),"") ->  | H282: =IF($C282>"",OFFSET($E275,I275,2*$A282),"") ->  | I282: =IF($C282>"",OFFSET($E275,I275,2*$A282-1),"") ->  | J282: =IF($C282>"",OFFSET($E275,K275,2*$A282),"") ->  | K282: =IF($C282>"",OFFSET($E275,K275,2*$A282-1),"") ->  | L282: =IF($C282>"",OFFSET($E275,M275,2*$A282),"") ->  | M282: =IF($C282>"",OFFSET($E275,M275,2*$A282-1),"") ->  | N282: =IF($C282>"",OFFSET($E275,O275,2*$A282),"") ->  | O282: =IF($C282>"",OFFSET($E275,O275,2*$A282-1),"") ->  | P282: =IF($C282>"",OFFSET($E275,Q275,2*$A282),"") ->  | Q282: =IF($C282>"",OFFSET($E275,Q275,2*$A282-1),"") ->  | R282: XXX | S282: XXX | W282: =IF($C282>"",(IF(F282=3,1,0)+IF(H282=3,1,0)+IF(J282=3,1,0)+IF(L282=3,1,0)+IF(N282=3,1,0)+IF(P282=3,1,0)+IF(R282=3,1,0)+IF(T282=3,1,0)),"") ->  | X282: =IF($C282>"",SUM(F282,H282,J282,L282,N282,P282,R282,T282),"") ->  | Y282: =IF(C282>"",IF(D282<2000,16,8),"") ->  | Z282: =IF($C282>"",IF($D282<2000,2,1),"") ->  | AA282: =IF($C282>"",IF($D282<2000,25,50),"") ->  | AC282: =IF($C282>"",SUM(AF282:AL282),"") ->  | AD282: =IF($C282>"",IF(AC282<=24,0,AC282-24),"") ->  | AE282: =IF($C282>"",AC282+AD282,"") ->  | AF282: =RatingChange(D282,OFFSET($D$275,AF$275,0),F282,G282) ->  | AG282: =RatingChange(D282,OFFSET($D$275,$AG$275,0),H282,I282) ->  | AH282: =RatingChange(D282,OFFSET($D$275,AH$275,0),J282,K282) ->  | AI282: =RatingChange($D282,OFFSET($D$275,AI$275,0),L282,M282) ->  | AJ282: =RatingChange(D282,OFFSET($D$275,$AJ$275,0),N282,O282) ->  | AK282: =RatingChange(D282,OFFSET($D$275,$AK$275,0),P282,Q282) ->  | AL282: XXX | AM282: =RatingChange(D282,OFFSET($D$275,$AM$275,0),T282,U282) -> 
A283: 8 | E283: =IF($C283>"",MAX(ROUND(D283+AE283,0),200),"") ->  | F283: =IF($C283>"",OFFSET($E275,G275,2*$A283),"") ->  | G283: =IF($C283>"",OFFSET($E275,G275,2*$A283-1),"") ->  | H283: =IF($C283>"",OFFSET($E275,I275,2*$A283),"") ->  | I283: =IF($C283>"",OFFSET($E275,I275,2*$A283-1),"") ->  | J283: =IF($C283>"",OFFSET($E275,K275,2*$A283),"") ->  | K283: =IF($C283>"",OFFSET($E275,K275,2*$A283-1),"") ->  | L283: =IF($C283>"",OFFSET($E275,M275,2*$A283),"") ->  | M283: =IF($C283>"",OFFSET($E275,M275,2*$A283-1),"") ->  | N283: =IF($C283>"",OFFSET($E275,O275,2*$A283),"") ->  | O283: =IF($C283>"",OFFSET($E275,O275,2*$A283-1),"") ->  | P283: =IF($C283>"",OFFSET($E275,Q275,2*$A283),"") ->  | Q283: =IF($C283>"",OFFSET($E275,Q275,2*$A283-1),"") ->  | R283: =IF($C283>"",OFFSET($E275,S275,2*$A283),"") ->  | S283: =IF($C283>"",OFFSET($E275,S275,2*$A283-1),"") ->  | T283: XXX | U283: XXX | W283: =IF($C283>"",(IF(F283=3,1,0)+IF(H283=3,1,0)+IF(J283=3,1,0)+IF(L283=3,1,0)+IF(N283=3,1,0)+IF(P283=3,1,0)+IF(R283=3,1,0)+IF(T283=3,1,0)),"") ->  | X283: =IF($C283>"",SUM(F283,H283,J283,L283,N283,P283,R283,T283),"") ->  | Y283: =IF(C283>"",IF(D283<2000,16,8),"") ->  | Z283: =IF($C283>"",IF($D283<2000,2,1),"") ->  | AA283: =IF($C283>"",IF($D283<2000,25,50),"") ->  | AC283: =IF($C283>"",SUM(AF283:AL283),"") ->  | AD283: =IF($C283>"",IF(AC283<=24,0,AC283-24),"") ->  | AE283: =IF($C283>"",AC283+AD283,"") ->  | AF283: =RatingChange(D283,OFFSET($D$275,AF$275,0),F283,G283) ->  | AG283: =RatingChange(D283,OFFSET($D$275,$AG$275,0),H283,I283) ->  | AH283: =RatingChange(D283,OFFSET($D$275,AH$275,0),J283,K283) ->  | AI283: =RatingChange($D283,OFFSET($D$275,AI$275,0),L283,M283) ->  | AJ283: =RatingChange(D283,OFFSET($D$275,$AJ$275,0),N283,O283) ->  | AK283: =RatingChange(D283,OFFSET($D$275,$AK$275,0),P283,Q283) ->  | AL283: =RatingChange(D283,OFFSET($D$275,$AL$275,0),R283,S283) ->  | AM283: XXX
A289: # | B289: ID | C289: Name | D289: Rating | E289: Rating | J289: Games Won/Lost against | W289: Matches | X289: Games | AC289: Rating | AD289: Bonus | AE289: Change | AF289: Rating change vs.
A290: 20 | D290: Pre | E290: Post | G290: 1 | I290: 2 | K290: 3 | M290: 4 | O290: 5 | Q290: 6 | S290: 7 | U290: 8 | W290: Won | X290: Won | AC290: Change | AD290: Points | AE290: w/Bonus | AF290: 1 | AG290: 2 | AH290: 3 | AI290: 4 | AJ290: 5 | AK290: 6 | AL290: 7 | AM290: 8
A291: 1 | E291: =IF($C291>"",MAX(ROUND(D291+AE291,0),200),"") ->  | F291: XXX | G291: XXX | W291: =IF($C291>"",(IF(F291=3,1,0)+IF(H291=3,1,0)+IF(J291=3,1,0)+IF(L291=3,1,0)+IF(N291=3,1,0)+IF(P291=3,1,0)+IF(R291=3,1,0)+IF(T291=3,1,0)),"") ->  | X291: =IF($C291>"",SUM(F291,H291,J291,L291,N291,P291,R291,T291),"") ->  | Y291: =IF(C291>"",IF(D291<2000,16,8),"") ->  | Z291: =IF($C291>"",IF($D291<2000,2,1),"") ->  | AA291: =IF($C291>"",IF($D291<2000,25,50),"") ->  | AC291: =IF($C291>"",SUM(AF291:AL291),"") ->  | AD291: =IF($C291>"",IF(AC291<=24,0,AC291-24),"") ->  | AE291: =IF($C291>"",AC291+AD291,"") ->  | AF291: XXX | AG291: =RatingChange(D291,OFFSET($D$290,$AG$290,0),H291,I291) ->  | AH291: =RatingChange(D291,OFFSET($D$290,AH$290,0),J291,K291) ->  | AI291: =RatingChange($D291,OFFSET($D$290,AI$290,0),L291,M291) ->  | AJ291: =RatingChange(D291,OFFSET($D$290,$AJ$290,0),N291,O291) ->  | AK291: =RatingChange(D291,OFFSET($D$290,$AK$290,0),P291,Q291) ->  | AL291: =RatingChange(D291,OFFSET($D$290,$AL$290,0),R291,S291) ->  | AM291: =RatingChange(D291,OFFSET($D$290,$AM$290,0),T291,U291) -> 
A292: 2 | E292: =IF($C292>"",MAX(ROUND(D292+AE292,0),200),"") ->  | F292: =IF($C292>"",OFFSET($E290,G290,2*$A292),"") ->  | G292: =IF($C292>"",OFFSET($E290,G290,2*$A292-1),"") ->  | H292: XXX | I292: XXX | W292: =IF($C292>"",(IF(F292=3,1,0)+IF(H292=3,1,0)+IF(J292=3,1,0)+IF(L292=3,1,0)+IF(N292=3,1,0)+IF(P292=3,1,0)+IF(R292=3,1,0)+IF(T292=3,1,0)),"") ->  | X292: =IF($C292>"",SUM(F292,H292,J292,L292,N292,P292,R292,T292),"") ->  | Y292: =IF(C292>"",IF(D292<2000,16,8),"") ->  | Z292: =IF($C292>"",IF($D292<2000,2,1),"") ->  | AA292: =IF($C292>"",IF($D292<2000,25,50),"") ->  | AC292: =IF($C292>"",SUM(AF292:AL292),"") ->  | AD292: =IF($C292>"",IF(AC292<=24,0,AC292-24),"") ->  | AE292: =IF($C292>"",AC292+AD292,"") ->  | AF292: =RatingChange(D292,OFFSET($D$290,AF$290,0),F292,G292) ->  | AG292: XXX | AH292: =RatingChange(D292,OFFSET($D$290,AH$290,0),J292,K292) ->  | AI292: =RatingChange($D292,OFFSET($D$290,AI$290,0),L292,M292) ->  | AJ292: =RatingChange(D292,OFFSET($D$290,$AJ$290,0),N292,O292) ->  | AK292: =RatingChange(D292,OFFSET($D$290,$AK$290,0),P292,Q292) ->  | AL292: =RatingChange(D292,OFFSET($D$290,$AL$290,0),R292,S292) ->  | AM292: =RatingChange(D292,OFFSET($D$290,$AM$290,0),T292,U292) -> 
A293: 3 | E293: =IF($C293>"",MAX(ROUND(D293+AE293,0),200),"") ->  | F293: =IF($C293>"",OFFSET($E290,G290,2*$A293),"") ->  | G293: =IF($C293>"",OFFSET($E290,G290,2*$A293-1),"") ->  | H293: =IF($C293>"",OFFSET($E290,I290,2*$A293),"") ->  | I293: =IF($C293>"",OFFSET($E290,I290,2*$A293-1),"") ->  | J293: XXX | K293: XXX | W293: =IF($C293>"",(IF(F293=3,1,0)+IF(H293=3,1,0)+IF(J293=3,1,0)+IF(L293=3,1,0)+IF(N293=3,1,0)+IF(P293=3,1,0)+IF(R293=3,1,0)+IF(T293=3,1,0)),"") ->  | X293: =IF($C293>"",SUM(F293,H293,J293,L293,N293,P293,R293,T293),"") ->  | Y293: =IF(C293>"",IF(D293<2000,16,8),"") ->  | Z293: =IF($C293>"",IF($D293<2000,2,1),"") ->  | AA293: =IF($C293>"",IF($D293<2000,25,50),"") ->  | AC293: =IF($C293>"",SUM(AF293:AL293),"") ->  | AD293: =IF($C293>"",IF(AC293<=24,0,AC293-24),"") ->  | AE293: =IF($C293>"",AC293+AD293,"") ->  | AF293: =RatingChange(D293,OFFSET($D$290,AF$290,0),F293,G293) ->  | AG293: =RatingChange(D293,OFFSET($D$290,$AG$290,0),H293,I293) ->  | AH293: XXX | AI293: =RatingChange($D293,OFFSET($D$290,AI$290,0),L293,M293) ->  | AJ293: =RatingChange(D293,OFFSET($D$290,$AJ$290,0),N293,O293) ->  | AK293: =RatingChange(D293,OFFSET($D$290,$AK$290,0),P293,Q293) ->  | AL293: =RatingChange(D293,OFFSET($D$290,$AL$290,0),R293,S293) ->  | AM293: =RatingChange(D293,OFFSET($D$290,$AM$290,0),T293,U293) -> 
A294: 4 | E294: =IF($C294>"",MAX(ROUND(D294+AE294,0),200),"") ->  | F294: =IF($C294>"",OFFSET($E290,G290,2*$A294),"") ->  | G294: =IF($C294>"",OFFSET($E290,G290,2*$A294-1),"") ->  | H294: =IF($C294>"",OFFSET($E290,I290,2*$A294),"") ->  | I294: =IF($C294>"",OFFSET($E290,I290,2*$A294-1),"") ->  | J294: =IF($C294>"",OFFSET($E290,K290,2*$A294),"") ->  | K294: =IF($C294>"",OFFSET($E290,K290,2*$A294-1),"") ->  | L294: XXX | M294: XXX | W294: =IF($C294>"",(IF(F294=3,1,0)+IF(H294=3,1,0)+IF(J294=3,1,0)+IF(L294=3,1,0)+IF(N294=3,1,0)+IF(P294=3,1,0)+IF(R294=3,1,0)+IF(T294=3,1,0)),"") ->  | X294: =IF($C294>"",SUM(F294,H294,J294,L294,N294,P294,R294,T294),"") ->  | Y294: =IF(C294>"",IF(D294<2000,16,8),"") ->  | Z294: =IF($C294>"",IF($D294<2000,2,1),"") ->  | AA294: =IF($C294>"",IF($D294<2000,25,50),"") ->  | AC294: =IF($C294>"",SUM(AF294:AL294),"") ->  | AD294: =IF($C294>"",IF(AC294<=24,0,AC294-24),"") ->  | AE294: =IF($C294>"",AC294+AD294,"") ->  | AF294: =RatingChange(D294,OFFSET($D$290,AF$290,0),F294,G294) ->  | AG294: =RatingChange(D294,OFFSET($D$290,$AG$290,0),H294,I294) ->  | AH294: =RatingChange(D294,OFFSET($D$290,AH$290,0),J294,K294) ->  | AI294: XXX | AJ294: =RatingChange(D294,OFFSET($D$290,$AJ$290,0),N294,O294) ->  | AK294: =RatingChange(D294,OFFSET($D$290,$AK$290,0),P294,Q294) ->  | AL294: =RatingChange(D294,OFFSET($D$290,$AL$290,0),R294,S294) ->  | AM294: =RatingChange(D294,OFFSET($D$290,$AM$290,0),T294,U294) -> 
A295: 5 | E295: =IF($C295>"",MAX(ROUND(D295+AE295,0),200),"") ->  | F295: =IF($C295>"",OFFSET($E290,G290,2*$A295),"") ->  | G295: =IF($C295>"",OFFSET($E290,G290,2*$A295-1),"") ->  | H295: =IF($C295>"",OFFSET($E290,I290,2*$A295),"") ->  | I295: =IF($C295>"",OFFSET($E290,I290,2*$A295-1),"") ->  | J295: =IF($C295>"",OFFSET($E290,K290,2*$A295),"") ->  | K295: =IF($C295>"",OFFSET($E290,K290,2*$A295-1),"") ->  | L295: =IF($C295>"",OFFSET($E290,M290,2*$A295),"") ->  | M295: =IF($C295>"",OFFSET($E290,M290,2*$A295-1),"") ->  | N295: XXX | O295: XXX | W295: =IF($C295>"",(IF(F295=3,1,0)+IF(H295=3,1,0)+IF(J295=3,1,0)+IF(L295=3,1,0)+IF(N295=3,1,0)+IF(P295=3,1,0)+IF(R295=3,1,0)+IF(T295=3,1,0)),"") ->  | X295: =IF($C295>"",SUM(F295,H295,J295,L295,N295,P295,R295,T295),"") ->  | Y295: =IF(C295>"",IF(D295<2000,16,8),"") ->  | Z295: =IF($C295>"",IF($D295<2000,2,1),"") ->  | AA295: =IF($C295>"",IF($D295<2000,25,50),"") ->  | AC295: =IF($C295>"",SUM(AF295:AL295),"") ->  | AD295: =IF($C295>"",IF(AC295<=24,0,AC295-24),"") ->  | AE295: =IF($C295>"",AC295+AD295,"") ->  | AF295: =RatingChange(D295,OFFSET($D$290,AF$290,0),F295,G295) ->  | AG295: =RatingChange(D295,OFFSET($D$290,$AG$290,0),H295,I295) ->  | AH295: =RatingChange(D295,OFFSET($D$290,AH$290,0),J295,K295) ->  | AI295: =RatingChange($D295,OFFSET($D$290,AI$290,0),L295,M295) ->  | AJ295: XXX | AK295: =RatingChange(D295,OFFSET($D$290,$AK$290,0),P295,Q295) ->  | AL295: =RatingChange(D295,OFFSET($D$290,$AL$290,0),R295,S295) ->  | AM295: =RatingChange(D295,OFFSET($D$290,$AM$290,0),T295,U295) -> 
A296: 6 | E296: =IF($C296>"",MAX(ROUND(D296+AE296,0),200),"") ->  | F296: =IF($C296>"",OFFSET($E290,G290,2*$A296),"") ->  | G296: =IF($C296>"",OFFSET($E290,G290,2*$A296-1),"") ->  | H296: =IF($C296>"",OFFSET($E290,I290,2*$A296),"") ->  | I296: =IF($C296>"",OFFSET($E290,I290,2*$A296-1),"") ->  | J296: =IF($C296>"",OFFSET($E290,K290,2*$A296),"") ->  | K296: =IF($C296>"",OFFSET($E290,K290,2*$A296-1),"") ->  | L296: =IF($C296>"",OFFSET($E290,M290,2*$A296),"") ->  | M296: =IF($C296>"",OFFSET($E290,M290,2*$A296-1),"") ->  | N296: =IF($C296>"",OFFSET($E290,O290,2*$A296),"") ->  | O296: =IF($C296>"",OFFSET($E290,O290,2*$A296-1),"") ->  | P296: XXX | Q296: XXX | W296: =IF($C296>"",(IF(F296=3,1,0)+IF(H296=3,1,0)+IF(J296=3,1,0)+IF(L296=3,1,0)+IF(N296=3,1,0)+IF(P296=3,1,0)+IF(R296=3,1,0)+IF(T296=3,1,0)),"") ->  | X296: =IF($C296>"",SUM(F296,H296,J296,L296,N296,P296,R296,T296),"") ->  | Y296: =IF(C296>"",IF(D296<2000,16,8),"") ->  | Z296: =IF($C296>"",IF($D296<2000,2,1),"") ->  | AA296: =IF($C296>"",IF($D296<2000,25,50),"") ->  | AC296: =IF($C296>"",SUM(AF296:AL296),"") ->  | AD296: =IF($C296>"",IF(AC296<=24,0,AC296-24),"") ->  | AE296: =IF($C296>"",AC296+AD296,"") ->  | AF296: =RatingChange(D296,OFFSET($D$290,AF$290,0),F296,G296) ->  | AG296: =RatingChange(D296,OFFSET($D$290,$AG$290,0),H296,I296) ->  | AH296: =RatingChange(D296,OFFSET($D$290,AH$290,0),J296,K296) ->  | AI296: =RatingChange($D296,OFFSET($D$290,AI$290,0),L296,M296) ->  | AJ296: =RatingChange(D296,OFFSET($D$290,$AJ$290,0),N296,O296) ->  | AK296: XXX | AL296: =RatingChange(D296,OFFSET($D$290,$AL$290,0),R296,S296) ->  | AM296: =RatingChange(D296,OFFSET($D$290,$AM$290,0),T296,U296) -> 
A297: 7 | E297: =IF($C297>"",MAX(ROUND(D297+AE297,0),200),"") ->  | F297: =IF($C297>"",OFFSET($E290,G290,2*$A297),"") ->  | G297: =IF($C297>"",OFFSET($E290,G290,2*$A297-1),"") ->  | H297: =IF($C297>"",OFFSET($E290,I290,2*$A297),"") ->  | I297: =IF($C297>"",OFFSET($E290,I290,2*$A297-1),"") ->  | J297: =IF($C297>"",OFFSET($E290,K290,2*$A297),"") ->  | K297: =IF($C297>"",OFFSET($E290,K290,2*$A297-1),"") ->  | L297: =IF($C297>"",OFFSET($E290,M290,2*$A297),"") ->  | M297: =IF($C297>"",OFFSET($E290,M290,2*$A297-1),"") ->  | N297: =IF($C297>"",OFFSET($E290,O290,2*$A297),"") ->  | O297: =IF($C297>"",OFFSET($E290,O290,2*$A297-1),"") ->  | P297: =IF($C297>"",OFFSET($E290,Q290,2*$A297),"") ->  | Q297: =IF($C297>"",OFFSET($E290,Q290,2*$A297-1),"") ->  | R297: XXX | S297: XXX | W297: =IF($C297>"",(IF(F297=3,1,0)+IF(H297=3,1,0)+IF(J297=3,1,0)+IF(L297=3,1,0)+IF(N297=3,1,0)+IF(P297=3,1,0)+IF(R297=3,1,0)+IF(T297=3,1,0)),"") ->  | X297: =IF($C297>"",SUM(F297,H297,J297,L297,N297,P297,R297,T297),"") ->  | Y297: =IF(C297>"",IF(D297<2000,16,8),"") ->  | Z297: =IF($C297>"",IF($D297<2000,2,1),"") ->  | AA297: =IF($C297>"",IF($D297<2000,25,50),"") ->  | AC297: =IF($C297>"",SUM(AF297:AL297),"") ->  | AD297: =IF($C297>"",IF(AC297<=24,0,AC297-24),"") ->  | AE297: =IF($C297>"",AC297+AD297,"") ->  | AF297: =RatingChange(D297,OFFSET($D$290,AF$290,0),F297,G297) ->  | AG297: =RatingChange(D297,OFFSET($D$290,$AG$290,0),H297,I297) ->  | AH297: =RatingChange(D297,OFFSET($D$290,AH$290,0),J297,K297) ->  | AI297: =RatingChange($D297,OFFSET($D$290,AI$290,0),L297,M297) ->  | AJ297: =RatingChange(D297,OFFSET($D$290,$AJ$290,0),N297,O297) ->  | AK297: =RatingChange(D297,OFFSET($D$290,$AK$290,0),P297,Q297) ->  | AL297: XXX | AM297: =RatingChange(D297,OFFSET($D$290,$AM$290,0),T297,U297) -> 
A298: 8 | E298: =IF($C298>"",MAX(ROUND(D298+AE298,0),200),"") ->  | F298: =IF($C298>"",OFFSET($E290,G290,2*$A298),"") ->  | G298: =IF($C298>"",OFFSET($E290,G290,2*$A298-1),"") ->  | H298: =IF($C298>"",OFFSET($E290,I290,2*$A298),"") ->  | I298: =IF($C298>"",OFFSET($E290,I290,2*$A298-1),"") ->  | J298: =IF($C298>"",OFFSET($E290,K290,2*$A298),"") ->  | K298: =IF($C298>"",OFFSET($E290,K290,2*$A298-1),"") ->  | L298: =IF($C298>"",OFFSET($E290,M290,2*$A298),"") ->  | M298: =IF($C298>"",OFFSET($E290,M290,2*$A298-1),"") ->  | N298: =IF($C298>"",OFFSET($E290,O290,2*$A298),"") ->  | O298: =IF($C298>"",OFFSET($E290,O290,2*$A298-1),"") ->  | P298: =IF($C298>"",OFFSET($E290,Q290,2*$A298),"") ->  | Q298: =IF($C298>"",OFFSET($E290,Q290,2*$A298-1),"") ->  | R298: =IF($C298>"",OFFSET($E290,S290,2*$A298),"") ->  | S298: =IF($C298>"",OFFSET($E290,S290,2*$A298-1),"") ->  | T298: XXX | U298: XXX | W298: =IF($C298>"",(IF(F298=3,1,0)+IF(H298=3,1,0)+IF(J298=3,1,0)+IF(L298=3,1,0)+IF(N298=3,1,0)+IF(P298=3,1,0)+IF(R298=3,1,0)+IF(T298=3,1,0)),"") ->  | X298: =IF($C298>"",SUM(F298,H298,J298,L298,N298,P298,R298,T298),"") ->  | Y298: =IF(C298>"",IF(D298<2000,16,8),"") ->  | Z298: =IF($C298>"",IF($D298<2000,2,1),"") ->  | AA298: =IF($C298>"",IF($D298<2000,25,50),"") ->  | AC298: =IF($C298>"",SUM(AF298:AL298),"") ->  | AD298: =IF($C298>"",IF(AC298<=24,0,AC298-24),"") ->  | AE298: =IF($C298>"",AC298+AD298,"") ->  | AF298: =RatingChange(D298,OFFSET($D$290,AF$290,0),F298,G298) ->  | AG298: =RatingChange(D298,OFFSET($D$290,$AG$290,0),H298,I298) ->  | AH298: =RatingChange(D298,OFFSET($D$290,AH$290,0),J298,K298) ->  | AI298: =RatingChange($D298,OFFSET($D$290,AI$290,0),L298,M298) ->  | AJ298: =RatingChange(D298,OFFSET($D$290,$AJ$290,0),N298,O298) ->  | AK298: =RatingChange(D298,OFFSET($D$290,$AK$290,0),P298,Q298) ->  | AL298: =RatingChange(D298,OFFSET($D$290,$AL$290,0),R298,S298) ->  | AM298: XXX