A2: 39864
A4: # | B4: Name | C4: Rating | D4: Rating | I4: Games Won/Lost against | S4: Matches | T4: Games | U4: Rating | V4: Bonus | W4: Change | X4: Rating change vs.
A5: 1 | C5: Pre | D5: Post | E5: 1 | F5: 1 | G5: 2 | H5: 2 | I5: 3 | J5: 3 | K5: 4 | L5: 4 | M5: 5 | N5: 5 | O5: 6 | P5: 6 | R5: 7 | S5: Won | T5: Won | U5: Change | V5: Points | W5: w/Bonus | X5: =IF(X6="", "", SUMIF(X6:X11,"XXX",$A6:$A11) ) -> 1 | Y5: =IF(Y6="", "", SUMIF(Y6:Y11,"XXX",$A6:$A11) ) -> 2 | Z5: =IF(Z6="", "", SUMIF(Z6:Z11,"XXX",$A6:$A11) ) -> 3 | AA5: =IF(AA6="", "", SUMIF(AA6:AA11,"XXX",$A6:$A11) ) -> 4 | AB5: =IF(AB6="", "", SUMIF(AB6:AB11,"XXX",$A6:$A11) ) -> 5 | AC5: =IF(AC6="", "", SUMIF(AC6:AC11,"XXX",$A6:$A11) ) -> 6 | AD5: =IF(AD6="", "", SUMIF(AD6:AD11,"XXX",$A6:$A11) ) -> 
A6: 1 | B6: Breton, Arthur | C6: 2317 | D6: 2347 | E6: XXX | F6: XXX | G6: 3 | H6: 0 | I6: 3 | J6: 0 | K6: 0 | L6: 0 | M6: 3 | N6: 0 | O6: 3 | P6: 0 | S6: 4 | T6: 12 | U6: 27.04 | V6: 3.04 | W6: 30.08 | X6: XXX | Y6: 7.76 | Z6: 7.08 | AA6: 0 | AB6: 6.28 | AC6: 5.92
A7: 2 | B7: Yang, Chris | C7: 2305 | D7: 2322 | E7: 0 | F7: 3 | G7: XXX | H7: XXX | I7: 3 | J7: 0 | K7: 3 | L7: 1 | M7: 3 | N7: 0 | O7: 3 | P7: 0 | S7: 4 | T7: 12 | U7: 17.04 | V7: 0 | W7: 17.04 | X7: -7.76 | Y7: XXX | Z7: 7.32 | AA7: 4.8 | AB7: 6.52 | AC7: 6.16
A8: 3 | B8: Lee, Bunny | C8: 2271 | D8: 2260 | E8: 0 | F8: 3 | G8: 0 | H8: 3 | I8: XXX | J8: XXX | K8: 1 | L8: 3 | M8: 3 | N8: 1 | O8: 3 | P8: 1 | S8: 2 | T8: 7 | U8: -10.88 | V8: 0 | W8: -10.88 | X8: -7.08 | Y8: -7.32 | Z8: XXX | AA8: -8.52 | AB8: 6.2 | AC8: 5.84
A9: 4 | B9: Sue, Sally | C9: 2195 | D9: 2207 | E9: 0 | F9: 0 | G9: 1 | H9: 3 | I9: 3 | J9: 1 | K9: XXX | L9: XXX | M9: 0 | N9: 0 | O9: 3 | P9: 0 | S9: 2 | T9: 7 | U9: 12.08 | V9: 0 | W9: 12.08 | X9: 0 | Y9: -4.8 | Z9: 8.52 | AA9: XXX | AB9: 0 | AC9: 8.36
A10: 5 | B10: Guo, Sylvan | C10: 2231 | D10: 2220 | E10: 0 | F10: 3 | G10: 0 | H10: 3 | I10: 1 | J10: 3 | K10: 0 | L10: 0 | M10: XXX | N10: XXX | O10: 3 | P10: 0 | S10: 1 | T10: 4 | U10: -11.36 | V10: 0 | W10: -11.36 | X10: -6.28 | Y10: -6.52 | Z10: -6.2 | AA10: 0 | AB10: XXX | AC10: 7.64
A11: 6 | B11: Lee, Mike | C11: 2213 | D11: 2179 | E11: 0 | F11: 3 | G11: 0 | H11: 3 | I11: 1 | J11: 3 | K11: 0 | L11: 3 | M11: 0 | N11: 3 | O11: XXX | P11: XXX | S11: 0 | T11: 1 | U11: -33.92 | V11: 0 | W11: -33.92 | X11: -5.92 | Y11: -6.16 | Z11: -5.84 | AA11: -8.36 | AB11: -7.64 | AC11: XXX
A14: # | B14: Name | C14: Rating | D14: Rating | I14: Games Won/Lost against | S14: Matches | T14: Games | U14: Rating | V14: Bonus | W14: Change | X14: Rating change vs.
A15: 2 | C15: Pre | D15: Post | E15: 1 | F15: 1 | G15: 2 | H15: 2 | I15: 3 | J15: 3 | K15: 4 | L15: 4 | M15: 5 | N15: 5 | O15: 6 | P15: 6 | R15: 7 | S15: Won | T15: Won | U15: Change | V15: Points | W15: w/Bonus | X15: =IF(X16="", "", SUMIF(X16:X21,"XXX",$A16:$A21) ) -> 1 | Y15: =IF(Y16="", "", SUMIF(Y16:Y21,"XXX",$A16:$A21) ) -> 2 | Z15: =IF(Z16="", "", SUMIF(Z16:Z21,"XXX",$A16:$A21) ) -> 3 | AA15: =IF(AA16="", "", SUMIF(AA16:AA21,"XXX",$A16:$A21) ) -> 4 | AB15: =IF(AB16="", "", SUMIF(AB16:AB21,"XXX",$A16:$A21) ) -> 5 | AC15: =IF(AC16="", "", SUMIF(AC16:AC21,"XXX",$A16:$A21) ) -> 6 | AD15: =IF(AD16="", "", SUMIF(AD16:AD21,"XXX",$A16:$A21) ) -> 
A16: 1 | B16: Yuen, Kevin | C16: 2094 | D16: 2111 | E16: XXX | F16: XXX | G16: 3 | H16: 1 | I16: 2 | J16: 3 | K16: 3 | L16: 2 | M16: 3 | N16: 0 | O16: 3 | P16: 0 | S16: 4 | T16: 14 | U16: 17.44 | V16: 0 | W16: 17.44 | X16: XXX | Y16: 7.06 | Z16: -7.68 | AA16: 4.96 | AB16: 6.84 | AC16: 6.26
A17: 2 | B17: Huang, Johnny | C17: 2097 | D17: 2113 | E17: 1 | F17: 3 | G17: XXX | H17: XXX | I17: 3 | J17: 0 | K17: 3 | L17: 2 | M17: 3 | N17: 1 | O17: 3 | P17: 0 | S17: 4 | T17: 13 | U17: 16.08 | V17: 0 | W17: 16.08 | X17: -7.06 | Y17: XXX | Z17: 6.26 | AA17: 4.9 | AB17: 5.78 | AC17: 6.2
A18: 3 | B18: Gamero, Pedro | C18: 2010 | D18: 2026 | E18: 3 | F18: 2 | G18: 0 | H18: 3 | I18: XXX | J18: XXX | K18: 3 | L18: 2 | M18: 0 | N18: 0 | O18: 3 | P18: 0 | S18: 3 | T18: 9 | U18: 16 | V18: 0 | W18: 16 | X18: 7.68 | Y18: -6.26 | Z18: XXX | AA18: 6.64 | AB18: 0 | AC18: 7.94
A19: 4 | B19: Nejad, Ray | C19: 2042 | D19: 2026 | E19: 2 | F19: 3 | G19: 2 | H19: 3 | I19: 2 | J19: 3 | K19: XXX | L19: XXX | M19: 3 | N19: 1 | O19: 2 | P19: 3 | S19: 1 | T19: 11 | U19: -16.32 | V19: 0 | W19: -16.32 | X19: -4.96 | Y19: -4.9 | Z19: -6.64 | AA19: XXX | AB19: 6.88 | AC19: -6.7
A20: 5 | B20: Tang, Daniel | C20: 2036 | D20: 2024 | E20: 0 | F20: 3 | G20: 1 | H20: 3 | I20: 0 | J20: 0 | K20: 1 | L20: 3 | M20: XXX | N20: XXX | O20: 3 | P20: 0 | S20: 1 | T20: 5 | U20: -12.08 | V20: 0 | W20: -12.08 | X20: -6.84 | Y20: -5.78 | Z20: 0 | AA20: -6.88 | AB20: XXX | AC20: 7.42
A21: 6 | B21: Roberson, Sam | C21: 2007 | D21: 1986 | E21: 0 | F21: 3 | G21: 0 | H21: 3 | I21: 0 | J21: 3 | K21: 3 | L21: 2 | M21: 0 | N21: 3 | O21: XXX | P21: XXX | S21: 1 | T21: 3 | U21: -21.12 | V21: 0 | W21: -21.12 | X21: -6.26 | Y21: -6.2 | Z21: -7.94 | AA21: 6.7 | AB21: -7.42 | AC21: XXX
A24: # | B24: Name | C24: Rating | D24: Rating | I24: Games Won/Lost against | S24: Matches | T24: Games | U24: Rating | V24: Bonus | W24: Change | X24: Rating change vs.
A25: 3 | C25: Pre | D25: Post | E25: 1 | F25: 1 | G25: 2 | H25: 2 | I25: 3 | J25: 3 | K25: 4 | L25: 4 | M25: 5 | N25: 5 | O25: 6 | P25: 6 | R25: 7 | S25: Won | T25: Won | U25: Change | V25: Points | W25: w/Bonus | X25: =IF(X26="", "", SUMIF(X26:X31,"XXX",$A26:$A31) ) -> 1 | Y25: =IF(Y26="", "", SUMIF(Y26:Y31,"XXX",$A26:$A31) ) -> 2 | Z25: =IF(Z26="", "", SUMIF(Z26:Z31,"XXX",$A26:$A31) ) -> 3 | AA25: =IF(AA26="", "", SUMIF(AA26:AA31,"XXX",$A26:$A31) ) -> 4 | AB25: =IF(AB26="", "", SUMIF(AB26:AB31,"XXX",$A26:$A31) ) -> 5 | AC25: =IF(AC26="", "", SUMIF(AC26:AC31,"XXX",$A26:$A31) ) -> 6 | AD25: =IF(AD26="", "", SUMIF(AD26:AD31,"XXX",$A26:$A31) ) -> 
A26: 1 | B26: Chan, Channing | C26: 1988 | D26: 2004 | E26: XXX | F26: XXX | G26: 3 | H26: 1 | I26: 2 | J26: 1 | K26: 3 | L26: 0 | M26: 3 | N26: 2 | O26: 2 | P26: 3 | S26: 3 | T26: 13 | U26: 16.4 | V26: 0 | W26: 16.4 | X26: XXX | Y26: 10.08 | Z26: 2 | AA26: 13.4 | AB26: 8.32 | AC26: -17.4
A27: 2 | B27: Chan, Paul | C27: 1890 | D27: 1919 | E27: 1 | F27: 3 | G27: XXX | H27: XXX | I27: 3 | J27: 0 | K27: 2 | L27: 3 | M27: 3 | N27: 0 | O27: 3 | P27: 1 | S27: 3 | T27: 12 | U27: 26.72 | V27: 2.72 | W27: 29.44 | X27: -10.08 | Y27: XXX | Z27: 18.72 | AA27: -10.68 | AB27: 16.24 | AC27: 12.52
A28: 3 | B28: Hong, Randy | C28: 1958 | D28: 1943 | E28: 1 | F28: 2 | G28: 0 | H28: 3 | I28: XXX | J28: XXX | K28: 3 | L28: 2 | M28: 2 | N28: 3 | O28: 3 | P28: 1 | S28: 2 | T28: 9 | U28: -14.8 | V28: 0 | W28: -14.8 | X28: -2 | Y28: -18.72 | Z28: XXX | AA28: 10.6 | AB28: -14.48 | AC28: 9.8
A29: 4 | B29: Hanson, Dave | C29: 1923 | D29: 1908 | E29: 0 | F29: 3 | G29: 3 | H29: 2 | I29: 2 | J29: 3 | K29: XXX | L29: XXX | M29: 1 | N29: 3 | O29: 3 | P29: 0 | S29: 2 | T29: 9 | U29: -15.2 | V29: 0 | W29: -15.2 | X29: -13.4 | Y29: 10.68 | Z29: -10.6 | AA29: XXX | AB29: -15.08 | AC29: 13.2
A30: 5 | B30: Eng, David | C30: 1896 | D30: 1885 | E30: 2 | F30: 3 | G30: 0 | H30: 3 | I30: 3 | J30: 2 | K30: 3 | L30: 1 | M30: XXX | N30: XXX | O30: 1 | P30: 3 | S30: 2 | T30: 9 | U30: -10.72 | V30: 0 | W30: -10.72 | X30: -8.32 | Y30: -16.24 | Z30: 14.48 | AA30: 15.08 | AB30: XXX | AC30: -15.72
A31: 6 | B31: Lam, Sam | C31: 1853 | D31: 1851 | E31: 3 | F31: 2 | G31: 1 | H31: 3 | I31: 1 | J31: 3 | K31: 0 | L31: 3 | M31: 3 | N31: 1 | O31: XXX | P31: XXX | S31: 2 | T31: 8 | U31: -2.4 | V31: 0 | W31: -2.4 | X31: 17.4 | Y31: -12.52 | Z31: -9.8 | AA31: -13.2 | AB31: 15.72 | AC31: XXX
A34: # | B34: Name | C34: Rating | D34: Rating | I34: Games Won/Lost against | S34: Matches | T34: Games | U34: Rating | V34: Bonus | W34: Change | X34: Rating change vs.
A35: 4 | C35: Pre | D35: Post | E35: 1 | F35: 1 | G35: 2 | H35: 2 | I35: 3 | J35: 3 | K35: 4 | L35: 4 | M35: 5 | N35: 5 | O35: 6 | P35: 6 | R35: 7 | S35: Won | T35: Won | U35: Change | V35: Points | W35: w/Bonus | X35: =IF(X36="", "", SUMIF(X36:X41,"XXX",$A36:$A41) ) -> 1 | Y35: =IF(Y36="", "", SUMIF(Y36:Y41,"XXX",$A36:$A41) ) -> 2 | Z35: =IF(Z36="", "", SUMIF(Z36:Z41,"XXX",$A36:$A41) ) -> 3 | AA35: =IF(AA36="", "", SUMIF(AA36:AA41,"XXX",$A36:$A41) ) -> 4 | AB35: =IF(AB36="", "", SUMIF(AB36:AB41,"XXX",$A36:$A41) ) -> 5 | AC35: =IF(AC36="", "", SUMIF(AC36:AC41,"XXX",$A36:$A41) ) -> 6 | AD35: =IF(AD36="", "", SUMIF(AD36:AD41,"XXX",$A36:$A41) ) -> 
A36: 1 | B36: Kim, Wonhyung | C36: 1870 | D36: 1929 | E36: XXX | F36: XXX | G36: 2 | H36: 3 | I36: 3 | J36: 0 | K36: 3 | L36: 0 | M36: 3 | N36: 0 | O36: 3 | P36: 2 | S36: 4 | T36: 14 | U36: 41.4 | V36: 17.4 | W36: 58.8 | X36: XXX | Y36: -14.24 | Z36: 14.52 | AA36: 12.64 | AB36: 16.56 | AC36: 11.92
A37: 2 | B37: Lin, Andrew | C37: 1814 | D37: 1831 | E37: 3 | F37: 2 | G37: XXX | H37: XXX | I37: 1 | J37: 3 | K37: 3 | L37: 2 | M37: 1 | N37: 3 | O37: 3 | P37: 1 | S37: 3 | T37: 11 | U37: 16.84 | V37: 0 | W37: 16.84 | X37: 14.24 | Y37: XXX | Z37: -13.24 | AA37: 10.88 | AB37: -11.2 | AC37: 16.16
A38: 3 | B38: Dai, Kang | C38: 1833 | D38: 1849 | E38: 0 | F38: 3 | G38: 3 | H38: 1 | I38: XXX | J38: XXX | K38: 3 | L38: 1 | M38: 3 | N38: 0 | O38: 1 | P38: 3 | S38: 3 | T38: 10 | U38: 16.28 | V38: 0 | W38: 16.28 | X38: -14.52 | Y38: 13.24 | Z38: XXX | AA38: 12.12 | AB38: 18.04 | AC38: -12.6
A39: 4 | B39: Adams, Steve | C39: 1786 | D39: 1786 | E39: 0 | F39: 3 | G39: 2 | H39: 3 | I39: 1 | J39: 3 | K39: XXX | L39: XXX | M39: 3 | N39: 1 | O39: 3 | P39: 1 | S39: 2 | T39: 9 | U39: -0.43999999999999773 | V39: 0 | W39: -0.43999999999999773 | X39: -12.64 | Y39: -10.88 | Z39: -12.12 | AA39: XXX | AB39: 17.92 | AC39: 17.28
A40: 5 | B40: Siu, Calvin | C40: 1884 | D40: 1858 | E40: 0 | F40: 3 | G40: 3 | H40: 1 | I40: 0 | J40: 3 | K40: 1 | L40: 3 | M40: XXX | N40: XXX | O40: 3 | P40: 0 | S40: 2 | T40: 7 | U40: -25.96 | V40: 0 | W40: -25.96 | X40: -16.56 | Y40: 11.2 | Z40: -18.04 | AA40: -17.92 | AB40: XXX | AC40: 15.36
A41: 6 | B41: Sun, Terence | C41: 1868 | D41: 1820 | E41: 2 | F41: 3 | G41: 1 | H41: 3 | I41: 3 | J41: 1 | K41: 1 | L41: 3 | M41: 0 | N41: 3 | O41: XXX | P41: XXX | S41: 1 | T41: 7 | U41: -48.12 | V41: 0 | W41: -48.12 | X41: -11.92 | Y41: -16.16 | Z41: 12.6 | AA41: -17.28 | AB41: -15.36 | AC41: XXX
A44: # | B44: Name | C44: Rating | D44: Rating | I44: Games Won/Lost against | S44: Matches | T44: Games | U44: Rating | V44: Bonus | W44: Change | X44: Rating change vs.
A45: 5 | C45: Pre | D45: Post | E45: 1 | F45: 1 | G45: 2 | H45: 2 | I45: 3 | J45: 3 | K45: 4 | L45: 4 | M45: 5 | N45: 5 | O45: 6 | P45: 6 | Q45: 7 | R45: 7 | S45: Won | T45: Won | U45: Change | V45: Points | W45: w/Bonus | X45: =IF(X46="", "", SUMIF(X46:X52,"XXX",$A46:$A52) ) -> 1 | Y45: =IF(Y46="", "", SUMIF(Y46:Y52,"XXX",$A46:$A52) ) -> 2 | Z45: =IF(Z46="", "", SUMIF(Z46:Z52,"XXX",$A46:$A52) ) -> 3 | AA45: =IF(AA46="", "", SUMIF(AA46:AA52,"XXX",$A46:$A52) ) -> 4 | AB45: =IF(AB46="", "", SUMIF(AB46:AB52,"XXX",$A46:$A52) ) -> 5 | AC45: =IF(AC46="", "", SUMIF(AC46:AC52,"XXX",$A46:$A52) ) -> 6 | AD45: =IF(AD46="", "", SUMIF(AD46:AD52,"XXX",$A46:$A52) ) -> 7
A46: 1 | B46: Dupont, Nick | C46: 1742 | D46: 1807 | E46: XXX | F46: XXX | G46: 3 | H46: 1 | I46: 3 | J46: 0 | K46: 0 | L46: 0 | M46: 0 | N46: 0 | O46: 3 | P46: 1 | Q46: 3 | R46: 1 | S46: 4 | T46: 12 | U46: 44.6 | V46: 20.6 | W46: 65.2 | X46: XXX | Y46: 10.28 | Z46: 11.56 | AA46: 0 | AB46: 0 | AC46: 13.96 | AD46: 8.8
A47: 2 | B47: Wu, Sean | C47: 1649 | D47: 1665 | E47: 1 | F47: 3 | G47: XXX | H47: XXX | I47: 3 | J47: 1 | K47: 3 | L47: 0 | M47: 3 | N47: 0 | O47: 0 | P47: 0 | Q47: 2 | R47: 3 | S47: 3 | T47: 12 | U47: 16.4 | V47: 0 | W47: 16.4 | X47: -10.28 | Y47: XXX | Z47: 13.28 | AA47: 13.68 | AB47: 13.2 | AC47: 0 | AD47: -13.48
A48: 3 | B48: Szumilo, Anthony | C48: 1631 | D48: 1634 | E48: 0 | F48: 3 | G48: 1 | H48: 3 | I48: XXX | J48: XXX | K48: 0 | L48: 0 | M48: 0 | N48: 0 | O48: 3 | P48: 2 | Q48: 3 | R48: 2 | S48: 2 | T48: 7 | U48: 2.8 | V48: 0 | W48: 2.8 | X48: -11.56 | Y48: -13.28 | Z48: XXX | AA48: 0 | AB48: 0 | AC48: 16.4 | AD48: 11.24
A49: 4 | B49: Sun, Vivian | C49: 1591 | D49: 1606 | E49: 0 | F49: 0 | G49: 0 | H49: 3 | I49: 0 | J49: 0 | K49: XXX | L49: XXX | M49: 3 | N49: 1 | O49: 1 | P49: 3 | Q49: 3 | R49: 1 | S49: 2 | T49: 7 | U49: 15.16 | V49: 0 | W49: 15.16 | X49: 0 | Y49: -4.92 | Z49: 0 | AA49: XXX | AB49: 0 | AC49: -2.84 | AD49: 22.92
A50: 5 | B50: Lee, Kanon | C50: 1579 | D50: 1588 | E50: 0 | F50: 0 | G50: 0 | H50: 3 | I50: 0 | J50: 0 | K50: 1 | L50: 3 | M50: XXX | N50: XXX | O50: 3 | P50: 2 | Q50: 3 | R50: 0 | S50: 2 | T50: 7 | U50: 9.08 | V50: 0 | W50: 9.08 | X50: 0 | Y50: -13.2 | Z50: 0 | AA50: -13.52 | AB50: XXX | AC50: 18.48 | AD50: 17.32
A51: 6 | B51: Labins, Mike | C51: 1741 | D51: 1700 | E51: 1 | F51: 3 | G51: 0 | H51: 0 | I51: 2 | J51: 3 | K51: 3 | L51: 1 | M51: 2 | N51: 3 | O51: XXX | P51: XXX | Q51: 0 | R51: 0 | S51: 1 | T51: 8 | U51: -40.84 | V51: 0 | W51: -40.84 | X51: -13.96 | Y51: 0 | Z51: -16.4 | AA51: 8 | AB51: -18.48 | AC51: XXX | AD51: 0
A52: 7 | B52: Cembura, Jim | C52: 1612 | D52: 1573 | E52: 1 | F52: 3 | G52: 3 | H52: 2 | I52: 2 | J52: 3 | K52: 1 | L52: 3 | M52: 0 | N52: 3 | O52: 0 | P52: 0 | Q52: XXX | R52: XXX | S52: 1 | T52: 7 | U52: -38.72 | V52: 0 | W52: -38.72 | X52: -8.8 | Y52: 13.48 | Z52: -11.24 | AA52: -14.84 | AB52: -17.32 | AC52: 0 | AD52: XXX
A55: # | B55: Name | C55: Rating | D55: Rating | I55: Games Won/Lost against | S55: Matches | T55: Games | U55: Rating | V55: Bonus | W55: Change | X55: Rating change vs.
A56: 6 | C56: Pre | D56: Post | E56: 1 | F56: 1 | G56: 2 | H56: 2 | I56: 3 | J56: 3 | K56: 4 | L56: 4 | M56: 5 | N56: 5 | O56: 6 | P56: 6 | Q56: 7 | R56: 7 | S56: Won | T56: Won | U56: Change | V56: Points | W56: w/Bonus | X56: =IF(X57="", "", SUMIF(X57:X63,"XXX",$A57:$A63) ) -> 1 | Y56: =IF(Y57="", "", SUMIF(Y57:Y63,"XXX",$A57:$A63) ) -> 2 | Z56: =IF(Z57="", "", SUMIF(Z57:Z63,"XXX",$A57:$A63) ) -> 3 | AA56: =IF(AA57="", "", SUMIF(AA57:AA63,"XXX",$A57:$A63) ) -> 4 | AB56: =IF(AB57="", "", SUMIF(AB57:AB63,"XXX",$A57:$A63) ) -> 5 | AC56: =IF(AC57="", "", SUMIF(AC57:AC63,"XXX",$A57:$A63) ) -> 6 | AD56: =IF(AD57="", "", SUMIF(AD57:AD63,"XXX",$A57:$A63) ) -> 7
A57: 1 | B57: Cheung, Carson | C57: 1560 | D57: 1580 | E57: XXX | F57: XXX | G57: 0 | H57: 3 | I57: 3 | J57: 1 | K57: 3 | L57: 1 | M57: 3 | N57: 0 | O57: 3 | P57: 2 | Q57: 3 | R57: 1 | S57: 5 | T57: 15 | U57: 20.12 | V57: 0 | W57: 20.12 | X57: XXX | Y57: -16.88 | Z57: 7.84 | AA57: 5.16 | AB57: 11.92 | AC57: 5.72 | AD57: 6.36
A58: 2 | B58: Lindo, Aristides | C58: 1538 | D58: 1546 | E58: 3 | F58: 0 | G58: XXX | H58: XXX | I58: 1 | J58: 3 | K58: 3 | L58: 0 | M58: 1 | N58: 3 | O58: 3 | P58: 0 | Q58: 3 | R58: 0 | S58: 4 | T58: 14 | U58: 8.28 | V58: 0 | W58: 8.28 | X58: 16.88 | Y58: XXX | Z58: -19.28 | AA58: 8.04 | AB58: -17.2 | AC58: 10.6 | AD58: 9.24
A59: 3 | B59: Tang, Isaac | C59: 1406 | D59: 1438 | E59: 1 | F59: 3 | G59: 3 | H59: 1 | I59: XXX | J59: XXX | K59: 0 | L59: 0 | M59: 3 | N59: 0 | O59: 1 | P59: 3 | Q59: 3 | R59: 1 | S59: 3 | T59: 11 | U59: 27.92 | V59: 3.92 | W59: 31.84 | X59: -7.84 | Y59: 19.28 | Z59: XXX | AA59: 0 | AB59: 18.08 | AC59: -14.12 | AD59: 12.52
A60: 4 | B60: Philips, Peter | C60: 1339 | D60: 1398 | E60: 1 | F60: 3 | G60: 0 | H60: 3 | I60: 0 | J60: 0 | K60: XXX | L60: XXX | M60: 3 | N60: 1 | O60: 3 | P60: 0 | Q60: 3 | R60: 0 | S60: 3 | T60: 10 | U60: 41.32 | V60: 17.32 | W60: 58.64 | X60: -5.16 | Y60: -8.04 | Z60: 0 | AA60: XXX | AB60: 18.76 | AC60: 18.56 | AD60: 17.2
A61: 5 | B61: Lungu, Adrian | C61: 1458 | D61: 1439 | E61: 0 | F61: 3 | G61: 3 | H61: 1 | I61: 0 | J61: 3 | K61: 1 | L61: 3 | M61: XXX | N61: XXX | O61: 1 | P61: 1 | Q61: 3 | R61: 0 | S61: 2 | T61: 8 | U61: -19.12 | V61: 0 | W61: -19.12 | X61: -11.92 | Y61: 17.2 | Z61: -18.08 | AA61: -18.76 | AB61: XXX | AC61: 0 | AD61: 12.44
A62: 6 | B62: Kong, Casey | C62: 1403 | D62: 1367 | E62: 2 | F62: 3 | G62: 0 | H62: 3 | I62: 3 | J62: 1 | K62: 0 | L62: 3 | M62: 1 | N62: 1 | O62: XXX | P62: XXX | Q62: 1 | R62: 3 | S62: 1 | T62: 7 | U62: -36.12 | V62: 0 | W62: -36.12 | X62: -5.72 | Y62: -10.6 | Z62: 14.12 | AA62: -18.56 | AB62: 0 | AC62: XXX | AD62: -15.36
A63: 7 | B63: Wang, Jim | C63: 1369 | D63: 1327 | E63: 1 | F63: 3 | G63: 0 | H63: 3 | I63: 1 | J63: 3 | K63: 0 | L63: 3 | M63: 0 | N63: 3 | O63: 3 | P63: 1 | Q63: XXX | R63: XXX | S63: 1 | T63: 5 | U63: -42.4 | V63: 0 | W63: -42.4 | X63: -6.36 | Y63: -9.24 | Z63: -12.52 | AA63: -17.2 | AB63: -12.44 | AC63: 15.36 | AD63: XXX
A66: # | B66: Name | C66: Rating | D66: Rating | I66: Games Won/Lost against | S66: Matches | T66: Games | U66: Rating | V66: Bonus | W66: Change | X66: Rating change vs.
A67: 7 | C67: Pre | D67: Post | E67: 1 | F67: 1 | G67: 2 | H67: 2 | I67: 3 | J67: 3 | K67: 4 | L67: 4 | M67: 5 | N67: 5 | P67: 6 | R67: 7 | S67: Won | T67: Won | U67: Change | V67: Points | W67: w/Bonus | X67: =IF(X68="", "", SUMIF(X68:X72,"XXX",$A68:$A72) ) -> 1 | Y67: =IF(Y68="", "", SUMIF(Y68:Y72,"XXX",$A68:$A72) ) -> 2 | Z67: =IF(Z68="", "", SUMIF(Z68:Z72,"XXX",$A68:$A72) ) -> 3 | AA67: =IF(AA68="", "", SUMIF(AA68:AA72,"XXX",$A68:$A72) ) -> 4 | AB67: =IF(AB68="", "", SUMIF(AB68:AB72,"XXX",$A68:$A72) ) -> 5 | AC67: =IF(AC68="", "", SUMIF(AC68:AC72,"XXX",$A68:$A72) ) ->  | AD67: =IF(AD68="", "", SUMIF(AD68:AD72,"XXX",$A68:$A72) ) -> 
A68: 1 | B68: Sun, Lynn | C68: 1319 | D68: 1387 | E68: XXX | F68: XXX | G68: 3 | H68: 1 | I68: 3 | J68: 0 | K68: 3 | L68: 2 | M68: 3 | N68: 1 | S68: 4 | T68: 12 | U68: 46.12 | V68: 22.12 | W68: 68.24 | X68: XXX | Y68: 8.84 | Z68: 12.96 | AA68: 11.24 | AB68: 13.08
A69: 2 | B69: Chung, Michael | C69: 1190 | D69: 1218 | E69: 1 | F69: 3 | G69: XXX | H69: XXX | I69: 0 | J69: 0 | K69: 3 | L69: 2 | M69: 3 | N69: 1 | S69: 2 | T69: 7 | U69: 25.8 | V69: 1.8 | W69: 27.6 | X69: -8.84 | Y69: XXX | Z69: 0 | AA69: 16.4 | AB69: 18.24
A70: 3 | B70: Li, Joe | C70: 1243 | D70: 1264 | E70: 0 | F70: 3 | G70: 0 | H70: 0 | I70: XXX | J70: XXX | K70: 3 | L70: 1 | M70: 3 | N70: 0 | S70: 2 | T70: 6 | U70: 21.44 | V70: 0 | W70: 21.44 | X70: -12.96 | Y70: 0 | Z70: XXX | AA70: 16.28 | AB70: 18.12
A71: 4 | B71: Zhou, Tieren | C71: 1300 | D71: 1256 | E71: 2 | F71: 3 | G71: 2 | H71: 3 | I71: 1 | J71: 3 | K71: XXX | L71: XXX | M71: 0 | N71: 0 | S71: 0 | T71: 5 | U71: -43.92 | V71: 0 | W71: -43.92 | X71: -11.24 | Y71: -16.4 | Z71: -16.28 | AA71: XXX | AB71: 0
A72: 5 | B72: Ritz, Jim | C72: 1296 | D72: 1247 | E72: 1 | F72: 3 | G72: 1 | H72: 3 | I72: 0 | J72: 3 | K72: 0 | L72: 0 | M72: XXX | N72: XXX | S72: 0 | T72: 2 | U72: -49.44 | V72: 0 | W72: -49.44 | X72: -13.08 | Y72: -18.24 | Z72: -18.12 | AA72: 0 | AB72: XXX
A75: # | B75: Name | C75: Rating | D75: Rating | I75: Games Won/Lost against | S75: Matches | T75: Games | U75: Rating | V75: Bonus | W75: Change | X75: Rating change vs.
A76: 8 | C76: Pre | D76: Post | E76: 1 | F76: 1 | G76: 2 | H76: 2 | I76: 3 | J76: 3 | K76: 4 | L76: 4 | M76: 5 | N76: 5 | P76: 6 | R76: 7 | S76: Won | T76: Won | U76: Change | V76: Points | W76: w/Bonus | X76: =IF(X77="", "", SUMIF(X77:X81,"XXX",$A77:$A81) ) -> 1 | Y76: =IF(Y77="", "", SUMIF(Y77:Y81,"XXX",$A77:$A81) ) -> 2 | Z76: =IF(Z77="", "", SUMIF(Z77:Z81,"XXX",$A77:$A81) ) -> 3 | AA76: =IF(AA77="", "", SUMIF(AA77:AA81,"XXX",$A77:$A81) ) -> 4 | AB76: =IF(AB77="", "", SUMIF(AB77:AB81,"XXX",$A77:$A81) ) -> 5 | AC76: =IF(AC77="", "", SUMIF(AC77:AC81,"XXX",$A77:$A81) ) ->  | AD76: =IF(AD77="", "", SUMIF(AD77:AD81,"XXX",$A77:$A81) ) -> 
A77: 1 | B77: Schwartz, Robert | C77: 1242 | D77: 1298 | E77: XXX | F77: XXX | G77: 3 | H77: 1 | I77: 3 | J77: 1 | K77: 3 | L77: 1 | M77: 3 | N77: 0 | S77: 4 | T77: 12 | U77: 40.08 | V77: 16.08 | W77: 56.16 | X77: XXX | Y77: 7.52 | Z77: 11.04 | AA77: 8.92 | AB77: 12.6
A78: 2 | B78: Lu, Son | C78: 1080 | D78: 1141 | E78: 1 | F78: 3 | G78: XXX | H78: XXX | I78: 3 | J78: 2 | K78: 3 | L78: 1 | M78: 3 | N78: 0 | S78: 3 | T78: 10 | U78: 42.48 | V78: 18.48 | W78: 60.96 | X78: -7.52 | Y78: XXX | Z78: 15.52 | AA78: 15.4 | AB78: 19.08
A79: 3 | B79: Rich, Alan | C79: 1168 | D79: 1167 | E79: 1 | F79: 3 | G79: 2 | H79: 3 | I79: XXX | J79: XXX | K79: 3 | L79: 1 | M79: 3 | N79: 1 | S79: 2 | T79: 9 | U79: -1.12 | V79: 0 | W79: -1.12 | X79: -11.04 | Y79: -15.52 | Z79: XXX | AA79: 11.88 | AB79: 13.56
A80: 4 | B80: Salmeron, Geovanny | C80: 1115 | D80: 1096 | E80: 1 | F80: 3 | G80: 1 | H80: 3 | I80: 1 | J80: 3 | K80: XXX | L80: XXX | M80: 3 | N80: 0 | S80: 1 | T80: 6 | U80: -18.52 | V80: 0 | W80: -18.52 | X80: -8.92 | Y80: -15.4 | Z80: -11.88 | AA80: XXX | AB80: 17.68
A81: 5 | B81: Tong, Roger | C81: 1157 | D81: 1094 | E81: 0 | F81: 3 | G81: 0 | H81: 3 | I81: 1 | J81: 3 | K81: 0 | L81: 3 | M81: XXX | N81: XXX | S81: 0 | T81: 1 | U81: -62.92 | V81: 0 | W81: -62.92 | X81: -12.6 | Y81: -19.08 | Z81: -13.56 | AA81: -17.68 | AB81: XXX
A84: # | B84: Name | C84: Rating | D84: Rating | I84: Games Won/Lost against | S84: Matches | T84: Games | U84: Rating | V84: Bonus | W84: Change | X84: Rating change vs.
A85: 9 | C85: Pre | D85: Post | E85: 1 | F85: 1 | G85: 2 | H85: 2 | I85: 3 | J85: 3 | K85: 4 | L85: 4 | M85: 5 | N85: 5 | P85: 6 | R85: 7 | S85: Won | T85: Won | U85: Change | V85: Points | W85: w/Bonus | X85: =IF(X86="", "", SUMIF(X86:X90,"XXX",$A86:$A90) ) -> 1 | Y85: =IF(Y86="", "", SUMIF(Y86:Y90,"XXX",$A86:$A90) ) -> 2 | Z85: =IF(Z86="", "", SUMIF(Z86:Z90,"XXX",$A86:$A90) ) -> 3 | AA85: =IF(AA86="", "", SUMIF(AA86:AA90,"XXX",$A86:$A90) ) -> 4 | AB85: =IF(AB86="", "", SUMIF(AB86:AB90,"XXX",$A86:$A90) ) -> 5 | AC85: =IF(AC86="", "", SUMIF(AC86:AC90,"XXX",$A86:$A90) ) ->  | AD85: =IF(AD86="", "", SUMIF(AD86:AD90,"XXX",$A86:$A90) ) -> 
A86: 1 | B86: Lim, Matt (Plays Free) | C86: 1072 | D86: 1092 | E86: XXX | F86: XXX | G86: 1 | H86: 3 | I86: 3 | J86: 2 | K86: 3 | L86: 1 | M86: 3 | N86: 0 | S86: 3 | T86: 10 | U86: 20.44 | V86: 0 | W86: 20.44 | X86: XXX | Y86: -15.24 | Z86: 8.48 | AA86: 14.08 | AB86: 13.12
A87: 2 | B87: Wong, Curtis | C87: 1041 | D87: 1098 | E87: 3 | F87: 1 | G87: XXX | H87: XXX | I87: 3 | J87: 2 | K87: 3 | L87: 1 | M87: 0 | N87: 0 | S87: 3 | T87: 9 | U87: 40.28 | V87: 16.28 | W87: 56.56 | X87: 15.24 | Y87: XXX | Z87: 9.72 | AA87: 15.32 | AB87: 0
A88: 3 | B88: Thorn, Jon | C88: 984 | D88: 983 | E88: 2 | F88: 3 | G88: 2 | H88: 3 | I88: XXX | J88: XXX | K88: 3 | L88: 1 | M88: 0 | N88: 0 | S88: 1 | T88: 7 | U88: -00.6 | V88: 0 | W88: -00.6 | X88: -8.48 | Y88: -9.72 | Z88: XXX | AA88: 17.6 | AB88: 0
A89: 4 | B89: Karan, Vadi | C89: 1074 | D89: 1027 | E89: 1 | F89: 3 | G89: 1 | H89: 3 | I89: 1 | J89: 3 | K89: XXX | L89: XXX | M89: 0 | N89: 0 | S89: 0 | T89: 3 | U89: -47 | V89: 0 | W89: -47 | X89: -14.08 | Y89: -15.32 | Z89: -17.6 | AA89: XXX | AB89: 0
A90: 5 | B90: Yee, Benson | C90: 1000 | D90: 987 | E90: 0 | F90: 3 | G90: 0 | H90: 0 | I90: 0 | J90: 0 | K90: 0 | L90: 0 | M90: XXX | N90: XXX | S90: 0 | T90: 0 | U90: -13.12 | V90: 0 | W90: -13.12 | X90: -13.12 | Y90: 0 | Z90: 0 | AA90: 0 | AB90: XXX
A93: # | B93: Name | C93: Rating | D93: Rating | I93: Games Won/Lost against | S93: Matches | T93: Games | U93: Rating | V93: Bonus | W93: Change | X93: Rating change vs.
A94: 10 | C94: Pre | D94: Post | E94: 1 | F94: 1 | G94: 2 | H94: 2 | I94: 3 | J94: 3 | K94: 4 | L94: 4 | M94: 5 | N94: 5 | P94: 6 | R94: 7 | S94: Won | T94: Won | U94: Change | V94: Points | W94: w/Bonus | X94: =IF(X95="", "", SUMIF(X95:X99,"XXX",$A95:$A99) ) -> 1 | Y94: =IF(Y95="", "", SUMIF(Y95:Y99,"XXX",$A95:$A99) ) -> 2 | Z94: =IF(Z95="", "", SUMIF(Z95:Z99,"XXX",$A95:$A99) ) -> 3 | AA94: =IF(AA95="", "", SUMIF(AA95:AA99,"XXX",$A95:$A99) ) -> 4 | AB94: =IF(AB95="", "", SUMIF(AB95:AB99,"XXX",$A95:$A99) ) -> 5 | AC94: =IF(AC95="", "", SUMIF(AC95:AC99,"XXX",$A95:$A99) ) ->  | AD94: =IF(AD95="", "", SUMIF(AD95:AD99,"XXX",$A95:$A99) ) -> 
A95: 1 | B95: Tang, Kenneth | C95: 985 | D95: 1065 | E95: XXX | F95: XXX | G95: 3 | H95: 2 | I95: 3 | J95: 0 | K95: 3 | L95: 1 | M95: 3 | N95: 0 | S95: 4 | T95: 12 | U95: 52.12 | V95: 28.12 | W95: 80.24 | X95: XXX | Y95: 12 | Z95: 15.92 | AA95: 11.8 | AB95: 12.4
A96: 2 | B96: Sun, Winnie | C96: 985 | D96: 991 | E96: 2 | F96: 3 | G96: XXX | H96: XXX | I96: 1 | J96: 2 | K96: 3 | L96: 2 | M96: 3 | N96: 1 | S96: 2 | T96: 9 | U96: 6.2 | V96: 0 | W96: 6.2 | X96: -12 | Y96: XXX | Z96: -2 | AA96: 9.8 | AB96: 10.4
A97: 3 | B97: Ginsburg, Leonard | C97: 983 | D97: 991 | E97: 0 | F97: 3 | G97: 2 | H97: 1 | I97: XXX | J97: XXX | K97: 3 | L97: 1 | M97: 3 | N97: 1 | S97: 2 | T97: 8 | U97: 8.44 | V97: 0 | W97: 8.44 | X97: -15.92 | Y97: 2 | Z97: XXX | AA97: 11.88 | AB97: 10.48
A98: 4 | B98: Chen, Er | C98: 930 | D98: 897 | E98: 1 | F98: 3 | G98: 2 | H98: 3 | I98: 1 | J98: 3 | K98: XXX | L98: XXX | M98: 1 | N98: 1 | S98: 0 | T98: 5 | U98: -33.48 | V98: 0 | W98: -33.48 | X98: -11.8 | Y98: -9.8 | Z98: -11.88 | AA98: XXX | AB98: 0
A99: 5 | B99: Higgins, Joseph | C99: 895 | D99: 862 | E99: 0 | F99: 3 | G99: 1 | H99: 3 | I99: 1 | J99: 3 | K99: 1 | L99: 1 | M99: XXX | N99: XXX | S99: 0 | T99: 3 | U99: -33.28 | V99: 0 | W99: -33.28 | X99: -12.4 | Y99: -10.4 | Z99: -10.48 | AA99: 0 | AB99: XXX
A102: # | B102: Name | C102: Rating | D102: Rating | I102: Games Won/Lost against | S102: Matches | T102: Games | U102: Rating | V102: Bonus | W102: Change | X102: Rating change vs.
A103: 11 | C103: Pre | D103: Post | E103: 1 | F103: 1 | G103: 2 | H103: 2 | I103: 3 | J103: 3 | K103: 4 | L103: 4 | M103: 5 | N103: 5 | P103: 6 | R103: 7 | S103: Won | T103: Won | U103: Change | V103: Points | W103: w/Bonus | X103: =IF(X104="", "", SUMIF(X104:X108,"XXX",$A104:$A108) ) -> 1 | Y103: =IF(Y104="", "", SUMIF(Y104:Y108,"XXX",$A104:$A108) ) -> 2 | Z103: =IF(Z104="", "", SUMIF(Z104:Z108,"XXX",$A104:$A108) ) -> 3 | AA103: =IF(AA104="", "", SUMIF(AA104:AA108,"XXX",$A104:$A108) ) -> 4 | AB103: =IF(AB104="", "", SUMIF(AB104:AB108,"XXX",$A104:$A108) ) -> 5 | AC103: =IF(AC104="", "", SUMIF(AC104:AC108,"XXX",$A104:$A108) ) ->  | AD103: =IF(AD104="", "", SUMIF(AD104:AD108,"XXX",$A104:$A108) ) -> 
A104: 1 | B104: Chen, Jeffrey | C104: 864 | D104: 959 | E104: XXX | F104: XXX | G104: 3 | H104: 1 | I104: 3 | J104: 1 | K104: 3 | L104: 0 | M104: 3 | N104: 0 | S104: 4 | T104: 12 | U104: 59.64 | V104: 35.64 | W104: 95.28 | X104: XXX | Y104: 14.76 | Z104: 14.44 | AA104: 13.72 | AB104: 16.72
A105: 2 | B105: Yuen, Ting | C105: 883 | D105: 907 | E105: 1 | F105: 3 | G105: XXX | H105: XXX | I105: 3 | J105: 1 | K105: 3 | L105: 1 | M105: 3 | N105: 1 | S105: 3 | T105: 10 | U105: 23.84 | V105: 0 | W105: 23.84 | X105: -14.76 | Y105: XXX | Z105: 13.68 | AA105: 10.96 | AB105: 13.96
A106: 3 | B106: Lee, Aria | C106: 875 | D106: 874 | E106: 1 | F106: 3 | G106: 1 | H106: 3 | I106: XXX | J106: XXX | K106: 3 | L106: 1 | M106: 3 | N106: 0 | S106: 2 | T106: 8 | U106: -0.55999999999999872 | V106: 0 | W106: -0.55999999999999872 | X106: -14.44 | Y106: -13.68 | Z106: XXX | AA106: 11.28 | AB106: 16.28
A107: 4 | B107: Frye, Scott | C107: 807 | D107: 788 | E107: 0 | F107: 3 | G107: 1 | H107: 3 | I107: 1 | J107: 3 | K107: XXX | L107: XXX | M107: 3 | N107: 1 | S107: 1 | T107: 5 | U107: -18.96 | V107: 0 | W107: -18.96 | X107: -13.72 | Y107: -10.96 | Z107: -11.28 | AA107: XXX | AB107: 17
A108: 5 | B108: Kong, Kailyn | C108: 882 | D108: 818 | E108: 0 | F108: 3 | G108: 1 | H108: 3 | I108: 0 | J108: 3 | K108: 1 | L108: 3 | M108: XXX | N108: XXX | S108: 0 | T108: 2 | U108: -63.96 | V108: 0 | W108: -63.96 | X108: -16.72 | Y108: -13.96 | Z108: -16.28 | AA108: -17 | AB108: XXX
A111: # | B111: Name | C111: Rating | D111: Rating | I111: Games Won/Lost against | S111: Matches | T111: Games | U111: Rating | V111: Bonus | W111: Change | X111: Rating change vs.
A112: 12 | C112: Pre | D112: Post | E112: 1 | F112: 1 | G112: 2 | H112: 2 | I112: 3 | J112: 3 | K112: 4 | L112: 4 | M112: 5 | N112: 5 | P112: 6 | R112: 7 | S112: Won | T112: Won | U112: Change | V112: Points | W112: w/Bonus | X112: =IF(X113="", "", SUMIF(X113:X117,"XXX",$A113:$A117) ) -> 1 | Y112: =IF(Y113="", "", SUMIF(Y113:Y117,"XXX",$A113:$A117) ) -> 2 | Z112: =IF(Z113="", "", SUMIF(Z113:Z117,"XXX",$A113:$A117) ) -> 3 | AA112: =IF(AA113="", "", SUMIF(AA113:AA117,"XXX",$A113:$A117) ) -> 4 | AB112: =IF(AB113="", "", SUMIF(AB113:AB117,"XXX",$A113:$A117) ) -> 5 | AC112: =IF(AC113="", "", SUMIF(AC113:AC117,"XXX",$A113:$A117) ) ->  | AD112: =IF(AD113="", "", SUMIF(AD113:AD117,"XXX",$A113:$A117) ) -> 
A113: 1 | B113: Lim, Gene | C113: 817 | D113: 834 | E113: XXX | F113: XXX | G113: 0 | H113: 3 | I113: 3 | J113: 1 | K113: 3 | L113: 1 | M113: 3 | N113: 1 | S113: 3 | T113: 9 | U113: 16.72 | V113: 0 | W113: 16.72 | X113: XXX | Y113: -16.96 | Z113: 15.72 | AA113: 10.84 | AB113: 7.12
A114: 2 | B114: Lindsay, Jim | C114: 793 | D114: 815 | E114: 3 | F114: 0 | G114: XXX | H114: XXX | I114: 0 | J114: 3 | K114: 3 | L114: 2 | M114: 3 | N114: 1 | S114: 3 | T114: 9 | U114: 21.52 | V114: 0 | W114: 21.52 | X114: 16.96 | Y114: XXX | Z114: -13.32 | AA114: 9.8 | AB114: 8.08
A115: 3 | B115: Khatilov, Alex | C115: 860 | D115: 844 | E115: 1 | F115: 3 | G115: 3 | H115: 0 | I115: XXX | J115: XXX | K115: 2 | L115: 3 | M115: 3 | N115: 2 | S115: 2 | T115: 9 | U115: -15.88 | V115: 0 | W115: -15.88 | X115: -15.72 | Y115: 13.32 | Z115: XXX | AA115: -16.88 | AB115: 3.4
A116: 4 | B116: Li, Ivy | C116: 738 | D116: 734 | E116: 1 | F116: 3 | G116: 2 | H116: 3 | I116: 3 | J116: 2 | K116: XXX | L116: XXX | M116: 0 | N116: 0 | S116: 1 | T116: 6 | U116: -3.76 | V116: 0 | W116: -3.76 | X116: -10.84 | Y116: -9.8 | Z116: 16.88 | AA116: XXX | AB116: 0
A117: 5 | B117: Fan, Jason | C117: 645 | D117: 626 | E117: 1 | F117: 3 | G117: 1 | H117: 3 | I117: 2 | J117: 3 | K117: 0 | L117: 0 | M117: XXX | N117: XXX | S117: 0 | T117: 4 | U117: -18.6 | V117: 0 | W117: -18.6 | X117: -7.12 | Y117: -8.08 | Z117: -3.4 | AA117: 0 | AB117: XXX
A120: # | B120: Name | C120: Rating | D120: Rating | I120: Games Won/Lost against | S120: Matches | T120: Games | U120: Rating | V120: Bonus | W120: Change | X120: Rating change vs.
A121: 13 | C121: Pre | D121: Post | E121: 1 | F121: 1 | G121: 2 | H121: 2 | I121: 3 | J121: 3 | K121: 4 | L121: 4 | M121: 5 | N121: 5 | P121: 6 | R121: 7 | S121: Won | T121: Won | U121: Change | V121: Points | W121: w/Bonus | X121: =IF(X122="", "", SUMIF(X122:X126,"XXX",$A122:$A126) ) -> 1 | Y121: =IF(Y122="", "", SUMIF(Y122:Y126,"XXX",$A122:$A126) ) -> 2 | Z121: =IF(Z122="", "", SUMIF(Z122:Z126,"XXX",$A122:$A126) ) -> 3 | AA121: =IF(AA122="", "", SUMIF(AA122:AA126,"XXX",$A122:$A126) ) -> 4 | AB121: =IF(AB122="", "", SUMIF(AB122:AB126,"XXX",$A122:$A126) ) -> 5 | AC121: =IF(AC122="", "", SUMIF(AC122:AC126,"XXX",$A122:$A126) ) ->  | AD121: =IF(AD122="", "", SUMIF(AD122:AD126,"XXX",$A122:$A126) ) -> 
A122: 1 | B122: Wang, Tony | C122: 616 | D122: 650 | E122: XXX | F122: XXX | G122: 3 | H122: 1 | I122: 3 | J122: 1 | K122: 3 | L122: 1 | M122: 3 | N122: 0 | S122: 4 | T122: 12 | U122: 28.76 | V122: 4.76 | W122: 33.52 | X122: XXX | Y122: 6.2 | Z122: 8.16 | AA122: 7.92 | AB122: 6.48
A123: 2 | B123: Leung, Leo | C123: 421 | D123: 431 | E123: 1 | F123: 3 | G123: XXX | H123: XXX | I123: 1 | J123: 3 | K123: 3 | L123: 2 | M123: 3 | N123: 0 | S123: 2 | T123: 8 | U123: 9.76 | V123: 0 | W123: 9.76 | X123: -6.2 | Y123: XXX | Z123: -12.04 | AA123: 13.72 | AB123: 14.28
A124: 3 | B124: Snyder, Rich | C124: 470 | D124: 470 | E124: 1 | F124: 3 | G124: 3 | H124: 1 | I124: XXX | J124: XXX | K124: 0 | L124: 3 | M124: 3 | N124: 0 | S124: 2 | T124: 7 | U124: -3.9999999999999147E-2 | V124: 0 | W124: -3.9999999999999147E-2 | X124: -8.16 | Y124: 12.04 | Z124: XXX | AA124: -16.24 | AB124: 12.32
A125: 4 | B125: Yuen, Michael | C125: 464 | D125: 441 | E125: 1 | F125: 3 | G125: 2 | H125: 3 | I125: 3 | J125: 0 | K125: XXX | L125: XXX | M125: 1 | N125: 3 | S125: 1 | T125: 7 | U125: -22.84 | V125: 0 | W125: -22.84 | X125: -7.92 | Y125: -13.72 | Z125: 16.24 | AA125: XXX | AB125: -17.44
A126: 5 | B126: Iseyama, Aiko | C126: 378 | D126: 362 | E126: 0 | F126: 3 | G126: 0 | H126: 3 | I126: 0 | J126: 3 | K126: 3 | L126: 1 | M126: XXX | N126: XXX | S126: 1 | T126: 3 | U126: -15.64 | V126: 0 | W126: -15.64 | X126: -6.48 | Y126: -14.28 | Z126: -12.32 | AA126: 17.44 | AB126: XXX
A129: # | B129: Name | C129: Rating | D129: Rating | I129: Games Won/Lost against | S129: Matches | T129: Games | U129: Rating | V129: Bonus | W129: Change | X129: Rating change vs.
A130: 14 | C130: Pre | D130: Post | E130: 1 | F130: 1 | G130: 2 | H130: 2 | I130: 3 | J130: 3 | K130: 4 | L130: 4 | M130: 5 | N130: 5 | P130: 6 | R130: 7 | S130: Won | T130: Won | U130: Change | V130: Points | W130: w/Bonus | X130: =IF(X131="", "", SUMIF(X131:X135,"XXX",$A131:$A135) ) -> 1 | Y130: =IF(Y131="", "", SUMIF(Y131:Y135,"XXX",$A131:$A135) ) -> 2 | Z130: =IF(Z131="", "", SUMIF(Z131:Z135,"XXX",$A131:$A135) ) -> 3 | AA130: =IF(AA131="", "", SUMIF(AA131:AA135,"XXX",$A131:$A135) ) -> 4 | AB130: =IF(AB131="", "", SUMIF(AB131:AB135,"XXX",$A131:$A135) ) -> 5 | AC130: =IF(AC131="", "", SUMIF(AC131:AC135,"XXX",$A131:$A135) ) ->  | AD130: =IF(AD131="", "", SUMIF(AD131:AD135,"XXX",$A131:$A135) ) -> 
A131: 1 | B131: Marcus, Lev | C131: 368 | D131: 381 | E131: XXX | F131: XXX | G131: 3 | H131: 1 | I131: 2 | J131: 3 | K131: 3 | L131: 2 | M131: 3 | N131: 0 | S131: 3 | T131: 11 | U131: 13.48 | V131: 0 | W131: 13.48 | X131: XXX | Y131: 11.24 | Z131: -12.48 | AA131: 5.44 | AB131: 9.28
A132: 2 | B132: Fong, Scott | C132: 299 | D132: 334 | E132: 1 | F132: 3 | G132: XXX | H132: XXX | I132: 3 | J132: 0 | K132: 3 | L132: 0 | M132: 3 | N132: 1 | S132: 3 | T132: 10 | U132: 29.28 | V132: 5.28 | W132: 34.56 | X132: -11.24 | Y132: XXX | Z132: 18.28 | AA132: 12.2 | AB132: 10.04
A133: 3 | B133: Lin, Grace | C133: 356 | D133: 368 | E133: 3 | F133: 2 | G133: 0 | H133: 3 | I133: XXX | J133: XXX | K133: 3 | L133: 1 | M133: 3 | N133: 0 | S133: 3 | T133: 9 | U133: 11.88 | V133: 0 | W133: 11.88 | X133: 12.48 | Y133: -18.28 | Z133: XXX | AA133: 7.92 | AB133: 9.76
A134: 4 | B134: Spindler, Eva | C134: 204 | D134: 200 | E134: 2 | F134: 3 | G134: 0 | H134: 3 | I134: 1 | J134: 3 | K134: XXX | L134: XXX | M134: 0 | N134: 0 | S134: 0 | T134: 3 | U134: -25.56 | V134: 0 | W134: -25.56 | X134: -5.44 | Y134: -12.2 | Z134: -7.92 | AA134: XXX | AB134: 0
A135: 5 | B135: Spindler, Lilana | C135: 200 | D135: 200 | E135: 0 | F135: 3 | G135: 1 | H135: 3 | I135: 0 | J135: 3 | K135: 0 | L135: 0 | M135: XXX | N135: XXX | S135: 0 | T135: 1 | U135: -29.08 | V135: 0 | W135: -29.08 | X135: -9.28 | Y135: -10.04 | Z135: -9.76 | AA135: 0 | AB135: XXX